id,song_name,artist_names,album_name,lyrics
6cXwEcBJjIOry6pT8zUzqz,"Shoulder (Dayytona Fox, YRN Lingo)","Quality Control, DAYYTONA FOX, YRN Lingo",59zpaLOByFkJhc9D5Xqna9,"15 contributorsshoulder lyricsintro
ayolump tell that bitch to come fuck with a winner lil baby

chorus yrn lingo  dayytona fox
she tried to get up but i bent that bitch over
causin trouble in these streets swervin a rover
and im right up on your ass gang gang yeah its over
i say she the chosen one why boy because i chose her
ever since i got older i hate to be sober
got older i hate to be sober
and we put a big body bitch just like a boulder
do it again do it again
better watch over your shoulder

verse dayytona fox  yrn lingo
gon hit the backdrop gon hit the backdrop
she give me top in my lap now thats a laptop
and we get lit we get lit like i was a matchbox
and no i aint gonna call a lil bitch better put that shit in the stash spot ah
i know these niggas waitin for me i got music i could drop
i got balmain jeans you can see these fat knots
srt real hot when i swerve up out the lot
we gon see if you real when i put you on the spot
somebody stop him
go ahead flex yeah go ahead flex lil bitch ima do it a lot
and you know what i do in the srt well link up swerve your block
and i dont give a fuck bout a stupid lil bitch no no no i do not
i dont know what the fuck you thought
ima get my secure better get your slot damn
i remember old man sitting by the texaco
he told me one day i gotta eat up all my vegetables
ever since that day he told me i eat it up just like a lunchable
now look at me big and strong feelin like mr incredible
you might also likechorus yrn lingo  dayytona fox
she tried to get up but i bent that bitch over
causin trouble in these streets swervin a rover
and im right up on your ass gang gang yeah its over
i say she the chosen one why boy because i chose her
ever since i got older i hate to be sober
got older i hate to be sober
and we put a big body bitch just like a boulder
do it again do it again
better watch over your shoulderembed"
