id,song_name,artist_names,album_name,lyrics
0Tacxc5lDJ8LwiO1pWNSl8,The Motion,Drake,7dqpveMVcWgbzqYrOdkFTD,"157 contributorstranslationsfrançaisthe motion lyricsintro drake  sampha
its not me and you its not me its you
youre reckless and you know it they dont love you like i do
say youre moving on well i guess thats just the motion
i guess thats just the motion
ohoh i guess thats just the motion
ohoh i guess thats just the motion
ohoh i guess thats just the motion

verse 1 drake
i dont have a fuck to give ive been moving state to state
in my leather and my timbs like its 1998
and my dog chubby chub thats my nigga from the way
on the eastside of the city thats where everybody stay
seem like everybody calling cause they want me on their song
its like every time i touch it i could never do no wrong
when they need a favor from you man they dont leave you alone
but i guess thats just the motion yeah

chorus 1 drake drake  sampha sampha
then that phone doesnt ring
when they got everything thats the motion
ohoh i guess thats just the motion
ooh ooh ooh ooh ooh ooh
ohoh i guess thats just the motion
ooh ooh ooh ooh ooh ooh
see drake liveget tickets as low as 90you might also likeverse 2 drake
yeah looking back on it at least my pride is intact
cause we said no strings attached and i still got tied up in that
everything that i write is either for her or about her
so im with her even when im here without her and she know it
the girl that i wanna save is like a danger to my health
try being with somebody that wanna be somebody else
i always thought she was perfect when she was being herself
dont even know how to help but i guess thats just the motion yeah

chorus 2 drake drake  sampha
shell probably come around
soon as i settle down thats the motion
ohoh i guess thats just the motion
ohoh i guess thats just the motion
ohoh i guess thats just the motion
outro drake sampha
nothing less and nothing more
i hear your heart hit the floor
i guess thats just the motion
talking to you is not enough no
i guess that’s just the motion
ohoh i guess thats just the motion
i guess thats just the motion
ohoh i guess thats just the motion
ohoh i guess thats just the motion
ohoh i guess thats just the motion
yeah162embed"
