id,song_name,artist_names,album_name,lyrics
2lLG56qpLP3UbcLuzMvkWX,Stop Breathing,Playboi Carti,2QRedhP5RmKJiJ1i8VgDGR,"182 contributorstranslationsрусскийtürkçeromânăсрпскиportuguêsenglishdeutschfrançaislatviešuitalianostop breathing lyricsintro
wake up f1lthy
breathin blatt yeah
breathin what yeah
breathin haha

chorus
i take my shirt off and all the hoes stop breathin ayy yeah
i take my shirt off and all the hoes stop breathin yeah
i take my shirt off and all the hoes stop breathin yeah what yeah
i take my shirt off and all the hoes stop breathin what yeah yeah what
breathin breathin bitches stop breathin yeah
breathin breathin i think that bitch not breathin ayy what what what
breathin breathin bitches stop breathin yeah ayy yeah
brеathin breathin i think that bitch not breathin what yeah what

postchorus
ha ha ha ha slatt ayy
ha ha yеah ha ha ayy
ha ha yeah ha oh my ha yeah
ha ha what ha what ha what damn

verse
ever since my brother died what died what
ever since my brother died died what what yeah
ive been thinkin bout homicide what what what what
ive been thinkin bout homicide what what what what
free lil tip what ooh free migo bliff what ah
free all my guys what free problem child what
i been with lil demon and lil beno and r5 what what demon in that
ridin in a tank on 285 five what what
on the way to front street who say we aint outside yeah
smokin on the henchmen what got a nigga fried
im hangin with the pirus what what hangin with the fives yeah
i got mob ties i got fuckin mob ties yeah
i got niggas in chain gang on my side what what what what chain gang
i got niggas in chain gang on my side what what what what
i had the niggas shank ola for a pie what what what what
i had the niggas shank ola for a pie what what what what
im on demon time what what im on demon time what what tell em
bitch im out my body what what i done lost my mind what what yeah
im a young bitch what what bitch but im in my prime what what yeah
im a young bitch what what go but im in my prime what what yeah
pussyass niggas cant hang round me what what what
all these pussyass niggas liabilities what what what
im too shiesty i aint got no og what woo
i keep the blicky blicky just in case they try me what blicky blicky what
kill me a opp what slatt kill me a opp ooh what okay
carry a mop yeah what carry a mop yeah what
the chopper wont stop choppa choppa what
the chopper wont stop choppa choppa what
i fuck on your thot choppa choppa what
i fuck on your thot
you fuck with my opps opps woo
you fuck with my opps yeah yeah
you fuck with my opps what yeah yeah
you fuck with the cops what what
brand new ventador i drove that bitch right to the moon moon what
i just hit a lick with a mask mf doom woo woo what woo woo
i just rocked the show on some mothafuckin shrooms god woo
i fucked my biggest fan in the fuckin green room god yeah
i gave that ho a band and told her go and buy some shoes ah what
ive been winnin all day bitch i cant lose woo what
i got the people goin crazy what watchin all my moves yeah
my bitch said i dress real nice dress cool ayy
if rick dont cut you a check what you better sue what what
yeah what what ha what
ha what yeah yeah ha tilt yeah
ha what what what ayy
yeah what what
yeah what bitch yeah what yeah
see playboi carti liveget tickets as low as 70you might also likechorus
i take my shirt off and all the hoes stop breathin ayy
i take my shirt off and all the hoes stop breathin yeah what red
i take my shirt off and all the hoes stop breathin yeah what what what red
i take my shirt off and all the hoes stop breathin what what hold up
breathin breathin bitches stop breathin yeah
breathin breathin i think that bitch not breathin ayy what yeah what what
breathin breathin bitches stop breathin yeah ayy what
breathin breathin i think that bitch not breathin ayy what what67embed"
