id,song_name,artist_names,album_name,lyrics
0NZ90au4uU11IkvReTOGYJ,Fat Bottomed Girls,Queen,7C2DKB8C12LqxMkfJRwTo9,"62 contributorsfat bottomed girls lyricsintro
are you gonna take me home tonight
oh down beside that red firelight
are you gonna let it all hang out
fat bottomed girls
you make the rocking world go around

verse 1
hey i was just a skinny lad
never knew no good from bad
but i knew life before
i left my nursery huh
left alone with big fat fanny
she was such a naughty nanny
hey big woman
you made a bad boy out of me
hey hey woo

verse 2
ive been singing with my band
cross the water cross the land
ive seen every blueeyed
floozy on the way hey
but their beauty and their style
went kinda smooth after a while
take me to them dirty ladies every time
come on
you might also likechorus
oh wont you take me home tonight
oh down beside your red firelight
oh and you give it all you got
fat bottomed girls
you make the rocking world go around
fat bottomed girls
you make the rocking world go around

verse 3
hey listen here
now i got mortgages on homes
i got stiffness in my bones
aint no beauty queens
in this locality i tell you
oh but i still get my pleasure
still got my greatest treasure
hey big woman you gonna make
a big man of me now get this

chorus
oh i know are you gonna
take me home tonight please
oh down beside that red firelight
are you gonna let it all hang out
fat bottomed girls
you make the rocking world go around
yeah fat bottomed girls
you make the rocking world go around
get on your bikes and ride
outro
ooh yeah
oh yeah
them fat bottomed girls
fat bottomed girls
yeah yeah yeah
alright ride em cowboy
fat bottomed girls
yes yes

solo24embed"
