id,song_name,artist_names,album_name,lyrics
3yywx0R5gIEXZ75rtKrmOs,She Wants To Move,N.E.R.D,4SJhZBuuLYlwUJGxWf8Pj0,"22 contributorsshe wants to move lyricsintro  pharrell williams
shake it up shake it up girl
shake it up bass
hey shake it up shake it up

verse  pharrell williams shae
she makes me think of lightning in skies
her name shes sexy
how else is  god supposed to write
her name shes sexy
move she wants to move
but youre hogging her youre guarding her
she wants to move she wants to move
she wants to move she wants to move
but youre hogging her youre guarding her damn

hook  pharrell williams shae
mister look at your girl she loves it
look at her i can see it in her eyes
she come here babe hopes this lasts forever hey

verse  pharrell williams shae
her off beat dance makes me fantasize
her curves shes sexy
her ass is a spaceship i want to ride
her ass shes sexy
move she wants to move
but youre hogging her youre guarding her
she wants to move she wants to move
she wants to move she wants to move
but youre hogging her youre guarding her beat it
you might also likehook  pharrell williams shae
mister look at your girl she loves it
i know you love it girl i can see it in her eyes
she  hopes this lasts forever hey hey

interludebridge  pharrell williams shae
ehh this is your part girl
uh this is your part girl
move she wants to move cmon
oww move she wants to move ehh
man and move she wants to move
move she wants to move
but youre hogging her youre guarding her
beat it

hook  pharrell williams shae
mister look at your girl damn she loves it
she loves i can see it in her eyes
she  hopes this lasts forever hey cmon
mister look at your girl look at your girl she loves it
she wants it i can see it in her eyes
she  hopes this lasts forever hey

outro  pharrell williams shae
somebody get us some water in here
cause its hot
yo why you why you why you wit that fool
hot yall hey huuuhh
i like it when youre wet baby ehh7embed"
