id,song_name,artist_names,album_name,lyrics
62FOsBpnZXEoPc1Qo9hcap,Beautiful Goodbye,Maroon 5,2pjfMmH52fryXVQuWTWOgP,"15 contributorsbeautiful goodbye lyricsverse 1
i count the ways i let you down
on my fingers and toes but im running out
clever words cant help me now
i grip you tight but youre slipping out

prechorus 1
and i remember your eyes were so bright
when i first met you so in love that night
and now im kissing your tears goodnight
and i cant take it youre even perfect when you cry

chorus
beautiful goodbye byebye byebye
its dripping from your eyes byebye byebye
your beautiful goodbye whoa byebye byebye
its dripping from your eyes byebye byebye
oh yeah

verse 2
when did the rain become a storm
when did the clouds begin to form
yeah we got knocked off course by a natural force
and well well be swimming when its gone

prechorus 1
and i remember your eyes were so bright
when i first met you so in love that night
and now im kissing your tears goodnight
and i cant take it youre even perfect when you cry
see maroon 5 liveget tickets as low as 100you might also likechorus
beautiful goodbye byebye byebye
its dripping from your eyes byebye byebye
your beautiful goodbye whoa byebye byebye
its dripping from your eyes byebye byebye
oh yeah

bridge
all the pain you try to hide
shows through your mascara lines
as they stream down from your eyes
and let them go let them fly
holding back wont turn back time
believe me ive tried

prechorus 2
and your eyes were so bright
i remember your eyes were so bright
and i remember your eyes were so bright
when i first met you how in love were we that night
and now im kissing your tears goodnight
and i cant take it youre even perfect when you cry

chorus
beautiful goodbye byebye byebye
oh yeah
its dripping from your eyes byebye byebye
your beautiful goodbye whoa byebye byebye
its dripping from your eyes byebye byebye
yeah yeah
outro
ooh ooh
oh oh yeah
hee oh7embed"
