id,song_name,artist_names,album_name,lyrics
3raTxbibtTZruSHwldoVO9,Pay My Rent,DNCE,3Wv4X8OA65pGpFzBkuUgAh,"19 contributorspay my rent lyricsverse 1
been runnin now runnin so smoothly
well never slow down hey
been thinkin now thinkin down on one knee
time to say it out loud

prechorus
when you love so good
wanna give you every hour
if you said you could
i would give you all the power

chorus
but would you pay my rent oohoohooh oohooh
would you pay my rent oohoohooh
would you would you would you get your love well spent hey woo oohoohooh oohooh
would you pay my rent oohoohooh oohooh
would you would you would you pay my rent

verse 2
ill never say woo never to your wishes
ill never let you fall oh yeah no no
you always know always know im with it woo
im always on call oh

prechorus
when you love so good love so good
wanna give you every hour
if you said you could said you could
i would give you all the power
you might also likechorus
but would you pay my rent woo oohoohooh oohooh
would you pay my rent oohoohooh
would you would you would you get your love well spent hey woo come on oohoohooh oohooh
would you pay my rent oohoohooh oohooh
would you would you would you–

postchorus
how can you hey love me right love me right if you dont get your money right oohoohooh oohooh
love me right love me right if you dont get your money oohoohooh
love me right love me right if you dont get your money right oohoohooh oohooh woo
love me right love me right oh if you dont get your money oohoohooh oohooh
love me right hey love me right if you dont get your money right woo
love me right you gotta get your money right girl love me right if you dont get your–how can you

prechorus
when you love so good love me right love me right if you dont get your money right love so good
wanna give you every hour love me right love me right if you dont get your–
if you said you could love me right love me right if you dont get your money right said you could love me right love me right
i would give you all the power

chorus
but would you pay my rent oohoohooh hey oohooh hey
would you pay my rent oohoohooh oh
would you would you would you get your love well spent oohoohooh oohooh woo
would you pay my rent girl oohoohooh oohooh
would you would you would you
postchorus
how can you love me right love me right if you dont get your money right oohoohooh oohooh
love me right love me right if you dont get your money oohoohooh
love me right love me right if you dont get your money right oohoohooh oohooh
love me right oohoohooh oohooh love me right if you dont get your–would you pay my rent3embed"
