id,song_name,artist_names,album_name,lyrics
7IteHlPcwD5mzvkXZmimLI,Pide Lo Que Tú Quieras,"Ozuna, De La Ghetto",4s05NbwGgw5SO42AdsN5Oo,"8 contributorspide lo que tú quieras lyricsletra de pide lo que tú quieras ft de la ghetto

intro ozuna  de la ghetto
hoy como que quiero complacerte
mami má a fondo a conocerte yeh
como dios te trajo al mundo quiero verte oh oh oh
dime que tú quieres de mí oh jaja
botellas e rosé en el cuarto
tu desnuda en la pared
poco a poco te llevo al espacio
este momento baby ya lo soñé

coro ozuna  de la ghetto
¡wohoh
pide lo que tú quieras mami
¡wohoh
pide lo que tú quieras mami
¡wohoh
pide lo que tú quieras mami
carro cartera sexo la noche entera mami
¡wohoh
pide lo que tú quieres baby
¡wohoh
yo te doy lo que tú quieres baby
¡wohoh
pide lo que tú quieres baby
viaje a paris y gastamo todo en chanel baby
you might also likeverso 1 de la ghetto
yo siento que tú quiere yo lo sé
baby en la cara se te ve yeah yeah
tú sabe lo que quiero también
hacértelo bien rico toa la noche gezzy
pide lo que tú quiera
toy bien puesto pa eso
baby ese culo es mío
yo soy el dueño e to eso
tú sabe cómo me pongo
que no termino cuando empiezo
cumpliendo tus fantasía
en to eso soy un experto wuh ah

precoro de la ghetto
ven trépate aquí encima de mí
hoy no vamo a parar de hacerlo baby
y yo que ya me acostumbré a ti yeah
me llama si tú quiere y lo volvemo a repetir

coro ozuna  de la ghetto
¡wohoh
pide lo que tú quieras mami
¡wohoh
pide lo que tú quieras mami
¡wohoh
pide lo que tú quieras mami
carro cartera sexo la noche entera mami
¡wohoh
pide lo que tú quieres baby
¡wohoh
yo te doy lo que tú quieres baby
¡wohoh
pide lo que tú quieres baby
viaje a paris y gastamo todo en chanel baby
verso 2 ozuna
ozuna
mucho diamante
camina conmigo en la alfombra roja sola se hace la importante
viajamo hacia paris gastamo aquí no hay limite
y claro mami si yo estoy pa ti como tú
ninguna se compara a la hora de hacerlo
tú sabe lo que me gusta sabe cómo moverlo
enséñame cómo eres tú en la cama pon la actitud
aquí bebé tú no tienes liga porque la compe solo eres tú

precoro ozuna  de la ghetto
ven trépate aquí encima de mí
hoy no vamo a parar de hacerlo baby
y yo que ya me acostumbré a ti
me llama si tú quiere y lo volvemo a repetir
ven trépate aquí encima de mí
hoy no vamo a parar de hacerlo baby
y yo que ya me acostumbré a ti
me llama si tú quiere y lo volvemo a repetir

coro ozuna  de la ghetto
¡wohoh
pide lo que tú quieras mami
¡wohoh
pide lo que tú quieras mami
¡wohoh
pide lo que tú quieras mami
carro cartera sexo la noche entera mami
¡wohoh
pide lo que tú quieres baby
¡wohoh
yo te doy lo que tú quieres baby
¡wohoh
pide lo que tú quieres baby
viaje a paris y gastamo todo en chanel baby
outro ozuna
baby
odisea
chris jedi
gaby music
hi music hi flow
de lade lade la geezy mami
ozunaembed"
