id,song_name,artist_names,album_name,lyrics
15eaTEZMA2CqOxBvyuosLI,In the Flesh,Kodak Black,5n1GSzC1Reao29ScnpLYqp,"31 contributorsin the flesh lyricsintro
money talk these diamonds on my cavity
money talk

verse 1
money talk these diamonds on my cavity
scoopin up all my bitches out the magazine
cartier my sight virtual reality
hoppin up out the space coupe with no gravity
i need me somebody to take the edge off
ten toes and they painted they dont let me down
nigga that money old just like im redd foxx
swear we still gon turn up when the feds watch
nigga aint got no love aint got no reasonin
baby i switched the sauce up every seasonin
turned up in a coupe theyre goin to venus yeah
jump up in that pussy with my feelings in it

chorus
im jumpin up in that pussy like im needlin
fresh up outta jail so ima leave it in
hittin from the back like im gon leave again
if i die tonight lets bet ill resurrect
if i die tonight lets bet ill resurrect
if i die tonight lets bet ill resurrect
you might also likeverse 2
them vvs in my mouth the platinum flawless diamonds
hopped out with that ap watch on like its perfect timin
if that nigga just like me he tryna ride or die
if that nigga just like me he tryna take yo life
i say aint i resurrect how i pull up in the flesh
you aint understand me i got more precise
i say aint i resurrect how i pull up in the flesh
just got out today already sent my dawg a kite
remember i was on that flight totin pipes out here rollin dice
now i get a hundred k to rock the mic
got lil baby eatin molly like its mike  ike
i just wanna fly dont wanna die so i be walkin light walkin light

chorus
im jumpin up in that pussy like im needlin
fresh up outta jail so ima leave it in
hittin from the back like im gon leave again
if i die tonight lets bet ill resurrect
if i die tonight lets bet ill resurrect
if i die tonight lets bet ill resurrect

bridge
i say aint i resurrect how i pull up in the flesh
aint i resurrect how i pull up in the flesh
i say aint i resurrect how i pull up in the flesh
aint i resurrect how i pull up in the flesh
just got out today already sent my dawg a kite
you aint understand me i got more precise
chorus
im jumpin up in that pussy like im needin it
fresh up outta jail so ima leave it in
hittin from the back like im gon leave again
if i die tonight lets bet ill resurrect
if i die tonight lets bet ill resurrect
if i die tonight lets bet ill resurrect3embed"
