id,song_name,artist_names,album_name,lyrics
3QLvGx3PNgsyIjJOyIcuGh,Big Shot,Gunna,1oUzjom2A9xtyRM1SdOAGj,"31 contributorsbig shot lyricsintro
ghetto guitar
run that back turbo

chorus
i connected all the dots connected all the dots
pulled that foreign out the lot that foreign out the lot
moved the family to the docks boondocks
put some diamonds in my watch diamonds in my watch
ballin like a big shot
ballin’ like a big shot uh
ballin like a big shot oh oh

verse 1
businessman i pop my collar i pop my collar
got good brain must be a scholar good brain must be a scholar
spent 2k on balmain joggers spent 2k on joggers
yeah im jogging to the bank oh
captain of the ship and we won’t sink we wont sink nah
gave her a hundred told her keep the change keep the change nah
work hard now we finally seein a change seein a change
my brothers keeper shit deeper than a chain on god
just like fendi gotta think she gotta think
and im drippin like a sink yeah drippin like a sink yeah
these vvs’s make you blink yeah make you blink yeah
oh yeah
you might also likechorus
i connected all the dots connected all the dots
pulled that foreign out the lot that foreign out the lot
moved the family to the docks boondocks
put some diamonds in my watch diamonds in my watch
ballin’ like a big shot
ballin like a big shot uh
ballin’ like a big shot oh oh

verse 2
in la smoking dosido smokin dosido
and i got dolce on my clothes dolce gabbana my clothes
i still got homies on flat shoals homies on flat shoals
im just getting started i got more goals still got goals
lookin for the pesos for the pesos
would stay inside but the bank closed but the bank closed
every time i turn around i see a bankroll bankroll
i used to get handmedowns now ain’t a thing old no
all my day ones gettin a payroll payroll
when you show la i dont wanna shop on rodeo rodeo
if killing was dripping gunna i had a case closed case closed
still independent you cant name a nigga i owe nigga i owe

chorus
i connected all the dots connected all the dots
pulled that foreign out the lot that foreign out the lot
moved the family to the docks boondocks
put some diamonds in my watch diamonds in my watch
ballin like a big shot
ballin like a big shot uh
ballin like a big shot oh oh3embed"
