id,song_name,artist_names,album_name,lyrics
100jjBqjnVYXDpKYqMZr9D,Betty's a Bombshell,GROUPLOVE,3oylWMc9TTC6Nx4I6U3axc,"4 contributorsbetty’s a bombshell lyricsbettys a bombshell she just got paid
crossing the street on passionate gates
billys a looker hes from upstate
he ran into betty and he took her on a date
and its a sunny day we will go away on a holiday
and its a sunny day we will go away on a holiday
and its okay all the suffering obliterates our speed
but dont you wait dont you wait for the faster you let go you will receive what you need
ohh ohh ohh
and betty said billy why you makin that face
since you moved in youve been on a different page
youve been out of commission hiding in the kitchen
freddy came over and you couldnt even listen
its a great escape from your heartache its your replay
its a great escape from your heartache its your replay
and its okay all the suffering obliterates our speed
but dont you wait dont you wait for the faster you let go you will receive what you need
its okay all the suffering obliterates our speed
but dont you wait dont you wait for the faster you let go you will receive what you need
uh uh uh
its a sunny day we will go away on a holiday
its a sunny day we will get away on a holiday
its a uh uh uh holiday holidaysee grouplove liveget tickets as low as 25you might also likeembed"
