id,song_name,artist_names,album_name,lyrics
7ijNqRvwWCkF2RG5oHoKCA,I Walk the Line,Johnny Cash,4E2eUhFHqTG2pu9MN1NDIF,"55 contributorsi walk the line lyricsverse 1
i keep a close watch on this heart of mine
i keep my eyes wide open all the time
i keep the ends out for the tie that binds
because youre mine i walk the line

verse 2
i find it very very easy to be true
i find myself alone when each days through
yes ill admit that im a fool for you
because youre mine i walk the line

verse 3
as sure as night is dark and day is light
i keep you on my mind both day and night
and happiness ive known proves that its right
because youre mine i walk the line

verse 4
youve got a way to keep me on your side
you give me cause for love that i cant hide
for you i know id even try to turn the tide
because youre mine i walk the line

verse 1
i keep a close watch on this heart of mine
i keep my eyes wide open all the time
i keep the ends out for the tie that binds
because youre mine i walk the lineyou might also like22embed"
