id,song_name,artist_names,album_name,lyrics
4jgIpOdte0ncY0EjSLzC0N,Suffer,Staind,2JHjVEvYNVQ9FUUMB2LcMl,"12 contributorssuffer lyricsintro
suffer
suffer
suffer

verse 1
the more you see the more you do
the televisions feeding you
with what you want to hear
anger and fear because you suffer

verse 2
the hate you feel wont go away
youre all programmed to feel this way
to live another day
within a world that longs to suffer

suffer

chorus
and then i come to find
and everythings ok
seen this all before
but that was yesterday
try to walk right through
the messes that ive made
just let me enjoy
the life here that i live
see staind liveget tickets as low as 41you might also likeverse 3
i try to give this all to you
cant take anymore to deal
with this it hurts inside
i know why i hide cause i suffer

suffer

verse 4
i tried to keep it all inside
it didnt leave me too much pride
i forced it all down inside
forced myself to make me suffer

suffer

chorus
and then i come to find
and everythings ok
seen this all before
but that was yesterday
try to make it through
the messes that ive made
so i can enjoy
the life here that i live
bridge
and then i come to find

chorus
and then i come to find
and everythings ok
seen this all before
but that was yesterday
try to walk right through
these messes that ive made
just try to enjoy
this life here that i have2embed"
