id,song_name,artist_names,album_name,lyrics
5wMfo13nXYHGo2ZlYhcL8G,Head to Toe,Sean Paul,32Bu3ETQhR1PFCj3ndDlYf,"2 contributorshead to toe lyricsintro
dont pretend yuh dont need mi
daily monthly weekly seanapaul pon di girl dem
intermediately weh we seh dutty yeah
don corleone deh yah fi mek di gyal ride pon di pony
seanapaul nuh phony hear mi tell girl dem seh my girl

chorus
from head to toe di finess jah jah bless see we nuh mash up man head fi show
most naturally anytime mi waan it girl just gimme di pree
i set yuh free i give yuh my love and yuh know its guaranteed
i got what yuh need believe in you and me

verse 1
girl yuh physique a speak
and every talk it a talk it a mek man heart a beat
when they out a street
dont walk weh yuh walk mek this world look counterfeit
cau yuh nuh incomplete everyting weh yuh got hot sexy
everyting look neat we can feel di heat
a guy must be blind if him haffi look hard to seek
cau from di set on mi ready fi go put on di sweat on
gyal cau yuh body it a beck on
any minute any second mi tun on di jet on
gyal yuh gwaan get wet on
just ease yuh mind one time
flex tonight becau its not a crime
relax yuh vibe becau hype we nah join
gyal bubble weh deh feel di bassline cau
see sean paul liveget tickets as low as 73you might also likechorus
from head to toe di finess jah jah bless see we nuh mash up man head fi show
most naturally anytime mi waan it girl just gimme di pure
i set yuh free i give yuh my love and yuh know its guaranteed
i got what yuh need believe in you and me

verse 2
girl come roll wid we
if yuh man nah pose up like him just dont know fi dweet
him luck early gee him nah wuk yuh right
neva wuk it fi yuh properly i give yuh memories
inna di bathroom or im a go between di trees
up in di evenin breeze
come on baby girl this is not a good time fi cease
so off let it see we nah fi get it
seanapaul dat yute weh nah go pamper nah pet it
pump it hard mi know mi nah upset it
know how fi tun it dont fret it girl
just ease yuh mind up one time
flex tonight becau its not a crime
relax yuh vibe becau hype we nah join
gyal bubble to di bassline cau

chorus
from head to toe di finess jah jah bless see we nuh mash up man head fi show
most naturally anytime mi waan it girl just gimme di pure
i set yuh free i give yuh my love and yuh know its guaranteed
i got what yuh need believe in you and me
verse 1
girl yuh physique a speak
and every talk it a talk it a mek man heart a beat
when they out a street
dont walk weh yuh walk mek this world look counterfeit
cau yuh nuh incomplete everyting weh yuh got hot sexy
everyting look neat we can feel di heat
a guy must be blind if him haffi look hard to seek
cau from di set on mi ready fi go put on di sweat on
gyal cau yuh body it a beck on
any minute any second mi tun on di jet on
gyal yuh gwaan get wet on
just ease yuh mind one time
flex tonight becau its not a crime
relax yuh vibe becau hype we nah join
gyal bubble weh deh feel di bassline cauembed"
