id,song_name,artist_names,album_name,lyrics
4MHoMNypaHE3Y0gmxzNxId,"Honey, I'm Good. (Duet w/ Eli Young Band)","Andy Grammer, Eli Young Band",7AGnFKaeMdOgRFazLNyBps,"9 contributorsjune 2021 singles release calendar lyrics61
akthesavior  lord fubu  another dimension
bad suns  heaven is a place in my head
cautious clay  saba  strange love
enny  i want
hayley kiyoko  chance
king princess  house burn down
lump  climb every wall
moneybagg yo  rookie of the year
remi wolf  liz
samia  show up
slumberjack  nicole millar  not for you
stela cole  i shot cupid
62
billie eilish  lost cause
charli adams  get high w my friends
chiiild  eventually
chvrches  robert smith  how not to drown
chief keef  mike will madeit  love dont live here
denzel curry  bad luck ft playthatboizay
fousheé  my slime
gaspard augé  vox
genesis owusu  same thing
glaive  detest me
gryffin  best is yet to come ft kyle reynolds
ider  bored
jake hill  coward
jojo  whats da jwett ft wizdawizard
jungle  talk about it
krimelife ca  a boogie ft abg neal
kwengface  tetley
matt maeson  nelsonwood lane
wanski  money  small towns
63
baby queen  american dream ft maya
belly  zero love ft moneybagg yo
cat  calmell  get old
​daine  dying
daine  dainecore
fixupboy  overdose
geko ms banks  backroad gee  woi oi
jax  like my father
​joan  dont say you love me
mak sauce  ding dong
molly burch  heart of gold
pa salieu  glidin ft  slowthai
prince  born 2 die
tion wayne  wow
token  hi billie eilish
wolf alice  how can i make it ok
yung kayo  not in the mood
yo gotti  drop ft dababy

64
4karri bankrol hayden  2kbaby  kiki
aidonia  u know di vibe
alesso  again
alesso  together
anthony ramos  échale
aviva  twisted
azizi gibson  sometimes
bad bunny  yonaguni
becky g  el alfa  fulanito
billen ted  when youre out ft mae muller
blackbear  tate mcrae  u love u
breland  throw it back ft keith urban
bülow  revolver
calvin harris  by your side ft tom grennan
cameron azi  ubjectz  bagg
cancel culture mick jenkins  meltycanon  super8
cascada  transx  one last dance
chavo  pierre bourne  michigan remix ft babyface ray
chet faker  feel good
chord overstreet  whats left of you
cynthia erivo  the good
david guetta  morten  impossible ft john martin
dcg shun  dcg bsavv  house party ft internet money
dee watkins  proud of me ft fcg heem
dennis lloyd  the way
dice soho  supernova
dillon francis  220 kid  unconditional ft bryn christopher
duvy  outside
egovert  stop it
g4 boyz  sba jobs ft g4choppa
george maple  demise
her  change
hitman holla  control da room ft tee grizzley
itsoktocry  arson radio ft kamiyada
ivan b  sugar coats
jack savoretti  too much history
james vickery  earthgang  you comfort me
jasiah  art of war ft denzel curry  rico nasty
jax jones  feels
jessia  i should quit
jessie ware  hot n heavy
john mayer  last train home
jp saxe  more of you
jumex  internet friends
jutes  couch surfin
​jxdn  think about me
kathleen  san andreas fault
kentheman  wtf
kidd kenn  good day
lauren aquilina  empathy
lena  strip
lenka  ivory tower
like saturn  lets go far away
lil rekk  backstabbers
lissie  all be okay
lølø  die without u
loser  your song
lpb poody  lil wayne  batman remix ft moneybagg yo
lucky daye  running blind
luis fonsi  myke towers  bésame
mace supreme  yn jay  jumanji
madison beer  reckless
marcus  martinus  alex rose  belinda
marshmello juicy j  eptic  hitta
michaela jaé  something to say
massaka  para ft 6ix9ine
masked wolf  gravity glidin
mykki blanco  summer fling ft kari faux
nasaan  busy ft swavay
nasty c  best i ever had
nico  vinz  dont be afraid
noah schnacky  jimmie allen  don’t you wanna know
og parker chris brown  pnb rock  rain down ft latto  layton greene
olivia rodrigo  granted
otis kane  kallitechnis  good love
overcoats  used to be scared of the dark ft middle kids
orville peck  born this way the country road version
pacman da gunman  one piece ft wale
polo  pan  channel tres  tunnel
popp hunna  cry in dubai
porridge radio  happy in a crowd
pressa  second hand smoke
quin nfn  lil 2z  back and better
rae morris  fish n chips ft soph aspin
reazy renegade tory lanez  k camp  cod
rei ami  ricky bobby
rich the kid  boss bitch ft coi leray
roddy ricch  late at night
roy woods  touch you
russ  money on me
scarlxrd  false hxpe
shaybo  mud
slayter  jaydayoungan  spinnin back
smallpools  life of the party
smiley  moving different
spaceman zack  hangover
stalking gia  astronaut
surf mesa  lose my mind ft bipolar sunshine
surfaces  so far away
the marías  un millón
thouxanbanfauni  irs
tinashe  buddy  pasadena
tobi  don’t touch
tokimonsta  vanjess  say yes
transviolet  blue flowers ft little hurt
trucarr  drakeo the ruler  know sumthin
tungevaag  ride with me ft kid ink
ty dolla ign jack harlow  24kgoldn  i won
zak abel  right side of the bed
65
derivakat  a whole world ft krustydavid

67
42 cheez  mo murda
est gee  bigger than life or death
joey trap  troops
justin bieber  peaches remix ft ludacris usher  snoop dogg
noel gallaghers high flying birds  flying on the ground
omb peezy  lefty
peggy gou  ohhyuk  nabi
tkay maidza  cashmere
yung bino  came a long way ft asian doll

68
ava max  everytime i cry
drippin so pretty  ride or die
lucy dacus  brando
marshmello  nitti gritti  bad bitches ft megan thee stallion
mive  something about you
nothing but thieves  futureproof
oscar lang  21st century hobby
poloboy nunu  spin for tre
ryster  history
​serpentwithfeet  you dont own mecanopy
steele 11  g19 ft midwxst
tierra whack  76
69
9lokknine  going 4 none
amber mark  competition
benny the butcher  harry fraud  sink
bleachers  how dare you want more
coldy  the mall at 4am
deb never  disassociate
eric bellinger  shine on the world
goldlink  white walls
​itzmrt3  confession ft unotheactivist
jacob collier  i love being here with you
joey trap  mad
kflay  dating my dad ft travis barker
kelsea ballerini  lany  i quit drinking
marian hill  yung baby tate  ooo thats my type
marina  venus fly trap
maty noyes  cake
orla gartland  do you mind
pierre bourne  sossboy 2 ft lil uzi vert
savannah ré  24hrs
sleaterkinney  method
valley  society
vincint  getaway ft tegan and sara

610
clairo  blouse
client liaison  house of holy
evie irie  the idea of you
flight facilities  the ghost
foolio  whip bump
gucci mane  like 34  8 ft pooh shiesty
jasmine thompson  already there
jimmy jam  terry lewis  somewhat loved there you go breakin my heart ft mariah carey
keep cool records  warzone ft bibi bourelly
lorde  solar power
marshmello  subtronics  house party
migos  avalanche
rema  soundgasm
ricky martin  paloma mami  qué rico fuera
skrillex ​noisia josh pan  dylan brady  supersonic my existence
tones and i  cloudy day
ybn almighty jay  choosy ft ddg

611
12am  ski mask ft jutes
451  hot for me
adelén  obsessed
aj mitchell  one more fight
alan walker  imanbek  sweet dreams
ann marie  like that
askjell  iris  sofia ft aurora
bfb da packman  heat ft beatking
bizzy banks  adore you ft pnb rock
brad paisley  city of music
brennan savage  far away
bruhmanegod  right here ft jeleel
brynn elliott  without you
calum scott  biblical
charlotte day wilson  keep moving
chloe bailey  feeling good
cold war kids  what you say
cupcakke  huhhhhh
curtis waters  bad mood ft brevin kim
derivakat  last goodbyes
dimitri vegas  like mike  rampage
doja cat  need to know
don diablo  too much to ask ft ty dolla ign
don toliver lil durk  latto  fast lane
dreamdoll  tryouts
dro kenji  im rich now bitch
eric saade  like u used to
evan giia  mood swings
frans  my favourite waste of time
fredo bang  trust issues remix ft nle choppa
french montana  fwmgab
gavin james  sober
her  we made it
honne  what would you do ft pink sweat
hrvy  1 day 2 nights
idk  peloton
inna  maza
jacob collier  justin kauflin  flow freely
jake shears  do the television
james arthur  september
jaydayoungan  murder
jessie j  i want love
john k  ​everything
josie proto  i just wanna walk home
juicy j  take it ft lord infamous  rico nasty
jutes  those were the days
k camp  game aint free
kayzo  paris shadows  poison
kenndog  beethoven
kream  roads ft dan caplen
kylie minogue  marry the night
lady a  things he handed down
like saturn  away from the storm
megan thee stallion  thot shit
mimi webb  dumb love
mirours  keep on driving
phangs matthew thiessen  relient k  a hurt like that
raissa  free
raye  call on me
riff raff  dj whoo kid  silhouette of the pinnacle
rob tone  i love it ft rubi rose
ruben young  tnt ft buddy
russ  lucky
saint jhn  just for me ft sza
scarlxrd  yxu knxw what im like
skylar stecker  you
snakehips  earthgang  run it up
sofia carson  he loves me but
the goo goo dolls  nothing can change you
topic  bebe rexha  chain my heart
trevor daniel  julia michaels  fingers crossed
troyboi  destructo  youre the one for me
twelve’len  bang that sugar
twenty one pilots  shy away livestream version
tyga  splash ft moneybagg yo
tyler posey  happy
unlike pluto  a cautionary tale
upsahl  melatonin
weezer  tell me what you want
x ambassadors  my own monster
xan griffin  sound remedy  catch me ft paige cavell
yebba  october sky
yungeen ace  giving up
yung bleu chris brown  2 chainz  baddest
yung pinch  issues
yvngxchris  bitch im joe biden
612
everything everything  mercury  me
613
ddg  ​icarly freestyle
lil yachty  dc2trill  bar for bar
614
cold hart  silver stars
dan bull  the emperors light
joey trap  blizzard pt 2
little simz  rollin stone
soulja boy  rick  morty
stunna 4 vegas  activated
tory lanez  skat ft dababy

615
aldous harding  old peel
dave east  they gotta hate us
dj kay slay  extravagant lifestyle ft raekwon ghostface killah tragedy khadafi  sheek louch
mykki blanco  its not my choice ft blood orange
richie wess  yung dred  lit
rittz  keep it like that ft vinnie paz
rozzi  june
unfoonk  temperature
yonaka  raise your glass
yungmanny  color blind
zaehd  ceo  get ratchet
616
banks  the devil
boofboiicy  no codefendant ft yung bans
dan bull  torbjörn not to be
dave b  all falls down
dave b  cocktail
fn dadealer  young stoner life  i remember
goldlink  raindrops ft flo milli
hope tala  mad
jenevieve  midnight charm
joey trap  chosen
joy crookes  feet dont fail me now
kojey radical  2fs
kojey radical  woohaa
mar90s  hold up
paris bryant  jay gwuapo  proud of you
rizzoo rizzoo  learn from boosie ft stunna 4 vegas
thomas rhett  things dads do
tracksmith  how im coming ft desiigner
trina  receipts
tyler the creator  lumberjack
young dolph snupe bandz  paperroute woo  nothing to me
617
b young  come alive
boyband  birth by sleep
brs kash  oh no madden22 version
chief keef  hadouken
derivakat  captains call ft cg5
diana ross  thank you
laura mvula  what matters ft simon neil
m1llionz  bando spot
offset trippie redd kevin gates lil durk  king von  hit em hard
tate mcrae  khalid  working
travie mccoy  a spoonful of cinnamon
yxng bane  birthday ft stefflon don

618
2kbaby  lazy song remix
azizi gibson  genesis ft akthesavior
becky hill  david guetta  remember
bino rideaux  got to know it
black birdie  lucky charm
brittney spencer  sober  skinny
chills  sunny dee ft itsoktocry
cj fly  you the type
clara mae  not sad anymore
colony house  lights on
dnice  kiana ledé  rather be
dababy  ball if i want to
dbangz  numb
don toliver  drugs n hella melodies ft kali uchis
flight  broke bih
g perico  out the house
gia woods  enough of you
isaiah rashad  headshots 4r da locals
jack savoretti  the way you said goodbye
jacquees  bed friend ft queen naija
jax jones  crystallise ft jem cooke
jay sean  happiness days
jennifer hudson  here i am singing my way home
joey trap  we slid on the ops today
jonas brothers  remember this
jutes  wiped out
kat von d  i am nothing
kodak black  falling over tribute to xxxtentacion
ksi  holiday
kyleyoumadethat yung baby tate  yvette  poof be gone ft cheerlebridee
lauren alaina  if the world was a small town
leon bridges  why don’t you touch me
like saturn  lucid unknowns
lilbubblegum  dropout
logic  intro
lukas graham  happy for you remix ft hanin dhiya
mabel  let them know
machine gun kelly  travis barker  a girl like you
majid jordan  been through that
mariah the scientist  2 you
natalie imbruglia  build it better
needtobreathe  sunshine
now united  nu party
olivia rodrigo  the rose song
omb bloodbath  dont do it
r3hab  kelvin jones  downtown
ramriddlz  jaegen  outta time
rejjie snow tinashe  grouptherapy  disco pantz
ron suno  fetty wap  drill zoo
roxy rosa  what about you ft kodak black
ruben  candy
russ  rather be myself
scarlxrd  grind
steve aoki gattüso  aukoustics  losing my religion ft mkla
suigeneris  slow down
surf  grooverelly  above me ft bigbabygucci
switchfoot  fluorescent
the cool kids  hibachi ft key  nikki sweets
thekidszn  bangers only  hills
the stupendium  the data stream ft camicat
the veronicas  goodbye
tisakorean  drift ft mighty bay  number9ok
tove styrke  mood swings
travis thompson  parked cars ft kyle  kota the friend
unlike pluto  lavender
vince staples  law of averages
wale  angles ft chris brown
xuitcasecity  slaves
yung tory  row ya boat
zara larsson  morning billen ted remix
zona man  how i started ft g herbo

619
lil yachty  fuck up my flow
soulja boy  mad
620
adamn killa  cheerio ft lil uzi vert
nle choppa  letter to my daughter
621
don q  law  order
logic  live from the country
nao  messy love
snoh aalegra  lost you
still woozy  thats life
tyler the creator  wusyaname ft youngboy never broke again  ty dolla ign
yuna  dont blame it on love ft pink sweat

622
asian doll  who want smoke
damon albarn  the nearer the fountain more pure the stream flows
elley duhé  traitor
grandson  jessie reyez  rain
jade bird  now is the time
jaden  bye
jordan rakei  family
lil jairmy  trust nun ft est gee
miley cyrus  nothing else matters ft chad smith robert trujillo yo‐yo ma elton john  watt
sugababes  same old story blood orange remix
the marías  little by little
vistas  young forever
years  years  the edge of glory
623
almighty jay  worthless
aap ant  lord fubu  futuristic diamonds ft baby 9eno
bastille  distorted light beam
cautious clay  shook
diplo  damian lazarus  dont be afraid ft jungle
faye webster  a dream with a baseball player
joey trap  wish list
kill jasper  muddy flow
mick jenkins  truffles
molly payton  honey
morgxn  sara bareilles  wonder
reese laflare omari shakir  key  i love my bitch
th​e blossom  spike collar
trapboy freddy  buss it open ft lakeyah
tropical fuck storm  gaff
wiki  highs and lows ft reed  hunnaloe
yn jay  triple s remix ft coi leray

624
637godwin  meagan good
aitch  learning curve
curreny  overhigh ft ty
dan bull  mr brigitteside
fredo  talk of the town
gavin turek  illusions
headie one  pound signs
icewear vezzo  tear the club up ft future
jazmine sullivan  tragic
jeremy zucker  18
kayla nicole  bundles 2 ft flo milli  taylor girlz
litany  sleepover
mist  rollin ft burna boy
rimon  feed me
s1mba  bounce ft tion wayne  stay flee get lizzy
selah sue  free fall
soulja boy  triple double
spacey jane  lots of nothing
tirzah  tectonic
625
alsojakob  new friends ft matt watson
american authors  nice and easy ft mark mcgrath
ashley kutcher  favorite what if
bankrol hayden  cabo
bayli  sick ft ilovemakonnen
betta lemme  girls
chase atlantic  oh mami
chris lane  aint even met you yet
coi leray  at the top ft  mustard  kodak black
dababy  red light green light
dennis lloyd  meditation
dillon francis  shift k3y  love me better ft marc e bassy
dimitri vegas  like mike felix jaehn  nea  heard about me
duckwrth  make u go
dvbbs  powfu  losing sleep
ebhoni  rotation
ed sheeran  bad habits
emily burns  im so happy
est gee  capitol 1
felly  fast car
filous  g flip  boys  girls
finn askew  paranoia
fletcher  healing
florrie  street lights
fredo bang  war time
gab3  lancey foux  gf remix
ji the prince of ny  no hook
james hype  good luck ft pia mia
jc stewart  loud
justin bieber  peaches masterkraft remix ft alpha p  omah lay
jutes  chariot
kidd g  lil uzi vert  teenage dreams 2
kyle  love me like you say you love me
​lany  dancing in the kitchen
leeky bandz  out of reach ft roddy ricch
like saturn  familiar dream
lil xan  life sucks
lil xxel  sorry changed
lil xxel  where do i start
lukas graham  happy for you duet ft janice vidal
magic whatever  i h8 everything ft dreamers  garzi
mary j blige  hourglass
max  ali gatie  butterflies
natasha bedingfield  lighthearted
​nessa barrett  counting crimes
nuski2squad  all for one
ohgeesy  secret service
olivia holt  next
osquinn  and most importantly have fun
peach prc  symptomatic
russ  satisfy
santino le saint  dopamine ft lancey foux
sara kays  traffic lights
scarlxrd  twx txne
scorey  love letter
sofía reyes  pedro capo  casualidad
tenille townes  girl who didn’t care
the band camino  know it all
the knocks  bedroom eyes ft studio killers
the score  victorious
the vaccines  back in love city
unknown mortal orchestra  weekend run
unlike pluto  hummingbird
voda fuji  pink quartz
wafia  wide open ft masego  taku
westside tut  sinbad remix ft 42 dugg
whokilledxix  spy turbo
willow  ​lipstick
xan griffin  sazón
yung gravy  bbno  wussup
626
​dearleo  ​let you in ft lil skil
kahdami  pick a strain ft matt ox  tyfontaine
soulja boy  copy  paste ft ti
627
yn jay  oxyyyyy
628
andy grammer  lease on life
omb peezy  not just anybody
sheff g  start some shyt
sodmg  4sho ft soulja boy flo malcom  keem sodmg

629
100k track  no love ft ynw melly  armon
cassius jay  personal ft young thug
faouzia  hero
flo rida  summers not ready ft inna  timmy trumpet
gashi  dont pass on love
lil yachty  love music
molly burch  took a minute
sg tip  one in the head ft slimelife shawty  21 lil harold
shygirl  bde ft slowthai
st vincent  sad but true
yameii online  frvr
630
bigwalkdog  whole lotta ice ft lil baby  pooh shiesty
claire rosinkranz  boy in a billion
dvsn  ty dolla ign  i believed it ft mac miller
grae  like you
inhaler  totally
lolo zouaï  galipette
louis the child  nez  keep on moving ft theophilus london
luke hemmings  starting line
magdalena bay  chaeri
matilda mann  bloom
midwxst  ruthless
noah kahan  godlight
phazzze  cold hart  scars
poppy  her
rico nasty  magic
smokeasac  purgatory ft lil tracy
teejay3k  no attempts ft omb peezy
the ophelias  julien baker  neil young on high
toby keith  happy birthday america
tyler shaw  sex on the beach
yebba  the past and pending
yola  starlight
you me at six  read my mind
yungblud  like a virgin1embed"
