id,song_name,artist_names,album_name,lyrics
1qASBtwhCOyfn6f1ZY0k2Y,Get A Life,Lil Wayne,2v3xdUz73rd6Nness5SSIh,"12 contributorsget a life lyricsintro
woo

verse 1
im just tryna get my own im up early in the monin
gettin it by all means
gotta get this dough oh oh oh
oh oh oh oh
but everytime i look over my shoulder
i see you and all your hatin hatin homies all up all up
in my zone no oh no no
oh no no oh no no
and your hatin hatin homies all up in my zone
come on man hey hey
what the fuck he lookin at me for hey
you wanna do somethin hey
do something

hook lil wayne
i say fuck you fuck you get a life get a life
man i got too much shit on my head
to have to deal with all of you you all you you
all you you all you you
i say fuck you fuck you get a life get a life
man i got too much shit on my head
to have to deal with all of you you all you you
all you you all you you
i say fuck you
see lil wayne liveget tickets as low as 84you might also likeverse 2
listen baby
youve got it goin on your girlfriends say i aint the one
they hate it when i call you i can hear em
in the background on your phone oh oh no oh
oh oh oh ohohoh
what you dont know about em baby when you not around em baby
they be tryna holla they be
hidin in the bushes of my home oh oh oh
oh oh ahoh oh
listen girl hey
you tired of your motherfuckin friends
hatin on your motherfuckin nigga everytime he call
theys a bunch of motherfuckin haters
fuck them boo

hook lil wayne
just say fuck you fuck you get a life get a life
man i got too much shit on my head
to have to deal with all of you you all you you
all you you all you you
i say fuck you fuck you get a life get a life
man i got too much shit on my head
to have to deal with all of you you all you you
all you you all you you
i say fuck you
bridge
all i can say is get a life
quit your motherfuckin hatin and get a life
get money get bitches and get a life
get it goin get it goin go get a life
all i can say is get a life
quit your motherfuckin hatin and get a life
get money get bitches and get a life
get it goin get it goin go get a life

outro lil wayne
ooh yeah
ooh yeah
ooh yeah1embed"
