id,song_name,artist_names,album_name,lyrics
4hf0hL4kWyjWztZzVsM39V,God Put a Smile upon Your Face,Coldplay,0RHX9XECH8IVI3LNgWDpmQ,"45 contributorstranslationsहिन्दीفارسیgod put a smile upon your face lyricsverse 1
where do we go nobody knows
ive gotta say im on my way down
god give me style and give me grace
god put a smile upon my face

verse 2
where do we go to draw the line
ive gotta say i wasted all your time oh honey honey
where do i go to fall from grace
god put a smile upon your face yeah

chorus
and ah when you work it out im worse than you
yeah when you work it out i wanted to
and ah when you work out where to draw the line
your guess is as good as mine

verse 3
where do we go nobody knows
dont ever say youre on your way down when
god gave you style and gave you grace
and put a smile upon your face ah yeah

chorus
and ah when you work it out im worse than you
yeah when you work it out i wanted to
and ah when you work out where to draw the line
your guess is as good as mine
see coldplay liveget tickets as low as 113you might also likebridge
its as good as mine
its as good as mine
its as good as mine
na nana nana nummana nana
as good as mine
as good as mine as good as mine
as good as mine as good as mine
as good as mine as good as mine

outro
where do we go nobody knows
dont ever say youre on your way down when
god gave you style and gave you grace
and put a smile upon your face18embed"
