id,song_name,artist_names,album_name,lyrics
0WtDGnWL2KrMCk0mI1Gpwz,Redbone,Childish Gambino,7caGY3YPOchIO8xLvTKWN4,"345 contributorstranslationstürkçeespañolportuguêsitalianofrançaisredbone lyricsverse 1
daylight
i wake up feelin like you wont play right
i used to know but now that shit dont feel right
it made me put away my pride
so long
you made a nigga wait for some so long
you make it hard for boy like that to go on
im wishin i could make this mine oh

prechorus
if you want it yeah
you can have it oh oh oh
if you need it ooh
we can make it oh
if you want it
you can have it

chorus
but stay woke
niggas creepin
they gon find you
gon catch you sleepin ooh
now stay woke
niggas creepin
now dont you close your eyes
you might also likeverse 2
too late
you wanna make it right but now its too late
my peanut butter chocolate cake with koolaid
im tryin not to waste my time

prechorus
if you want it oh
you can have it you can have it
if you need it you better believe in somethin
we can make it oh
if you want it
you can have it ahh

chorus
but stay woke stay woke
niggas creepin they be creepin
they gon find you they gon find you
gon catch you sleepin ooh gon catch you sleepin put your hands up now baby
now stay woke
niggas creepin
now dont you close your eyes
but stay woke oohahh
niggas creepin they gon find you
they gon find you
gon catch you sleepin ooh gon catch you gon catch you
now stay woke
niggas creepin
now dont you close your eyes
outro
howd it get so scandalous
oh howd it get so scandalous
oh oh baby you howd it get
howd it get so scandalous
howd it get so scandalous
but stay woke
but stay woke358embed"
