id,song_name,artist_names,album_name,lyrics
6hkQ6OQ6nhe7QCckH91aGa,Victory Lap (feat. Stacy Barthe),"Nipsey Hussle, Stacy Barthe",6rcbbhcm8Os7EiVRHP9Aef,"2 contributorstranslationsenglishnipsey hussle  victory lap ft stacy barthe traducción al español lyricsletra de nipsey hussle  victory lap ft stacy barthe traducción al español

intro stacy barthe y arctic monkeys
woahoh
woahoh
woahoh
al igual que el comienzo de calles malas tú podrías oh
al igual que el comienzo de calles malas tú podrías
al igual que el comienzo de calles malas tú podrías
al igual que el comienzo de calles malas tú podrías

verso 1 nipsey hussle y arctic monkeys
soy creativo bien bendecido
soy del tipo que va a ir a buscarlo no es broma
rompiendo un swisher al frente de tu edificio
sentado en los escalones sin sentir sentimientos
anoche fue una muerte fría
tienes que mantener al diablo en su agujero negro
pero ya sabes cómo es negro
estoy en primera línea cada vez que está en marcha negro
estilo prueba e cien correr y disparar proactivo
458 convertible sonando bullet proof soul
cada unos show solamente compro unos oro nuevo
el círculo se hizo más pequeño todos no pueden ir
el centro distrito de diamantes joyeros dicen oye
hussle tírame tengo cubanas en venta
volé a cancún fumando cubanos en el bote
luego desembarque en tulum solo para fumar mera
escuchando música en las ruinas mayas
verdadera devoción en el océano más azul navegando
mi influencia cultural incluso rivaliza con lucien
estoy integrado verticalmente ustedes negros lo arruinaron
me dicen hussle simplificalo podrías confundirlos
este no es ese rap raro al que cabrone están acostumbrados
al igual que el comienzo de calles malas
soy una leyenda urbana centro sur en cierta sección
no puedo expresar cómo curvé a los detectives
supongo que es evidencia de una presencia divina bendiciones
me detuvieron a veces parecía descuidado al carajo
obtuviste una f pero tienes una e por esfuerzo lo maté
lo tiré en el desierto de mojave luego lo abandoné
no hay respuesta para estas preguntas trucosas
dinero creador nip ordeno mis joyas en la cómoda de mi perra
bien conocido me retrato y hago pose de prisión
agarro una botella de champán de ricos hasta que t llegue
no importa negro jugando al ajedrez no a las damas negro
treinta y ocho especiales para los negros listos
vez chico si no vives y mueres según el código de la calle
pasé por todas estas mociones arriba y abajo como un balancín
nunca podré verte como mi igual
¿pa qué carajo quiero escuchar tu cd
you might also likecoro stacy barthe  arctic monkeys
al igual que el comienzo de calles malas
al igual que el comienzo de calles malas
al igual que el comienzo de calles malas
al igual que el comienzo de calles malas
al igual que el comienzo de calles malas
al igual que el comienzo de calles malas
tenemos que lograrlo
al igual que el comienzo de calles malas

verso 2 nipsey hussle
sí mira
voy a llevarlo ahí
esta vez lo dejaré claro
hablé algunas cosas en el universo y aparecieron
yo digo que vale la pena no diré que es justo
encuentra tu propósito o desperdicias aire
a la mierda entonces ustedes negros están asustados
ojos abiertos puedo verlo claro
no los hacen obtener nada no los hacen reales
no lo logran de donde soy no lo toman aquí
no vieron a su debido tiempo estaría ganando millone
mandando en este juego he estado haciendo tratos
llama a tu abogado por teléfono podemos hacerlo real
tengo cheques y balance me flexiono dramáticamente
otros cincuenta en mi cuello solo mi hábito imprudente
no hay cobardía en mi reputación irrespeta al salvaje
hago una llamada telefónica y el resto se maneja
es solo otro paso adelante con velas
pequeño mensaje de la ganga aceptamos tu reto
outro stacy barthe
woahoh
woahoh
woahoh
guau guau
tenemos que lograrlo sí tenemos que
tenemos que lograrlo oh tenemos que lograrlo
oh ah oh
tenemos que lograrlo oh
vuelta de la victoriaembed"
