id,song_name,artist_names,album_name,lyrics
7MmVXDISr1AEsJTjNiAlMG,Pose,Daddy Yankee,7JeWY0pvC27pCgn5eiSeV6,"11 contributorspose lyricsletra de pose

intro
dy
ey yo
ziggy da ziggy da
peligro oh oh
sigue el fuego ma sigue el fuego
caliente eh eh
ziggy da dy
ziggy dadaddy yan oh oh
you know baby
tú sabes lo que yo quiero baby
come on

coro
modélame así dame ahora tu mejor
pose pose pose
pose pose pose
vívetelo así dame ahora tu mejor
pose pose pose
pose pose pose cmon
modélame así dame ahora tu mejor
pose pose pose
pose pose pose you know
vívetelo así pero dame ahora tu mejor
pose pose pose pose cause you know this lady daddy
au au au
you might also likeverso 1
ella explota como en irak guilla como pipa de crack
se ve como tyra banks es algo ay ay
ella es la nena de daddy su pelo y su sexy body
está a otro nivel intocable no la pueden ver
mami vente al webcam fácil sigue mi plan
haz la cosa de la tuya como nadie la sabe hacer
ponte pa la foto me saqué la lotto
ahora dame la pose más sensual que sepas bebé

coro
modélame así dame ahora tu mejor
pose pose pose
pose pose pose en la cima del mundo daddy
vívetelo así dame ahora tu mejor
pose pose pose
pose pose pose evolución doctor
modélame así dame ahora tu mejor
pose pose pose cmon
pose pose pose lets go cmon
vívetelo así pero dame ahora tu mejor
pose pose pose pose
au au au

verso 2
miss latina next top model
tienes un estilo caro yeah
cuando baila con nadie la comparo paro
ella está matando en el club club
en mi lista la tengo en el top top
es impredecible tiene dulces ráfagas como un rifle
yeah sigue así tu movimiento lo siento
me está quitando el aliento
cuando te pegues préndete mi bebé
coro
modélame así dame ahora tu mejor
pose pose pose
pose pose pose is daddy yankee the big boss
vívetelo así dame ahora tu mejor
pose pose pose
pose pose pose the big boss cmon
modélame así dame ahora tu mejor
pose pose pose
pose pose pose controlando el área the big boss
vívetelo así pero dame ahora tu mejor
pose pose pose pose
au au au

outro
soy la evolución la revolución
the bigbig boss oh oh
el mejor de todos los tiempos ya tú lo sabes eh eh
ando con el musicólogo montando presión oh oh
con menes y talento de barrio el poder eh eh
the big boss oh oh
eh eh
oh oh1embed"
