id,song_name,artist_names,album_name,lyrics
5Xp42Elb6H3XyhjtjX5RNO,The Beginning,Little Mix,2FnfZiFMv7bmXAIATOJDHs,"19 contributorstranslationsespañolthe beginning lyricsintro jesy all jade
ahah
ahahahahah
ahah
ahahahahah

verse leighanne jade jesy perrie
lets take it back to where we first began
they turned us strangers into closest friends
turn the page and see the wonder
thats here for you and i i
was all so different once upon a time
but now the spark we got wont ever die
oh close your eyes and feel the magic
dont ever let it go

interlude jesy all
ahah
ahahahahah

prechorus perrie  jesy jade  leighanne
a bit of me a piece of you
with a sprinkle of attitude
a little dream a lot of love
turn up the heat baby dont give up
you might also likechorus all
yeah i know weve come so far
but its just the beginning ahh woahoh
yeah i know weve come so far
but its just the beginning15embed"
