id,song_name,artist_names,album_name,lyrics
3tcoEYOZUHKB3RKNByIN13,For Real,Lil Uzi Vert,733e1ZfktLSwj96X5rsMeE,"132 contributorsfor real lyricsintro
damn dj plugg you just kill—
bobby kritical

verse 1
for real for real for real yeah
sleep on em thats tempurpedic
get the green like its kale pockets they fat just like kenan
told her i love her aint mean it what thats because her head the meanest what
you heard that i am from mars i heard that you was from venus okay
i met that bitch in a meeting ooh i fucked that bitch from the meeting ooh
i been was planning to leave her ooh so i just left it to jesus
yuh yuh yuh yuh yuh lil vert like gerald damn
told that girl to cheer up fucking that girl til she tear up
heard you fucked her she embarrassed
heard your whip gary barbara eww
wait for real for real for real
diamonds they wet like a seal diamonds wet like navy seal
heard you drink lean crack the seal everybody know it aint real

chorus
you know i kept it for real walk around with it for real
you wanna bet if my money for real for real for real
all of my diamonds for real different color like pharrells
yeah thats for real for real for real
you know i kept it for real walk around with it for real
you wanna bet if my money for real for real for real
all of my diamonds for real different color like pharrells
yeah thats for real for real for real
see lil uzi vert liveget tickets as low as 450you might also likeverse 2
wont say no names but my niggas they pulled up
you niggas talk too much get your mouth sewed up yeah
look at my chain throwing salt cause its snowing
vivienne west but my fur lookin polar
my gosha from dover i drive in the rover
homie dont know me dont get in my moment
all that sneak dissing dont think that i aint noticed
i lift my door and i forgot to close it
boy better keep it sealed huh fuck around get killed yeah
fuck around get drilled cut your hands if you steal damn
whip it up like a meal i just made me a mil yup
money jumping out my pocket tucking bands in my belt
stop calling my phone leave me alone
im on tv with the vvs so i 3dd my stones yeah
we really dont get along she anemic im more chill
had to keep this shit for real all the way to the beat build yeah

chorus
you know i kept it for real walk around with it for real
you wanna bet if my money for real for real for real
all of my diamonds for real different color like pharrells
yeah thats for real for real for real
you know i kept it for real walk around with it for real
you wanna bet if my money for real for real for real
all of my diamonds for real different color like pharrells
yeah thats for real for real for real
outro
my diamonds real
for real for real for real36embed"
