id,song_name,artist_names,album_name,lyrics
0CKefyZmTxVJLnGZGYwsDq,Black & White People,Matchbox Twenty,2HqQR5SkxWX7uUWaxlLksn,"6 contributorsblack  white people lyricsverse 1
one more day down
everybody has those days
where one soft sweet songs
just enough to clear my head

verse 2
fall on real life
is anybody left there sane
and we slide on over and accept fate
then its bound to be a powerful thing

chorus
and if its just that youre weak can we talk about it
its gettin so damn creepy just nursin this
ghost of a chance the fiction the romance
and the technicolor dreams of black and white people

verse 3
one boy headstrong
he thinks that livin heres just plain
hes pushed down so hard
you can hear him start to sink

verse 4
and its one last round of petty conversation
you hold on boy cause you wont go down like this
you just roll on over and lay down
til its more than you can take
see matchbox twenty liveget tickets as low as 77you might also likechorus
and if its just that youre weak can we talk about it
its gettin so damn creepy just nursin this
ghost of a chance the fiction the romance
and the technicolor dreams of black and white people

interlude

bridge
so one more day down
and everybodys changin
one soft sweet songs
just enough to clear my my head

chorus
and if its just that youre weak can we talk about it
its gettin so damn creepy just nursin this
ghost of a chance the fiction the romance
and the technicolor dreams of black and white people

outro
yeah if youre weak can we talk about it
its gettin so damn creepy just nursin this
ghost of a chance the fiction the romance
and the technicolor dreams of black and white people
we are black and white people
yeah we are black and white people
yeah we are black and white peopleembed"
