id,song_name,artist_names,album_name,lyrics
7g7M96UGiA7OR79H86gV4m,U and Dat (feat. T. Pain & Kandi Girl),"E-40, T-Pain, Kandi Girl",3VqKqWHOHYfZqttJ0WwQHl,"27 contributorsu and dat lyricschorus tpain
girl i been shakin stickin and movin
tryna to get to you and that booty
tryna to get to you and that booty
tryna to get to you and that booty
girl i been shakin and actin a donkey
tryna to get to you and that monkey
tryna to get to you and that monkey
tryna to get to you and that monkey

verse 1 tpain  e40
girl hes simpin
walk up in the club with a limp and girl listen
whatcha gon do with this pimpin
whatcha gon do with this pimpin
girl ima call ya
later on tonight or tomorrow now follow
whatcha gon do with this baller e40 tpain
whatcha gon do with this baller girl ooh

verse 2 e40
whatcha gon do when i bend the block
pull up on that ass in a brandnew drop
speakers on blast with tremendous knock
tvs in the dash rims just wont stop
you need to be down with a pimp like me
i aint turnin down nothin but my collar ya see
ima leave you with my number you should holla at me
cause im a baller cant nobody hustle harder than me ooh
you might also likechorus tpain
girl i been shakin stickin and movin
tryna to get to you and that booty
tryna to get to you and that booty
tryna to get to you and that booty
girl i been shakin and actin a donkey
tryna to get to you and that monkey
tryna to get to you and that monkey
tryna to get to you and that monkey girl

verse 3 e40
ooh yo ass is ripe
i aint tryna to let that pass me tonight
ima put my bid in and tell you somethin slick
whisper in your ear while im holdin my dick
i dont mean no harm its the hood in me
sippin on that richard hennessy
psychedelic colors in my jewelry
suckers hella jealous cause youre diggin me ooh
now whatchu gon do mama
im tryna to dip later on me and you mama
i like the way that you groove when you move mama
you know the women love me im the 40 water
poppin my ps cause im laced with game
nothin but the yay flowin through my veins
she wears misssixty cant fit into gucci
cause her ass big enough to sit a cup on her booty ooh goodness
chorus tpain
girl i been shakin stickin and movin
tryna to get to you and that booty
tryna to get to you and that booty
tryna to get to you and that booty
girl i been shakin and actin a donkey
tryna to get to you and that monkey
tryna to get to you and that monkey
tryna to get to you and that monkey

verse 4 kandi
yeah i see you lookin
but my ass in these jeans got you shook and
i dont think you know what to do with this pussy
whatcha gon do with this pussy
yeah i know you want this want this
tryna chase me through the club for this good shit
but i dont think you can handle this pussy
whatcha gon do with this pussy boy

verse 5 e40
you lookin like you got that good gooshy gooshy
fuck around with me ill beat the brakes off that pussy
have yo ass comin like a porno star movie
tell yo friends then ill bet they all wanna do me
hoes know me im efouro
they recognized pimpin when i stepped in the door
higher than a satellite full of that dro
holla at a player when youre ready to go ooh
chorus tpain
girl i been shakin stickin and movin
tryna to get to you and that booty
tryna to get to you and that booty
tryna to get to you and that booty
girl i been shakin and actin a donkey
tryna to get to you and that monkey
tryna to get to you and that monkey
tryna to get to you and that monkey2embed"
