id,song_name,artist_names,album_name,lyrics
5OvxVXpGfp2rKQ3X0CqcIr,Negative Energy (feat. Kodie Shane),"Trippie Redd, Kodie Shane",1fFwMXuTJ8J3KXo14Vvsna,"65 contributorsnegative energy lyricsintro trippie redd
i love trippie redd
oh these hoes
i dont know about these hoes
what about me though
balling like victor oladipo skrrt skrrt
yeah steady yeah yeah

verse 1 trippie redd
uh feel like steveo
see a pussy nigga through the peephole
hit him with the beam though
diamonds shine hit him with the gleam though
game on lock no keyhole
50k on the teeth ho
bugatti with all the speed though
bet they wont find me like nemo
yeah takin that bitch straight to mickey ds for real
she want a burger and 10piece for real
might catch a murder its tempting for real
wont everybody remember me yeah
i aim at the head of a enemy
i swear this lil thottie she into me
im takin her soul and her energy

chorus trippie redd
this shit it just fill up my entity yeah
made me just feel like my enemy yeah
i might just turn into my inner beast yeah
know we tote choppers we in the streets yeah
you niggas got fucked up energy fucked up energy
come on big dawg where you wanna meet
dawg where you wanna meet
come on big dawg where you wanna meet
dawg where you wanna meet
come on big dawg where you wanna meet
dawg where you wanna meet
see trippie redd liveget tickets as low as 61you might also likeverse 2 trippie redd
bitch im the shit like my butt stink
that little bitch is a bustie
that little bitch wanna fuck me
but that lil bitch is too dusty
she prolly got crabs she so crusty
i bet that lil pussy is pusy
just the thought of that shit is disgusting
off the wall humpty dumpty

chorus trippie redd  kodie shane
this shit it just fill up my entity yeah
made me just feel like my enemy yeah
i might just turn into my inner beast yeah
know we tote choppers we in the streets yeah
you niggas got fucked up energy fucked up energy
come on big dawg where you wanna meet
dawg where you wanna meet
come on big dawg where you wanna meet slatt
dawg where you wanna meet
come on big dawg where you wanna meet
dawg where you wanna meet

verse 3 kodie shane
come on big dawg come be one of me
i know my demons are chasing me
only lost once it was in a dream
so i went and i run if its chasin me
big body coupe it looks like stars in the patek yeah
we could see the moon because the roof came off this shit uh
yeah thats her best friend but i still wanna fuck again yeah
i dont know why my demons keep following me again
come on big dawg come be one of me yeah yeah
i dont fear none of my enemies
they want to steal all my energy
chorus trippie redd
this shit it just fill up my entity yeah
made me just feel like my enemy yeah
i might just turn into my inner beast yeah
know we tote choppers we in the streets yeah
you niggas got fucked up energy fucked up energy
come on big dawg where you wanna meet
dawg where you wanna meet
come on big dawg where you wanna meet
dawg where you wanna meet
come on big dawg where you wanna meet
dawg where you wanna meet

outro rocket da goon  trippie redd
yeah this a muhfuckin love chopper bitch
ill shoot you in yo muhfuckin ass
huh what the fuck you thought
you wanna fuck with the rocket you gotta put it in my pocket
tell a broke ho stop it
im the plug to the muhfuckin socket ya dig
love letter to you 3
huh big 14
yeah huh
yeah huh
yeah huh
yeah yeah ahahah yeah
i had to end this screamin bitch15embed"
