id,song_name,artist_names,album_name,lyrics
64iFfe5BlA6VayEGnGGaPH,El Empuje,Daddy Yankee,4pLuE50wL9T26lSv42X0J2,"7 contributorsel empuje lyricsletra de el empuje

intro
¡rra
demente

coro 1
mami ¿tú aguantas el empuje dale daddy
mami ¿tú aguantas el empuje dale daddy
mami ¿tú aguantas el empuje ahh
que los perros andan sueltos
mami ¿tú aguantas el empuje dale daddy
mami ¿tú aguantas el empuje dale daddy
mami ¿tú aguantas el empuje
tira la mano al aire tira la mano al aire

verso 1
ma ven y viaja en mi flow aquí comando yo
nuevamente a partir el ritmo del dembow
quieres más latigo te lo doy rapido
es mortal el veneno de mi acido
tá dura yo lo sé tá buena yo lo sé
si te viera te coje de guitarra josé
pero guaya to ese mahon que te da comezón
¿qué misterio tu guarda en ese pantalón ahh
que to el mundo le quiere dar un vocao ahh
ese jardin ella lo tiene bien cuidao ahh
tengo licencia heavy pa guiarguiarle yo ahh
ese equipo pesao
you might also likecoro 2
vamo rabiosa tú pide dame
si a ella le gusta tú dale sigue
pa que ella se lo vacile duro
perreando todo se vale eheheheheh

tú pide dame
si a ella le gusta tú dale sigue
pa que ella se lo vacile duro
perreando todo se vale eheheheheh

verso 2
las mujeres de hoy en día son independiente
no buscan un incompetente
no le hablen de la plancha ni del detergente
aquí nadie le impone a ella los quehacere
le gusta vacilar toda la noche entera
te voa zumbar un poco de mi crema avena
por que cuando yo canto ella olvida las pena
mi apellido es ayala dueño de esta plena
es que desde mi nacimiento traje la sandunga
y mira que facilito yankee los madruga
así que no te ahogues en tu propio vache
que en esto soy un gangster a lo tony sanchez
el cazador no falla cuando busca la liebre
si sale contra el cangri yo hare que te siembreb
mi gatita y yo dandonos vida e reyes
vacilando más que un 31 e diciembre donde sea
coro 1
mami ¿tú aguantas el empuje dale daddy
mami ¿tú aguantas el empuje dale daddy
mami ¿tú aguantas el empuje ahh
que los perros andan sueltos
mami ¿tú aguantas el empuje dale daddy
mami ¿tú aguantas el empuje dale daddy
mami ¿tú aguantas el empuje

coro 2
vamo rabiosa tú pide dame
si a ella le gusta tú dale sigue
pa que ella se lo vacile duro
perreando todo se vale eheheheheh

tú pide dame
si a ella le gusta tú dale sigue
pa que ella se lo vacile duro
perreando todo se vale eheheheheh

puente
ma ven y viaja en mi flow aquí comando yo
nuevamente a partir el ritmo del dembow
quieres más latigo te lo doy rapido
quiere más latigo
te voa sumbar un poco de mi crema avena
te voa sumbar un poco de mi crema avena
te voa sumbar un poco de mi crema avena
te voa sumbar un poco de mi crema avena
mamamama ven y viaja en mi flow
ven y viaja en mi flow
nuevamente a partir el ritmo del dembow
mamamama ven y viaja en mi flow
ven y viaja en mi flow
tira la mano al aire tira la mano al aire ahh
outro
mami ¿tú aguantas el empuje dale daddy
mami ¿tú aguantas el empuje dale daddy
mami ¿tú aguantas el empuje ahh
que los perros andan sueltosembed"
