id,song_name,artist_names,album_name,lyrics
2MF4HtZHBoUliOi9nOAbS0,Purity (feat. Frank Ocean),"A$AP Rocky, Frank Ocean",3MATDdrpHmQCmuOcozZjDa,"2 contributorstranslationsenglishaap rocky  purity ft frank ocean tradução em português lyricsintro aap rocky
eu estive ocupado ocupado ocupado
eu estive ocupado pra caralho eu estive ocupado fodendo
eu estive todo tipo de ocupado ou meio ocupado
tipo gata estamos fodendo bem se não então fodase
desculpas pra família achamos que tínhamos se livrado deles
eu disse que tava com pressa mas eu tava ocupado correndo
é uma merda ocupada ocupado aqui ocupado ali
e eu preciso de um minuto calma aí

refrão lauryn hill aap rocky  frank ocean
viu isso é o que aquela voz na sua cabeça diz
quando você tenta ter paz de espírito
eu tenho que encontrar paz de espírito ooh vou encontrar
eu tenho que encontrar paz de espírito eu vou encontrar
eu tenho que encontrar paz de espírito yeah

verso 1 frank ocean  lauryn hill
passando o tempo girando em direção a um desejo que não era puro
nasci antes do vírus ser curado afinação perfeita violinos no chão
avanço rápido revestimentos no meu crânio isso é o que aquela voz na sua cabeça diz quando você tenta ter paz de espírito
esse é o tipo de grife que eu poderia pagar
avanço rápido grana voando
eles levantam as mãos como se reconhecessem o führer eu tenho que e—
eu volto nas faixa 6 volto com passes de dança
leia a minha mente liberte a minha mente alimente a minha mente faça sentido
assim como os espelhos na parede assim como sentar em mim isso é o que aquela voz na sua cabeça diz quando você tenta ter paz de espírito
cru em espelhos que veem de tudo poderia fazer dois um pedaço da mente eu tenho que e—
cinzas voando derramando metade não despeje em um copo
despeje na espuma esse branco tem cascas de ovo na minha omelete
meus lóbulos das orelhas são amarelos como a gema que tá escorrendo
cérebro nas drogas eu ainda não tenho paz de espírito merda
woof woof—cachorros no lugar dente solto—perdido na briga
sem teto no wraith teto perdido no caminho
autoestrada nada de rozay força bruta champanhe brüt
fala pra recepção pra fazer chaves novas
reservado no mercer por dois anos em duas suítes
tirei a cama tipo fodase dormir
eu vou pegar uma vadia como se fossem mãos quentes
demiti a gravadora tipo fodase as marcas
tô confortável baixo fodase os xans
tô confortável lento quem diabos correu
nada é doce nada no tanque é doce é só um tanque p
sal numa lesma refrigerante em dentes lesados mastigando o nada
você tá mexendo ou algo assim você tá procurando por algo
você tá falando então fale você tá pensando você tá pensando demais
um piscar de olhos e eu tô quase gozando
isso poderia transformar cada ninguém em alguém
you might also likerefrão lauryn hill frank ocean  aap rocky
eu tenho que encontrar paz de espírito ohh do do do do oh
eu tenho que encontrar paz de espírito oh oh
eu tenho que encontrar paz de espírito oh oh
eu tenho que encontrar paz de espírito você torna meu desejo puro
eu tenho que encontrar paz de espírito você torna meu desejo puro
eu só preciso de paz de espírito para minha pureza
você torna meu desejo puro apenas me diga
você torna meu desejo puro apenas me diga

verso 2 aap rocky  lauryn hill
as memórias queimam as baratas
bebendo hennessy pelas minhas velhas lembranças
anfetaminas para a dosagem
tô me mantendo acordado e focado
pano de joias meus bonés são de ouro
ny das antigas igual o velho fab eu estou desfeita porque
perdido no google maps no seu imac acho que meu telefone tá grampeado
calma aí segura aí calma aí meu mano segura aí— eu estou desfeita porque
mano despeje o refrigerante mano segura essa tosse tô tentando segurar
a chamada caiu quando o facetime parou eu estou desfeita porque não ligue de volta
não consegui lidar quando seu coração se partiu
fala mansa passa alguma coisa compra alguma coisa narco
santo igual a joana darc mano código de barras de anel
dois de tudo deveria ter sido o culpado quando a arca de noé quebrou eu estou desfeita porque
mais dois drinques de tudo antes do bar fechar
cara a cara com meus traumas numa banqueta
não vejo a minha sobrinha há semanas
meses passaram ​​desde que eu e a minha irmã conversamos
sem uma ligação ou visita há semanas
perdi nada desde setembro
a última vez que vi ela foi em 16 de setembro
cara parece eu estou desfeita porque
perder alguém a cada lançamento parece que a maldição tá em mim aap
a imprensa se foi e eu luto eu compartilho a minha paz com você
saída lauryn hill
eu estou desfeita porque—
eu estou desfeita porque—embed"
