id,song_name,artist_names,album_name,lyrics
4BOikd4oZjOYMde9AXfrTo,Feels,Kehlani,73ZvpuYhKDr2FW4vlPsTpW,"19 contributorsfeels lyricsverse 1
i ask myself is this shit real
i contemplate bout how i feel
but you make it way too hard to think
that this could be what true love is

prechorus
i dont want wait another minute for ya
oh you got me falling from the ceiling for ya
knew right from the start there was no limit to ya
and im catching feelings baby

chorus
you give me feels and i
know that it know that it know that its real
you give me you give me feels
you give me feels and i
know that it know that it know that its real
you give me you give me feels

verse 2
it took a lot of hard shit just to learn
how not to break down and stop baby
no matter what i seen in the past
i wont let it impact how we grow now baby
i cant let it slip away or drift away
cant go to waste go to waste uh
i say it straight straight to your face
wont contemplate yeah contemplate that baby
you might also likeprechorus
i dont want wait another minute for ya no no
oh you got me falling from the ceiling for ya oh yeah
knew right from the start there was no limit for me
and im catching feelings baby

chorus
you give me feels and i you give
know that it know that it know that its real that its real
you give me you give me feels feels
you give me feels and i
know that it know that it know that its real
you give me you give me feels oh

bridge
you give me feels you give me feels
you give me feels you give me feels feels
you give me feels you you you you you you uh
you give me feels you give me feels feels

chorus
you give me feels and i oh
know that it know that it know that its real that its real
you give me you give me feels
you give me feels and i
know that it know that it know that its real know that its real
you give me you give me feels oh
you give me feels11embed"
