id,song_name,artist_names,album_name,lyrics
2M7y4xDWT67Lf0JE9mrz1R,Man in the Mirror,Michael Jackson,77dNyQA0z8dV33M4so4eRY,"164 contributorstranslationsnederlandsfrançaisman in the mirror lyricsverse 1
im gonna make a change for once in my life
its gonna feel real good
gonna make a difference gonna make it right
as i turn up the collar on my favorite winter coat
this wind is blowin my mind
i see the kids in the street with not enough to eat
who am i to be blind pretending not to see their needs
a summers disregard a broken bottle top
and one mans soul
they follow each other on the wind ya know
cause they got nowhere to go
thats why i want you to know

chorus
im starting with the man in the mirror
im asking him to change his ways
and no message could have been any clearer
if you wanna make the world a better place
take a look at yourself and then make a change
nanana nanana nana nana

verse 2
ive been a victim of a selfish kinda love
its time that i realize
there are some with no home
not a nickel to loan
could it be really me pretending that theyre not alone
a willow deeply scarred somebodys broken heart
and a washedout dream
they follow the pattern of the wind ya see
cause they got no place to be
thats why im starting with me
you might also likechorus
im starting with the man in the mirror who
im asking him to change his ways who
and no message could have been any clearer
if you wanna make the world a better place
take a look at yourself and then make a change
im starting with the man in the mirror who
im asking him to change his ways who
and no message could have been any clearer
if you wanna make the world a better place
take a look at yourself and then make that change
im starting with the man in the mirror man in the mirror oh yeah
im asking him to change his ways change his ways
come on change
and no message could have been any clearer

bridge
if you wanna make the world a better place
take a look at yourself and then make the change
you gotta get it right while you got the time
cause when you close your heart you cant
then you close your mind close your your mind

chorus
that man that man im starting with the man in the mirror
that man
ooh
that man that man im asking him to change his ways
that man the man
change his ways ooh
and no message could have been any clearer
if you want to make the world a better place
take a look at yourself and then make that
take a look at yourself and then make that
change
outro
hoo hoo nanana nanana nana nana hoo hoo hoo hoo hoo
gonna feel real good oh yeah
yeah yeah yeah yeah nanana nanana nana nana
yeah yeah oh oh no
im gonna make a change
its gonna feel real good shamone change
just lift yourself you know
youve got to start with yourself yeah hoo
make that change i gotta make that change today hoo
man in the mirror you got to you got to not pick yourself brother hoo yeah
you know make that change
ive gotta get that man that man man in the mirror
you got to you got to move shamone shamone
you got to stand up yeah stand up make that change stand up stand up and lift yourself now man in the mirror
hoo hoo hoo aaow yeah make that change
go make that change shamone man in the mirror
you know it you know it you know it you know change
make that change86embed"
