id,song_name,artist_names,album_name,lyrics
2xBfOUdiRafSWGqTj4yToU,Mind on My Murder,YNW Melly,7naY6j4wcgUxfHB98G79CW,"73 contributorsmind on my murder lyricsintro
i thank god for everything
mind on my murder mind on my murder
young nigga world bitch
mind on my murder murder
murder on my mind part two hey

verse 1
sky is getting red body getting cold
losing hella blood lord please save my soul
if i have to die dont know where ill go
i dont want to die im only 10 years old oh
my mama cried
yellow tape around my body its a homicide
and he told me it was accidental by surprise
ambulances everywhere and i just pray that i survive

prechorus
cause baby its a homicide oh a homicide
he just shot me and i dropped down to the floor
he said i caught him by surprise i caught him by surprise
he was shellshocked and he claimed he didnt know
i grabbed his hand cause i was terrified said i was scared to die
he just watched my blood spill out and die slow
i looked him right inside the eyes he looked inside my eyes
asked him would i survive he shook his head no
you might also likechorus
mind on my murder yeah murder huh murder huh
mind on my murder yeah murder ayy murder hey
mind on my murder yeah murder hey murder huh
mind on my murder hey mind on my murder

verse 2
yellow tape around my body its a homicide
never thought my day one friend would be the one to take my life
and he aint even shoot me once this nigga shot me twice
and i dropped down to the floor and i had teardrops in my eyes
never thought a home invasion wouldve costed me my life
all i wanted was a mouth full of golds and my neck and wrist with ice
but now i just got murdered while i go in paradise
just sing this chorus with me twice

chorus
mind on my murder hey murder hey murder huh
mind on my murder hey murder hey murder hey
mind on my murder hey murder hey murder hey
mind on my murder hey mind on my murder

verse 3
fuck with it then and your life will get ended
fuck do you know about melly the menace
glock26 and that bitch is extended
glock27 bitch im really with it
catch that fuck nigga hit him with the semi
you know my young niggas really aint friendly
bite like tarantula flip like a spatula
suck on that bitch i want blood like im dracula
whoawhoa suck on it slow fuck that lil bitch on the floor
you know its melly the menace the clip is extended
you fuck with me life will get ended
we go in your mouth like a dentist
we walk through the entrance
bitch give me the bag run it up
your bitches wanna have fun with us
she wanna tote on a gun with us
she smokin dick yeah that ho smokin angel dust
topic yeah
let a nigga get back on top yeah
pull up on a nigga with that glockock bitch
i dont give no fuck about shot shit
i dont give no fux about her
pull up on a nigga its a fuckin m1
free my nigga trell he just caught an m1
prechorus
cause baby its a homicide oh a homicide
he just shot me and i dropped down to the floor
he said i caught him by surprise i caught him by surprise
he was shellshocked and he claimed he didnt know
i grabbed his hand cause i was terrified said i was scared to die
he just watched my blood spill out and die slow
i looked him right inside the eyes he looked inside my eyes
asked him would i survive he shook his head no

chorus
mind on my murder murder huh murder huh
mind on my murder ayy murder ayy murder huh
mind on my murder ayy murder ayy murder huh
mind on my murder hey mind on my murder yellow tape31embed"
