id,song_name,artist_names,album_name,lyrics
1F1ZBb99LyHuSiBP7OJtVW,Vale La Pena El Placer,Romeo Santos,6a3RDPcFamZvFCi8VeXWkK,"3 contributorsvale la pena el placer lyricsdecidiste elegir un clavel
un hombre que supiera ser fiel
porque evidentemente soy espinas
y aunque te amo tanto causo heridas
el te ofrece el cielo te compra el edén
pero carece de conocerte muy bien
no se imagina que es plan b en tu vida
cuando dices que lo amas es mentira
yo te propongo que te seas fiel
aunque signifique serle infiel

regálate una noche conmigo de derroches
ven rompe cada reglas lo prohibido
seremos dos corruptos y si es delito
que podemos hacer
vale la pena el placer

regálale a tu cuerpo
una fiesta de recuerdos
hagamos el amor hasta el cansancio
y si el remordimiento viene a estorbarnos
que podemos hacer
vale la pena el placer

yo no lo odio pero no me cae tan bien
se que el es tuyo pero tu eres mi mujer
y el pobre no lo sabe o se hace el tonto
tu eres mi propiedad de cualquier modo
yo te propongo que te seas fiel
aunque signifique serle infiel
you might also likeregálate una noche conmigo de derroches
ven rompe cada reglas lo prohibido
seremos dos corruptos y si es delito
que podemos hacer
vale la pena el placer

regálale a tu cuerpo
una fiesta de recuerdos
hagamos el amor hasta el cansancio
y si el remordimiento viene a estorbarnos
que podemos hacer
vale la pena el placer…embed"
