id,song_name,artist_names,album_name,lyrics
1WqLZZ54Mp7SDHypeAAtCE,Eve,Key Glock,7snqOEQEtKqxJw3NTGml6i,"8 contributorseve lyricsintro
bandplay
glizzock
let the bandplay
ayy yeah

chorus
ever since i heard bout eve i can’t be playin with these bitches uhuh yeah yeahyeah
dollar sign up on my ring finger im married to the shit yeah yeahyeah
yeah every time i get a bag i spend that shit or i go flip it yeah yeah yeahyeahyeah
yeah ever since i lost my granny i’ve been drinkin like a fish yeah yeah yeahyeahyeah
yеah im talking bout wockhardt i cant find it then its tris
nigga tryna slime my glizzock i fuck around they comе up missin
yup i really came from shit now it aint shit to get a milli
they like why you don’t do features ’cause i dont like meetin’ new niggas yeah

verse
hoppin out that yellow motherfucker with blue figures uh
smokin on some ziup its just me and my four nickel uh
slime your bitch like jaiah in my city i’m that nigga glizzock
get the seaters on my frontline aint no monkey in the middle
yeah im a blood they know im official
i got stripes but not a whistle yeah
and you know i keep a pistol know my name came with credentials yeah
glock 40 in my denim this bitch here came with utensils yeah
all my jesus piece a hunnid racks and it got all emerald
yeah i be pourin jesus blood in my styrofoam yeah yeah yeah yeah
yeah the doctor told me money runnin through my chromosome yeah yeah yeah yeah
yeah im addicted to this shit somehow i cant leave it alone leave it alone the fuck
see key glock liveget tickets as low as 83you might also likechorus
ever since i heard bout eve i cant be playin with these bitches yeah
dollar sign up on my ring finger im married to the shit yeah
yeah every time i get a bag i spend that shit or i go flip it yeahyeah yeah
yeah ever since i lost my granny ive been drinkin like a fish yeah
yeah im talking bout wockhardt i cant find it then its tris
nigga tryna slime my glizzock i fuck around they come up missin
yup i really came from shit now it aint shit to get a milli
they like why you dont do features cause i dont like meetin new niggas the fuck

outro
on god1embed"
