id,song_name,artist_names,album_name,lyrics
5stbfxsPi8gcOH2LCuA4Le,pad lock,21 Savage,007DWn799UWvfY1wwZeENR,"57 contributorstranslationsespañol​pad lock lyricsintro
yeah yeah dawg
this shit real dawg
niggas kill dawg
keep the steel dawg
or be a longlive dog
straight up

verse 1
im hangin with killers serial straight up
still in the hood eatin cereal straight up
i pray to these streets like they biblical straight up
jump off the rope rey mysterio straight up
two ounces stashed in my stereo on god
you can get killed for subliminals on god
im a big dog you a cheerio on god
i dont gotta talk loud but you hear me though straight up
catch him down bad in traffic 21
way before the deal i was trappin 21
way before the deal i was puttin that fire on niggas just to feed my family on god
21 gang im a bandit straight up
i aint have a father he abandoned 21
me and mine swear i went and picked up a lil bit of weed and a nine yeah
partner damn near did a dime yeah
and he still got another nine yeah
sent my boy 100 racks in the chain gang nigga cause money is time on god
lately i been on my grind straight up
25 hundred on wine facts
50 thousand on a suit its a good investment
yeah cause the deal worth dyin 21
see 21 savage liveget tickets as low as 79you might also likechorus
heart so cold got a padlock padlock
padlock padlock padlock padlock padlock
he aint in the field he a mascot mascot
mascot mascot mascot mascot mascot
chasin this money i cant stop wont stop
cant stop wont stop cant stop wont stop wont stop
chasin this money i cant stop wont stop
cant stop wont stop cant stop wont stop wont stop
heart so cold got a padlock padlock
padlock padlock padlock padlock padlock
he aint in the field he a mascot mascot
mascot mascot mascot mascot mascot
chasin this money i cant stop wont stop
cant stop wont stop cant stop wont stop wont stop
make more than a teacher ima drop out drop out

verse 2
i got rich nigga problems rich nigga
tryna put a 50 in my joggers wont fit nigga
knew you was a rat when we was toddlers you a snitch nigga
you was always the cop i was the robber lil bitch nigga
born to be a leader not follow follow
seventeen with a monte carlo carlo
yall was in the house playin mario mario
i was sellin weed and went hollow went hollow
thats just how we was raised on god
before we came of age straight up
yall niggas wanted some pets 21
my niggas wanted some ks on god
i had to sell a lil weed to hit the flea market and buy some fake yes straight up
thats where i bought my first grill on god
thats where i bought my first js on god
member when my mama was stressed damn
look at your son now im paid goddamn
she aint really worry bout harm
she worry bout jail cause she know i dont play yes maam
she remember days twobedroom mini14 and a sk 21
i could leave today she know that ima take a nigga with me cause she know im gon spray on god
chorus
heart so cold got a padlock padlock
padlock padlock padlock padlock padlock
he aint in the field he a mascot mascot
mascot mascot mascot mascot mascot
chasin this money i cant stop wont stop
cant stop wont stop cant stop wont stop wont stop
chasin this money i cant stop wont stop
cant stop wont stop cant stop wont stop wont stop
heart so cold got a padlock padlock
padlock padlock padlock padlock padlock
he aint in the field he a mascot mascot
mascot mascot mascot mascot mascot
chasin this money i cant stop wont stop
cant stop wont stop cant stop wont stop wont stop
make more than a teacher ima drop out drop out10embed"
