id,song_name,artist_names,album_name,lyrics
1boRrmld4Ao43YxAIl59qh,La Vieja Banca,Lalo Mora,1BnTwu2JNvBuSAWnfDwBn4,"1 contributorla vieja banca lyricshay frente a la iglesia
una vieja bancaque testigo fue
de aquellas promesas
que de amor me hiciste
que yo no olvidare

tambien es testigo
que cuando te fuiste
te quise detener
se me parte el alma
se me parte el alma
tan solo de pensar
que ya no has de volver

yo no queria
que te fueras
pero mi orgullo
me impidio detenerte
ante la imposibilidad
de hacerte feliz
mejor te deje partir
llevaste contigo
mi ilusion y todo
mi anhelo
hiciste triste mi vida
me oscuresiste el camino
mi mundo y mi cielo
you might also likecuanto sufrimiento
hay dentro de mi alma
que grande dolor
llorando en silencio
mi vida se acaba
me falta tu amor
se me parte el alma
ver la vieja banca
desde que te perdi
no me siento en ella
porque tengo miedo
que un dia me pregunte
que ha sido de tiembed"
