id,song_name,artist_names,album_name,lyrics
2blUPZhTicoBzBFl5CwcyY,Slippin',DMX,2ge7Lk4Sl7hHs4AYxqDbf1,"109 contributorstranslationsdeutschslippin’ lyricsintro
this life shit this life shit is like
is like bugged the fuck out son for real
see to live is to suffer
but to survive
well thats to find meaning in the suffering

chorus
ayo im slippin im fallin i cant get up
ayo im slippin im fallin i cant get up
ayo im slippin im fallin i gots to get up
get me back on my feet so i can tear shit up
ayo im slippin im fallin i cant get up
ayo im slippin im fallin i cant get up
ayo im slippin im fallin i gots to get up
get me back on my feet so i can tear shit up

verse 1
ive been through mad different phases like mazes to find my way
and now i know that happy days are not far away
if im strong enough ill live long enough to see my kid
doing something more constructive with their time than bids
i know because i been there now im in there ugh
sit back and look at what it took for me to get there ugh
first came the bullshit the drama with my mama
she got on some fly shit so i split and said that ima
be that seed that doesnt need much to succeed ugh
strapped with mad greed and a heart that doesnt bleed what
im ready for the world or at least i thought i was
bagging niggas when i caught a buzz
for thinking about how short i was come on
goin too fast it wouldnt last but yo i couldnt tell
group homes and institutions prepared my ass for jail uhhuh
they put me in a situation forcing me to be a man
when i was just learning to stand without a helping hand
damn was it my fault something i did
to make a father leave his first kid at seven doin my first bid ugh
back on the scene at fourteen with a scheme ugh
to get more cream than id ever seen in a dream ugh
and by all means i will be livin high off the hog what
and i never gave a fuck about much but my dog what
thats my only mothafucka i hit off with my last
just another lil nigga headed nowhere fast
you might also likechorus
ayo im slippin im fallin i cant get up
ayo im slippin im fallin i cant get up
ayo im slippin im fallin i gots to get up
get me back on my feet so i can tear shit up
ayo im slippin im fallin i cant get up
ayo im slippin im fallin i cant get up
ayo im slippin im fallin i gots to get up
get me back on my feet so i can tear shit up

verse 2
that aint the half shit gets worse as i get older
actions become bolder heart got colder
chip on my shoulder that i dared a nigga to touch
didnt need a clique cause i scared a nigga that much
one deep with the pit startin shit for kicks
catchin vics throwin bricks gettin by bein slick
used to get high just to get by
used to have to puff my l in the morning before i could fly
ate somethin a couple of forties made me hate somethin
i did some coke now im ready to take somethin
three years later showin signs of stress
didnt keep my hair cut or give a fuck how i dressed
im possessed by the darker side livin the cruddy life
shit like this kept a nigga with a bloody knife
wanna make records but im fuckin it up
im slippin im fallin i cant get up
chorus
ayo im slippin im fallin i cant get up
ayo im slippin im fallin i cant get up
ayo im slippin im fallin i gots to get up
get me back on my feet so i can tear shit up
ayo im slippin im fallin i cant get up
ayo im slippin im fallin i cant get up
ayo im slippin im fallin i gots to get up
get me back on my feet so i can tear shit up

verse 3
wasnt long before i hit rock bottom
niggas talkin shit like damn look how that rock got him
open like a window no more indo
look at a video sayin to myself that coulda been yo
ass on the tv believe me it could be done
somethins got to give gots to change cause now ive got a son
i gots to do the right thing for shorty
and that means no more gettin high drinkin 40s
so i get back lookin type slick again
fake niggas jump back on my dick again
nothin but love for those that know how it feel
and much respect to all my niggas that kept it real
kept a nigga strong kept a nigga from doin wrong
niggas know who they is and this is your fuckin song
and to my boo who stuck with a nigga through
all the bullshit youll get yours because its due
chorus
ayo im slippin im fallin i cant get up
ayo im slippin im fallin i cant get up
ayo im slippin im fallin i gots to get up
get me back on my feet so i can tear shit up
ayo im slippin im fallin i cant get up
ayo im slippin im fallin i cant get up
ayo im slippin im fallin i gots to get up
get me back on my feet so i can tear shit up

outro
see this is that shit this is that shit
that all real niggas can relate to
this is from the heart baby
dont get it twisted
x baby108embed"
