id,song_name,artist_names,album_name,lyrics
0tgyi5mvvPNEZYUp5v5Qs1,Come Together (feat. H.E.R.),"Chris Brown, H.E.R.",3okhA6w5uau6ZNhnVpwVww,"41 contributorscome together lyricsverse 1 chris brown
stay the night fall in love its on the table
if you know what i mean dont be afraid oh
lay your cards front of me if youre able
and you might might might get what you want tonight night

prechorus chris brown her
i cant say that i never dreamed of touchin on you
aint that what wild dreams are made of ooh oh yeah
so many feelings involved
we cant pretend dont play it off
i wanna feel everythin i want you woah

chorus chris brown
and i want you babe
ooh and i cant lie yeah
and i want you babe
if we could then we should just
come together babe

verse 2 her chris brown her  chris brown
you and i its alright its perfect timin oh for it
youve been waitin and im anxious for you to dive in me too uh
im doin for you what i wouldnt do for anybody
so you might i might might get what you want tonight
you might also likeprechorus her chris brown her  chris brown
i wont say that i never dreamed of touchin on you on you
aint that what wild dreams are made of yeah
so many feelings involved
we cant pretend dont take it off
i wanna feel everything i want you oh

chorus chris brown  her her chris brown
and i want you babe want you baby
ooh and i cant lie yeah
and i want you babe woo
if we could then we should just
come together babe

bridge chris brown  her chris brown
we should come come together baby oh please come
oh so dont dont make me wait wait
we on the same page you know aint nothin in the way babe
the way that i want you you

chorus chris brown  her chris brown
and i want you babe want you too but dont tell no babe
ooh and i cant lie ooh no
and i want you babe baby
if we could could then we should should just
come together babe
outro chris brown
ooh ooh
come together babe
come oh yeah27embed"
