id,song_name,artist_names,album_name,lyrics
5yhXLtQL9waNMjgkl8MsMP,I Don't Wanna Care Right Now (feat. MDMA),Lupe Fiasco,1j0apvEvaWbTmlZpKsfr2D,"57 contributorsi don’t wanna care right now lyricsverse 1 lupe fiasco
im not a turtle im a turbo
haters pray to god that i turn slow
like im sipping on purple
but i aint on your glow
im in a whole nother circle
trying to keep it clean like church clothes
said that respect was something had to work for
but that aint gonna work though
get your respect but lose all my worth no
you can dead that get a hearse go
dont need 48 youll find a killer in the first floor
it was me boy to commercials
feeling out of place like peta at a fur store
so i left with a couple dozen fur coats
said i could never break away from your hold
watch me turn though
said that i blew it like turquoise
just mad hear it all in your word choice
know it hurts but i really dont care though
let me rub it in get it all up in that ho

hook poo bear  lupe fiasco
i can see the morning creeping up on us
its like the worlds in my hands now
im feeling so rebellious from all of the envy crowding around me
i dont wanna care right now
i dont wanna dont wanna right now i dont wanna care right now
i dont wanna care right now
i dont wanna dont wanna right now no i really dont no i really dont no i really dont no i really dont no i really dont care now
you might also likeverse 2 lupe fiasco
ohoh gogogod over everythingthing
you fly but stars over everythingthing
and im one of them yeah one of ththethem
oh im not ooone well im a hundred ththethen
im a hundred mother loving stars
youre no lights youre an undercover car
im an ambulance and a fire truck and some strobe lights tied up
shining all in your eyes all out of yours and all into mine
lights and stars is all intertwined
and im feeling like malcolm looking all out the blinds
any means any means and you can do anything anything
and the flow tight skinny jeans skinny jeans
hit you like pacquiao philippines philippines

hook poo bear  lupe fiasco
i can see the morning creeping up on us
its like the worlds in my hands now
im feeling so rebellious from all of the envy crowding around me
i dont wanna care right now
i dont wanna dont wanna right now i dont wanna care right now no i really dont care now
i dont wanna care right now
i dont wanna dont wanna right now no i really dont no i really dont no i really dont no i really dont no i really dont care now

verse 3 lupe fiasco
yall know what im a let on
im lupe yes sir who they
they yester and im today and tomorrow hooray
can i get a hiphip for the new king nigga iamhe
got the game in the clutch like iron sheik
you ball little boy but i nba
with a hand for the world you a boy band with a dance and a twirl
im a rockstar with a band so thorough
big ass tour bus thats jammed full of girls
tttell em what it do holla from the bottom yell it from the roof
tttell em what it do i dont care about your curfew
ill tell you when im through boy
hook poo bear  lupe fiasco
i can see the morning creeping up on us
its like the worlds in my hands now
im feeling so rebellious from all of the envy crowding around me
i dont wanna care right now
i dont wanna dont wanna right now i dont wanna care right now no i really dont no i really dont no i really dont care now
i dont wanna care right now
i dont wanna dont wanna right now no i really dont no i really dont no i really dont no i really dont no i really dont care now

outro lupe fiasco  poo bear
tell em what it do yell it from the bottom yell it from the roof boy
tell em what it do holla from the bottom yell it from the roof boy
tell em what it do holla from the bottom yell it from the roof boy
tell em what it do holla from the bottom yell it from the roof boy
i dont wanna ii dont wanna iii dont wanna
ccccare right cccare right now
i dont wanna ii dont wanna iii dont wanna
ccccare right cccare right now7embed"
