id,song_name,artist_names,album_name,lyrics
7GIgvsTn4NMOQNs2uzM9C9,Skit,Three 6 Mafia,0Pe9KCcaFK7CkeZPWXCuaB,"6 contributorsfuck you lyricsintro  gangsta boo
yeah yall know what time it is nigga
im bringin a lot of shit today
im bringin mchild
im bringin two for ya
im also bringin the pain nigga
cause when i come im comin for you
so you better ask somemothafuckinbody
for the 98 until 2 gs nigga
im takin over
you understand this type of shit
three 6 mafia hypnotize prophet posse
fuck you bitch

hook mchild prophet posse x2
when we high off that green and gin
aint no tellin what well do
you got some anna with the crew
fuck you fuck you
with that heat we be bussin
conversation no discussion
hollow points they comin straight at you
fuck you fuck you

gangsta boo
bustin bitches daily maybe its the herb in me
i wanna see what you hidden for shake em and see
time to steal time to kill time to get real and wassup
im just a beefin in the club tear that fuckin bitch up
im in the corner round some smoke smokin fine ass weed
freakin like vanessa del rio wont you take you a peak
mob it was me bringin shit to the do
i be the lady unabomber bombin bitches and mo
so time to go toe to toe with a bitch that be rockin
aint nothin stoppin prophet posse til your body be droppin
you fuckin bitch spittin rhythms in your rhyme like a joke
im gonna tote you like a 90 when im pullin that dope
i know youre hopin that ill fall to my face but i aint
my shoes are stuck to the ground when i walk out on bank
another fuckin lp dropped like its some rice
we be straight like 915 bitch fuck your spot
nigga
you might also likerepeat 1
repeat 1

verse 2 mchild
let cha let cha mind explode
with these lyrics i control
just a peak to let you see
how mchild do it in flip mode
now im baddest on a level
find a new way to be paid
aint gon burn or slice or beat em down
with bats and prophet dank
yellin thangs im comin up
and niggas want your life to live
pack that steel if you real
but you better shoot to kill
all that flossin aint gon do
bring a gun without the clip
and for the rest of your life
youll be walkin around with a halfass limp
read my lips dont fuck with us
because we dangerous
and when we on that good stuff
like a junkie we be anxious
to get up in yo shit
and take your life with all quickness
a orange mound playa that be strictly bout his business
watch out nigga
dont give a fuck nigga
walk on top of water
we some mean ass niggas
prophet til i fry
so fuck with me you cant avoid
plus the first time you slip
you goin bungee jumpin without the cord bitch
repeat 1
repeat 1

verse 3 koopsta knicca
coulda been a friend seemed to busy pimpin
gettin upon the skin
i had no team 34 hancock
puttin them cuts upon these men
again its on dont be phony
tellin these hoes that i love em
you think youre tough fool
look at your  hey they groupies
nigga dont give a fuck
wanna know bout better things
that fool is gonna be 
raisin doja what i saw is me
i best get the mothafucka off
bbbadaboom patapatapow
loadin got me goin down
swear im trippin
fore i come up justa left a fuckin cal
on the ground with the 40
hell and me criticizing no
ho i never sold no dope
oh shit then shoot me cuz im 
some of them charges said the sergeant
you been wanted for the longest on the street they call you creep
nah nigga my name is 
well if youre wanted
then im gonna give you something to collect
man you can take that mothafuckin gat
and stick that heat up your ass
nine in my  got the 5 
3 with the tag around my throat gotta let me go
hook x 2

prophet posse repeat to fade
hey hey hey hey hey hey
fuck you fuck youembed"
