id,song_name,artist_names,album_name,lyrics
6c662odAbBnUQNEuttI7Ak,Palomas Blancas,Natalia Lafourcade,0Kww7Dpo0uSxtOiiFTvyCv,"10 contributorspalomas blancas lyricsletra de palomas blancas

te pido de que no se vayan de mí las palomas blancas
la fuerza que hay en sus alas que vuelan sobre montañas
que el suelo que siempre tiembla sostenga mis pantorrillas
que el sol de esta melodía sea para alegrar mis días
y que nunca se acabe nada de lo nuestro
que nunca se acabe nada de lo nuestro
te pido que no se mueran las rosas y los suspiros
que trajes sin elegancia sean siempre de vida un rito
que el oro que voy cargando no mate ningún zumbido
que eso que ando persiguiendo no apague de mí un sentido
y que nunca se acabe nada de lo nuestro
que nunca se acabe nada de lo nuestro
tierra abrázame abrázame con tu luz
escucha mis pasos caminar mi alma respirar en tus brazos
tierra abrázame abrázame con tu piel
escucha mi cuerpo acelerar corriendo hasta la cima por tener tu querer
te pido que no se vayan de mí las palomas blancas
que el fuego que hay en su aliento no dejen mi fe un momento
que el suelo que siempre tiembla renueve un sueño dormido
que aquél que al seguir buscando despierte un amor cantando
you might also liketierra abrázame abrázame con tu luz
escucha mis pasos caminar mi alma respirar en tus brazos
tierra abrázame abrázame con tu piel
escucha mi cuerpo acelerar corriendo hasta la cima por tener tu querer
que nunca se acabe nada de lo nuestro
que nunca se acabe nada de lo nuestro
que nunca se acabe nada de lo nuestro
que nunca se acabe nada de lo nuestro3embed"
