id,song_name,artist_names,album_name,lyrics
2f8FHYOkBjxnNxBWXWBpsG,Burnin' Up,"Jessie J, 2 Chainz",2rDIivxBafNKpgRqlzIRSb,"23 contributorsburnin’ up lyricsprechorus jessie j
walkin through the fire please dont let me go
take me to the river i need you to know

chorus jessie j
im burnin up come put me out
come and put me out
im burnin up come put me out
come and put me out

verse 1 jessie j
hot in the kitchen like a thousand degrees
thats how im feelin when youre next to me
i got a fever tell me what did you do
temperature risin when i look at you look at you

bridge jessie j
subliminal sex
drippin in sweat
im losing my breath
huhhuhhuhhuh
look what ive found
its bout to go down
i want it right now
huhhuhhuhhuh
you might also likeprechorus jessie j
walkin through the fire please dont let me go
take me to the river i need you to know

chorus jessie j
im burnin up come put me out
come and put me out
im burnin up come put me out
come and put me out
im burnin up come put me out
come and put me out
im burnin up come put me out
come and put me out

verse 2 jessie j
oh hey i got the matches you got the gasoline
light up the floor like its billie jean heehee
the way were movin by the end of the song
theyre gonna have to pull the fire ffire alarm

bridge jessie j 2 chainz
subliminal sex uh
drippin in sweat ooh
im losing my breath damn
huhhuhhuhhuh
look what ive found yeah
its bout to go down yeah
i want it right now
huhhuhhuhhuh
prechorus jessie j 2 chainz
walkin through the fire walkin through the fire
please dont let me go please dont let me go
take me to the river take me to the river yeah
i need you to know i need you i need you to know

verse 3 2 chainz jessie j
2 chainz
everything hot like its fresh off the grill
million dollar grill look fresh on the hill
plus im 65 she need to step in some heels
fore she step up in here you need to step up your gear
wish a lamborghini had four doors four doors
from the corner store to the corridor corridor
me and my homie on the dance floor
white girl in the middle looking like an oreo im burnin up
roof on fire we can burn up
turn down for what nigga turn up turn up
motherfer must aint learn nothin
back in the day used to down with a burn coat im burnin up
light got the lord on the top floor
in a ford wearin tom ford
walk in the club and her ass start clappin
tell shawty i want an encore ooh
chorus jessie j
come put me out
come and put me out
im burnin up up
come put me out
come and put me out ayy
come put me out
come and put me out ooh im im burnin up
im burnin up
come put me out
come and put me out
im burnin up
come put me out
come and put me out hey hey hey
im burnin up
come put me out
come and put me out im im burnin up
im burnin up
come put me out
come and put me out hey hey hey
im burnin up
come put me out
come and put me out ooh24embed"
