id,song_name,artist_names,album_name,lyrics
4KeVH56SHUw2y3jHicLDw8,El Uno Para El Otro,El Trono de Mexico,2UZuDn4sKTaAiQxjKlJYfE,"1 contributorel uno para el otro lyricsaunque todo se acabe aunque
pasen mil años aunque tu ya
no quieras saber de mi aunque
olvides mi nombre mi rostro
mis manos mis besos mi aliento
siempre vivire en ti amor siempre
te recordare por que fui yo mi
bien quien te supo querer estare
esperando tambien adorandote por
toda la eternidad fuimos hechos
el uno para el otro no podemos
negarlo no si un dia quieres volver
a mi lado aqui estare aunque no
te lo dije quiero hoy confesarte
que por ti conoci el amor con un
beso tatuaste la verdad de mis dias
el amor que jamas senti siempre vivire
en ti amor siempre te recordare por
que fui yo mi bien quien te supo querer
estare esperando tambien adorandote por
toda la eternidad fuimos hecho el uno
para el otro no podemos negarlo si
un dia quieres volver a mi lado aqui
estare esperando tambien adorandote
por toda la eternidad fuimos hecho el
uno para el otro no podemos negarlo
no si un dia quieres a mi lado
aqui estareeeeeeeyou might also likeembed"
