id,song_name,artist_names,album_name,lyrics
192FMB0B5V6ydpKBS6Bm0e,Drank,Jeremih,7DMyQuDPe8xzjC0UDSDa96,"22 contributorsdrank lyricshook
pardon my behavior
ill apologize later
say sorry later
blame it on the drank baby
blame it on the drank baby
blame it on the drank drank drank
said if you leave with me tonight
i wont judge you nono
blame it on the drank baby yeahyeah nono
blame it on the drank baby
blame it on the drank baby

verse 1
you know who you dealing with
you know who you down work
put yo money down put ya head
in the headboard baby
lets go to war baby
first time i couldnt ignore it baby
how you come and shut the place down place down
a pretty face you throw up with your face down face down
i couldnt help but think bout how you taste
i couldnt help but think of how you kiss
you lookin glisten all up on my neck on my neck
could make me know enough just one time one time
ay ma lets get on dummy dummy one time one time
just screamin daddy daddy one time one time
you keep your body bangin like a 9
you know that any minute girl its mine
you might also likehook
pardon my behavior
ill apologize later
say sorry later
blame it on the drank baby
blame it on the drank baby
blame it on the drank drank drank
said if you leave with me tonight
i wont judge you nono
blame it on the drank baby yeahyeah nono
blame it on the drank baby
blame it on the drank baby

verse 2
i dont know no i dont know you now
but all i know know is im gon love you down
dj khaled say j just hold em down
way you wind and roll them hips i hold you down
cant help that pussy tastes like green apple crown no
got me so drunk you need some thumpin round
to beast up on you left side
legs up talkin peaced up
girl your bodys amazing
if you aint hear that from your own mind
youd probably trip if you heard me
have your ass screamin out jeremih jeremih
girl go head light up the marley go light up the marley
do not know how you got topless dont know you got topless
we should take trips to the tropics trips to the tropics
this drank and that ass a problem
hook
pardon my behavior
ill apologize later
say sorry later
blame it on the drank baby
blame it on the drank baby
blame it on the drank drank drank
said if you leave with me tonight
i wont judge you nono
blame it on the drank baby yeahyeah nono
blame it on the drank baby
blame it on the drank baby3embed"
