id,song_name,artist_names,album_name,lyrics
3rfDkHCYGAwngKxArHz08k,Eso Si Me Dolió,Julión Álvarez y su Norteño Banda,50JOxUvIxX7M3glXWM2Ubi,"2 contributorseso si me dolió lyricshoy mi corazón
ella me partió
no puedo creer el motivo
por que me dejo

y nuestro amor donde se quedo
de aquella promesa de amarnos fácil se te olvido
que mala manera de olvidarte de todo
piensas que yo ignore el porque etas con el

por que te marchaste
porque me olvidaste
que tu me querías puras falsedades
ayer te tenia ayer eras mía
hoy solo el recuerdo

los bellos momentos que juntos pasamos
los dos corazones que tu y yo pintamos
tu querías riqueza y no mi pobreza
es si me dolió

y nuestro amor donde se quedo
de aquella promesa de amarnos facil se te olvido
que mala manera de olvidarte de todo
piensas que yo ignore el porque etas con el
you might also likepor que te marchaste
porque me olvidaste
que tu me querías puras falsedades
ayer te tenia ayer eras mía
hoy solo el recuerdo

los bellos momentos que juntos pasamos
los dos corazones que tu y yo pintamos
tu querías riqueza y no mi pobreza
es si me dolióembed"
