id,song_name,artist_names,album_name,lyrics
6XOvMjNjLdTsolZGAy5w4s,B.S.D.,"Tyler, The Creator, Jasper Dolphin, Taco",5dbCm8qaCdWnNdVyi3urUO,"141 contributorsbitch suck dick bsd lyricsintro jasper dolphin
oh shit swag
three icyass niggas from odd future swag doin some crazy shit bitch
by the way we do punch bitches huh

verse 1 jasper dolphin
im a swagging bitch swag im iced out iced out
oh you mad bitch bitch cause im laying on the couch woo
smoke a blunt fuck a bitch in the butt im bossing bow bow
dont give a fuck i never roll slauson
im fly bitch i should poke you in your eye bitch
got the burner bitch bow bow bow
you dead bitch im hot as fuck
i aint never cold but im icy bitch woo

chorus jasper dolphin
my bitch suck dick like she suck dick
my bitch suck dick like she suck dick bow bow bow
my bitch suck dick like what she suck dick
my bitch suck dick like she suck dick nigga bow bow

verse 2 tyler the creator
got the bops in the house socking bitches in they mouth bitch
see my neck iced the fuck out im getting money nigga
she at the fucking mall forty bitches on my nutsack
i pulled up on a motherfuckin unicorn im getting ponies nigga
wolf gang nigga
scream that til they motherfucking show me death
golf wang nigga
free earl better show some motherfucking respect
all this ice around my neck all this ice around my dick
gun to her head make your bitch massage my shoulders
see tyler the creator liveget tickets as low as 425you might also likechorus jasper dolphin
my bitch suck dick like she suck dick
my bitch suck dick like she suck dick bow bow bow
my bitch suck dick like what she suck dick
my bitch suck dick like she suck dick nigga bow bow

verse 3 taco
shut up bitch shut up bitch suck my dick suck my nuts
you fucking bop bitch you better swallow it
i got a chain with a fuckin platinum plaque on it
is that a hundred dollar bill ill shit on it
i bought a fucking whale cause im ballin ballin
your bitch work for me she my dick washer
swag on my dick refrigerator thirtythousand million nigga nigga

chorus jasper dolphin
my bitch suck dick like she suck dick
my bitch suck dick like she suck dick
my bitch suck dick like she suck dick
goddamn

verse 4 jasper dolphin
you bopping bitch question mark you like this dick
we all know why cause yous a boppin bitch bow bow bow
i got the burner i pop you in your lip bow bow
zoomzoom yeah im going fast bitch
im loud as fuck im loud as fuck im ignorant ignorant
punch a bitch in her mouth just for talkin shit
you lurking bitch well i see that shit
once again i gotta punch a bitch in her shit
im icy bitch dont look at my wrist at my wrist
because if you do if you do i might blind you bitch bitch
mount everest aint fucking with my fucking wrist
fuck global warmin this the ice age bitch bitch suck dick
outro tyler the creator and jasper dolphin tyler the creator taco
swag swag punch a bitch
swag swag punch a bitch
swag swag punch a bitch
swag swag punch a bitch
swag swag punch a bitch
swag swag punch a bitch
swag swag punch a bitch
swag swag punch a bitch
yo yo jasper taco yall my niggas man
i love yall niggas im sorry
gunshot
ow what the fuck
gunshot38embed"
