id,song_name,artist_names,album_name,lyrics
0DDobGXXqCJTxQVcwe2lcq,Sorrow,Box Car Racer,3gODo8aZ2dTVIaOr9SqeRE,"12 contributorssorrow lyricsverse 1
because i need you more than you need me
because i want you more i know

verse 2
because we moved too fucking fast
i think i really had to wish to make this last i know

chorus
im sorry please forgive me believe me if you would

verse 3
because i cared way more
because i really felt that you felt so much more i know

chorus
im sorry please forgive me believe me if you would
im sorry please forgive me believe me if you could

chorus
im sorry please forgive me believe me if you would
im sorry please forgive me believe me if you could
believe me if you couldyou might also like3embed"
