id,song_name,artist_names,album_name,lyrics
1TmLaiVxH5XFRcI08KUgrg,Mi Casa Nueva,Los Invasores De Nuevo León,5fKj1UiyRfFcRmLGPN4tTn,"6 contributorsmi casa nueva lyricsletra de mi casa nueva

verso 1
te escribí una carta y no me contestaste
fui a buscarte y ya cambiaste dirección
como tengo unas cosas que reclamarte
me obligaste a que te cante esta canción
dejé mi casa por vivir feliz contigo
y me pagaste como algunas pagan mal
por tu culpa estoy viviendo donde ahora vivo
y a esta vida no me puedo acostumbrar

verso 2
a veces lloro muy cerca de las botellas
especialmente cuando me acuerdo de ti
si amanece no se miran las estrellas
y oscurece y nunca brillan para mí
una radiola y dos amigas me acompañan
mi casa nueva muy distinta a las demás
tiene un letrero de color en la vidriera
y una cualquiera es la que ocupa tu lugaryou might also likeembed"
