id,song_name,artist_names,album_name,lyrics
6xq1EMT320v5qtjoSWZKpf,All Of It,Megan Thee Stallion,6B26OzQRObxAp1tbf8jeTq,"17 contributorsall of it lyricsintro
yeah buddah blessed this beat
yeah hmm
young tina snow hot girl but im cold ah lil tag
ayy

chorus
i got bluefaces credit cards wire transfers
loggin in his bank accounts got the passwords
i want all of it yeah i need all of it ayy ayy
i want a scammer shout out to jt
he can get it all as long as he got me
make that shit hit make them pieces work
as long as he got it im makin that shit twerk
i want all of it yeah i need all of it yeah ah

verse
he want a piece of pie but aint shit sweet
and everything he doin he know he doin for me
i want all of it yeah i need all of it yeah
i aint a gold digger
but what the fuck i look like fuckin broke niggas
im a motherfuckin millionaire
if you want a lame bitch nigga go and get a square
he tellin me to come through told that nigga get me there ayy
i treat myself to villas every trip a private plane
i was here disappeared played a trick like david blaine
addicted to this life ill never give it up
im already rich but on your time ill live it up
champagne bottle ill take my time to sip it up
rolls royce full of rose petals when you pick me up ayy ah
see megan thee stallion liveget tickets as low as 244you might also likechorus
i got bluefaces credit cards wire transfers
loggin in his bank accounts got the passwords
i want all of it yeah i need all of it ayy ayy
i want a scammer shout out to jt
he can get it all as long as he got me
make that shit hit make them pieces work
as long as he got it im makin that shit twerk
i want all of it i need all of it

outro
all day
i watched you i watched you i watched you i watched you
all day
i watched you i watched you i watched you i watched you
all day
i watched you i watched you i watched you i watched you
all day
i watched you i watched you i watched you i watched youembed"
