id,song_name,artist_names,album_name,lyrics
45n7uujqwmMyBMjBu9SwRu,Pretty Visitors,Arctic Monkeys,5IEoiwkThhRmSMBANhpxl2,"80 contributorstranslationsespañolpretty visitors lyricsverse 1
trudging through the morning
the tramp with the trampoline under his arm
shifts past your whiskers so stark is the charm
but the barking alarm waits coiled til the corner is turned
and the bicycle wheels all struggle to move round
in your muddy mind blatantly caked and
unwilling to wind uncooperative time
so he sits on the springs til the muck goes dry

chorus
all the pretty visitors came and waved their arms
and cast the shadow of a snake pit on the wall
all the pretty visitors came and waved their arms
and cast the shadow of a snake pit on the

verse 2
what came first the chicken or the dickhead
split sleep reaps rewards from ill fitting thoughts
and twilight forced you to go on a walk
your legs start running and your head gets caught
canopy 19 is perfectly placed
for the reasonably frightening fall from the aftertaste
youll have to slip away i am unhappy to say
behold as the crook in the hammock plays
you might also likechorus
all the pretty visitors came and waved their arms
and cast the shadow of a snake pit on the wall
all the pretty visitors came and waved their arms
and cast the shadow of a snake pit on the wall

bridge
behold as a crook in the hammock plays
cruelly with the base and the scales
and fiddles with her feet on a balancing act
gagged bound and crafting a tale
trailing wrapped in a gasp
cruelly with the base and the scales
and fucking fiddles with her feet on a balancing act
she was gagged bound and crafting a tale
trailing wrapped in a gasp

chorus
all the pretty visitors came and waved their arms
and cast the shadow of a snake pit on the wall
all the pretty visitors came and waved their arms
and cast the shadow of a snake pit on the wall14embed"
