id,song_name,artist_names,album_name,lyrics
3h0vmKrR4xJOmQ7pr6ut6S,I'm Content With Losing,Underoath,5GeXnKDk6sD6RnkPVwFi19,"10 contributorsi’m content with losing lyricsverse 1 spencer chamberlain aaron gillespie both
like i said
leave your baggage at the back door
im leaving you the way i think it should be
were always
pulling into spaces that we cant back out of
starting fights we cant talk our way out of them
talk our way out of them
talk our way out of them

prechorus spencer chamberlain
how does it feel to be on the receiving end
of this one of this one

chorus spencer chamberlain aaron gillespie both
im halfway there and its all on me
this is what i get for wanting more for wanting more
this is the way its got to be dancing on all these changes
so i walk around with this rope in my hand rope in my hand

postchorus spencer chamberlain
so ill tie it around and around
and around ill tie me down

verse 2 spencer chamberlain aaron gillespie
ill fantasize of being manic and leaving us behind
in your eyes you were the one that tried
acceptance is what holds us here and you my dear are the one i
fear tonight well try just one more time
see underoath liveget tickets as low as 81you might also likeprechorus spencer chamberlain aaron gillespie
this is the moment that we all live for
are you ready are you ready yeah

chorus spencer chamberlain aaron gillespie both
im halfway there and its all on me
this is what i get for wanting more for wanting more
this is the way its got to be dancing on all these changes
so i walk around with this rope in my hand rope in my hand

postchorus spencer chamberlain
so ill tie it around and around
and around ill tie me down

refrain spencer chamberlain aaron gillespie
you cant see past my waving hands
just running away again
you cant see past my waving hands
goodbye

instrumental bridge

interlude aaron gillespie
you think so loud it hurts my ears

bridge spencer chamberlain
i want to know how to get through this
how to get through this without choking up
i want to know how to get through this
how to get through this without choking up
i cant
feel you
youre so
far from me
outro spencer chamberlain aaron gillespie
this is what i get for wanting more
im halfway there
this is what i get for wanting more
im halfway there and its all on me
this is what i get for wanting more
im halfway there
this is what i get for wanting more
im halfway there and its all on me
this is what i get for wanting more
im halfway there
this is what i get for wanting more
im halfway there and its all on meembed"
