id,song_name,artist_names,album_name,lyrics
2mqTtvbKxH7SoEQ2oGAnsA,CHURCH GIRL,Beyoncé,6FJxoadUE4JNVwWHghBwnb,"77 contributorstranslationsbeyoncé  church girl türkçe çeviriespañolportuguêsहिन्दीfrançaisbeyoncé  church girlελληνικάchurch girl lyricsintro
lord make me
lord place me
ooh oohooh i wanna be centered
oohooh i wanna be centered
oohooh i wanna be centered
in thy will will will will

verse 1
ive been up ive been down
felt like i move mountains
got friends that cried fountains oh

prechorus
im warnin everybody
soon as i get in this party
im gon let go of this body
im gonna love on me
nobody can judge me but me ooh
i was born free ooh ooh

chorus
ill drop it like a thottie drop it like a thottie
i said now pop it like a thottie pop it like a thottie you bad
me say now drop it like a thottie drop it like a thottie you bad
church girls actin loose bad girls actin snotty you bad
let it go girl let it go let it out girl let it out
twirl that ass like you came up out the south girl ooh ooh
i said now drop it like a thottie drop it like a thottie you bad
bad girl actin naughty church girl dont hurt nobody
you might also likepostchorus
you could be my daddy if you want to
you you could be my daddy if you want to
you could get it tatted if you want to
you you could get it tatted if you want to she aint tryna hurt nobody
put your lighters in the sky get this motherfucker litty
she gon shake that ass and them pretty tig ol bitties huh
so get your racks up word get your math up huh
ima back it up uh back it back it up back it back it up
ima buss it buss it buss it buss it actin up actin up
i see them grey sweats grey sweats i see a blank check

verse 2
mm im finally on the other side
i finally found the urge to smile
swimmin through the oceans of tears we cried tears that weve cried
you know you got church in the mornin the mornin
but you doin gods work you goin in ooh
she aint tryna hurt nobody ooh
she just tryna do the best she can ooh
happy on her own ooh
with her friends without a man

prechorus
im warnin everybody
soon as i get in this party
im gon let go of this body
im gonna love on me
nobody can judge me but me
i was born free born free
chorus
ill drop it like a thottie drop it like a thottie free
i said now pop it like a thottie pop it like a thottie you bad free
me say now drop it like a thottie drop it like a thottie you bad
church girls actin loose bad girls actin snotty you bad
let it go girl let it go let it out girl let it out
twirl that ass like you came up out the south girl ooh ooh
i said now drop it like a thottie drop it like a thottie you bad
bad girls actin raunchy church girl dont hurt nobody dont hurt nobody

postchorus
you could be my daddy if you want to you bad
you you could get it tatted if you want to you bad
put your lighters in the sky get this motherfucker litty you bad
she gon shake that ass and them pretty tig ol bitties
so get your racks up ooh get your math up ooh
ima back it up back it up back it back it up back it back it up
ima buss it buss it buss it buss it actin up actin up
i see them grey sweats ooh i see a blank check oohooh

bridge
must be the cash cause it aint your face
it must be the cash cause it aint your face
now do it baby stick it baby do it baby stick it baby
do it baby spin it now spin it baby do it
now spend that cash a little harder
and she might let you dive in the water
chorus
drop it like a thottie drop it like a thottie
now now now drop it like a thottie drop it like a thottie
ohohoh drop it like a thottie drop it like a thottie
good girls actin bad church girls dont hurt nobody

outro
i aint tryna hurt nobody mm
tryna bring the life up in your body mm14embed"
