id,song_name,artist_names,album_name,lyrics
2Le39t0EOzJcQoa22ya3wM,Déjenme Si Estoy Llorando,El Trono de Mexico,58phrarDe6ZFupwWSkNSqe,"1 contributordéjenme si estoy llorando lyricsdéjenme si estoy llorando
ni un consuelo estoy buscando
quiero estar solo con mi dolor

si me ves que a solas voy llorando
es que estoy de pronto recordando
a un amor que no consigo olvidar

déjenme si estoy llorando
es que sigo procurando
en cada lágrima a darme paz

pues el llanto le hace bien al alma
si ha sufrido perdiendo la calma
y yo quiero olvidar que tu amor ya se fue

si me ven que estoy llorando
es que a solas voy sacando
la nostalgia que ahora vive en mi

no me pidan ni una explicación
si es que no ha de hallar mi corazón
la felicidad que ya perdí

y anegado en este mar de llanto
sentiré que no te quise tanto
y quizás me olvidaré de ti
you might also likeel trono de méxico ora

si me ven que estoy llorando
es que a solas voy sacando
la nostalgia que ahora vive en mi

no me pidan ni una explicación
si es que no ha de hallar mi corazón
la felicidad que ya perdí

y anegado en este mar de llanto
sentiré que no te quise tanto
y quizás me olvidaré de tiembed"
