id,song_name,artist_names,album_name,lyrics
1myUmsHZJT8zr0PsgkfntS,Armageddon,Ying Yang Twins,2SS2QYikI1mNohhyPN2v95,"3 contributorsarmageddon lyricshook
armageddon what
armageddon what
armageddon what
armageddon incoming

verse 1
see its the ying yang
and we a hazard
were gonna get bumping up
and get ready for war
if we have to
its a disaster
and were them bastards
they dont know what slap a ho
jack a ho
crack a ho forehead
bucking we leave more dead
destined for hell
we might as well
be narrow bred
fucking your health
we rearrange the game
put that thing on your ho
pussy popping dropping and twurkulating
ready to go
now if you think we think we wont buck buck
try your luck fuck and i bet you get stuck
much as yall want to dog a broad
little treat the ho
never to be dull
and let her eat dough
and when youre me though
this how you greet the ho
this how you greet the ho
hello
naw i jumped off track
let me get back to my subject
yall victims we suspects
yall talk shit we crack necks
were bad bad bad
were on fire
fuck the man man
cause we all gotta die now
if you figure that youre bigger than god
i cant tell it
and if you shit a little bit in the school
youre gonna smell it
so all you niggas need to quit all that hate
it wont last
but a blast from gun
player make you run fast
see ying yang twins liveget tickets as low as 45you might also likehook

verse 2
look up in the sky
its a bird its a plane
naw droc and kayne
who ying yang
faster than the speeding bullets
and we leap over ghettos
came to take the rap game
for you niggas that dont know
here we come come come
better run run run
saying dont want none
saying dont want none
you better move
get out the way and let a mother fucker get through
if you get ran over then nigga thats on youi know you dont want to see us cut a fool
cause niggas like us be thorough bred
thugs coldhearted
dont make us get retardeddont want trouble so youd best not start it
step off to the side when you see us come in
two alley mother fuckers in your city again
we are on now guppy
cause young ass niggas
came to thingand we always win
but you throwing a win
and lets all have a party
cause we dont want to hurt nobodywe just came to have fun
give me a bottle and a mother fucking cup
and if you feel what im saying get fucked up
hookembed"
