id,song_name,artist_names,album_name,lyrics
7l0asn24bdO7MB9tqucIdt,Santa Claus Is Comin' to Town,Frank Sinatra,64jNt6b5Ds4itNEXTpk9Fk,"11 contributorssanta claus is comin’ to town lyricschorus
you better watch out you better not cry
you better not pout im telling you why
santa claus is comin to town
hes making a list and checking it twice
gonna find out whos naughty and nice
santa claus is comin to town

verse
he sees you when youre sleeping
he knows when youre awake
he knows if youve been bad or good
so be good for goodness sake

chorus
oh you better watch out you better not cry
you better not pout im telling you why
santa claus is comin to town

instrumental interlude

verse
he sees you when youre sleeping
he knows when youre awake
he knows if youve been bad or good
so be good be good for goodness sake
you might also likechorus
you better watch out you better not cry
you better not pout im telling you why
santa claus is comin to town
yes hes on his way
hes got ties all over the sleigh
santa is comin to townembed"
