id,song_name,artist_names,album_name,lyrics
3BaLqF7KkEKpaLWP8dl7yW,Brand New,Trey Songz,44jrX3SThj7pFjOzUTLm85,"7 contributorsbrand new lyricsintro trey songz
oh oh oh song oh
songz is my name yup

chorus trey songz
shawty brand new brand new fresh out the box fresh out the box
i think she came here with her girlfriend
shawty brand new brand new fresh out the box fresh out the box
tonight im gon be your husband

verse 1 trey songz
soon as girl step up in the club
all the fellas trying hard to say whats up
but me i play it cool just like chess i know the rules
and i bet i checkmate her in like 4 moves
ima say girl whatcha drinkin on trone
and she drink it straight cause she like it strong
look girl i wanna leave with you so we can get it on
is this is the last call and this is the last song

chorus trey songz  soundz
she said boy im brand new brand new fresh out the box fresh out the box
yeah i came here with my girlfriend
she said she brand new brand new fresh out the box fresh out the box
tonight im gon be her husband
so lets just tear our clothes off lets just tear our clothes off
she sipping on that liquor im tryna get her to the house
gggirl lets just tear our clothes off lets just tear our clothes off
she said she brand new im tryna see what thats aboutboutboutboutbout
see trey songz liveget tickets as low as 87you might also likeverse 2 trey songz
she said she aint even looking for a dude
but if you with a winner then you know you cant lose
and its all red on the bottom of ya shoes
so i already know you gotta have loot
aint got a lot of time so i wont spend it talking like these lame niggas
paper that they aint spending can you dig it girl
i wanna leave with you so we can get it on
is this is the last call and this is the last song

chorus trey songz  soundz
she said boy im brand new brand new fresh out the box fresh out the box
yeah i came here with my girlfriend
she said she brand new brand new fresh out the box fresh out the box
tonight im gon be her husband
so lets just tear our clothes off lets just tear our clothes off
she sipping on that liquor im tryna get her to the house
gggirl lets just tear our clothes off lets just tear our clothes off
she said she brand new im tryna see what thats aboutboutboutboutbout

bridge trey songz  soundz
she said she aint tryna be no one night creep
but you aint never had one night with me
come ride with me girl you gon see
theres no place else youd rather be
nothing else id rather see
eyes on you what you gon do
so brand new you know what i wanna do
open you up
yup so lets just tear our clothes off lets just tear our clothes off
lets girl lets just lets just lets just tear our clothes off
girl lets just tear our clothes off lets just tear our clothes off
girl you brand new so lets just tear our clothes off
chorus trey songz  soundz
she said boy im brand new brand new fresh out the box fresh out the box
yeah i came here with my girlfriend
she said she brand new brand new fresh out the box fresh out the box
tonight im gon be her husbandso lets just tear our clothes off lets just tear our clothes off
she sipping on that liquor im tryna get her to the house
gggirl lets just tear our clothes off lets just tear our clothes off
she said she brand new im tryna see what thats aboutboutboutboutbout

outro trey songz
songz oh oh oh oh
songz oh oh oh oh1embed"
