id,song_name,artist_names,album_name,lyrics
0440JCJyIAmINA8KcYgFb5,Fighting Demons,Juice WRLD,6n9DKpOxwifT5hOXtgLZSL,"91 contributorstranslationsitalianoрусскийtürkçefrançaisnederlandsdeutschespañolfighting demons lyricsintro
run away
in fear of me dying today

chorus
yeah i run away
in fear of me dying today ah
and im not the same
who said i was subject to change
my demons are breakin out of their cage
im praying that i see another day chill chill
i said my demons are breakin out of their cage
on my knees i pray for better days

verse 1
chip chip cheerio everythings all good right
i got rich i got rich im livin that fast life
couple ms in my bank account i got cash right
and thats supposed to make me happy
i got a couple questions
how come that shit dont ever make me happy
money give me an erection
but that dont mean its gon be everlasting
yeah i know its a blessing
but how come it always feel like the devil plottin
and the devil watchin
he see me buyin all these watches
benjamin franklin in my pockets
ooh been a year of the glitz and the glam
and the tv channels brains going scramble
scrambling sometimes cause this shit is hard to handle
demons in my heart yeah they destroy me like a vandal ah
you might also likeprechorus
take my hand
dont give up
take my hand
dont give up

chorus
yeah i run away
in fear of me dying today ah
and im not the same
who said i was subject to change
my demons are breakin out of their cage
im praying that i see another day chill chill
i said my demons are breakin out of their cage
on my knees i pray for better days

verse 2
karma aint what you think it is
super stressed still handle all of my business
do the best i can yes i can
yes i am misfortune
i know in the dark they be lurking why
same way they lurk in your head when they get in your mind
you dont wanna know what theyre tryin to find
ill protect your soul ah
prechorus
take my hand
dont give up
take my hand
dont give up

chorus
yeah i run away
in fear of me dying today ah
and im not the same
who said i was subject to change
my demons are breakin out of their cage
im praying that i see another day chill chill
i said my demons are breakin out of their cage
on my knees i pray for better days48embed"
