id,song_name,artist_names,album_name,lyrics
0xhEydZ27iNhTyneiIaTJn,Que Siga La Mata Dando,Junior H,3ind4Ir3JMazCITxWQajDb,"5 contributorsque siga la mata dando lyricsletra de que siga la mata dando

verso 1
mientras las matas siguen siempre dando
muchos de ustedes están descansando
me la navego siempre pa todos lados
pero eso sí jamás miro pa abajo
pasan los años tiempos correteando
recuero ayer loqueado con los vatos
éramos felices no lo miramos
pero ni modos de quedar callados
pensando en cómo la gente ha cambiado
ayer éramos siete hoy solo cuatro
mientras el tiempo va y va bien pasando
te miras al espejo y vaya hay cambios
conocerás gente de todos modos
unos critican pero nacen sordos
unos te admiran por todos tu logros
y créanme que de esos ya hay muy pocos

interludio
ea y siga la matando viejo
hoy mañana y siempre
puro junior h

verso 2
bien dice el corrido yo no he cambiado
los pocos que era seguimos intactos
pa esos amigos de todo ha pasado
solo los recuerdos siguen pasando
un blunt del verde nos vamos rolando
los verdaderos no van a negarlo
un trago amargo al pecho apretado
y brindemos por los que se olvidaron
dicen que las matas se siguen dando
y aunque no creas mira mira bien vato
hay gente corriente por todos lados
tienes que cuidarte de los más falsos
hoy brindo porque ya murió el pasado
y en el futuro no sé pa sigamos
si algo aprendí es que hay amigos contados
y siempre que siga la mata dandosee junior h liveget tickets as low as 123you might also likeembed"
