id,song_name,artist_names,album_name,lyrics
06S7iIXT8ZVAcVK6l1iXvx,Idk Why,Gunna,1oUzjom2A9xtyRM1SdOAGj,"39 contributorsidk why lyricsintro
wheezy outta here

chorus
all i know is grind grind
wonder why the lord steady sendin me blessings i dont know why dont know why
mama thanked me for her purse
and looked me in my face and then she started cryin started cryin
my talent take me different places
i can say lately ive been dodgin crime lately ive been dodgin crime
every day im high high
intoxicated i done swallowed me a whole tesla now im on a ride now im on a ride
investigators tried to put a cable on the table i cant wear a wire i cant wear a wire
i done made an m without a label trust me ill be stable for a while ill be stable for a while

verse 1
ima bet on me me
i dont care if its a dollar i got three my partners thats a quarter each thats a quarter each
i got some snakes in my collar lil bitch im a slime and we dont ever sleep slime
the converts are damn near robotic its same color powder whiter than a sheep sheep
the pussy wet like she in heat yeah
dolce gabbana on her feet yeah
young gunna slime anaconda we bite like piranhas me and my brother keed keed
took 30k the whole summer now i want a hunna i stopped bein cheap cheap
young turbo came out the gutter now he chargin 50 thousand for a beat
i dont work for free no
the salesman that know me in barneys say i smell like biscotti mixed with creed biscotti mixed with creed
i know some women adore me tell me im the realest they seen im the realest they done seen
i keep my mind on my money cause thats really all a nigga ever need thats all a nigga ever needed
you might also likechorus
all i know is grind grind
wonder why the lord steady sendin me blessings i dont know why dont know why
mama thanked me for her purse
and looked me in my face and then she started cryin started cryin
my talent take me different places
i can say lately ive been dodgin crime lately ive been dodgin crime
every day im high high
intoxicated i done swallowed me a whole tesla now im on a ride now im on a ride
investigators tried to put a cable on the table i cant wear a wire i cant wear a wire
i done made an m without a label trust me ill be stable for a while ill be stable for a while

verse 2
i got better days i got better days
i moved my mom to the boondocks we already used to sleepin in a cave in a cave
i started sellin that mota makin me some moohla servin out our place servin out our place
now i charge rappers for verses do it for a purpose i dont wanna trade do it for a purpose i dont wanna trade
i done got a raise i done got a raise
og told me my future was bright gotta wear the shades gotta wear your shades
blessed life so i paint the coupe all white just to give him praise just to give him praise
came a long way from sittin waitin in the line for the new js waitin in the line for the new js
i can get away i can get away
you gonna need you a surfboard when it come to me and wheezy wave me and wheezy wave
cant get bigger than who you work for cause you know some shitll prolly change shitll prolly change
charge that shit up til were worth more we aint in the business for the fame we aint in the business for the fame
chorus
all i know is grind grind
wonder why the lord steady sendin me blessings i dont know why dont know why
mama thanked me for her purse
and looked me in my face and then she started cryin started cryin
my talent take me different places
i can say lately ive been dodgin crime lately ive been dodgin crime
every day im high high
intoxicated i done swallowed me a whole tesla now im on a ride now im on a ride
investigators tried to put a cable on the table i cant wear a wire i cant wear a wire
i done made an m without a label trust me ill be stable for a while ill be stable for a while

outro
thats a quarter each5embed"
