id,song_name,artist_names,album_name,lyrics
1RRwz9czf39ZVeLq6tAY14,Alley Cat,Nardo Wick,338LPt19lJ2GiGmxDSOAtR,"18 contributorsalley cat lyricsintro
g i think we got one
she a alley cat alley cat
dont take it personally

chorus
this ho think she classy shes not this ho think she sassy shes not
no bitch you is ratchet ratchet you lil fuckin whore
she say suckin dick a habit such a habit you lil fuckin whore
wont let the semen hit the cameras wont let it hit the floor ground
this bitch a alley cat lil slimy bitch your name have slat
this bitch a ratatat that pussy dead go get the gat
this bitch a knickknack how the hell you worth less than your bag
this bitch a bunny rabbit hoppin set to set to set

verse
this bitch a grime capper lyin to them folks
she scream chanel chanel go home and sleep on the floor
there were points where im by that steering wheel where she know she do the most
talkin bout all them niggas she fucked stupid bitch that aint no boast
stupid bitch that aint no brag bitch get in your bag
callin all them niggas daddy this bitch got like twelve dads
and she be on creep shit done got a couple daddies mad
im trippin like i dont even know what it is but im pissed
fuck it ima spazz you lil fuckin thot
you lil fuckin slut slut you lil fuckin wet whore
want a million dollar nigga you aint even got no cat
this bitch here aint got no morals ready to fuck the set
you might also likebridge
ready to fuck the set we done fuckin made some hoes
bitch think she classy you is not that think you sassy you is not that
you is a mothafuckin thot haha

chorus
this ho think she classy shes not this ho think she sassy shes not
no bitch you is ratchet ratchet you lil fuckin whore
she say suckin dick a habit such a habit you lil fuckin whore
wont let the semen hit the cameras wont let it hit the floor ground
this bitch a alley cat lil slimy bitch your name have slat
this bitch a ratatat that pussy dead go get the gat
this bitch a knickknack how the hell you worth less than your bag
this bitch a bunny rabbit hoppin set to set to set

outro
bitch a alley cat this bitch a alley cat
this bitch a alley cat alley cat this bitch a alley cat
this bitch a alley cat this bitch a alley cat
she a alley cat fuckin alley cat
bitchembed"
