id,song_name,artist_names,album_name,lyrics
3P5EDl7LwhoWWkpmKr3nxL,Sleepy Freestyle,Sleepy Hallow,38nZLvJx8A9p4YYpTG5iFP,"18 contributorssleepy freestyle lyricsintro
great john on the beat by the way
look

verse
brand new whip i race it
bad bitch wit me no basic huh
still keep chops got cases huh
i cant let a nigga take me out
watch how i run up a check huh
i bet they love me to death woah
watch how i run up a check huh
i bet they love me to death woah
ooh pop perkies not xans huh
glock up on my hip i bet this chopper make em dance ayy
hol on huh these versaces not vans
lil bitch gon make it shake she say its jelly not jam
oh woah she wanna keep me alone huh
she wanna get in my zone
she dont know i know she fuckin the bros
she out in miami she drivin the boat huh
you cant say i ever fold huh you cant say i ever told
ride wit my niggas put that on my soul
push to start my car huh moncler kept me warm
bro got chops the size your arms
two gun charges on my dome huh
pray my lawyer keep me home huh
this your shawty favorite song huh
she gon lick it when you gone huh
she gon lick it when you gone huh
ocean on my neck im drownin shit huh
benny just drowned the wrist
and i got up cause i was down and shit huh
aint have a pot to piss
but they gon act like they dont know huh
they gon miss me when im gone huh
they gon miss me when im gone huh
they gon miss me when im gone huh
look trap got lit look and we used to sleep in that shit
money make her do a thousand tricks
and i get money so she wildin shit up
i bet they proud of the kid huh wanna be down with the kid
flex on niggas hate on a kid sex your bitch wanna rape on the kid
i bet they love me i bet they love me now uh
when shit got ugly aint no one help me out uh
i bet they love me i bet they love me now uh
when shit got ugly aint no one help me out
trappin out the same sweater uh
you know sleepy do it better uh
you know he a big stepper uh
ride with choppers thats forever uh
momma said you gotta change like
so i left and made a change right
got the gang rightsee sleepy hallow liveget tickets as low as 55you might also likeembed"
