id,song_name,artist_names,album_name,lyrics
0JXXNGljqupsJaZsgSbMZV,Sure Thing,Miguel,493HYe7N5pleudEZRyhE7R,"85 contributorstranslationsenglishالعربيةsure thing lyricsintro
love you like a brother
treat you like a friend
respect you like a lover

refrain
ohoohoh ohoohoh ohoohoh you could bet that never gotta sweat that
ohoohoh ohoohoh oh you could bet that never gotta sweat that
yeah yeah yeah you could bet that never gotta sweat that
you could bet that never gotta sweat that yeah

verse 1
if you be the cash ill be the rubber band
you be the match i will be a fuse boom
painter baby you could be the muse
im the reporter baby you could be the news
cause youre the cigarette and im the smoker
we raise a bet cause youre the joker
checked off you are the chalk
and i could be the blackboard you can be the talk
and i can be the walk yeaheah

chorus
even when the sky comes fallin
even when the sun dont shine
i got faith in you and i
so put your pretty little hand in mine
even when were down to the wire babe
even when its do or die
we could do it baby simple and plain
cause this love is a sure thing yeah
you might also likerefrain
you could bet that never gotta sweat that oh yeah yeah
you could bet that never gotta sweat that
you could bet that never gotta sweat that
you could bet that never gotta sweat that

verse 2
you could be the lover id be the fighter babe
if im the blunt uh you could be the lighter babe fire it up
writer baby you could be the quote yeah uh
if im the lyric baby you could be the note uh record that
saint im a sinner prize im a winner
and its you what did i do to deserve that
paper baby ill be the pen
say that im the one cause you are a ten
real and not pretend

chorus
even when the sky comes fallin yeah yeah yeah yeah yeah yeah
even when the sun dont shine
i got faith in you and i
so put your pretty little hand in mine
you could bet that never gotta sweat that even when were down to the wire babe
you could bet that never gotta sweat that even when its do or die
you could bet that never gotta sweat that we could do it baby simple and plain
you could bet that never gotta sweat that cause this love is a sure thing yeah
bridge
uh now rock with me babe
and let me hold you in my arms talk with me babe yeahyeah
uh now rock with me babe
and let me hold you in my arms talk with me babe yeahyeah
this love between you and i is simple as pie baby
its such a sure thing its such a sure thing
oh its such a sure thing yeah yeah yeah yeah its such a sure thing

chorus
you could bet that never gotta sweat that even when the sky comes fallin yeah
you could bet that never gotta sweat that even when the sun dont shine
you could bet that never gotta sweat that i got faith in you and i
you could bet that never gotta sweat that so put your pretty little hand in mine
you could bet that never gotta sweat that even when were down to the wire babe
you could bet that never gotta sweat that even when its do or die
you could bet that never gotta sweat that we could do it baby simple and plain
you could bet that never gotta sweat that cause this love is a sure thing

outro
you could bet that never gotta sweat that love you like a brother
you could bet that never gotta sweat that treat you like a friend
you could bet that never gotta sweat that respect you like a lover
you could bet that never gotta sweat that ohoohoh ohoohoh ohoohoh61embed"
