id,song_name,artist_names,album_name,lyrics
7pwZrhH1OEJW0zCJeezQLO,Same Hood,"Only The Family, Lil Durk",2cULL7lcy0pCCpCRJsUZck,"12 contributorssame hood lyricsintro
no snake could snake me dy krazy
man i feel like i lived this life before
like i seent this shit happen

chorus
we ain’t got the same blood we just brothers from the mud
grew up in the same hood
and the violence so fucked up my niggas cant judge
we gon sleep around each other ’til we neighbor uh
im just tryna wonder when this feeling of my pain stop
how you say you love me you my brother but gave my name up
you must be crazy thinkin i changed up
id do anything plus give my fame up
you know id give my fame up
you know i will never change up
you know im that dude but you let a lame fuck
you know im that dude but you let a lame fuck

verse 1
when i be gone off the ecstasy shorty she gon get the best of me let’s get it
and she know i be with killers her family is not acceptin’ me gang gang gang
i nutted all in her and left i told her i got a vasectomy skrrt skrrt skrrt
yeah why them niggas get to ating me
said they catchin me they stretchin’ me brrah
bro nem be watchin my back they know i be gone off the medicine ganggang
my cousin had died on a cam the police got footage and edited it ooh
big facts on god i cant get shit snatched
can’t leave i need that get back
fuck shot i need you kidnapped
surprise that glock come giftwrapped
i tatted all of my dead homies in my skin lets get it yeah yeah
foenem crackin them boas they need your pin yeah yeah
gulp a cup of my lean just to wash off my sins on god
make my tristate hoes buy me all my timbs
you might also likechorus
we aint got the same blood we just brothers from the mud
grew up in the same hood
and the violence so fucked up my niggas cant judge
we gon sleep around each other til we neighbor uh
im just tryna wonder when this feeling of my pain stop
how you say you love me you my brother but gave my name up
you must be crazy thinkin i changed up
id do anything plus give my fame up
you know id give my fame up
you know i will never change up
you know im that dude but you let a lame fuck
you know im that dude but you let a lame fuck

verse 2
your homies say they on me i be with killers and parolees
them niggas police i know they namedrop
you be rappin bout that trap but you aint never sold nothin
i hold a grudge back in 09 you aint let me hold nothin
you cheat on me i swear ill beat you like you stole somethin
pillow talkin to these hoes yeah you coldblooded
how you follow me on the gram and you dont like pics
i fucked a bitch she like all girls she dont like dick
cum on my nice sheets they dont like this
that bitch a pisces i keep a nice stick
i swear im at my nicest been through my crisis
we not to be played with they on that night shift
niggas tryna stick me up like i never showed no love
that petty shit let go i told you i aint got no grudge
i dont give no fucks addicted to these drugs
when i was down and gone them niggas aint send me nothin
sip red i aint fuckin with tussin
bite down im bustin
shoot first you clutchin
you mad i pressed your button
you know we read your mind my niggas aint duckin
you know you play with mine aint no discussion
chorus
we aint got the same blood we just brothers from the mud
grew up in the same hood
and the violence so fucked up my niggas cant judge
we gon sleep around each other til we neighbor uh
im just tryna wonder when this feeling of my pain stop
how you say you love me you my brother but gave my name up
you must be crazy thinkin i changed up
id do anything plus give my fame up
you know id give my fame up
you know i will never change up
you know im that dude but you let a lame fuck
you know im that dude but you let a lame fuck1embed"
