id,song_name,artist_names,album_name,lyrics
2NRUU0gP1d8Yif8CpsCW8l,Faded,"Tyga, Lil Wayne",3KHamR7LZmFT0xqPA1Hyob,"115 contributorsfaded lyricsintro tyga
hahah i dont give a fuck shit
ahhhahahahah hah

verse 1 tyga
young nino fuck a bitch in a peacoat
carlito scarface al pacino
bun b though pimp c rip though
i goes deep in that pussy dan marino
she wanna be the one fuck her to my own single
break a bitch heart no future miss cleo
snapback auauautomatic reload
flyer than a fucking beetle you can’t beat em
hah vampire fuck up your evening
i pop up and eat lunch leave you in the cement
don’t believe it stripe like afuckingdidas
the gun selena give a nigga bieber fever
hah hah real fucking hot
put it in pot take a shot higher than a tube sock
yous a bop give me top top as i load the whop
man these niggas say i’m fly but to her i’m god

chorus tyga
i’m faded faded faded
my nigga i’m faded faded faded
my nigga i’m faded faded faded
my nigga i’m faded faded faded
my nigga i’m faded faded faded
my nigga i’m faded faded faded
my nigga i’m faded faded faded
my nigga i’m faded faded and i don’t give a fuck
see tyga liveget tickets as low as 300you might also likeverse 2 tyga
fuck is up niggas stomping in my chucks
yeah i make it reindeer cause i’m all about my bucks
use the butt up in the front ddick up in her cunt
and i put it in her hole holeinone putt putt
aughh susuper mcnasty
why you mclovin when the bitch call me daddy
pimp no caddy she wish she never had me
treat her like a dog dog called the bitch lassie hah
young savvy bang her like cincinnati
above average ffly like i’m aladdin
they bend backwards thrthrow the pussy at them
i’m ben wallace dunk up in your basket haha
uuh balls in the air
no games i’m serious double dare
there’s too many bitches why these niggas wanna stare
pat ron up in here nigga this ain’t no beer

chorus tyga  lil wayne
i’m faded faded faded
my nigga i’m faded faded faded
my nigga i’m faded faded faded
my nigga i’m faded faded faded
my nigga i’m faded faded faded yeah
my nigga i’m faded faded faded
my nigga i’m faded faded faded
my nigga i’m faded faded and i don’t give a fuck
verse 3 lil wayne
mama there go that monster
abracadabra magic johnson
my motherfucking doctor said i need a doctor
so i called house now i am a pill popper
faded like skinnys young money we winning
i told her if i change she won’t get a penny
milking this shit pregnant bitch titties
bringing home the bacon i’m fucking miss piggy
loaded like a semi send me naked pictures
she knows my dick she call that nigga richard
prior to me cumming i had to stick my thumb in
her ass one time smell my finger make you vomit
flyer than a hornet the shoe fit i worn it
she tried to jack me off can’t beat it join it
tunechi coochie that what she call it
flag scarlet i killed it mourning

chorus tyga  lil wayne
i’m faded faded faded faded
my nigga i’m faded faded faded yeah
my nigga i’m faded faded faded
my nigga i’m faded faded faded uhh
my nigga i’m faded faded faded
my nigga i’m faded faded faded young mula baby
my nigga i’m faded faded faded
my nigga i’m faded faded and i don’t give a fuck70embed"
