id,song_name,artist_names,album_name,lyrics
6nGeLlakfzlBcFdZXteDq7,Love Story,Indila,1r7XjAgjwlakmXC2GbPXjH,"17 contributorstranslationsenglishlove story lyricsparoles de love story

couplet 1
l’âme en peine
il vit mais parle à peine
il attend devant cette photo dantan
il il nest pas fou
il y croit cest tout
il la voit partout
il lattend debout
une rose à la main
à part elle il nattend rien
rien autour na de sens
et lair est lourd
le regard absent
il est seul et lui parle souvent
il il nest pas fou
il laime cest tout
il la voit partout
il lattend debout
debout une rose à la main
non non plus rien ne le retient

refrain
dans sa love story
dans sa love story
dans sa love story
sa love story
you might also likecouplet 2
prends ma main
prometsmoi que tout ira bien
serremoi fort
près de toi je rêve encore
oui oui je veux rester
mais je ne sais plus aimer
jai été trop bête
je ten prie arrête
arrête comme je regrette
non je ne voulais pas tout ça
je serai riche
et je toffrirai tout mon or
et si tu ten fiches
je tattendrai sur le port
et si tu mignores
je toffrirai mon dernier souffle de vie

refrain
dans ma love story
dans ma love story
dans ma love story
ma love story

couplet 3
une bougie
peut illuminer la nuit
un sourire
peut bâtir tout un empire
et il y a toi
et il y a moi
et personne ny croit
mais lamour fait dun fou un roi
et si tu mignores
jme battrais encore et encore
refrain
cest ta love story
cest ta love story
cest lhistoire dune vie
love story

outro
des cris de joie
quelques larmes on sen va
on vit dans cette love story
love story love story love story…14embed"
