id,song_name,artist_names,album_name,lyrics
44hWXFu2i4bteXLi2v7WyD,Problem With You,Chris Brown,3okhA6w5uau6ZNhnVpwVww,"14 contributorsproblem with you lyricsintro
da got that dope

verse 1
friday saturday sunday night
only girls in the crib if they bout that life yeah
twenty twentyfive is the usual
and im a young nigga with em livin my best life oh
phone ring i dont really think about it no
its too late to talk about it
if you aint tryna get dicked down
thats fine but

chorus
my only problem with you is
you call me late and never come over
why you gotta cap
its 330
and im horny and thirsty
so whyyyy
why you be hittin my line up
please dont waste my time time
and youre too damn fine oh for me not to pick up

verse 2
two missed calls from a bad bitch woo
slide in the dm ima smash it facts
4 am why you playin catfish
you know you aint gon drive
youre playin with my mind again
a nigga tryna get some head
no guestroom you in my bed
thinkin what im bout to do with your legs
but i know you aint comin so my ooh
you might also likechorus
my only problem with you is only problem is
you call me late and never come over
why you gotta cap ohwoah
its 330 ohwoah
and im horny and thirsty
so whyyyy
why you be hittin my line up line
please dont waste my time my time
and youre too damn fine oh for me not to pick up

verse 3
dont know why you play with me me
you can really get eeverythin
head to toe ima lick you up and down
have you ever tried a sex swing ooh
next best thing
dont text me
if you aint talkin sex i wont listen ooh
im too fade too faded
and youre playin now

chorus
my only problem with you is oh
you call me late and never come over ooh baby
why you gotta cap
its 330 30
and im horny horny and thirsty ooh
so whyyyy why
why you be hittin my line up up
please dont waste my time my time
and youre too damn fine oh for me not to pick up5embed"
