id,song_name,artist_names,album_name,lyrics
6mtBnwLOUTItu8od7MqauY,La Envidia,Tony Dize,6RDOn06oitF2wzme2uWDX8,"1 contributorla envidia lyricsletra de la envidia
mi viejo siempre tuvo otra forma de ver la vida
otra forma de entenderala
otra forma de vivirla

el 28 de mayo del 2000
el destino le dio fin a su vida aquí en la tierra
recuerdo como ayer las palabras que decia
manten fe en dios hijo que el nunca falla
respeta a quien respeta y seras respetado
no midas a las personas por lo que tienen sino por lo que son
pero como joven al fin nunca entendi lo que el me queria decir
hasta q me toco sentarme en su lugar y demostrar
el me dijo rafy cuando la marea de la vida te arrope
hay que ser preciso en aguas tibias
son interrogantes que te pueden limitar
en el momento de irte a veces no da tiempo ni de gritar
yo aprendi que la envidia es una herramienta vital y se utiliza como medidor

la envidia divide al amigo del traidor
la envidia solo sigue a personas q tiene algun tipo de exito en sus manos
la envidia puede estar tan cerca de ti
como dentro de tu nucleo tu casa tus vecinos tus familiares y hasta en el mismo trabajo
ellos solo van en busca de los mejores planos
la envidia se disfraza de abrazos agradecimientos felicitaciones y hasta el amor
la envidia no tiene sexo color y mucho menos edad
you might also likesolo tu podras separar la envidia de la bondad
si nadie te envidia es que algo anda mal
hijo de seguro vas a encontrar el transito
la envidia es un sentimiento del sector que nunca logró nada
y se quedo en la misma esquina haciendo nada

la envidia es la sangre de mucha gente
la envidia es un medidor que nunca miente
la envidia no es problema hasta el momento en que tu la sientesembed"
