id,song_name,artist_names,album_name,lyrics
2Em9XZZw8yEgxjojjGxntN,Un Sueño (feat. Trippie Redd),"Rauw Alejandro, Trippie Redd",3fq06DDIkadDRB9RuBb22v,"12 contributorstranslationsenglishun sueño lyricsletra de un sueño

intro rauw alejandro
rarauw

coro rauw alejandro
hace tiempo que yo tus beso no tengo
hoy te vuelvo a tener desnuda en mis sueño
no me dejes despertar baby te lo ruego
porque en la realidad ya no soy tu dueño uhuh uh
hace tiempo que yo tus beso no tengo no
hoy te vuelvo a tener desnuda en mis sueño
no me dejes despertar baby te lo ruego yeah
porque en la realidad ya no soy tu dueño yeah rarauw

verso 1 rauw alejandro
no paro de recordar e como si hubiera pasado ayer wuh
acostumbrado a despertar con tu calentura en mi piel ¿qué
baby qué pesadilla desde que te fuiste de aquí ¡ah
si solo en mis sueño puedo meterte como te metía uh ¡yah
sé que te acuerdas yih
cómo tú dejabas toa la cama mojá uhuh
dime qué tengo que hacer pa que vuelvas
ya no aguanto más el no verte cuando despierte yihih
sé que te acuerdas uh
cómo tú dejabas toa la cama mojá
dime qué tengo que hacer pa que vuelvas uhuh
ya no aguanto más otra ve quiero tenerte ¡yah
you might also likecoro rauw alejandro
hace tiempo que yo tus beso no tengo
hoy te vuelvo a tener desnuda en mis sueño
no me dejes despertar baby te lo ruego
porque la realidad ya no soy tu dueño uhuh

verso 2 trippie redd
i dont wanna wake up no
i dont wanna deal with another breakup yeah
know it feels better when we make love nahnah
its just me and you and they cant take us
yeah they cant break us no
baby youre in my mind you feel madeup
let me hit it one time and embrace love yeah yeah

puente trippie redd
im so crazy about you you
i cant do this without you you
im not even gon doubt you you
ive been dreaming about you girl yeah
im so crazy about you
i cant do this without you
im not even gon doubt you
ive been dreaming about you girl yeah

coro rauw alejandro
hace tiempo que yo tus beso no tengo
hoy te vuelvo a tener desnuda en mis sueño
no me dejes despertar baby te lo ruego
porque en la realidad ya no soy tu dueño
hace tiempo que yo tus beso no tengo no
hoy te vuelvo a tener desnuda en mis sueño
no me dejes despertar baby te lo ruego yeah
porque en la realidad ya no soy tu dueño no no
outro rauw alejandro  trippie redd
rarauw
trap cartel
con tripp
dímelo tripp eh
trap cartel
dímelo yampi
dímelo colla
mr naisgai yah
duars entertainment2embed"
