id,song_name,artist_names,album_name,lyrics
0xOFqoCyGiLFgGAXD73xtC,Slight Work (feat. Big Sean),"Wale, Big Sean",0jCVC8ndYYOooEY2YTO1l6,"58 contributorsslight work lyricsintro big sean  wale
you gotta work slight work light work
dtown to the dmv slight work diplo whats up
work it work it
probably got your girl going crazy
work wowowork it oh drunk white bitches
work it work it
work wowowork ot oh oh

verse 1 wale
i can do it all and it aint no problem
aint nobody harder than that nigga folarin
bitch i go hard im ballin im globetrottin
and my flow art my nigga im mozart with it
as often i do this
i turn a straight prude bitch into a nudist
foolish i be on that new shit
and im blowing up like bitches we went to school with
aint nobody checking for your garbage
lot of intuition i aint even finished college
never hit the mall and forever get it all
any broad bet i lay her like im dressin for the fall nigga
and im all that hit the passenger door
shawty was pinkberry sweet and i aint lactose
i aint tryna brag though i just know im that dope
kick game bojack my bo jacks tae bo
haha and it aint no problem
you race to these broads i relay and baton em
bitches aint hearin one thou
but when you step out why these bitches run out
double mg shit i put the set down
rick james that bad bitches on the couch
ah word play olubowale is my first name
i think im koko b ware you just a bird babe
i got a pair of js i roll a pair of js
we up in diamond supply spending that carat cake
let em marinate you forever late
a million home sellers couldnt find a realer state
you might also likehook wale
its slight work its light work
the wrong drink the right work
its slight work light work
the wrong drink the right work
work work work work
work it out work it out work it out dont stop
work work work work
work it out work it out work it out dont stop
work work work work
work it out work it out work it out dont stop
work work work yeah lets go work it out work it out ahhh

verse 2 big sean
bitch you aint a boss til you cut a fuckin paycheck
only thing between me and your bitch is a latex
man and i aint into saving these hoes what
my nigga tell me where you see the cape at
bi bi bitch big big
two things that i dont need are you and my id
ima need a yellow cab and a yellow bad bitch
green faces but a nigga dodgin yellow badges
woop heheheh
cause im drunk yeah okay
under 25 living the fuckin life
white america said id be doing 25 to life
and just for that ima blow 25 tonight do it
you make 25 a year i make 25 a night whoa
blocka blocka blocka blocka
bitch get hit with my cîroca vodka chopper go
taking body shots blocka blocka blocka whoa
probably in your girls dreams probably in your daughter locker
top floor like im out tanning whoa
and they stoled your whole delivery now thats outlandish
i guess like the delivery man im outstanding
car tinted im in that tint like im out camping
god damn it im one hell of a guy
looking down on a cloud thats a hell of a high
bitch i gets ghost the way she screaming big
niggas couldnt tell if i was dead or alive
hook wale
its slight work its light work
the wrong drink the right work
its slight work light work
the wrong drink the right work
work work work work
work it out work it out work it out dont stop
work work work work
work it out work it out work it out dont stop
work work work work
work it out work it out work it out dont stop
work work work yeah go work it out work it out ahhh

outro big sean  wale
man you already know uh
finally famous in this gettin slight work light work
maybach slight work light work
slight work light work good boi
slight work light work boi gotta work
slight work light work
dtown to the dmv slight work
probably got your girl going crazy stupid
crazy boi haha boi boi uh uh
slight work light work slight work
from the dtown to the dmv
i got all these bad bitches tryna get with me uh
yeah from the dtown to the dmv you gotta work
got all these bad bitches tryna get on me uh
haha we need to see id16embed"
