id,song_name,artist_names,album_name,lyrics
7jKgWJnK4QX37vfFRw1HTD,Without You,Jagged Edge,2LFRjzwf61Y7CIl54Kiq8j,"3 contributorswithout you lyricsintro
oh yeah yeah yeah
je yall yeah
oh yeah yeah yeah yeah
check it
ima send this song out to my dad
oh yeah yeah yeah
cause uh one day i came to him
and told him how i was feelin about this girl
he told me he used to write poetry
so ima try to poetically explain how i feel ooh

verse 1
girl you know that youre the apple of my eye
to me youre like the cherry in my cherry pie
i wake up early like the sunrise
to be there for you when you wake up oh yeah
and i i cant seem to get you off my mind
cause since the day we met ive been on cloud nine
i think thats why i didnt recognize
i wasnt putting in enough time girl dont you leave yeah

chorus
im nothing without you
like a fire with no flame girl its all you girl its all you
i can hardly maintain you you you
you with no me the earth with no sea
the birds with no bees
thats the way im gonna be ooh ooh ooh
nothing without you
like a fire with no flame girl its all you girl its all you
i can hardly maintain you you you you
you with no me the earth with no sea hey
the birds with no bees
thats the way im gonna be without you oh without you baby
you might also likeverse 2
youre just like a doctor that wouldnt work
i feel more like a fighter cause you made me hurt
cause i know all things aint perfect but in my heart youre worth it
i hope you change your mind cause im worthless
like a football player put in overtime
know that you aint happy wanna know just why
give me half a chance girl
im bringing romance girl and its all

chorus
im nothing without you
like a fire with no flame girl its all you baby
i can hardly maintain i can hardly
you with no me the earth with no sea the earth with no bees baby
the birds with no bees
thats the way im gonna be ooh
nothing without you
like a fire with no flame girl its all you baby baby baby
i can hardly maintain hardly maintain
you with no me the earth with no sea
the birds with no bees
thats the way im gonna be without you oh

bridge
ooh baby dont you leave
cause ima try my best to be
everything that you might need
tell me baby whyd you leave whyd you leave
ooh baby dont you leave
said i dont know everything
just another young nigga from the street
now i can believe just a little young ooh
ooh baby dont you leave
cause ima try my best to be ooh
everything that you might need
tell me baby whyd you leave whyd you leave
ooh baby dont you leave yeah
said i dont know everything oohooh yeah
just another young nigga from the street
now i can believe yeah
chorus
im nothing without you
like a fire with no flame girl its all you fire with no flame baby
i can hardly maintain i can hardly
you with no me the earth with no sea hardly yeah
the birds with no bees hardly
thats the way im gonna be and i dont wanna be alone no no no
nothing without you
like a fire with no flame girl its all you
i can hardly maintain girl its all you you you you
you with no me the earth with no sea girl its all you you you you you
the birds with no bees
thats the way im gonna be without you ohembed"
