id,song_name,artist_names,album_name,lyrics
6Eu0w6ZNE1Qfk20tYZxn5Y,¿Como Quieres Que Te Olvide?,"Wisin & Yandel, Ednita Nazario",7zTlfidBmhUVtUmLSKk7WF,"5 contributors¿cómo quieres que te olvide lyricsletra de ¿cómo quieres que te olvide ft ednita nazario

intro wisin  ednita nazario
la revolución ahah
esta es la historia de un amor perdido
ella lucha por olvidar las heridas que él le causó ah
todo los días le pide a dios una nueva oportunidad uh yeah
w yandel
ednita nazario

precoro ednita nazario wisin  yandel
yo sufrí yo lloré
me arrepiento de haber sido de ti y fue muy difícil
viviré sobreviviré sobreviviré
yo te pido que te olvides de mí ohoh ohoh yandel

coro yandel  wisin
¿cómo quieres que te olvide
si cuando te olvido empiezo a recordarte muy difícil
recordarte yo no puedo más
¿cómo quieres que te olvide
si cuando te olvido empiezo a recordarte yo ya no puedo más
me acostumbraste a tu calor

verso 1 ednita nazario  wisin
no puedo respirar
yo tengo que olvidar
aunque me vaya mal
me voy a levantar
volveré a empezar
lo vas a pagar ajá
es mi dignindad
vete vete yandel eh
you might also likecoro yandel  ednita ambos wisin
¿cómo quieres que te olvide
si cuando te olvido empiezo a recordarte es imposible
recordarte uhuh tú lo sabes ya
¿cómo quieres que te olvide
si cuando te olvido empiezo a recordarte nooh es imposible
me acostumbraste a tu calor

verso 2 wisin  ednita nazario
siento que llegué tarde ajá
yo sé que he sido un cobarde yo sé
estoy solo en la casa el corazón me arde ajá
y pobre de mí cuando cae la tarde
me arrodillo de noche y que jesucristo me guarde ey
grande la carga la vida se amarga heh eh eh oehoehoh
pienso en ella a diario y mi mente se recarga
al ver que no estás aquí siento una descarga es duro
si me das una oportunidad mi vida se alarga
qué dura marca ajá y yo guillao de monarca
con tan solo un recuerdo mi mirada se encharca yo lloro
es difícil entender que se me ha ido la barca oye
estoy consciente de lo que hice perdóname

precoro ednita nazario wisin  yandel
yo sufrí yo lloré
me arrepiento de haber sido de ti
viviré sobreviviré yo no podré vivir sin ti
yo te pido que te olvides de mí ohoh ohoh
coro yandel  ednita ambos
¿cómo quieres que te olvide
si cuando te olvido empiezo a recordarte
recordarte uhuh
¿cómo quieres que te olvide
si cuando te olvido empiezo a recordarte
me acostumbraste a tu calor oh
¿cómo quieres que te olvide
si cuando te olvido empiezo a recordarte nooh
recordarte nooh ohoh
¿cómo quieres que te olvide
si cuando te olvido empiezo a recordarte nooh
me acostumbraste a tu calor calor calor

outro wisin  ednita nazario
la necesidad que tengo de ti de ti de ti
me ha hecho recapacitar vuelve
y me ha hecho entender que solo como tú hay una
si en algún momento vuelve perdí tu noble corazón
estoy aquí de frente pidiéndote perdón
la revolución
¡nesty
¡víctor el nazi
¡el profesor gómez
la revoluciónembed"
