id,song_name,artist_names,album_name,lyrics
7nbLDEX5VrZt70uvYDQ4cQ,"Baby, I'm Back","Baby Bash, Akon",77eKpEVxmSr1RhqMlirlTF,"8 contributorsbaby i’m back lyricsintro akon  baby bash
ooh yeah
any thing that you want me do ill do it
tell me what the word is already oohhoo hoo
tell me what the word is already ooh ooh
tell me what the word is already yeah
tell me what the word is already baby

chorus akon
dont look no farther
baby im back yeah
im here to cater to you any thing that you want me do ill do it
cause ill be your lover ill be your lover
ill be your best friend yeah
tell me what i gotta do tell me what i gotta do and ill do it
do do for you

verse 1 baby bash  akon
now im back in the flesh feelin so blessed
back in your corner sugar sugar dont stress
forget about the rest lets go inside
im back in your zone baby back in your vibe oohhoo
now i cant be denied i cant lie im on ya yeah
i never ever wanna say sayonara
somebody told me that the grass was greener
on the other side andale arriba
never really intended on being a cheater
what i gotta do to be your keeper
these words comin out the speaker true love is off the meter
you might also likechorus akon  baby bash
dont look no farther
baby im back yeah woah
im here to cater to you any thing that you want me do ill do it woah woah woah woah
cause ill be your lover ill be your lover woah
ill be your best friend oh yeah
tell me what i gotta do tell me what i gotta do and ill do it
do do for you

verse 2 baby bash  akon
i was gone for a minute but now im home
please forgive me for being a rolling stone
please forgive me let me polish it up like chrome oohhoo ooh ooh
get off the phone til he swears to leave you alone yeah yeah
let me spark your interest now theres no more dating on the internet uhuh uhuh
cause you already know how i get it wet how i keep it so saucy and i get respect ha
you dont have to look no farther nah
you dealin with the whole enchilada yeah yeah
you dont have to look no farther no
you hotter then a fire starter yeah yeah

chorus akon
dont look no farther dont look no farther
baby im back yeah yeah yeah
im here to cater to you any thing that you want me do ill do it woah woah woah woah
cause ill be your lover ill be your lover
ill be your best friend ooh
tell me what i gotta do tell me what i gotta do and ill do it
do do for you
bridge baby bash  akon
i was gone for a minute oh oh
i was gone for a minute oh oh
i was gone for a minute oh oh
i was gone for a minute oh oh
now im back let me hit it oh oh
now im back let me hit it oh oh
now im back let me hit it oh oh
now im back let me hit it oh oh
cause im back baby

chorus akon
dont look no farther but baby im back baby
baby im back yeah  so believe me when i tell you girl
im here to cater to you back baby i said that im back baby
cause ill be your lover oh yes im back baby
ill be your best friend oh you gotta believe it when i tell you
tell me what i gotta do im back baby
do do for you
dont look no farther ooh
baby im back yeah ooh
im here to cater to you any thing that you want me do and ill do it
cause ill be your lover ill be your lover
ill be your best friend yeah
tell me what i gotta do tell me what i gotta do and ill do it
do do for you1embed"
