id,song_name,artist_names,album_name,lyrics
35wvL50xvKpCHEJPxLOLPI,Si Estuviésemos Juntos,Bad Bunny,7CjJb2mikwAWA1V6kewFBF,"61 contributorstranslationsenglishdeutschsi estuviésemos juntos lyricsletra de si estuviésemos juntos

intro
yehyehyehyehyeh
yehyehyehyeh
yehyehyehyehyeh
yeh

verso 1
no sé si tu boca está besando a otra
en estos momentos en estos momentos
y no sé si tus ojos ya se olvidaron de mí
y los pensamientos se fueron con el tiempo

estribillo
y me pregunto qué hubiera pasado
si estuviésemos juntos aún enamorados
y me pregunto qué hubiera pasado
si estuviésemos juntos aún enamorados
yehyeh

verso 2
todavía yo te espero
aunque yo sé que tú no vas a volver
todavía yo te quiero
aunque yo sé que eso me puede joder
y tengo tu foto guarda
tú y yo bailando cuando éramo menore de edad
te digo la verda
te extraño el 14 y en la navidad
y lo polvo en la parte posterior
del carro pa los tiempo en la superior
siempre dejaba ropa interior
cada polvo mejor que el anterior
pero no como el primero
tú sabe que ese no se va a borrar
ahora me paso en el putero yeh
a otra persona no he podido amar
y te juro que lo he tratao
pero es que ninguna se te para al lao
desde que te fuiste sigo trastornao
escuchando masterpiece baby me siento down
si no tengo de tu piel down
deuces de ñengo y de la no la de chris brown
el cerebro dando vuelta lo tengo mareao
cada cual por su lao yeheh
see bad bunny liveget tickets as low as 45you might also likeestribillo
y me pregunto qué hubiera pasado
si estuviésemos juntos aún enamorados
y me pregunto qué hubiera pasado
si estuviésemos juntos aún enamorados
yeh14embed"
