id,song_name,artist_names,album_name,lyrics
3m1W9S6nDaFOVyb3YCzomi,El Guacho,Los Tucanes De Tijuana,368bh2s0aVeChSmOHvmXxz,"2 contributorsel guacho lyricsya publicaron mi nombre mi foto y mis generales
ya me ficharon nimodo compre nuevas credenciales
y mande hacerme un corrido pa que sigan hable y hable

solo me fui abriendo cancha desde chico fui muy vago
el que no tranza no avanza el dicho lo dice claro
ahora ya controlo plazas con mi gente y mis hermanos

a mi me apodan el güicho fui creciendo poco a poco
ay traigo a mis muchachitos armados y bien filosos
ensenada y rosarito siguen siendo de nosotros
en tijuana y tecatito tambien hacemos negocios

esos que me andan buscando nomas quiero recordales
que traigo un m60 tambien el famoso barrett
ese calibre 50 que traspasa los blindajes

saludos a mis hermanos que son gallos de pelea
al peligro acostumbrados se la rifan donde sea
hombres muy diciplinados que hacen muy bien sus tareas

nunca me gusta andar solo
soy hombre muy precavido
traigo mis grupos de apoyo que se la rifa conmigo
de 3 para arriba es combo no desperdiciamos tiros
see los tucanes de tijuana liveget tickets as low as 71you might also likesaludos guadalajara no se rajen compañeros
seguimos aqui en la baja haciendo lo que sabemos
y se enoje quien se enoje a balazos respondemos
no matamos inocentes somos bravos pero buenosembed"
