id,song_name,artist_names,album_name,lyrics
16Ov4UwdVxKGDHuGEhg40C,A Mi Me Gusta Soñar,Juan Gabriel,2ERJFuFlmwOV0bxl8VOtdU,"1 contributora mi me gusta soñar lyricsyo no me canso ni me cansaré
de amarle tanto y más le amaré
de ser tan suyo y mas lo seré
yo nunca me cansaré
de darle todo lo que yo le doy
si al dar recibo por eso es que estoy
lleno de amor lleno de felicidad
yo no me canso ni me cansaré
de soñar tanto y más soñaré
que nuestro amor nunca se va acabar
yo nunca me cansaré
yo se que un día no va a ser igual
que todo tiene un principio y un final
pero el amor es eterno y el mío así será
que sueño dicen que sueño
que me ame como le amo
si la vida es un sueño
y el mundo entero esta
creyendo y soñando que es la realidad
si es un sueño a mi me gusta soñar
yo le amo yo no quiero despertar
que sueño dicen que sueñobis
undefined
undefined
more
undefined
close
undefined
close
undefinedyou might also likeembed"
