id,song_name,artist_names,album_name,lyrics
6jriAHSKHdWrEU2KhBwE2f,Me He Enamorado De Ti,Los Inquietos Del Norte,7M2EVYSttIuhJ63yOsIUrR,"1 contributorme he enamorado de ti lyricsme pongo a pensar
a pensar en ti
en los bellos momentos
que paso a tu lado
soy muy feliz

otra vez el amor
se acerca tu ami
no hace ni el año
apenas meses
que te conocí

quiero contarte
todo lo que siento
lo que yo siento por ti
siento mil cosas bonitas
bonitas por ti
y sin andar ya con tanto rodeo
me he enamorado de ti

cuando estoy junto a ti
se hace mi sueño real
es como un paraíso
si estoy a tu lado
es hermoso y real
you might also likeotra vez el amor
se acerca tu ami
no hace ni el año
apenas meses
que te conocí

quiero contarte
todo lo que siento
lo que yo siento por ti
siento mil cosas bonitas
bonitas por ti
y sin andar ya con tanto rodeo
me he enamorado de ti
y sin andar ya con tanto rodeo
me he enamorado de tiembed"
