id,song_name,artist_names,album_name,lyrics
6I8nOn6RtxQ2G9bhDhGum7,Got Money,"Lil Wayne, T-Pain",4fRZNOawjx1uzGLN3VhAZ4,"81 contributorsgot money lyricsintro lil wayne  tpain
plplplayn—playn—playnskillz
yeah yeah
i need a winndixie grocery bag full of money woo uhhuh
right now to the vip section woo yeah
you got young mula in the house tonight baby yeah
yeah
haha yeah uhhuh
young ayhey
young young young young mula baby

chorus tpain
if you got money yeah and you know it yeah
take it out your pocket and show it then throw it like fly
thisaway fly thataway fly
thisaway fly thataway
if you getting mugged from everybody you see
then hang over the wall of the vip like fly
thisaway fly thataway fly
thisaway fly thataway yeah uhhuh alright alright

verse 1 lil wayne
now i was bouncing through the club
she love the way i diddybop
i see her boyfriend hatin like a city cop
now i aint never been a chicken but my fifty cocked
say i aint never been a chicken but my semi cocked
now where your bar at im tryna rent it out
and we so bout itbout it now what are you about
dj show me love he say my name when the music stop
young money lil wayne then the music drop
i make it snow i make it flurry
i make it all back tomorrow dont worry
yeah young wayne on them hoes
aka mr makeitrainonthemhoes—young money
see lil wayne liveget tickets as low as 84you might also likechorus tpain lil wayne both
if you got money yeah and you know it yeah
then take it out your pocket and show it then throw it like fly
thisaway fly thataway fly yeah
thisaway fly thataway
if you getting mugged from everybody you see yeah
then hang over the wall of the vip like fly come on
thisaway fly thataway fly come on
thisaway fly thataway streets

verse 2 lil wayne
it go one for the money two for the show
now clap your hands if you got a bankroll chris
like some clapon lights in this bitch
ima be clapping all night in this bitch uhhuh
lights off uhhuh mask on uhhuh
creep silent uhhuh she smiling ugh
he mugging—who cares
cause my goons are right here
like its nothing to a big dog
and im a great dane i wear eight chains
im in so much ice they yell skate wayne
she wanna fuck weezy but she wanna rape wayne

chorus tpain lil wayne both
if you got money yeah and ima let her and you know it yeah
then take it out your pocket and show it then throw it like fly uhhuh
thisaway fly uhhuh thataway fly uhhuh
thisaway fly uhhuh thataway yeah
if you getting mugged from everybody you see yeah ugh
then hang over the wall of the vip like—
verse 3 lil wayne
okay its young wayne on them hoes
aka mr makeitrainonthemhoes like ayy
and everybody say
mr rainman can we have a rainy day
bring an umbrella please bring an umbrella
ella ella ella ayy
bitch aint shit but a ho and a trick
but you know it aint trickin if you got it
you know we aint fuckin if you not thick
and ill cool your ass down if you think you hot shit
so rolexwatch this i do it fourfivesix
my clickclack goes the black fourfifth
and just like it ill blow that shit
cause bitch im the bomb like tick tick biatch

chorus tpain
if you got money yeah and you know it yeah
then take it out your pocket and show it then throw it like fly
thisaway fly thataway fly
thisaway fly thataway
if you getting mugged from everybody you see
then hang over the wall of the vip like
thisaway fly thataway fly
thisaway fly thataway
bridge lil wayne
yeah its young wayne on them hoes
aka mr makeitrainonthemhoes
yeah young wayne on them hoes
make a stripper fall in love tpain on them hoes uhhuh

outro lil wayne
um young mula baby17embed"
