id,song_name,artist_names,album_name,lyrics
5aJ1M43pinROpwaPnO8KRj,Amor Tumbado,Natanael Cano,6HvpgqHcpyXzAdNIioqIoq,"18 contributorstranslationsenglishamor tumbado lyricsletra de amor tumbado

verso 1
para ser directo no me arrepiento
cosas de la vida o de la mía
tú fuiste un momento y te agradezco
pero no eras mía y lo sabías

precoro
no fue mucho tiempo eso lo acepto
pero creía lo que sentía
no respondías y me moría
tú me tenías y lo sabías
yo no soy aquel que te dio rosas
pero te di mi corazón y es más valiosa
la forma en que te trataba y lo superé

coro
la canción se acaba y tú constante
el whatsapp me lo estás llenando de mensajes
que ya no llames
que el amor también se vuelve odio recordé

interludio
lil bitch
nata ¡eah
see natanael cano liveget tickets as low as 101you might also likeprecoro
no fue mucho tiempo eso lo acepto
pero creía lo que sentía
no respondías y me moría
tú me tenías y lo sabías
yo no soy aquel que te dio rosas
pero te di mi corazón y es más valiosa
la forma en que te trataba y lo superé

coro
la canción se acaba y tu constante
el whatsapp me lo estás llenando de mensajes
que ya no llames
que el amor también se vuelve odio recordé15embed"
