id,song_name,artist_names,album_name,lyrics
1q1j4J77FDgq3fqnFCLSvi,O' City Lights,Gregory Alan Isakov,3IcfYXw7lTtLfG5XWLlSZi,"6 contributorso’ city lights lyricsmarias stoned like a porcelain saint
sweet morphine
sweet morphine

curls a smile when the sadness hits
finds my face with fingertips

have you seen her
the daughter of the hum of the highway
shes curling up like smoke

oh city lights fly at this speed
oh heaven knows
it aint me behind the wheel
this time

through the hills you can hear them sing
ah maria ah mariasee gregory alan isakov liveget tickets as low as 40you might also like1embed"
