id,song_name,artist_names,album_name,lyrics
0g8IDqktweI1MNNpyeIaql,So Blu,Blu Cantrell,3EIwRVOXjqWAxVLt7raduU,"3 contributorsso blu lyricsverse 1
you see me at the bottom tryna to get on top
you see me at the club tou know i used to rock
you see me cryin tears
lord make em stop
you see the sun shine but never on my block
you see im tryna to grow let me get ahead
you know im tryna to do what my mamma said
lord i need a change
lord feel my pain
lord find me one that aint bout this game

chorus
im tryna find a man
im tryna find a ring
im tryna find someone
who loves me more than his bling bling
im tryna be a wife
im tryna make a life
im tryna get in touch with my spiritual side
tryna have your back
im tryna help you stack
im tryna be your strength when you know you lack
lord i need a change
lord tell me you feel my pain
so blu so blu
so blu so blu
so blu so blu
so blu so blu
you might also likeverse 2
you see me hustling for every cent i got
you see i never sleep until i reach the top
you see i cant slow down because you know its real
you see i cant stop here i gotta make a mill
im finna be a woman that stands the test of time
aint afraid to say im finna blow ya mind
im finna be the one you trust more than your boys
im finna reach the level number one across the board

chorus
im tryna find a man
im tryna find a ring
im tryna find someone
who loves me more than his bling bling
im tryna be a wife
im tryna make a life
im tryna get in touch with my spiritual side
tryna have your back
im tryna help you stack
tryna be your strength when you know you lack
lord i need a change
lord tell me you feel my pain
so blu so blu
so blu so blu
so blu so blu
so blu yeah so blu
im blu so blu
so blu so blu
so blu yeah yeah im so blu so blu
yeah yeah yeah yeah yeah im so blu
bridge
i dont wanna feel the hurt inside no more
i dont wanna feel the hurt inside
i dont wanna feel the hurt inside no more
lord im cryin for you yeah
i dont wanna feel the hurt inside no more
oh yeah yeah yeah
so blu i i i i i oh yeah
i dont wanna feel the hurt inside no more
i dont wanna feel the hurt
i dont wanna feel the hurt inside no more
lord im crying for you yeah yeah yeah
i dont wanna feel the hurt inside no more
ohoh ohoh yeah yeah yeah yeah so blu
i dont wanna feel the hurt inside no more lord lord lord lord
i dont wanna feel the hurt inside no more
i dont wanna feel inside
i dont wanna feel the hurt inside no more
need you to help me out
so blu lord lord yeah yeah yeah

outro
so blu so blu so blu so bluembed"
