id,song_name,artist_names,album_name,lyrics
52WyhmhBgVbCuRJkJbLfTw,Smoke & Retribution (feat. Vince Staples & Kučka),"Flume, Vince Staples, KUČKA",4NZWRpoMuXaHU7csTjWdB5,"2 contributorsnew music friday 012916 lyricszayn  pillowtalk
charlie puth  we dont talk anymore feat selena gomez
bishop  river
tory lanez  la confidential
sia  cheap thrills
travis mills  dont need much
akon  hypnotized
lincoln jesser  baby boy feat yuna
betsy  fair
strangers you know  used
wet  youre the best
st lucia  game 4 u
tritonal  blackout feat steph jones
dawn richard  not above that
michael brun  wherever i go feat the audio institute
sia  reaper
dreezy  body feat jeremih
snbrn  gangsta walk feat nate dogg
lemaitre  stepping stone feat mark johns
school of seven bells  ablaze
flume  smoke  retribution feat vince staples  kučka
ishi  we run feat french montana raekwon  wale
j cole  gomd live
kevin gates jam feat trey songz ty dolla ign  jamie foxx
pell  in the morning feat stephen  caleborate
a r i z o n a  i was wrong
foxes  wicked love
daughtry  torches
charles kelly  leaving nashville
w darling  dizzy
adam friedman  pretty things
harriet  ten steps
katie day  kids
betablock3r  what you wanted
suuns  translate
marit larsen  please dont fall for me
lola marsh  in good times
edward sharpe  the magnetic zeros  free stuff
børns  bennie  the jets live from sxsw 2015
mothxr  she cant tell
sivik  last night
gibbz  stay for a while
emmi  my kinda swag
aquilo  best of us go down
just kiddin  only for you
lontalius  glow
j churcher  yesterday
pop etc  what am i becoming
cold chilling collective  it was a good day feat danelle
haerts  eva1embed"
