id,song_name,artist_names,album_name,lyrics
4OGIeHtYhRTJ8iW21UUyZW,Bad Bitch From Tokyo (Intro),Pop Smoke,7e7t0MCrNDcJZsPwUKjmOc,"56 contributorstranslationstürkçeenglishрусскийportuguêsbad bitch from tokyo intro lyricsintro
yeah yeah
yeah yeah yeah
yeah yeah yeah this is a melo beat
yeah yeah

verse
bad bitch from tokyo oh drip from italy oh
smokin runtz in rome oh got it for eight a piece ohoh
christian dior christian dior big twentytwos oh
big thirtyeight oh dont tote no twentytwos ohoh
wait im goin state to state look
i looked my killer in his eyes yeah im talkin facetoface
my nigga killer caught a body took it to trial and beat the case
my nigga walked out of court ha then hopped in a wraith

outro
hopped in a wraith yeah skrrtyou might also like10embed"
