id,song_name,artist_names,album_name,lyrics
4gGYiGsxhPYpsGIttWLwlT,Take Me As I Am,Mary J. Blige,13HYuDhB1soZvHzwoymXoV,"7 contributorstake me as i am lyricsverse 1
shes been down and out
shes been wrote about
shes been talked about constantly
shes been up and down
shes been pushed around
but they held her down nyc
she has no regrets
she accepts the past
all these things they helped to make she
shes been lost and found
and shes still around
theres a reason for everything yeah

prechorus
you know ive been holding on
try to make me weak but i still stay strong
put my life all up in these songs
just so you can feel me
so you can get the real me

chorus
so take me as i am take me as i am
or have nothing at all nothing at all
just take me as i am
or have nothing at all nothing at all
you might also likeverse 2
yes shes older now
yes shes wiser now
cant disguise her now
she dont need no one tellin her
what to do and say
no one tellin her who to be
shes on solid ground
shes been lost and found
now she answers to god
and shes confident this is not the end
ask me how i know cause she is me yeah

prechorus
you know ive been holdin on ive been holdin on
try to make me weak but i still stay strong stay strong
put my life all up in these songs
just so you can feel me
so you can get the real me

chorus
so take me as i am
or have nothing at all at all
just take me as i am as i am
or have nothing or nothing baby at all this is me this is me
bridge
so its all or nothing at all
all or nothing at all
dont you know i can only be me
i can only be me yeah i can only be me
so its all or nothing at all
all or nothing at all
dont you know i can only be me
i can only be me yeah

chorus
so take me as i am
or have nothing at all
just take me as i am
i can only be me yeah i can only be me yeah
or have nothing at all
so take me take me as i am or have nothing at all

outro
take me as i am take me
take me as i am
said its all or nothing at all
said its all or nothing at all
just take me as i am yeah
or have nothing at all
or nothing baby this is me this is me
just take me as i am take me as i am
or have nothing nothing at all take me as i am
just take me as i am take me as i am
or have nothing nothing
take me as i am2embed"
