id,song_name,artist_names,album_name,lyrics
3aLFVeonlyrjumYSjbCBcg,El Aire De Tu Casa,Jesús Adrián Romero,0Jttxgk5XzLJgGtJQQWmHd,"1 contributorel aire de tu casa lyricsquiero respirar el aire de tu casa
disfrutar de tu fragancia
y llenarme de ti
quiero en tu presencia
estar todos los dias
y llenarte de alegria
en tu jardin

coro
quiero estar tan cerca
que te pueda respirar
y un solo latido
pueda yo escuchar
quiero estar tan cerca
que te pueda yo tocar
y que tu pureza pueda yo imitar
quiero ser tu amigo
quiero estar contigo

quiero navegar el mar de tu mirada
y saber que no habra nada
que me aparte de ti
quiero caminar siguiente los pasos
y aprender en tu regazo
lo que esperas de mi
you might also likecoro 4xembed"
