id,song_name,artist_names,album_name,lyrics
4qE2iDO78w5uHs03R8V7FQ,Girls Like You,Miguel,493HYe7N5pleudEZRyhE7R,"17 contributorsgirls like you lyricshook
girls like you remind me that im lonely
yeaaah
remind me that im lonelyyy
no one to play connect 4 with me
i declare war with me
knock out and snore from rolling around in my bed

verse 1
someone anyone to listen
i feel like im missing the real thing
tell me where i go
girl i got a few
i can always call when im ready
but i feel like im wasting my time
yeah

prehook
cause my heart beats are empty
so once in awhile

hook
girls like you remind me that im lonely
yeaaah
remind me that im lonely
no one to play connect 4 with me
i declare war with me
knocked out and snore
im rolling around in my bed
you might also likeverse 2
i dont wanna think i just wanna drink
cause im overcome by this notion
dont you know im real baby cant you tell
but you got a hole in your heart
i probably would dismiss it
the truth that i miss you for real
hook up something new

till i see a girl like you

prehook
cause my heart beats are empty
so once in awhile
hook
girls like you remind me that im lonely
yeaaah
remind me that im lonely
no one to play connect 4 with me
i declare war with me
knock out and snore from rolling around in my bed

bridge
beautiful girls
intelligent girls
creative girls
i hate ya
yeah i hate ya
but the truth is i want ya
and i need ya
whats the very best way to reach ya 
i beseech ya
cause im looking for something real

prehook
cause my heart beats are empty
so once in awhile
hook
girls like you remind me that im lonely
yeaaah
remind me that im lonely
no one to play connect 4 with me
i declare war with me
knock out and snore from rolling around in my bed7embed"
