id,song_name,artist_names,album_name,lyrics
6ajihXpsHpDnIdqtBXZYGN,White Christmas - Remastered 2006,Bing Crosby,3My4DXwRjAS5HXontsJx1A,"3 contributorswhite christmas remastered 2006 lyricsverse 1
im dreaming of a white christmas
just like the ones i used to know
where the treetops glisten and children listen
to hear sleigh bells in the snow

verse 2
im dreaming of a white christmas
with every christmas card i write
may your days be merry and bright
and may all your christmases be whiteyou might also likeembed"
