id,song_name,artist_names,album_name,lyrics
1Kd5Qj9kicqjCw1BjWRzH0,Amor Gitano,"Beyoncé, Alejandro Fernández",0Zd10MKN5j9KwUST0TdBBB,"13 contributorsamor gitano lyricsletra de amor gitano ft alejandro fernández

intro alejandro fernández  beyoncé
ay ay gitana
oh

verso 1 beyoncé  alejandro fernández
ven y quédate conmigo dame el corazón
vida mía estoy muriendo lento en mi prisión
anda dime lo que sientes quítate el pudor
y deja de sufrir escapa con mi amor oh

preestribillo alejandro fernández  beyoncé
después te llevaré hasta donde quieras
sin temor y sin fronteras hasta donde sale el sol
contigo soy capaz de lo que sea
no me importa lo que venga porque ya sé a dónde voy

estribillo alejandro fernández  beyoncé
soy tu gitano tu peregrino
la única llave de tu destino
el que te cuida más que a su vida soy tu ladrón
soy tu gitana tu compañera
la que te sigue la que te espera
voy a quererte aunque me saquen el corazón
you might also likepostestribillo alejandro fernández  beyoncé
y aunque nos cueste la vida
y aunque duela lo que duela
esta guerra la ha ganado nuestro amor woh woh
esta guerra la ha ganado nuestro amor woh oh oh

verso 2 beyoncé  alejandro fernández
yo nací para tus ojos para nadie más oh
siempre voy a estar en tu camino
alma de mi alma corazón de tempestad oh
dime por donde ir uh no no no

preestribillo alejandro fernández  beyoncé
después te llevare hasta donde quiera oh
sin temor y sin fronteras mm hasta donde sale el sol
contigo soy capaz de lo que sea
no me importa lo que venga porque ya sé a dónde voy

estribillo alejandro fernández  beyoncé
soy tu gitano tu peregrino
la única llave de tu destino
el que te cuida más que a su vida soy tu ladrón
soy tu gitana tu compañera
la que te sigue la que te espera
voy a quererte aunque me saquen el corazón
postestribillo alejandro fernández beyoncé  ambos
aunque nos cueste la vida
y aunque duela lo que duela
esta guerra la ha ganado nuestro amor
uh y aunque nos cueste la vida
y aunque duela lo que duela
esta guerra la ha ganado nuestro amor woh

outro beyoncé alejandro fernández  ambos
nuestro amor woh oh
nuestro amor yeah
nuestro amor1embed"
