id,song_name,artist_names,album_name,lyrics
3ugAI8vlmz6y4T9BlKhytz,Beg For It,Chris Brown,6df0qvkMXoyHGt9J8cujZb,"20 contributorsbeg for it lyricsverse 1 chris brown
girl girl girl girl girl gggirl
i woke up before the light thinking about tonight
i cant i cant sleep
just a few hours ago we had the tv on
drowning out your screams
tell me your favorite love song girl
im gonna play it while your toes curl
girl what you saying speak your mind
tttelltell me what you like

chorus chris brown chris brown  sevyn streeter
ima make you beg for it beg for it
ill give you what you need only if you say please
ima make you beg for it beg for it
gon and whisper your wishes to me babe

verse 2 chris brown
not gonna lie to you wasnt expecting you to
have me on my knees yeah
ima gonna make you cry tears from your paradise
and love your ass to sleep yeah
youve got my favorite secrets on
and i wont use my hands to take them off
girl what you saying speak your mind
tell me what you like
you might also likechorus chris brown chris brown  sevyn streeter
ima make you beg for it beg for it
ill give you what you need only if you say please
ima make you beg for it yeah beg for it
gon and whisper your wishes to me babe do it baby oh

bridge chris brown sevyn streeter both
baby im gon let it go girl you gon get it good
ima make twenty more seconds oh oh feel like twenty more minutes oh oh
baby ima make you scream yeah im not finished yet yeah
twenty more seconds oh oh oh you aint gotta beg no more
ima give it up ima give you all my love
and baby i—
im gon give you what you asking for
but if you want more im gon make you beg

chorus chris brown chris brown  sevyn streeter
ima make you beg for it beg for it
and ill give you what you need
ill give you what you need only if you say please
ima make you beg for it beg for it
but her body your bodys telling me yes
gon and whisper your wishes to me babe
ima make you beg for it beg for it
ill give you what you need only if you say please
ima make you beg for it beg for it
gon and whisper your wishes to me babe35embed"
