id,song_name,artist_names,album_name,lyrics
7HDOS7qOhBxmcsWTv29PSK,Pretextos (feat. Cosculluela),"Maluma, Cosculluela",3PomvFR694SrCSZzDWMWV7,"7 contributorspretextos lyricsletra de pretextos ft cosculluela

intro maluma cosculluela rudeboyz
el principe pretty boy
baby no entiendo porque después de tanto tiempo
seguimos buscando pretextos para vernos
me cansé de intermediarios para poder saber de ti

somos dos locos enamorados contra el mundo tú y yo
así tus padres no me quieran
rudeboyz
yo voy por ti hasta el fin bebé

coro maluma
ya no quiero mentiras para ir a buscarte nah nah nah nah
estoy cansado de escondites pa poder tenerte
nah nah nah nah
cuando será ese día que acepten tus padres nah nah nah nah
que el corazón no elige cuando enamorarse

verso 1 cosculluela
estoy harto de mentir y decir las cosas como no son
de nuestra relación solamente saben una versión
es que en televisión me pintan un hombre sin corazón
pero tú me conoces sabes que camino en dirección
solo pa arriba un varón con iniciativa
y nada va a pasarte a ti mientras yo viva
dile al viejo que tú estas con el que nadie derriba
y que ni se preocupe mientras yo escriba
y las cante una muralla me levanten
yo por ti meto las manos al horno sin guante
mudense de mi pasado vivan el durante
yo jure de mi vida dedicarte el restante
el princi
you might also likeprecoro maluma
se pasan los días yo buscándote
tú extrañándome nos queremos ver
en el mismo lugar donde sin miedo fuimos cómplices
de nuestro placer

se pasan los días yo buscándote
tú extrañándome nos queremos ver
en el mismo lugar donde sin miedo fuimos cómplices
de nuestro placer

coro maluma cosculluela
ya no quiero mentiras para ir a buscarte nah nah nah nah
estoy cansado de escondites pa poder tenerte
nah nah nah nah
sea lo que sea maluma
cuando será ese día que acepten tus padres nah nah nah nah
que el corazón no elige cuando enamorarse

verso 2 cosculluela
no puedo con esta demora discúlpeme señora
del libro de mi vida su hija es la autora
ella no me ve solo me escucha en la emisora
y de un botón la señal se vapora
y otro programa es otro día otra mañana
nos comunicamos aunque sea por telegrama
estoy grave con esto de hablar en clave
si este amor es ilegal que me boten la llave
que nada se acabe que todo siga
de intriga aunque tu viejo nos persiga
que dios lo bendiga y no le quite lo que nos una
es un amor para siempre dicelos maluma
pre coro maluma cosculluela
se pasan los días yo buscándote
tú extrañándome nos queremos ver
somos tú y yo
en el mismo lugar donde sin miedo fuimos cómplices
de nuestro placer

se pasan los días yo buscándote
tú extrañándome nos queremos ver
en el mismo lugar donde sin miedo fuimos cómplices
de nuestro placer

coro maluma cosculluela
ya no quiero mentiras para ir a buscarte pretty boy
nah nah nah nah
estoy cansado de escondites pa poder tenerte
nah nah nah nah pretty boy dirty boy baby
cuando será ese día que acepten tus padres cosculluela
nah nah nah nah
que el corazón no elige cuando enamorarse
el príncipe y pretty boy

outro cosculluela maluma
ya estoy harto de esconderno para poder verno
rottweilas
cuando el amor es real no solamente dejalo ser
déjalo brillar
atlantik music
maluma y el princi
kevin adg chan el genio
rude boys
y el mueka
lil wizard
rottweilas
cmonembed"
