id,song_name,artist_names,album_name,lyrics
2GyWz8uNUu7yF2DZ446E4G,El Que la Hace la Paga,Plan B,0qmyud8qe8LqaVQ1YQ7S5G,"4 contributorsel que la hace la paga lyricsel chance ya se acabo se acabo
ese amor ya se fue ya se fue
tus lagrimas ya no me mueven
tus palabras no me consuelan lo siento
si hay un dicho que dice
que el que la hace la paga
y ahora tu la estas pagando fuego lento

el chance ya se acabo se acabo
ese amor ya se fue ya se fue
tus lagrimas ya no me mueven
tus palabras no me consuelan lo siento
si hay un dicho que dice
que el que la hace la paga
y ahora tu la estas pagando fuego lento

al diablo con los lamentos
que lo lamento que te quemes por dentro
pero ya yo no lo intento
eso paso desde hace tiempo

tu amor es viejo como el viento
quiero algo nuevo como mi vida
tu me perdiste desde aquel día
de tu salida si lo sabias
que si lo hacías me caerías
pero no te importo nada
y te fuistes a la huida
see plan b liveget tickets as low as 29you might also likeme dejaste solo solo con mi querer
jugaste con mi mente jugaste con mi ser
no te importo nada y te fuiste con el
destruyo mi sueño y ahora quieres volver

el chance ya se acabo se acabo
ese amor ya se fue ya se fue
tus lagrimas ya no me mueven
tus palabras no me consuelan lo siento
si hay un dicho que dice
que el que la hace la paga
y ahora tu la estas pagando fuego lentox2

tanto que le pedí al señor
que me devolviera tu amor
yo de rodillas sufriendo y tu gozando
tanto que te explique te hable
confieso lo echastes a perder
tanto que nos quisimos y nos juramos
y ahora yo tengo otro interés
tanto lindos momentos
convertidos en recuerdos que jamas recordare

chencho y maldy
el artesano
dj blass
te quise tanto tanto tanto tanto
lo siento tanto yoembed"
