id,song_name,artist_names,album_name,lyrics
13Vs4lw2XisMw76z5ZV5Za,Antidote,Migos,1NIzKm1DqvComMoEF1FZPQ,"46 contributorsantidope lyricsintro quavo
whatyouwant
migo
no no no
migo
go

chorus quavo
call me what you want but you cant call me broke money
pull up with that choppa and a telescope
got 50 chickens in with me runnin around in my city
young rich nigga trappin out bentleys rich nigga trappin out bentleys
we makin a motion picture movie michelangelo movie
im seein the snakes in the grass  shhh
i got the antidope antidope antidope antidope
antidope antidope antidope antidope

verse 1 quavo
yo quavo
i got the antidope try to come juuggin and im bustin your cantaloupe
im trappin out of the bando still got tools like rambo bando
im feelin like harry houdini houdini
the pack was just here did you see it
the plug he be here any second now plug
if he didnt then something went down fuck what
we losing our bags gotta go to the stash huh
at the age of 19 i was running from the task
put it on my mama mama no flex no brag
young nigga been had cash
just me and rel money got rich off a half a bag
thats why they mad
you might also likechorus quavo
call me what you want but you cant call me broke money
pull up with that choppa and a telescope
got 50 chickens in with me runnin around in my city
young rich nigga trappin out bentleys rich nigga trappin out bentleys
we makin a motion picture movie michelangelo movie
im seein the snakes in the grass  shhh
i got the antidope antidope antidope antidope
antidope antidope antidope antidope

verse 2 takeoff
i got the antidope
im feelin like scarface al pacino comin off a banana boat
and how the fuck 200 migo touchin down in mexico
fuckin around with eduardo told me that he know armando
armando fuckin with carlos carlos wrappin em up in the barcodes
ridin around with that scotty in brand new bugattis
og miley cyrus snakes tryna give me the virus
but i got that antidope like i know science but im no scientist
fuckin around with them bombs but i am no terrorist
piss on your bitch that r kelly shit
im on mount everest sippin on medicine

chorus quavo  offset
call me what you want but you cant call me broke money
pull up with that choppa and a telescope
got 50 chickens in with me runnin around in my city
young rich nigga trappin out bentleys rich nigga trappin out bentleys
we makin a motion picture movie michelangelo movie
im seein the snakes in the grass  shhh
i got the antidope antidope antidope antidope antidope antidope antidope
antidope antidope antidope antidope antidope
verse 3 offset
austin powers you niggas be takin my mojo takin my mojo
young nigga i got the antidope
coke and baking soda minerals cocaina
i got a brick in the figurefour
young nigga i never made honor roll no
but i know how to add up them digits i do
whippin and cookin and flippin chickens i do
you say you got money but pussy nigga you dont have a witness cause ive never seen it
im a rich nigga i mean it rich nigga
keep talkin bullets go through yo beanie
im in a phantom ghost call that shit casper
young nigga plugged in like adapters
stomp yo ass out like an alpha
ahead of you niggas you still in the first chapter

chorus quavo
call me what you want but you cant call me broke money
pull up with that choppa and a telescope
got 50 chickens in with me runnin around in my city
young rich nigga trappin out bentleys rich nigga trappin out bentleys
we makin a motion picture movie michelangelo movie
im seein the snakes in the grass  shhh
i got the antidope antidope antidope antidope
antidope antidope antidope antidope81embed"
