id,song_name,artist_names,album_name,lyrics
6LRsdFGs3jfTRtmkb538jY,Alzheimerz,Los Inquietos Del Norte,1CAbmBdilHOVUGGiDjpCxp,"1 contributoralzheimerz lyricssolo y triste y sin amor
acostado en una cama
con las ganas de mirarte
con las ganas de besarte
lo que no comprendo es
porque nos peliamos tanto
si tu me quieres tanto a mi
yo te quiero tanto tanto
coro
pero no no puede ser
que nos peliemos a cada rato
y aquel inmenso amor
nuestras peleas lo esten matando
no podria vivir sin ti
aunque sufriera de alzheimer
te necesito junto a mi
me derrumbo al no mirarte
coro
pero no no puede ser
que nos peliemos a cada rato
y aquel inmenso amor
nuestras peleas lo esten matando
coro
pero no no puede ser
que nos peliemos a cada rato
y aquel inmenso amor
nuestras peleas lo esten matandoyou might also likeembed"
