id,song_name,artist_names,album_name,lyrics
7bzLhOfjzbFsGl0z7jp1qz,Be A Witness,"Ramirez, Shakewell",2oaau3jGhm8zjnBbGxmCA6,"11 contributorsbe a witness lyricsintro killa klan kaze
killa klan get this business motherfucka be a witness and then
killa klan get this business motherfucka be a witness and then
killa klan get this business motherfucka be a witness and then
killa klan get this business motherfucka be a witness and then
killa klan get this business motherfucka be a witness and then

verse 1 ramirez
bitch you know this score is murder when im crossin through your fuckin hood
bullies with them pulleys bangin the set and still up to no good
bring the pump leavin the body inside of the trunk your body get slumped
mangle the body and leave it in chunks
slow to the flow roll up the skunk
comin out the westside jumpin out the whip with a full clip
then i let it bust with the deadly touch get em buck as fuck
dont get stuck by the devils son
cursed and burned by the flames
this aint an arrange im bringin the pain
loced in the brain i dont give a fuck
hangin myself then cuttin the vein

bridge killa klan kaze
killa klan get this business motherfucka be a witness and then
killa klan get this business motherfucka be a

verse 2 shakewell
its a stickup my choppa do the hiccup sip
pull up with a cuete and five paisas in the pickup boom
longhaired dragon with the silver back gorilla sip
key stone the prince down south of north califa sip
aint shit changed walkin round with my ts up no
homies keep they thing cholos tryna get they visa yeah
swiper no swipin mastercard or them visa work
its time to get sly fuckboy its the season sip
you might also likeoutro killa klan kaze
killa klan get this business motherfucka be a witness and then
killa klan get this business motherfucka be a witness and then
killa klan get this business motherfucka be a witness and then
killa klan get this business motherfucka be a witness and then
killa klan get this business motherfucka be a witness and then
killa klan get this business motherfucka be a witness and then
killa klan get this business motherfucka be a witness and then1embed"
