id,song_name,artist_names,album_name,lyrics
5mFyresbt1RELCLQByoWeg,Come & Go,50 Cent,5VfBwkAoSsQwtZjPU0Gr7h,"30 contributorscome  go lyricsproduced by drdre

intro 50 cent
i make em move
i make em move
i make it hot up in here
look around
lets see what we got up in here

chorus 50 cent  dr dre
bring em in kick em out
bring em in kick em out
bring em in you aint freaking we aint speaking bitch
bring em in kick em out
bring em in kick em out
bring em in its dr dre and 50 cent trick

verse 1 50 cent
they say he couldnt do it look now i did it
i topped in the club im still sipping the bub
the drama im with it i get biz you get it
i breezed on that shiddit i split your widdig
thats why a niggas bidded i cant forget it
i said i didnt do it witnesses said i did it
im fresh out on bail my benz is all kitted
five tvs my rims is so sidick
i cruise through your bitch just fell in love with it
baby come in girl i want to give it to you
once im in its on im a freak with it
money comes quidick hot shit i spit it
g unit kidicks blue new york fitted
shorty want to cut oh yeah im with it
she comes to my hotel room she know shes gone get it
its exercise my homie hes been waiting hes next in line
see 50 cent liveget tickets as low as 87you might also likechorus 50 cent  dr dre
bring em in kick em out
bring em in kick em out
bring em in you aint freaking we aint speaking bitch
bring em in kick em out
bring em in kick em out
bring em in its dr dre and 50 cent trick

bridge 50 cent
people always talking about my reputation
i dont love them i dont need them
i dont love them i dont need them
i dont love them
i dont care what she do with him its all good with me
suwoo

verse 2 50 cent
they cant do it how i do it im number one i knew it
i do i do my thing and gangsters bop to it
its hit after hit damn im on a roll
im like james brown now man ive got soul
no i aint a pimp but hell yeah ive got hoes
i was born to do this when i breathe i make a killing
think im bullshitting my moneys touching the ceiling
cam buying condos im buying the whole buildings
im pissin on grown women r kelly do it to chilen
you bet against me boy imma hurt your feelings
because over and over imma keep on winning
my rolls royces tinted your phantoms rented
thats why we never ever ever see you with it
man everybody knows like everywhere i go
when 50 in the club shit just goes out of control
you can blame it on em or blame it on dre okay
chorus 50 cent  dr dre
bring em in kick em out
bring em in kick em out
bring em in you aint freaking we aint speaking bitch
bring em in kick em out
bring em in kick em out
bring em in its dr dre and 50 cent trick3embed"
