id,song_name,artist_names,album_name,lyrics
1NCSa6QvClPVe7KqsqjnMn,I Don't Know (feat. P. Diddy),"USHER, Diddy",6k16WXh4rKyusIoN00rmpi,"16 contributorsi don’t know lyricsverse 1 puff daddy
all my niggas take a walk with me
you aint gotta holla you can talk with me
just try to learn where my thoughts can be and how i stack figures
learn why im real still that nigga
i get money i aint gotta do a crime
shit i hit dimes what i need with a nine
before yall judge me be clear
we got nothing but heat here beware we here
whats my name got chicks twisted like whats my game
pimp things still the same
i smash it i dont harass it
ma im a baller i score and pass it
feel me still be filthy
if making hits is a crime i plead guilty
and this is what we came do
party diddy usher game is through come on

verse 2 usher
its right around eleven oclock
one of your girls just called
asked you how you look are you ready
you tell her you look hot
not to worry at all
niggas will be shook yall doing it heavy
shes telling you she might change
but you tell her not to
she know that she looks stunning itll be fun
the club will be full of game
but none of that has got you
me i think youre running cause im the one
you see
see usher liveget tickets as low as 94you might also likechorus usher
i dont know what you came to do girl
what you came to do tonight
but i came to party oh
i dont know what you came to do girl
what you came to do tonight
but i came to party oh

bridge usher
youre probably thinking to yourself whats the occasion
and believe me girl i dont just sex for fun
im the perfect gentleman in every situation
and the only thing thats missing is the one
is it you

chorus usher
i dont know what you came to do girl say what
what you came to do tonight
but i came to party oh
i dont know what you came to do girl
what you came to do tonight
but i came to party oh

interlude usher  pharrell williams
check this out sing it la la la
ghetto girls la la la
suburban girls la la la
international girls you smell me la la la la
la la la
ghetto girls la la la
suburban girls la la la
international girls you smell me la la la la
verse 3 usher
had to take the time
to open up your mind
thats exactly what you are open
you got the memorizing grind
your shape should be a crime
damn baby youre a star youre smoking

bridge usher
youre probably thinking to yourself whats the occasion
and believe me girl i dont just sex for fun
im the perfect gentleman in every situation
and the only thing thats missing is the one
is it you yeah

chorus usher
i dont know what you came to do girl
what you came to do tonight
but i came to party
i dont know what you came to do girl
what you came to do tonight
but i came to party

interlude usher  pharrell williams
sing it la la la
ghetto girls la la la
suburban girls la la la
international girls you smell me la la la la
la la la
ghetto girls la la la
suburban girls la la la
international girls you smell me la la la la
outro usher  pharrell williams
its real serious
youre so fine girl
at the end of the day im going home with you
i dont know what you came to do girl
what you came to do tonight youre so fine girl
but i came to party at the end of the day im going home with youembed"
