id,song_name,artist_names,album_name,lyrics
7egGWCqoxtAuo7QgsWw3tm,Scott and Ramona,Lil Uzi Vert,7mgdTKTCdfnLoa1HXHvLYM,"71 contributorsscott and ramona lyricsintro
yeah yeahyeah
yeah yeahyeah yeah yeah
yeah yeah yeah yeah lil uzi
yeah
yeah
yeah
yeah

verse 1
baby you are not alone yeah
you call my phone i pick it up
she p— she pick it up then drop it slow
ke— keep it on the low
from what i hear she got a man at home
i go deep but got tired of waitin
got a situation
live my double life amazin

chorus
i cant go a day if i dont talk to my baby
i went to my hood all my friends think i made it
i talk to my fam man my mama think im famous
yeah yeah yeahyeah my mama think im famous

refrain
hundred dollar bills in the way yeah
yeah it feels good to be great yeah
now she gonna do what i say yeah
now she gonna do what i say
i count my dough i make it stack
i spend on her i make it back
what you told me cant take that back
what i told you cant take that back
see lil uzi vert liveget tickets as low as 450you might also likechorus
i cant go a day if i dont talk to my baby
i went to my hood all my friends think i made it
i talk to my fam man my mama think im famous
yeah yeah yeahyeah my mama think im famous yeah

verse 2
rule number one gotta get all your paper ayy
im in a zone i cant see none of you lames
when im not around i dont know what she sayin
say she single but she know she really taken
i dont care though skrrt
rule number one yeah yeah ayy never trust no ho ayy
ride around la in a range rove ayy skrrt skrrt
radio blasting ayy ayy listening to dej loaf yeah

refrain
hundred dollar bills in the way yeah
yeah it feels good to be great yeah
now she gonna do what i say yeah
now she gonna do what i say
i count my dough i make it stack
i spend on her i make it back
what you told me cant take that back
what i told you cant take that back
outro
i dont care though
i dont care though
rule number one never trust no ho
ride around la in a range rove
radio blastin listenin to dej loaf
yeah33embed"
