id,song_name,artist_names,album_name,lyrics
339RnREljheLS4Wmw7pQp2,Love Me As I Have Loved You,Mac Miller,1xCNBnc7Gm2VudnyeyZ11Q,"18 contributorslove me as i have loved you lyricsverse french female
girl laughing
vibrer une corde une inspiration un cil
un cheveux des antennes dinsectes
vibration le son la vie
are you there are you there
where are you
un souffle une veine qui bat un frisson
chaire de poule les lèvres qui tressailles
tressaillir trembler brièvement
sursauter a cause dune émotion
can you see me
une paupière qui cligne un regard profond
can you feel me
une émotion vive un amour impossible
une sensation essentielle inéluctable inébranlable
do you love me
les hommes viennent de mars
i love you
et les femmes viennent de vénus
essentialiste
let me in
nature féminine et masculine différente par essence
love me as i have loved you as i have love you
love me as i have loved you
are you readyyou might also like7embed"
