id,song_name,artist_names,album_name,lyrics
5H25xsIuRWUI8GwcoAoeSG,Piss On Your Grave (feat. Kanye West),"Travis Scott, Kanye West",4PWBTB6NYSKQwfo79I3prg,"138 contributorstranslationssvenskaespañolportuguêsazərbaycanca  آذربايجانpiss on your grave lyricsinstrumental intro

bridge kanye west
yo yo yo

verse 1 kanye west
i use your face as a urinal then do the same at your funeral
piss on your grave piss on your grave piss on your grave
piss on your grave piss on your grave piss on your grave
this one here for the executives fuck you and all of your relatives
piss on your grave piss on your grave piss on your grave
piss on your grave piss on your grave nigga behave
nigga behave nigga behave

verse 2 travis scott
us niggas we cant behave
we mobbed on the pave got treated like slaves
young niggas treated like slaves
this the moment ive been waiting for
this why i moved to cali stepped outside and got shaded for
told momma bitch get back in the door
ive been comin up and down a nigga cant take no more
kamikaze over commas
benjamins dividends stuffed in my jeans i cant fit in
poppin pills since droppin ritalins
pop a penicillin nigga you gotta get with it
my my my my look at little scotty now
the same fuckers used to doubt
all preachin that they proud
i pull my zipper down and whip it out
you might also likeverse 3 kanye west
piss in your grave piss in your grave
turn this up teacher
play this in the third grade in the third grade
cant hide from the truth
now we bout to go ape were bout to go ape
these streets is not safe
these niggas aint playin these niggas aint playin huh
these niggas aint playin
this for my fam this for the fam do this for the fam
hop out of the lamb hop onto the gram
what the fuck was you sayin
piss in your grave piss in your grave piss in your grave
ill piss on your face
ill piss on your bitch ill piss on your date ugh
fuck is you sayin fuck is you sayin fuck is you sayin
me and la flame is you not entertained

outro kanye west
huh86embed"
