id,song_name,artist_names,album_name,lyrics
4QQm7dLH6kB5aBVK5XptLl,Amor Sin Primavera,Los Yaguarú,6zLHoo66ahzFaPgo7Sp3FA,"2 contributorsamor sin primavera lyricsesta es la historia tan triste que vivo
me desespero y me siento confundido
es que no tengo quien consuele
en minutos este corazon

y me enloquezco si es que no te tengo
me siento raro y atraves del tiempo
sigo esperando que regreses ami
mi tan querido amor

desconsolado y extraсo tu pelo
tus rojos labios y esos ojazos negros
tu dulce forma de mirar tu sonrisa
que me conquisto

desesperado veo correr el tiempo
que acorrolado junto a tus recuerdos
y mientras tanto yo sigo esperando
que llegues amor

no hay primavera
desde aquel dia que te fuiste
el sol no sale
ya se secaron las rosas
que tu plantaste y asi mismo se ha secado
ya este corazon
you might also likequien se muere por ti
si tu no estas amor
si no vuelves jamas
se muere mi corazonembed"
