id,song_name,artist_names,album_name,lyrics
3QHONiXGMGU3z68mQInncF,"I'll Be Missing You (feat. Faith Evans, 112)","Diddy, Faith Evans, 112",46JQVqJpOg8opDLUl1qHT1,"6 contributorstranslationsenglishdiddy  i’ll be missing you ft faith evans  112 traduction française lyricsintro dalbum  puff daddy
tous les jours quand je me réveille jespère que je rêve
je ne peux pas croire cette merde
ne peux pas croire que tu nes plus là
parfois cest juste dur pour un mec de se réveiller
cest dur de continuer
cest comme si je me sens vide à lintérieur sans que vous soyez ici
je ferai nimporte quoi mec pour te ramener
je donnerai toute cette merde lensemble de cette merde
jai vu ton fils aujourdhui il te ressemble
tu étais le meilleur tu seras toujours le meilleur
tu mmanques big
je npeux pas attendre ce jourlà quand je vois ton visage
je npeux pas attendre ce jourlà quand je vois ton visage

intro  puff daddy
yeah this right here tell me why
cest destiné à tous ceux qui ont perdu quelquun
quils aimaient vraiment allez écouter ça

couplet 1  puff daddy
jai limpression quhier on faisait vibrer le spectacle
jai inséré la chanson tu as stoppé le flow
loin de traîner dans la rue pour de largent
notorious ils doivent savoir que
la vie nest pas toujours ce quelle semble être
les mots ne peuvent pas exprimer ce que tu signifiais pour moi
bien que tu sois partis nous sommes toujours une équipe
a travers ta famille jaccomplirai tes rêves cest vrai cest vrai
dans le futur je ne peux pas attendre de voir
si tu ouvres les portes pour moi
je me rappelle parfois la nuit ou il ont pris mon ami
try to black it out but it plays again à traduire
quand cest réel les sentiments sont durs à cacher
ne peux imaginer toute la douleur que je ressens
je donnerai nimporte quoi pour entendre une petite respiration de ta part respiration
je sais que tu vis encore ta vie après la mort
you might also likerefrain  faith evans
chaque décision que je fais chaque pas que je fais
chaque jour chaque fois je prie
tu me manqueras
en pensant au jour où tu es parti
quelle vie à prendre quelle serment à briser
tu me manqueras

couplet 2  puff daddy
its kinda hard with you not around à traduire
know you in heaven smilin down à traduire
en nous regardant pendant que nous prions pour toi
chaque jour nous prions pour toi
jusquau jour où lon se reverra
cest dans mon cœur que je te garderai mon ami
la mémoire me donne la force dont jai besoin pour continuer
la force dont jai besoin pour croire
my thoughts big i just cant define à traduire
je voudrais pouvoir faire tourner les aiguilles à lenvers
nous dans la sixième achetant de nouveaux vêtements et des baskets
toi et moi se tapant sur lépaule
faisant un carton des plateaux tv où ils te recevaient
je narrive toujours pas à y croire que tu es partis
je donnerai nimporte quoi pour entendre une petite respiration de ta part
je sais que tu vis encore ta vie après la mort
refrain  faith evans
chaque décision que je fais chaque pas que je fais
chaque jour chaque fois je prie
tu me manqueras
en pensant au jour où tu es parti
quelle vie à prendre quelle serment à briser
tu me manqueras

interlude  faith evans
que quelquun me dise pourquoi
un matin
quand la vie est finie
je sais
que je reverrai ton visage

outro  112
chaque nuit je priechaque décision que je prends
chaque pas que je fais chaque jours unique
chaque nuit je priechaque décision que je prends
puff chaque jour qui passe
chaque mouvement que je fais chaque jour unique
puff is a day that i get closer
puff to seeing you again
chaque nuit je prie chaque décision que je prends
puff tu nous manques big et nous narrêterons pas
chaque pas que je fais chaque jours unique
puff car nous ne pouvons pas nous arrêter… cest vrai
chaque nuit je prie chaque décision que je prends
chaque pas que je fais chaque jours unique
puff tu nous manques big2embed"
