id,song_name,artist_names,album_name,lyrics
41xhihO63WDGBER5gLA9cw,Come Around Again,Jet,6NrLpQCPYrNS3kVWxDgIlg,"4 contributorscome around again lyricsyeah i’m waitin’ for you it’s been so long
yeah i’m waitin’ for you it’s been so long
yeah i’m sad when i’m on my own
they said it takes a long long time
if it’s not too much
could you hear me now

you promised me you’d always be
when i wake up please come around again
come around again
you promised me you’d always be
when i wake up please come around again
come around again yeah

yeah i’m waitin’ for you it’s been so long
yeah i’m sad when i’m all alone
they said it takes a long long time
if it’s not too much
could you hear me now

you promise me you’d always be
when i wake up please come around again
come around again
you promised me you’d always be
when i wake up please come around again
come around again
you might also likeyeah there’s something i was thinking about
get it out of my head
yeah there’s something i was kicking around
somethin’ you said
i don’t know when i’m right
i only know when i’m wrong
when you gonna leave some light to show it all
and keep the lights from going off
coz i don’t see

yeah i’m waitin’ for you it’s been so long
yeah i’m lost but i’m at home
they said it takes a long long time
if it’s not too much
could you hear me now

come around again
come around again
please come around againembed"
