id,song_name,artist_names,album_name,lyrics
7jQhfMtUnIQFPa4qVkAqmu,You Like That,Chris Brown,1BfLzaTFI5qKsAAk0Ae6aV,"18 contributorsyou like that lyricsverse 1
girl i need you to get in the vibe
but you dont even try
you are the one that i want
yeah you know what i like

refrain
nobody deny it
my bed and your body is callin
come sit on this chair yeah
come sit on this let me

prechorus
put it in your body
dont you give this to anybody
this is mine all mine
you know i can give you life
girl youre so exotic
come on lets have a private party
quit puttin up a fight
you know i know what you like

chorus
so come on give me that
gimme that arch your back let me take control
when the lights down low down low
when the lights down low down low
stop playin with me this is where you belong
i know you like that though that though
i know you like that though
your body on me
quit actin like youre so shy
when the lights down low down low
i know you like that though that though
you might also likeverse 2
you got that got that right
you give me what i like
we put it on the line
you like it

refrain
nobody deny it
my bed and your body is callin
come sit on this chair yeah
come sit on this let me

prechorus
put it in your body
dont you give this to anybody
this is mine all mine
you know i can give you life
girl youre so exotic
come on lets have a private party
quit puttin up a fight no no
you know i know what you like ooh

chorus
so come on give me that
gimme that arch your back let me take control
when the lights down low ohoh down low
when the lights down low down low
you best stop playin with me this is where you belong
i know you like that though oohooh that though
i know you like that though yeah
your body on me
quit actin like youre so shy
when the lights down low down low low ooh
i know you like that though that though oohooh
give me that arch your back let me take control
when the lights down low down low oh
when the lights down low
outro
stop playin with me this is where you belong
i know you like that though
i know you like that though
your body on me
quit actin like youre so shy
when the lights down low
i know you like that though12embed"
