id,song_name,artist_names,album_name,lyrics
0t7HKmZDWnOIRDVT9hqyuQ,Blaze Up The Fire,"Major Lazer, Chronixx",2rqjmynngV4AmGoL1ZEuwM,"17 contributorsblaze up the fire lyricsintro  major lazer
and me just blaze up di fire blaze it til a morning
blaze up di fire blaze it til a morning
blaze up di fire blaze it til a morning
blaze up di fire reload blaze up di fire

verse 1  major lazer  chronixx
some a dem a evil from dem christen
so one by one dem a miss’n
nah beat dem wid batten fi dem go fatten inna prison
when binghi drum start whistle
babylon drop and cripple
dem judgement double and triple
cause dem heart come in like icicle

chorus  major lazer  chronixx
me just blaze up di fire blaze it til a morning
blaze up di fire blaze it til a morning
blaze up di fire blaze it til a morning
blaze up di fire reload blaze up di fire reload

verse 2  major lazer  chronixx
look how mi ease pon top a di riddim
and how mi did ease from in di beginning
and den mi just ease and sekkle and cease and trample di beast
a rastafai seh him bruk di seven seal
again i say fi ease and sekkle and cease
wha me do
you might also likechorus  major lazer  chronixx
me just blaze up di fire blaze it til a morning
blaze up di fire blaze it til a morning
blaze up di fire blaze it til a morning
blaze up di fire reload blaze up di fire reload

verse 3  major lazer  chronixx
di youths dem a di future dem a gwan like dem a di least
what you reap is what you sew mi she you sew what you reap
until di day harvest the tiers grow with di wheat
mi know dem a vampire cause dem show mi di teeth
well mi just blend up a cup a juice weh full a all kinda sit’n
real rastaman a lion cyah come tek man fi kitten
mi ready fi chant down
babylon dem sins cyah forgiven
mi rock and pop off wheel out dem cyah believe what we risen

chorus  major lazer  chronixx
and me just blaze up di fyah blaze it till a morning
blaze up di fyah blaze it till a morning
blaze up di fyah blaze it till a morning
blaze up di fyah
me just blaze up di fyah blaze it till a morning
blaze up di fyah blaze it till a morning
blaze up di fyah blaze it till a morning
blaze up di fyah4embed"
