id,song_name,artist_names,album_name,lyrics
7qeBZftWEs7ClFFHMtBwwR,The North Bleeding,YoungBoy Never Broke Again,1ZCsPUZ7j9dTqjhU2I36tw,"24 contributorsthe north bleeding lyricsintro
ayo bans what you cookin
its malik on the track
look

verse 1
no new shoes til mama get her taxes
police harass me cause its thug life survival tactics
from a shoebox to my mattress from my mattress to the bank
been doin this shit since i was seventeen you think that i cant think
my gangster what the fuck you thinkin
bout these cold killers and dope sniffers that run with me
seen that i dont fuck with em now they come for me
they know he keep it tucked with him
now which one yall wanna romp with me
back against the wall real through it all now they wan see me bleed

chorus
the sun dont shine no more the rain dont fall
ill be back on my feet soon as the time come round
i stack that money up tall just in case bad days call
i heard they comin to see me tell em it wont be easy woah
let down that window then they spray round nigga walk walk
bitch lay your pussy ass on the floor big 4ktrey and i want all the smoke
two hundred for lil bro a pole and he told me he aint need it
we fell off cause i was loaded she just flashed and i was leanin
you might also likeverse 2
black forces my gun you cannot see im lookin like im thievin
i feel it in the air like beanie sigel and bitch im rich like john cena
i keep it gangster like hot beezy im talkin to stunna im finna leave her
he got a chick with a bad daughter i told him see if she wan mingle”
thats twenty mill for me and here go thirty mill for you thug
bless the shooter and fuck these hoes these niggas wasnt raised like us
shoot the burner til you hear it click never tried to make a shoe fit
baby mama fuckin them they tried to kill me nasty dirty bitch you know

chorus
the rain dont fall
know ill be back on my feet soon as the time come round
i stack that money up tall just in case bad days call
i heard they comin to see me tell em it wont be easy woah
let down that window then they spray round nigga walk walk
lay your flunky ass down where that money at
big 4ktrey and i want all the smoke
two hundred for my bro a pole
swervin in that rolls member back up in the day it was a stolo

postchorus
turn that ass round lil thottieottie mami
take your pants off and come get on me on me
oh shakalaka twerk it drop it mami
she say she want a thug nigga she told me that she love me
verse 3
bitch i aint got no budget tag that nigga
cadillac on twentyfours this that north swag nigga
in the bed with your ho im just singin riddles
im like lalala tell your boyfriend ill kill him
plenty hitters nigga and i put em up in transition
at your car shoot dirty glocks and knock out all your transmission
how you try to run lil daddy stupid all your pants missin
fuckin doofus we too ruthless he just wanna smash niggas
and she know that though that gang got dead bodies
its a true crime pole shawty know i get it on
bangin like this saints row i made my bones inside the north
she tryna help me take it slow

chorus
the sun dont shine no more the rain dont fall
ill be back on my feet soon as the time come round
i stack that money up tall just in case bad days call
i heard they comin to see me tell em it wont be easy woah
let down that window then they spray round nigga walk walk
bitch lay your pussy ass on the floor big 4ktrey and i want all the smoke
two hundred for lil bro a pole and he told me he aint need it
we fell off cause i was loaded she just flashed and i was leanin

postchorus
turn that ass round lil thottieottie mami
take your pants off and come get on me on me
oh shakalaka twerk it drop it mami
she say she want a thug nigga she told me that she love me2embed"
