id,song_name,artist_names,album_name,lyrics
1t9E0dxtpjZwSzuHfz43kd,Trust None,"Chief Keef, Johnny May Cash",36wYfxi4GQ9QunPwdfiwBI,"32 contributorstrust none lyricschorus johnny maycash
trust none none bitch i dont bitch i dont
bitches on my dick but i know she want yeah
fuck niggas fuck niggas i dont fuck with them no
i dont trust no nigga why not why
cause they pussy niggas they is they snake niggas yeah
theyll turn on you yeah yes sir fuck you
this bitch say i dont trust her i dont give no fuck yeah
i dont trust myself so what the fuck

verse chief keef
trust none none bitch i dont i dont
wife a bitch a bitch bitch i wont bitch i wont
this loud loud bitch i smoke i smoke
i got a lot of dawgs a lot of dawgs
dont make me sick em on you no
getting money money my true religion true religion
bitch sosa day sosa day its what you been missing you been missing
rolling rolling im rolling bitch rolling bitch
im with a bad bitch bad bitch my pistol she be holding it she holding it
take it out out and start shooting start shooting
we got a lot of clips lot of clips you can say this a movie this a movie
im cumming in her mouth in her mouth
she aint tryna bust bust then i kicked her out out
oblock oblock what i rep i rep
you need some help if you disrespect
chief sosa bitch im on on
and purple lean purple lean what im sipping on sipping on
see chief keef liveget tickets as low as 208you might also likechorus johnny maycash
trust none none bitch i dont bitch i dont
bitches on my dick but i know she want yeah
fuck niggas fuck niggas i dont fuck with them no
i dont trust no nigga why not why
cause they pussy niggas they is they snake niggas yeah
theyll turn on you yeah yes sir fuck you
this bitch say i dont trust her i dont give no fuck yeah
i dont trust myself so what the fuck3embed"
