id,song_name,artist_names,album_name,lyrics
4VCbgIdr8ptegWeJpqLVHH,Love All (with JAY-Z),"Drake, JAY-Z",3SpBlxme9WbeQdI9kx7KAV,"21 contributorstwitter qa 1112014 lyricsim curious who you got winning tomorrow seattle or new orleans  kingjamesim taking sea but hard to bet vs brees

kingjames where is somwhere you havent visited yet but would like tosouth africa jerusalem dubai

kingjames favorite shoe to ball in 11s  soldier 7s

kingjames how tall where you as a freshman62

kingjames toughest player to guard man to man carmeloanthony  kdtrey5

kingjames whats your favorite shot to takea layup lol

kingjames whats your favorite thing about playing in miamimy teammates and our fans heatles heatnation

kingjames what motivates to strive for greatnessmy family and the kids that i inspire throughout the world

kingjames the best movie you have seen in the last monthanything with the jennifers in it lawrence or aniston

kingjames whats your favorite jayz song what about albumhard to pick one song or album hes the goat

kingjames what you like doing on your free timechillin with my boys

kingjames do you watch vines loadedquestionno doubt i be seeing u wildin out hahaha

kingjames when are you coming to australiahopefully soon heard its great
kingjames would you buy a unicorn with the money you haveall depends on what all that unicorn can do lol

kingjames what made you work harder and decide to be the greatest i just love what i do my passion runs deep

kingjames is your hairline a sensitive topic for younot at all my pops screwed me with this hairline dang it haha
kingjames favorite rapper besides jayzdrake
kingjames what do you say to the hatersstriveforgreatness

kingjames whats your favorite video gamenba 2k14

kingjames whats your favourite ever moment in basketballwinning a championship

kingjames would you go up and try and block a blake griffin dunki aint crazy i know my limitations

kingjames  whats your favorite quote of all time man in the arena

kingjames who is the funniest guy on the teamjj aka champ

you kingjames think you could beat me one on one absolutely lol

kingjames what happened to dru joyce iiihes playing professionally overseas

kingjames do you ever feel nervous before a gameall the time
kingjames can i get a reply lolreply

kingjames do you really laugh when yu type haha or lolhaha i just did

kingjames whos the loudest on the team loleasyst0

kingjames why you a cowboys fanmy lil league team wore the exact same unis as them so i thought i was emmitt smith
kingjames wat professional team do u have the most love for other than the heatlfc

kingjames no love for kendrickof course love him as well crazy bars

kingjames who do you think is the greatest ingame dunker of all timevince nique mj

kingjames what sports do you want your kids to playbasketball and soccer

kingjames i used to hate u but now it changed lol i love ur gameits all good i appreciate the love

kingjames come to egypt in summer king  king james fans want to see youi wanna see the pyramids as well

kingjames do you think kobe bryant is good what did u think jaws was a huge shark exactly

kingjames why are so many great players injuredi dont know cant remember it being like this in years pastbad for game

kingjames whats your definition of successhappiness
kingjames do you think derick roses prime is over with after his recent injuriesabsolutely not

kingjames is kevin hart really that funny in personhes out of his mind hahaha

kingjames favorite cartoontom and jerry

kingjames who is your favorite nfl playerprime time

kingjames how do i get my baby to fall asleepput my performance in the 2011 finals on night night immediately27embed"
