id,song_name,artist_names,album_name,lyrics
7mQq0wSWh7vmtnr0yLlTHq,Sobre Iluminados E Iluminadores,La Mosca Tse-Tse,4vIw5XspQuPt04VHX5oK5W,"1 contributorsobre iluminados e iluminadores lyricsme gusta verte bailar
riéndote frívolametne
ero quisiera verte también
pensar algo inteligente
es cuestión de sospechar
con los sentidos atentos
o siempre te vas a enterar cuando la tengas adentro
cuantos sobres sin quemar
cuantos pibes sin aliento
los que mandan tienen más
apetito que el hambriento
apagué el televisor
y encendí mis reflectores
a falta de iluminados
sobran iluminadores
a mi me gusta verte bailaryou might also likeembed"
