id,song_name,artist_names,album_name,lyrics
0ztML32VCTeiSyL1aasshe,"Don't Leave, I Think I Love You",Toby Keith,7xPAsIGxs8It3pVWnZEHan,"3 contributorsdon’t leave i think i love you lyricschorus
dont leave i think i love you
i just saw the rest of my life honey youre in it
wont you hear what i say give me a minute
dont leave i think i love you
i know you think im crazy and you probably should
i wouldnt make this up i couldnt dream this good

verse 1
now baby dont tell me that i missed my chance
i havent heard last call would you like to dance
ive been sitting here waiting on you all night
why dont you give me that old goodtogo green light
am i coming on strong baby moving kind of fast
im rushing along but at least i got to ask
i couldnt live with myself if you got away
im a love sick puppy baby what do you say

chorus
dont leave i think i love you
i just saw the rest of my life honey youre in it
wont you hear what i say give me a minute
dont leave i think i love you
i know you think im crazy and you probably should
i wouldnt make this up i couldnt dream this good
you might also likeverse 2
its late and been a long night youre tired i know
aw dont break my heart baby please dont go
it aint the whiskey talking aint this neon light
you see ive fallen stonecold in love at first sight
going to cut to the chase baby get right to it
i got a lot to say and a short time to do it
aw dont walk away honey im just trying to
aw listen to me talking im a babbling fool

chorus
dont leave i think i love you
i just saw the rest of my life honey youre in it
wont you hear what i say give me a minute
dont leave i think i love you
i know you think im crazy and you probably should
i wouldnt make this up i couldnt dream this good

outro
really baby dont leave
i think i love you
i know you think im crazy and you probably should
i wouldnt make this up i couldnt dream this goodembed"
