id,song_name,artist_names,album_name,lyrics
0AjgI4luhlLVhcAuPgsmnB,Que Me Olvidas,Julión Álvarez y su Norteño Banda,4kWF9XKqqLONgYtUQ4alvb,"1 contributorque me olvidas lyricsletra de que me olvidas

verso 1
que me olvidas y me dejas
que me has dejado de amar
que te tomas una copa
y se te suelta la boca
me empiezas a criticar

verso 2
que me llamas por las noches
y te pones a llorar
esas cosas no las cuentas
te volviste parrandera
nada más para olvidar

coro
tú pláticas que fui tuyo
y que siempre así será
siendo que tú me has buscado
para que vuelva a tu lado
pero eso no lo verás

interludio
nomás falta que se anime y diga ¡ah
julión álvarez y su norteño banda oiga
you might also likeverso 3
que me debes tantas cosas
que quedaste de saldar
con tus caricias tan falsas
y en la espalda puñaladas
nunca vas a acabalar

coro
tú pláticas que fui tuyo
y que siempre así será
siendo que tú me has buscado
para que vuelva a tu lado
pero eso no lo verásembed"
