id,song_name,artist_names,album_name,lyrics
7szuecWAPwGoV1e5vGu8tl,In Your Eyes,The Weeknd,4yP0hdKOZPNshxUOjY0cZj,"156 contributorstranslationstürkçeespañolрусскийportuguêsdeutsch한국어françaisفارسیthe weeknd  in your eyes përkthim në shqippolskiitalianodanskin your eyes lyricsverse 1
i just pretend that im in the dark and
i dont regret cause my heart cant take a loss
id rather be so oblivious
id rather be with you

prechorus
when its said when its done yeah
i dont ever wanna know
i can tell what you done yeah
when i look at you

chorus
in your eyes
i see theres something burning inside you
oh inside you
in your eyes
i know it hurts to smile but you try to
oh you try to
you always try to hide the pain
you always know just what to say
i always look the other way
im blind im blind
in your eyes
you lie but i dont let it define you
oh define you
you might also likeverse 2
i tried to find love
in someone else too many times
but i hope you know i mean it mean it
when i tell you youre the one that was on my mind oh

prechorus
when its said when its done yeah
i would never let you know let you know
im ashamed of what ive done yeah
when i look at you

chorus
in your eyes your eyes
i see theres something burning inside you inside you
oh inside you oh inside you
in your eyes
i know it hurts to smile but you try to but you try to
oh you try to you try to
you always try to hide the pain oh oh
you always know just what to say oh dear
i always look the other way
im blind im blind
in your eyes
you lie but i dont let it define you hey
oh define you
chorus
in your eyes
i see theres something burning inside you
oh inside you
you always try to hide the pain
you always know just what to say
i always look the other way
im blind im blind
in your eyes
you lie but i dont let it define you
oh define you97embed"
