id,song_name,artist_names,album_name,lyrics
2sB0xPnrtFSNkfugdmuUXy,Tumbleweed,Afroman,5WW91LUt9Oqkhzrg0Ao4K0,"10 contributorstumbleweed lyricsintro afroman  cuz
damn how long its gonna take you to roll the joint cuz
i just got the bag
you over there actin like you playin the piano or something cuz
i just got the bag homie know what im sayin
chill the fuck out homie
here let me hit this homeboy hehe

la da da da da
shoop shoop shoobie doo wa
yeah it looks lovely
hey where the light loc
right here cuz
give it here man stop bullshittin

i love you baby
i love you honey
yes i dooo
do it to me girl uh
yeah yeah chicken clucking
yeah yeah chicken clucking
fo sho
yeah

its been a long long time ive been smokin
smokin marijuana
la da da da da
it takes out of my mental ghetto and places me in the bahamas
its been a long long time ive been smokin
smokin marijuana
la da da da da
it takes out of my mental ghetto and places me in the bahamas
it puts my mind at ease
indulgin myself in the calm breeze
and my problems will flow away beyond the palm trees
see afroman liveget tickets as low as 30you might also likehook
but i gotta keep smokin and a smokin and a smokin on
i keep chokin and a chokin and a chokin on
i keep sellin and a sellin and inhalin
my tumbleweed

i like to go to palmdale yeah
sit by the fountain sit by the fountain
i light up a fat one gazin at the snowcapped mountains
come again now uh i like to go to palmdale
sit by the fountain sit by the fountain
i light up a fat one gazin at the snowcapped mountains
baby please dont nag
go and get me the zigzag
and my problems will float away
like a plastic baiiiag

hook
but i gotta keep smokin and a smokin and a smokin on
i keep chokin and a chokin and a chokin on
i keep sellin and a sellin and inhalin
my tumbleweed

i need to get a job
and thats not funny
la da da da da
cause me be smoking too much ganja
yeah
and be runnin out of money
i gotta lie to the man
let me get an application
tell him that ive never been arrested
sir you have never been to jail
i gottta go to the clinic baby
i gotta get drug tested
oh no
i got no food for my stomach
got no gas for my coup de ville
i gotta walk to the supermarket for some goldenseal
cause everyday
hook
but i gotta keep smokin and a smokin and a smokin on
i keep chokin and a chokin and a chokin on
i keep sellin and a sellin and inhalin
my tumbleweed

ohhh ohhh yeahhhh
uh
i said the black man smokin
black man smokin
if hes a soul bro
hey man whats happening
i said the mexican smokin
mexican smokin
if hes a cholo
where you from esse
i said the creole smokin
creole smokin
down in mississippi
fuck creoles
i said the white man smokin
white man smokin
if hes a hippie
wheres the bud man
it puts my mind at ease
indulgin myself in the calm breeze
and my problems will flow away beyond the palm trees
hook
but i gotta keep smokin and a smokin and a smokin on
i keep chokin and a chokin and a chokin on
i keep sellin and a sellin and inhalin
my tumbleweed

right about now
ohhh
im fixin to dedicate this to everybody
oohhhh yeahh
that went to palmdale high school with me
check this shit out cuz

beatboxing and singing

i said joey jo has an afro
sing something with soul chillin ice cold
jerry with the high top fade
left palmdale but he still gettin paid
hey man take me back to the bridge we up outta here man

it puts my mind at ease
indulgin myself in the calm breeze
and my problems will flow away beyond the palm trees
whatcha gotta do

hook
but i gotta keep smokin and a smokin and a smokin on
i keep chokin and a chokin and a chokin on
i keep sellin and a sellin and inhalin
my tumbleweed1embed"
