id,song_name,artist_names,album_name,lyrics
04A8bbdUo0wkesKOWSMztk,Fire Starter,Demi Lovato,6Kssm2LosQ0WyLukFZkEG5,"30 contributorstranslationstiếng việtfire starter lyricsverse 1
theres an s under my clothes
on my chest where nobody else can see
i light up when the doors are closed
i am free yeah
and i wish i could make my move
i can tell that youre really into me
and i dont got a thing to lose
in my dreams in my dreams

prechorus 1
im a badass jumping off the moving train
im a jane bond putting all them guys to shame
im a wild card and im gonna steal your game
you better watch out

chorus 1
im a fire starter
make your blood run faster
i melt hearts like water
yeah yeah ohoh yeah yeah ohoh yeah yeah
im a fire starter yeah yeah
im a sweet disaster yeah yeah
i melt hearts like water
yeah yeah ohoh yeah yeah ohoh yeah yeah
yeah
you might also likeverse 2
i might look all innocent
but the embers are burning inside of me
and im ready to take that step
cant you see cant you see

prechorus 2
im a badass jumping off the moving train
im a jane bond putting all them guys to shame
im a wild card im about to take my aim
you better watch out watch out

chorus 2
im a fire starter yeah yeah
im a sweet disaster yeah yeah
i melt hearts like water
yeah yeah ohoh yeah yeah ohoh yeah yeah
im a fire starter yeah yeah
im a sweet disaster yeah yeah
i melt hearts like water
yeah yeah ohoh yeah yeah ohoh yeah yeah

bridge
im so high im burning up
kiss your lips im waking up
theres nothing more to be afraid of
theres an s under my clothes
on my chest where nobody else can see yeah
chorus 3
im a fire starter yeah yeah
make your blood run faster yeah yeah
i melt hearts like water
yeah yeah ohoh yeah yeah ohoh yeah yeah
im a fire starter yeah yeah
im a sweet disaster yeah yeah
i melt hearts like water
yeah yeah ohoh yeah yeah ohoh yeah yeah

outro
im a fire starter6embed"
