id,song_name,artist_names,album_name,lyrics
1dNELwsmubT9iZfHZTyBdD,Nuthin' (feat. E-40 & Detail),"T-Pain, E-40, Detail",7rWNM4Q11nvmpHOuSnLFME,"10 contributorsnuthin’ lyricsverse 1 tpain
you niggas aint nothin nothin nothin
see me undercover fist pumpin with your cousin
pull up to the club let ya hear the speakers bump
wit a honey and a hummer got her cummin on my thumb
i am second to none drummer steady drummin
and i dont need keys im just thumpin on the button
shawty want my love and she not thinkin nothin of it
so i told her get in line she can come and take a number
she lookin at my pocket like she gettin something from me
and if she think she is then this bitch is really dumb and
im a boss get lost maybach rick ross
im lookin for a chick wit the ability to keep that booty jumpin
ya see what i got cookin put my meat up in that oven
and when its all over you can get ready for supper
they say that im a pornstar call me tpumper

chorus detail  tpain
what ya say what ya say
yeah got her shakin that thing like its
huh hell naw hell naw
said her ass so fat she aint even tryna tuck it
got her suckin and fuckin like its nothin nothin nothin

verse 2 tpain
look at this motherfuckin rug that im cuttin
these bitches act sidity but these chickens steady cluckin
like its nothin nothin nothin and they dont give a fuck if
im up in the maserati or im duckin in a bucket and i love it
big chain teddy p tpain thats me
i do my thang twentyeights turnin lane
they see me wit a couple bad bitches and they know i keep it truckin
bottle of that drink and im feelin kinda lucky
and if they playin games its the deuces that im chuckin
cause they know why they came they aint fuckin nigga fuck em
in the butt whats up damn right you gon let a nigga cut
fo sho yee aint know teddy pain from the 850 pussy nigga aint
see tpain liveget tickets as low as 57you might also likechorus detail  tpain
what ya say what ya say
yeah got her shakin that thing like its
huh hell naw hell naw
said her ass so fat she aint even tryna tuck it
got her suckin and fuckin

verse 3 e40
she might be 19 but she aint green
her coochie get sticky and goopy like vaseline uh
but im much growner so i sick my son droope on her
he knocked it out the park hit a homer all four quarters
zip of broc and a sixpack of corona
damn fool he a boss like his pops gangedup hella cool bitch
when i slide through the function kisses and huggin
hella alcohol and i aint talkin bout rubbin
squares mean muggin cause we forward and they backwards
they got a n on they chest for nothin
i got a s on my chest for somethin uh
so what i told that square ass poodle what you tell that money
ill spaghetti yo noodle yo noodle
she off ciroc and that henny and that landy
got on pink panties lookin like nuvo biotch

chorus detail  tpain
what ya say what ya say
yeah got her shakin that thing like its
huh hell naw hell naw
said her ass so fat she aint even tryna tuck it
got her suckin and fuckin like its nothin nothin nothin
what ya say what ya say
yeah got her shakin that thing like its
huh hell naw hell naw
said her ass so fat she aint even tryna tuck it
got her suckin and fuckin like its nothin nothin nothinembed"
