id,song_name,artist_names,album_name,lyrics
7DcWaEjsO3PTAODV2fKeSn,Shit on Me,Kodak Black,4J5QtgOhv6tPCsxxifVskj,"20 contributorsshit on me lyricsintro
ayy skrrt skrrt
sg gang nigga skrrt
kodak why you strapped like that
why you act like that
cause i got it by myself ayy
you know i got that shit on me
i keep that shit on me

chorus
lil shorty got that shit in his pants lil shorty got that shit
40 with the dick at the end 40 with the dick
they know i keep that shit on me they know i keep that shit on me
no they wont hit no lick on me no they wont hit no lick on me
come here break yo neck for me baby come here break yo neck
come here sign a check for me baby come here sign a check
she gon take a risk for me she gon take a risk
i think this the bitch for me she might be my bitch

verse 1
i just went up top like elevators kokokokodak
about to come back down with 20 gs come back down kodak
i be sippin codeine kickin flavor
i got baby bottles full of lean
girl you be on my dick you be on my
i think its the cuban on my wrist cuban on my wrist
got her goin through the bank line
now im slidin in the audi a5 slidin on yo ass
free lil cool doin that time free lil cool
freeman with the stick he doin fed time freeman with the stick
im ballin like the knicks ballin like the
i remember i was sellin nicks remember i was sellin
smokin gas but your whip on e yeah
she find out you a lame now your bitch on me your bitch she on me
watch out im bouta blow watch out im bouta blow
got niggas locked up eatin sloppy joe niggas eatin sloppy joe
you might also likechorus
lil shorty got that shit in his pants lil shorty got that shit
40 with the dick at the end 40 with the dick
they know i keep that shit on me they know i keep that shit on me
no they wont hit no lick on me no they wont hit no lick on me
come here break yo neck for me baby come here break yo neck
come here sign a check for me baby come here sign a check
she gon take a risk for me she gon take a risk
i think this the bitch for me she might be my bitch

verse 2
ho you cant get this dick for free
fuck a bodyguard i got that shit on me i got that shit on me
that money got me geeked that money got me
im in miami runnin with my heat in miami runnin with my dawgs
ratatouille boy im comin for my cheese comin for that
thought it was thanksgiving how i stuffed it in my jeans stuffed it in my pockets
in science class high as hell just kiddin
im floatin off that loud i feel like tinker bell bitch im high as hell
now she dont wanna leave here she dont wanna leave
girl you gotta go home you cant sleep here bitch you gotta leave here
no cardio im runnin up a check runnin up a check
leave you where you stand my niggas dumpin on the set dumpin on the set
girl you cant be calling me this late calling me
lil shorty wanna see me everyday you cant see me everyday
on molly and a double cup molly and a double
two pieces on me just like reeses butter cup like reeses butter
chorus
lil shorty got that shit in his pants lil shorty got that shit
40 with the dick at the end 40 with the dick
they know i keep that shit on me they know i keep that shit on me
no they wont hit no lick on me no they wont hit no lick on me
come here break yo neck for me baby come here break yo neck
come here sign a check for me baby come here sign a check
she gon take a risk for me she gon take a risk
i think this the bitch for me she might be my bitch9embed"
