id,song_name,artist_names,album_name,lyrics
7r9kOxiNDnkAg5QKqtyjVk,Rescue,Lauren Daigle,6pmoTLfsPpn0wisT3YFJSN,"37 contributorstranslationsfrançaisrescue lyricsverse 1
you are not hidden
theres never been a moment
you were forgotten
you are not hopeless
though you have been broken
your innocence stolen

prechorus 1
i hear you whisper underneath your breath
i hear your sos your sos

chorus 1
i will send out an army
to find you in the middle of the darkest night its true
i will rescue you

verse 2
there is no distance
that cannot be covered
over and over
youre not defenseless
ill be your shelter
ill be your armor

prechorus 1
i hear you whisper underneath your breath
i hear your sos your sos
see lauren daigle liveget tickets as low as 37you might also likechorus 2
i will send out an army
to find you in the middle of the darkest night its true
i will rescue you
i will never stop marching
to reach you in the middle of the hardest fight its true
i will rescue you

bridge
i hear the whisper underneath your breath
i hear you whisper you have nothing left

chorus 2
i will send out an army
to find you in the middle of the darkest night its true
i will rescue you
i will never stop marching
to reach you in the middle of the hardest fight its true
i will rescue you

outro
oh i will rescue you9embed"
