id,song_name,artist_names,album_name,lyrics
6SB2sufUkTTb3Ovjw6TELT,Give It 2 U - Remix,"Robin Thicke, Kendrick Lamar, 2 Chainz",1eHyfkrIOVLGVnt5E4MD2j,"52 contributorsgive it 2 u remix lyricsproduced by circut and dr luke
intro 2 chainz robin thicke
okay baby yeah
all i got to say baby huh
thats robin thicke yeah
and im 2 chainz baby baby baby
talk to me yeah
let me see that body language baby baby
i said talk to me
let me see that body language hey hey

refrain robin thicke
girl give it to me girl you know what it do
girl give it to me i got somethin brand new
girl give it to me ill put it all on you
girl give it to me woo

verse 1 robin thicke
i got a gift for yah i got this for yah
a little thicke for yah a big kiss for yah
i got a hit for yah big dick for yah
let me give it to yah baby baby
i gotta car for yah i got a whip for you
black card for yah ball hard for you
i know you wanna get fancy
i know you wanna start dancin
you might also likechorus robin thicke
hey girl
you know youre lookin so damn fly
you lookin like you fell from the sky
you know you make a grown man cry
i wanna give it to you tonight
and make everything you fantasize
come true ooh baby
ill make you so so so amazing
ill give it to you

refrain robin thicke
girl give it to me
girl give it to me
girl give it to me
girl give it to me ooh

verse 2 robin thicke
whats that girl whats that baby
i like that girl i like that baby
on your back girl on your back
yeah shake it like that girl baby baby
i got an eye for yah i got an eye for yah
i got a smile for yah cheese
let me put it on your face for you please
i got a taste for you tasty
i bought lace for you freaky
ill put it on you yeah
so i can come and take it off you yeah
and get it off to you
chorus robin thicke 2 chainz
hey girl
you know youre lookin so damn fly
you lookin like you fell from the sky angel
you know you make a grown man cry
i wanna give it to you tonight
and make everything you fantasize
come true ooh baby girl yah
ill make you so so so amazing 2 chainz
ill give it to you

verse 3 2 chainz
highly respected
black michael jackson
when the dj bring it back
i pump it back like a chiropractor no
im at the main event
baby you the main attraction girl
what i need a script and a camera for
lets put this thing in action do it

bridge 2 chainz
lets put this thing in action do it
lets put this thing in action do it
2 chainz
all the things collapsin
lets put this thing in action do it
lets put this thing in action do it
22 chainz
gave your girl a chain reaction
verse 4 kendrick lamar
ugh
youre like a needle in a haystack ugh
i wanna sit you where my face at ugh
lunch with a few maitais ugh
purple kisses on my tie ugh
life can leave a dick loved ugh
now you gettin this dick love ugh
im lookin for you with a flashlight
i wanna feel what a real fat ass like
no injection i learned my lesson
i walk it like i talk it baby this pedestrian
runnin through your mind like jackie joyner
pussy like pop go give me a burner
got shot like pop
this can be detrimental
tshirt and panties thats your credential
youre cotton candy i need a fistful
im often antsy hope that convince you

chorus robin thicke
hey girl
you know youre lookin so damn fly
you lookin like you fell from the sky angel
you know you make a grown man cry
i wanna give it to you tonight
and make everything you fantasize
come true ooh baby
ill make you so so so amazing
ill give it to you
i wanna give it to you tonight
and make everything you fantasize
come true ooh baby
ill make you so so so amazing
ill give it to you
ill give it to you9embed"
