id,song_name,artist_names,album_name,lyrics
77JzXZonNumWsuXKy9vr3U,Beasty,A Boogie Wit da Hoodie,3r5hf3Cj3EMh1C2saQ8jyt,"79 contributorsbeasty lyricsintro
whoa kenny

verse 1
hold up you know its the logo say hb
the glock got no safety dont push me i’ll do it
please do not push me you think that im pussy
got too much to lose nigga dont make me lose it
i cant be trusting no bitch is you stupid
i came with a shooter he came with a ruger
i just seen one of my bros on the news
i cant call him no more he respect why i do it
im in the big body benz with my friends
and it look like we just hit a lick off the jeweler
look like a dope boy i hop out a rolls royce
they taking my flows like i said they can use it
dirty diana im pushing a phantom
i know that they wanna see me in a buick
three different bourbons we twentyone deep
you see gang in the shows like they dont know my music
fuck all the bitches that fronted on me when i didnt have money
you feeling so stupid
im from the trenches where niggas get hit up for nothing
you better go get on your bully
niggas be acting so tough
you can front if you want
got some shit that could knock down a bully
niggas be talking to police
you dont even know me
you only hear whats in the music
see a boogie wit da hoodie liveget tickets as low as 35you might also likechorus
talking to the feds is a nono
i can get bread with my eyes closed
insecure so she got lipo
vvss on me thats a light show
it could get litty like a light show
nigga im litty like a light show
if its bout money ima gogo
fucked a couple bros she a hoho

verse 2
too addicted hard to stop it
fell in love with saint laurent shit
louis luggages and monclers
flyest niggas out the bronx yeah
and we come straight out of highbridge
i swear you dont wanna die yeah
dont get caught up in my projects
i dont need no yes men round me
talking about lets get fleetfleet
come around tryna get treetree
popping on pills with the beanbean
rolling through the hills off the leanlean
dont hate me just love me
melody nigga she need me
blowing me kisses through the tv
look at me now im beasty
im beasty im beasty too od im beasty
nigga i cut her off easy
word to my mother im beasty im beasty im beasty
saint laurent sweater cost three gs
fucking on the bro just to meet me
okay you a eater like ee
chorus
talking to the feds is a nono
i can get bread with my eyes closed
insecure so she got lipo
vvss on me thats a light show
it could get litty like a light show
nigga im litty like a light show
if its bout money ima gogo
fucked a couple bro she a hoehoe8embed"
