id,song_name,artist_names,album_name,lyrics
6oO7WMjD6kEvCITLbVj0mu,Hypnotize,System Of A Down,3QxX3NbWyLlLG6lP1xveL3,"52 contributorstranslationsespañolhypnotize lyricsverse 1 serj tankian  daron malakian
why dont you ask the kids at tiananmen square
was fashion the reason why they were there
they disguise it hypnotize it
television made you buy it

chorus serj tankian with daron malakian
im just sitting in my car and waiting for my

verse 2 serj tankian  daron malakian
shes scared that i will take her away from there
dreams and her country left with no one there
mesmerized the simpleminded
propaganda leaves us blinded

chorus serj tankian with daron malakian
im just sitting in my car and waiting for my girl
im just sitting in my car and waiting for my girl

guitar solo

chorus serj tankian  daron malakian
im just sitting in my car and waiting for my girl
im just sitting in my car and waiting for my girlsee system of a down liveget tickets as low as 600you might also like27embed"
