id,song_name,artist_names,album_name,lyrics
0OAyZn9pGuuL2FJih1PM58,Billie Jean,A Boogie Wit da Hoodie,3r5hf3Cj3EMh1C2saQ8jyt,"24 contributorsbillie jean lyricsintro
wont miss that shit
if you find them they gon get that shit
go grizz
and i wont miss any of them
yeah mmh
winners circle
uh uh uh and uh
uh uhuh they uh and uh

verse
look at my schedule nigga
my itinerary is lookin too busy for niggas
but i still fuck with you niggas
yeah i swear to god yeah i got love for you niggas
shedded some blood for you niggas
if you think im slippin you buggin lil nigga
i stay groupied up lil nigga
fingers twisted up throwin up w nigga
im thinkin ahead of you niggas
all my niggas cases went federal nigga
im so immaculate nigga
on my way to the bank i laugh at you niggas
all my chains on everywhere i fuckin go
so i keep the ratchet lil nigga
mike amiri jeans on in my billie jean bag
in my bag on you niggas
put you on a tshirt you aint like that
you dont want static with niggas
she think ima keep her
beat it up bad like i caught a battery nigga
blood on my sneakers
louboutin bag im givin swag to you niggas
i dont really think they could fucking keep up
i still got respect for you niggas ah
shawty wanna kiss me fuck me suck me lick me love me ah
look at my wrist my drip my dick my stick i get like ah
shawty gon stay down spin around
get around come back just like ooh
but its okay now found out
youre just like me and im just like you
ah ah ah im just like you
tryna get my fuckin bread up
i got drugs on me but im blessed up
gotta keep my fuckin head up
diamonds all around the bezel
hoodie on feelin mellow
they hit my nigga in the head yo
that shit made me wanna let go
that shit made me wanna let go
that shit made me wanna let go
that shit made me wanna let go
that shit made me wanna let go
that shit made me wanna let go
that shit made me wanna let go
that shit made me wanna let go
that shit made me wanna let gosee a boogie wit da hoodie liveget tickets as low as 35you might also like1embed"
