id,song_name,artist_names,album_name,lyrics
3eQT5BfKPyu63e3gso55oo,Get Away,"Rick Ross, Mario Winans",42T8qfRs7jdpInsSk6nDJk,"7 contributorsget away lyricsintro mario winans  rick ross
uh uh
yeah its fly
its rick ross
its that la reid flow right here
mario winans
holla hold up

verse 1 rick ross
sometimes i rhyme slow
sometimes i rhyme quick
sometimes i buy blow
so i supply bricks ross
motherfuckers lookin at me sideways
but can they tell im gettin money five ways
lot of leather wood and the seats vibrate
chattin with a bitch like your boy on myspace
but she right here in my face
take her to a fly place with a fly fireplace
no marshmallows we let the dro burn
i done seen the world girl its your turn
i told you lies all my life
but you hold me down wrong or right
so its only right she get that porsche truck
all black black rims call her porscha
let your weave blow in the wind
cause believe ever dboy need a friend
see rick ross liveget tickets as low as 117you might also likechorus mario winans
when can we get away and enjoy each other
get away and explore each other
all i wanna know is
when can we get away and exchange our feelings
keep it poppin like a move screenin
i only wanna get away

verse 2 rick ross
im in heavy dough i dont kiss every hoe
so when i like a bitch i enlist mario
feed her larryos sip everglo
with gloria estefan and emillio
baby really though this your best bet ross
it will be six os in my next check ross
with a gun in hand ive also been a money man
crack runnin man fat randall cunningham
look here imma tell you like this
we need time to just kick it like this
she lickin my lips she diggin my kicks
so we did it like this
its rick ross im the man of the hour
she love to make love and we can in the shower
back against the wall imma stand like a tower
every time imma stand like a tower
chorus mario winans
when can we get away and enjoy each other
get away and explore each other
all i wanna know is
when can we get away and exchange our feelings
keep it poppin like a move screenin
i only wanna get away

verse 3 rick ross
sometimes i rhyme slow
sometimes i rhyme quick
sometimes i buy blow
so i supply bricks ross
you cant look me in the face
when you wrong imma put you in your place
my money long i got money just to waste girl
my money home and its up to my waist girl
i really love how you shake girl
you like a phantom i love how you shake girl
rick ross im a real nigga
you can feel the realness when i deal with ya
baby i wont lie to ya
im too honest i promise i wont lie to ya
that other bitch finished with
you the one im havin dinner with
and its candlelit
can you handle it
cause i can handle it
well lets handle this
chorus mario winans
when can we get away and enjoy each other
get away and explore each other
all i wanna know is
when can we get away and exchange our feelings
keep it poppin like a move screenin
i only wanna get away

bridge mario winans
when can we
oh you dont have to be alone no not anymore
baby when can we
ill take you anywhere you wanna go baby
all you have to do is say yes to me
say yes to me oh
say yes to me baby
say yes to me girl
say yes to me oh
say yes to me baby
say yes to me girl
and ill do anything anything for you3embed"
