id,song_name,artist_names,album_name,lyrics
2KKYlJFyJ8Ozxj7FABxKEg,La Medecina,Joan Sebastian,2xCw6KdAxnF1OBvsrLbKDM,"1 contributorla medecina lyricsunos le dicen huapango
otros le dicen chilena
yo le llamo el remedito
pa olvidarme de las penas

los besos de las trompudas
los brazos de las morenas
los ojitos de las gueras
que medecina tan guena

hoy les cuento las razones
para ser tan presumido
yo soy como la gallina
mucho huevos en el nido

pero mi abuela me dijo
no fuera a meter la pata
más si de lazar se trata
soy la punta de la riata

que mala pata destindió
si sembraba no llovía
y si llovía granizaba
granizaba noche y día

y cuando la papa se acaba
la pinche tienda no fia
ese si es grave problema
eso es serio no se ria
you might also likemás les cuento mis motivos
para vivir tan contento
yo nací con mucha suerte
pues me paresco al jumento

con las orejotas grandes
y chiquito el instrumento
pero le saco partido
yo le pongo sentimiento

por algo será mi apodo
me dicen dulce tormento

parece merequetengue
y en venezuela joropo
yo no se de ritmos
no se mucho yo se poco

y no es por hacerle al listo
y no es por hacerle al loco
pero se que a las mujeres
les gusta se se las toco

unos le dicen huapangoembed"
