id,song_name,artist_names,album_name,lyrics
5fbHRCsGpFIOLRtlhCRFDR,LEMONHEAD (feat. 42 Dugg),"Tyler, The Creator, 42 Dugg",45ba6QAtNrdv6Ke4MFOKk9,"2 contributorstranslationsenglishitalianoespañolsvenskatyler the creator  lemonhead ft 42 dugg tradução em português lyricstradução da música lemonhead de tyler the creator por genius brasil traduções

introdução tyler the creator  dj drama
vocês sabem qual que é
você diz você diz pandemia yeah
oh você quer ver uma pandemia bunnyhop
eles deveriam remover a gente do jogo
eu não inclino
essa merda fica louca
eu não inclino
gangsta grillz yeah

verso 1 tyler the creator dj drama  42dugg
eu não inclino mas minha casa sim
da colina com a vista má yeah
casa boa se você olhar
você consegue ver umas águias e alguns iates
tenho um colega de quarto ele não se muda
se você quer fumaça ele é o oponente
e ele fura coisas tá com a ferramenta pra fora
é a gangue wolf zoológico do brooklyn ahahah ahahah ahah
negro wutang você é mastigado
quando a gente woohah isso é flipmode
e eles sabe que você é buceta tipo ducha
vadia eu sou cuco e a boca dele tá molhada cuco cuco
agora ele é uma piscina antes mergulhava no palco agora eles processam
eu era muito quente cachoeiras de tlc no meu peito me ajudam a esfriar ah
tenho muitos carros a merda de um kart yeah
eles tão pegando poeira querendo fazer uma barraca yeah
apaixonado pelos cabeçasdelimão parecendo com bart
fique com seu patek eu gasto isso em arte gasto isso em arte negro
quanto isso custa merda eu não sei nah
mas eu sei que aquele palco faz um milhão por show fatos reais
preso nos meus caminhos eles dizem como
primeiro negro a colocar um suporte de bicicleta no rolls t fode comigo
you might also likeverso 2 42 dugg  dj drama
um negro jovem e bêbado eu tenho fodido essas putas
aparência de vinte eu entendo eu vou estou aqui
rich diz pro mundo vem me ver de perto
eu não estou curtindo com os manos negro livre meus irmãos trez
eu não tenho cofre e eles me veem brilhando vadia huh
continuo fodendo estou buscando patético
oitenta por uma grama lembreos ayy ayy ayy
patek de dois tons nessa porra cacete ayy puta
dez putas más negro olha praquela vadia olha praquilo
continuo vendendo droga eu estou cozinhando aquela merda cara real merda de cachorro
meu casaco tipo seis mil olha merda de cachorro
mais de cem yeah yeah
eu sou de baixo vadia a gente pega o dinheiro
posso dar gorjeta pra uma puta boa mas dai ela não vai ganhar nada
carro faz skrrt segura ha muito bom liga isso aí
negro você teve sorte skrrt
todo esse papel eu posso apostar que ela fode
eu não estou fazendo conversa eu não estou fazendo salvação não não não
peguei ela de um patético eu pego a vadia dele de volta aqui
sabe que eu não sou louco negros continuam alças de sacola
tipo vai vadia só cospe em algo
cara o meu deus lembra do lil
sim ele caiu calma fui fomos
vadia
outro tyler the creator  frank ocean
liga pra mim
meu irmão é
se você se perder
passando os dedos na tigela ddo ai weiwei ai veivei
liga pra mim
eu tenho essa merda sentando na meu balcão tipo uma tigela de frutas isso é tipo cem prateleiras
se você se perder
eu gosto da cor verde em todos os tons
se você se perder
eu gosto da vida
liga pra mim
minha tipo minha vida
se você se perder
não morde vocês amam roubarembed"
