id,song_name,artist_names,album_name,lyrics
3eUOJD4ZWLofc2FrIK6HSd,Look At Me,Alan Jackson,26w8J2SKCxa80Bwq6G8ctN,"3 contributorslook at me lyricsi would bet my life like i bet my heart
that you were the one baby
ive never been so sure of anything before
its driving my heart crazy
i cant hold out i cant hold back now
like ive done before

darlin look at me ive fallen like a fool for you
and darlin cant you see id do anything you want me to
i tell myself im in too deep
then i fall a little farther
every time you look at me

how do you do that girl
make me feel like im the only man alive for you
i guess thats what it is that makes me fall like this
the first time in your arms i knew
the way you held me it overwhelmed me
i went out of my mind

darlin look at me ive fallen like a fool for you
and darlin cant you see id do anything you want me to
i tell myself im in too deep
then i fall a little farther
every time you look at mesee alan jackson liveget tickets as low as 22you might also likeembed"
