id,song_name,artist_names,album_name,lyrics
3CA9pLiwRIGtUBiMjbZmRw,Nice For What,Drake,1ATL5GLyefJaxhQzSPVrLX,"280 contributorstranslationstürkçeespañolportuguêsnice for what lyricsintro big freedia  lauryn hill
i wanna know who mothafuckin representin in here tonight
hold on hold on
i keep lettin you back in you back in
how can i explain myself

chorus lauryn hill  drake
care for me care for me you said youd care for me
there for me there for me said youd be there for me
lil weezyana shit
cry for me cry for me you said youd die for me
murda on the beat
give to me give to me why wont you live for me
care for me care for me i know you care for me
a song for yall to cut up to you know
there for me there for me said youd be there for me yeah
cry for me cry for me you said youd die for me
give to me give to me why wont you live for me

verse 1 drake
everybody get your mothafuckin roll on
i know shorty and she doesnt want no slow song
had a man last year life goes on
havent let that thing loose girl in so long
youve been inside know you like to lay low
ive been peepin what you bringin to the table
workin hard girl everything paid for
firstlast phone bill car note cable
with your phone out gotta hit them angles
with your phone out snappin like you fabo
and you showin off but its alright
and you showin off but its alright alright
its a short life yeah
see drake liveget tickets as low as 90you might also likechorus lauryn hill
care for me care for me you said youd care for me
there for me there for me said youd be there for me
cry for me cry for me you said youd die for me
give to me give to me why wont you live for me

refrain drake
thats a real one in your reflection
without a follow without a mention
you really pipin up on these niggas
you gotta be nice for what to these niggas

verse 2 drake
i understand you got a hunnid bands
you got a baby benz you got some bad friends
high school pics you was even bad then
you aint stressin off no lover in the past tense
you already had them
work at 8 am finish round five
hoes talk down you dont see em outside
yeah they dont really be the same offline
you know dark days you know hard times
doin overtime for the last month
saturday call the girls get em gassed up
gotta hit the club gotta make that ass jump
gotta hit the club like you hit them mothafuckin angles
with your phone out snappin like you fabo
and you showin off but its alright
and you showin off but its alright alright
its a short life
bridge big freedia  letitia wright
uhhuh oh yeah
these hoes they mad
your boy i had
i made watch the breakdown

chorus lauryn hill
care for me care for me you said youd care for me
there for me there for me said youd be there for me
cry for me cry for me you said youd die for me
give to me give to me why wont you live for me

breakdown drake
gotta make that jump gotta make that gotta gotta make that
gotta make that jump gotta make that gotta gotta make that
gotta gotta gotta gggotta gggotta gotta
gotta gggotta gotta gotta make that jump jump lets go
bend it over lift it up bend it over lift it up
make that jump jump
bend it over lift it up bend it over lift it up
make that jump jump
bend it over over over over over lift it up
make that jump jump
bend it over lift it up make that jump jump
bend it over lift it up make that jump jump
refrain drake
thats a real one in your reflection
without a follow without a mention
you really pipin up on these niggas
you gotta be nice for what to these niggas
i understand

chorus lauryn hill
care for me care for me you said youd care for me
there for me there for me said youd be there for me
give to me give to me why wont you live for me
cry for me cry for me you said youd cry for me

outro drake  lauryn hill
gotta hit the club like you hit them hit them hit them angles
blaqnmild you a genius you diggin me
its a short life yeah
cry for me cry for me you said youd die for me
give to me give to me why wont you live for me160embed"
