id,song_name,artist_names,album_name,lyrics
3vZGtceCbJVh5aDT4XhE0p,2AM,SZA,6FKP2O0oOvZlDkF0gyTjiJ,"62 contributorstranslationsespañolfrançaisportuguês2am lyricspart i 2 am

verse 1
2 am again and im thinkin bout
2 am again and im thinkin should i come through
can i come kick can i come kick with you
2 am again and im thinkin bout
its 2 am and im stuck up thinkin about the
last time you were behind me all in the mirror
i could see everything you would be doin
i could see everything lookin at me like you love me
i know you dont love me
i never care long as i come first you come on time
i reverse you rewind do it again
stuck in time do it again

chorus
all you ever say is come and see me for once
come and see me for once
you dont ever come to me yeah
you dont ever come why you never come
will you ever come
come and see me for once
come and see me for once
why you never come to me no
why you never come to me
why you never come to me no
see sza liveget tickets as low as 143you might also likeverse 2
this my time its your turn
i know youre right
i know it burns to be in love
i know it burns to be another
one of your girls on the side like that
i know your kind how you lie like that
i know youre mine when you bite it like that
i know youre mine when you put it like that
guess you was right when you put it like that
i know now
i get the point i hear you loud and clear
all this time ive been playin your side
i couldve done better shit with my life
and waste no time on you
got to move on cause you got me fucked up
i am confused from this point i dont trust nobody yeah
out of my body blowin my fuse out
devil please cut me loose yeah please cut me loose oh

chorus
come and see me for once
come and see me for once
you dont ever come to me yeah
you dont ever come why you never come
will you ever come
come and see me for once
come and see me for once
why you never come to me no
why you never come to me
why you never come to me no
outro
wait wait wait wait wait wait wait
for you you you you you you
never never too late late late late late late late
fall through through through through
its 2 am its 2 am and im on you you you you
thinkin bout you you again you again
never knew another nigga i want bad as i want you baby
its 2 am and i confess i want you bad as i want you bad as i want you
its 2 am its 2 am again
part ii inside man

verse
i might be thirsty for you
how can you blame me
oh i might be thirsty for you
how can you blame me
oh i might play circus for you
how do you want me
i conjure up that coochie for you
voodoo houdini
and i might be that hoochie for you
do you need me19embed"
