id,song_name,artist_names,album_name,lyrics
6nPkmfARd7hbwae3eB6m8Y,Plan De Vuelo,Alfredo Olivas,5t3QwyKSV5oww8T0eB26mB,"1 contributorplan de vuelo lyricsque me perdone mi gente
ya me le rendí a la vida
mas no reprocho a la muerte

siempre le di bateria
y en su lista me traía
desde hace tiempo pendiente

tampoco estoy enojado
pero hago una observación
ahi le va mi presidente

antes de mandar refuerzos
seleccione bien a su gente

se muy bien que hubo dinero
como siempre de por medio
y es la tentación más grande

pero no les justifico
pagaran por su delito
van a conocer la carcel

solo que de otra manera
ahora será permanente
llegarán para quedarse
viendola bien eso es poco
mejor quiero ver correr sangre

que madrugada tan fría
pero lo que mas lastima
es que no pude despedirme

por un lado mi familia
que era lo que mas quería
y por otro lado mis plebes

lo que si quiero que sepan
que yo puse resistencia
y no quiso ceder la muerte
pero aun sigo con ustedes

me gustaba la artisteada
siempre agarraba la banda
y me ponía a cantar con ellos

jamas me gusto algun vicio
pero el que andaba conmigo
siempre lo traia contento

de eso el equipo es testigo
antes de irse a trabajar
hacia rolar el perico
me distinguí por ser hombre
lo demostre muy a mi estilo

espero que el papalote
siga volando muy alto
como siempre lo mantuve

no se me tiren del barco
que ya casi va llegando
a donde yo ya no pude

ya tengo mi plan de vuelo
y esta vez es diferente
me voy con rumbo distinto

cuidense mucho mujeresembed"
