id,song_name,artist_names,album_name,lyrics
6Q34rDGhBgUK0KlOsnU0Ls,Consistent,Lil Baby,6uhEg4ASZYLIilZFCBFy1r,"29 contributorsconsistent lyricsintro
cook that shit up quay

verse 1
this aint the vibe that i need
stop the beat g5 free
i be spendin racks in these jeans
im too real fuck is yall mean
i aint have to sell you no dream
i said what it was you didnt believe me
you be the cake and i be the cream
now i look up and then she was leaving
im on the way cannot be late
speedin through traffic like im in a race
i wanted it now she want me to wait
im one of a kind so you gotta taste it
granddad died knew i would make it
im a real one you cant fake that
most of my niggas still be takin
i got rich this shit still dont faze me
you only get one call i cant chase em
might take one shot a lil chaser
stayin up now for us to fuck later
mama used to tell me times would get greater
cartier diamonds blockin these haters
dior drip shit gettin tapered
i just spent a bentley truck with lil tatum
favor for favor nigga i dont pay them
get off my dick nigga we dont play them yeah
look like it we dont stay here
makin half a million dollar plays juggs
still chunkin up neighborhoods
grass cut sure the neighbors good
my partners mama know im really hustlin
if the spot hot we invade houses
we got kicked out go in they house yeah
you might also likeprechorus
it was hot and it was dark and i had thought of ending it all
then the sun had came out and i looked up and i seen god
aint gon lie like it was easy its the truth this shit been hard
i done finally got an award yeah

chorus
tired of this car then switch it switch up
tired of my ho new bitch me please
at this point this shit pimpin pimpin
never off be consistent huh
glock twothree extension bahbah
handle the business dont mention
i aint even have a pot to piss in
now i got em mad im turnin livid
tired of this car then switch it switch up
tired of my ho new bitch me please
at this point this shit pimpin pimpin
never off be consistent huh
glock twothree extension bahbah
handle the business dont mention
i aint even have a pot to piss in
now i got em mad im turnin livid

verse 2
my cars come with stars and kits
none of my kids gon starve for shit
you werent even here when i started this
all the drugs i sold all the shit i took
i done seen so much i can write a book
aint stuntin that ho i can buy that look
clothes off how your body look
i been bout business im still a crook
i get in my mode they all be shook
said thats your bro yall all get pushed
you was in the house on punishment
i was in the hood sellin strong ass kush
your cuz came through with that reggie bush
give me style and credit for all his looks
soldout shows in the dmv
now shaquille oneal cant lil boy me
prechorus
had some dirt off in my diamonds had to brush it off
i was posed to be somewhere workin im somewhere fuckin off
i get checks in by the contract like im playin ball
i been hanging round some millionaires its safe to say its rubbin off

chorus
tired of this car then switch it switch up
tired of my ho new bitch me please
at this point this shit pimpin pimpin
never off be consistent huh
glock twothree extension bahbah
handle the business dont mention
i aint even have a pot to piss in
now i got em mad im turnin livid
tired of this car then switch it switch up
tired of my ho new bitch me please
at this point this shit pimpin pimpin
never off be consistent huh
glock twothree extension bahbah
handle the business dont mention
i aint even have a pot to piss in
now i got em mad im turnin livid2embed"
