id,song_name,artist_names,album_name,lyrics
2SUr6GzykCot30GEKdFXKd,No Queda Nada,Los inquietos del vallenato,3q8OdkyrGwVNUgiKTvvCZX,"1 contributornovedades de viernes 060522 lyrics  canciones incompletas 140new music friday latin
eslabon armado  junior h  dos morritas
bad bunny  moscow mule
tini  la triple t
amesty  ovy on the drums  química
jesse  joy  imagina
kany garcía  alejandro sanz  muero
chris andrew wisin  dreah  mató a cupido remix
pailita  nio garcía  yo quiero
christian nodal  vivo en el 6
yendry  kiki
carlos vives  fito páez  babel
rvssian  sfera ebbasta  sola ft myke towers
dylan fuentes  sael  sonrisa falsa
trueno  manifiesto freestyle
natalia lacunza  karma c  todo va a cambiar
fuerza regida  chingas a tu madre
guitarricadelafuente  a carta cabal
francisca valenzuela  dar y dar
rombai  vamo a tomar una
pepe aguilar  hasta que llegue el alba
josé feliciano  la borinqueña
xavi  kilómetros
chucky73  freestyle 73
javiielo  nekxum  mi casi algo
dayvi dj zetian  mc killer  salio pa guarachar
silvestre dangond  monáco  no tenemos la culpa
kaio viana bad gyal  totoy el frío  formosa remix ft mc ceja
sin bandera  nadie
benji gramitos  sayian jimmy  quiere ma
vic mirallas  rqr
bandalos chinos  cállame
flowtiago  que dios me libre
latenightjiggy  úsame
swifty blue  d smoke  preguntas
cariño  si quieres
carolina gaitán  la gaita  bailaito
susana cala  bacilos  paralizante
xina mora  los del control  diavla
iskander  alex cuba  dime si soy yo
ralphy dreamz  se me olvidó otra vez
sofia thompson  sobrino  gotas
lizzy parra  angel brown  cielo
casero  cosas que creo
crooked stilo  ella me da
immasoul  na pa ti ft kofi
grupo diez 4tro  el fantasma
san marcos  dices
yorghaki  aloisio  inigualable
jenn morel  sigue y sigue
café  demos records  despacito
los bosques  rambla sur
carlo laquinta  plan b
motherflowers  qué quieres tú de mí
luana  thyago  pa siempre
feer  el dusty  solo
alec roman  leiva  chera
truzman  sólo hay una vida
reyna  orgullosa
agina  i only have eyes for you
karen lizarazo  francy  mesero
gian varela  steve andreas  veneno ft felicia
omar cruz  gt garza  slidin
rarri blanco  marry me
maahez  tiburón
xcelencia  isla verdenovedades viernes sudamérica
cris mj mendoza  ghetto kids  webcam
mocedades  morat  sobreviviremos
j alvarez  ñengo flow  química
jorge  mateus  todo seu ao vivo
edén muñoz  michelle maciel  no sabía cuánto
eslabon armado  vete a la fregada
haash  serías tú
aqua vs marcianeke  tunechikidd  fondo de bikini ft vishoko  ov black
joão gomes  digo ou não digo
salastkbron  kaleb di masi  patada
charles ans bcn  lefty sm  777
giulia be  fbi
vitão  declaração
sabino  dime tú
criolo  pretos ganhando dinheiro incomoda demais
la vela puerca  andrea echeverri  tormenta
princesa alba  paula cendejas  besitos cuídate remix
bandalos chinos  una propuesta
ventino  mariposas
di ferrero  uma bad uma farra
kapo nath  la gabi  moka
felipe gordon  feeling all over it
motherflowers  anakena  xinchorro
jossman  slow mike  en lo oscurito
los cumbia stars  maría cristina plata  me borrarás
celest  dí que no
lorena blume  muerdo  mi propio lago
pavlo  ¿qué más da acústiconovedades viernes españa
bad bunny  rauw alejandro  party
lérica  la la love you  la teoría
bad bunny  the marías  otro atardecer
fernandocosta  dollar selmouni  oye
el ima  papi suena
cyril kamer  angelina
la pantera  bdp music  miradas rotas
keen levy  30tman  la mentira
marmi  divina
jimena amarillo  belicemanu  pantalones de pana
cariño  año de mierda
lorena santos  amara ignacia  tu recuerdo
pepe vizio  bigla  mala vita
hard gz  antony z  barquito de vela
samueliyo baby  aiman jr  lp
lopes elpatron970  mbs rolling  dealers
cocco lexa  dtbilardo  choque
pepe bernabé  funambulista  8 años
soraya  te quiero a ti
judit neddermann  ainoa buitrago  como un amuleto
kike  manu paulo domínguez  ozarus  conmigo de borrachera
los estanques  anni b sweet  tu pelo de flores
meler  me encanta
rorro  alex granero  estar mal está bien
roy borland  sueño
franvvi  david otero  mar de cristal
rulo y la contrabanda  fito y fitipaldis  aún queda un sitio
rocío márquez bronquio  41v1l  de mí  rumba
luis fercán  iseo  color miel
interrogación amor  el amor está en el aire
el jhota  derrape
tatiana delalvz  luis cortés  yo nací pa amarte
leiti sene iseekarlo  bitcoin
beauty pikete  love yi  tijuana
xeinn  deva  como yo
gomz  muriendo en el cielo
jaime lorente  el chaval
mariagrep  por eso
lbeel  entre las cuerdasnovedades viernes méxico
jvke  leon leiden  this is what falling in love feels like leon leiden remix
belinda  eden
valentina moretti  muévelo
lucho ssj  grr paw
big metra  podrán imitarme
absa g  kenan  kel
reyli barba  una de cri cri
pedro guerra  silvio rodríguez  cuando tú no estás
alaina castillo  sad girls always finish firstnovedades viernes colombia
los inquietos del vallenato  te quiero más
fanny lu  amor de mi vida
kevin roldán  llanogrande
tsh sudaca negro valle  nv produce  más alto
valles t  4312
métricas frías zor beats  doble porcion  aviso parental
bazurto all stars  champecarioca
cantoras de mi tierra  la estrella
agrupación pilón  a mi madre
dayhan díaz  chabuco  esto no es amor
gael morantes  aquí vamos de nuevo
césar pinzón  excesos
tavo botero  cobarde
lika nova  desde que no estás
margarita siempre viva  canto de abrigo
bonus trak  abril
invisibles  no espero nadacanciones sin transcribir  140embed"
