id,song_name,artist_names,album_name,lyrics
0XCjXjAXCntjLob1TCqsRH,963,Timo Krantz,10UxWeXdW1SFpghU3a4On8,"1 contributorthe house 1997 lyricsintro outloud method man
when we in the house
when we when we in the house
i black that eye like peas you better freeze
when we in the house aint no time to act sheisty
i black that eye like peas you better freeze
when we in the house aint no time to act sheisty

verse 1 mr bones
get ready for the informatical lyrical miracle style
i be thе redfaced wonder about to go wild
with rеpresentin my clique my crew that i call my home
untouchable brothers with attitudes so leave us alone
as we roam through your district and town
house of krazees straight puttin it down
for all of yall motherfuckers from here to outer space
remember a rhyme is a terrible thing to waste
and based on the topic we had to drop it
to put some new shit on the shelf and get a little loot in our pocket
and rock it dont stop it you gotta let the rhythm keep it on
kickin the crazy lyrics til the biggy break of dawn
exterminatin rappers like the organ man
cause yall dont really know and i bet youd never understand
what we went through to get what we got
a lot of blood sweat and tears and loot went into the meltin pot
but now we got a little somethin but its not enough
and we wont stop bringin the lyrics til the whole world know whats up
the dirty trio drop bombs dont ask why
representin the house til the day we fuckin die right
you might also likechorus
when we in the house bitches best 
when we in the house bitches best 
when we in the house bitches best 
show me three niggas thats deafer
when we in the house bitches best 
when we in the house bitches best 
when we in the house bitches best 
show me three niggas thats deafer

verse 2 hektic
let me flex it no questions as you know who the best is
testes to grab for days watch me on amaze
it aint no thang cause you know how the fuck we do it
leavin you stranded with one chance too late you blew it
i gots to flow with a fistful onslaught droppin you down
not good for nothin but rockin the crowd now how this sound
its all bad but me and my fellas roam my home sweet home
now who you gon call the police on
its like a threeman punch you can smoke all the weed
drink til you drunk but dont fuck with the dirty bunch
ill eat your ass lunch without a second thought
or have you on my dick you and all the hoes you brought
so stay the fuck out of my mix many turns and flips
relax and chill packin sawedoffs with pistol grips
everybody know who i is stay outta my biz
trustin no one leavin no ties to my exfriends
so many people actin scurvy and all that
off of instinct i react whats up with that
a chokehold is applied when the lyrics ride
step up inside and you leavin with a black eye
chorus
when we in the house bitches best 
when we in the house bitches best 
when we in the house bitches best 
show me three niggas thats deafer
when we in the house bitches best 
when we in the house bitches best 
when we in the house bitches best 
show show me three niggas thats deafer

verse 3 the roc
sucker i blacked out one time back in 93
some motherfuckers tried to do me
but i came back with the outbreed to fuck the world up
dont ask if its tough as leather whats up
a pow a bang i got em i shot em
i globetrot em and dunk emcees like mic i drop em
emcees get destroyed as 
to fuck up the whole scene kit and caboodle
 i cruise down niggas starin
but they cant see the roc as i flees and seize
attention whats your extension i wanna get to know ya
my duty as the male race is to ho ya
cause hoes should be hod ladies should be kept
niggas should get death for even tryin to step i bet
because the roc creeps like a snake
and then i rattles and rolls and shakes up the industry
your deeds and missions couldnt even compare
my black hair hittin in the midnight i takes flight
with the house i drop the crazy so act like you know
the mental skill might go hazy if you try to loc
chorus
when we in the house bitches best 
when we in the house bitches best 
when we in the house bitches best 
show me three nig show show me three niggas thats
when we in the house bitches best 
when we in the house bitches best 
when we in the house bitches best 
show show me three niggas thats show me three niggas thats
when we in the house bitches best 
when we when we in the house bitches best 
when we when we in the house bitches best 
show me three niggas thats deaferembed"
