id,song_name,artist_names,album_name,lyrics
6WMqBpW8oKyTRE0GSOyyAa,Party On Fifth Ave.,Mac Miller,17mAoDs7T8EA9zzlj6QPBv,"39 contributorsparty on fifth ave lyricsproduced by id labs

intro
yeah hahahahahahahaha
i think— i think i see where youre goin with this one e

verse 1
hey hey
been around the world and back yeah i did that
still kick raps that cause impact so where my kids at
these mufuckers hatin soundin funnier than sinbad
im ill as the pills that they give you when you collapse
this that the other kiss your mother with that mouth
we the assholes that she warned you about
we just storm in your house open doors through a cloud
got an assortment of style just be sure that its wild
630 in the mornin and there still aint signs of slowin down
twin sisters gettin wasted so they both are down
its goin down i thought i told you man
if you tryna party let me see you raise your hand

chorus
theres a party on fifth ave party on fifth ave
hit me if you tryna go hit me if you tryna go
i can be there in like twenty ima honk it and come runnin
cause we gotta hit the road we gotta hit the road
make you sure you got a clean shirt clean pants new shoes new shoes
or just hitch a ride there you choose you choose
theres a party on fifth ave tonight
and thats what im tryin to do
you might also likeverse 2
hey whats the difference tween me and you
when no one believe in you im flyer than beetlejuice
dont count on the sheep to snooze im fucked up off weed and booze
i party then sleep til noon what every day people do
so haters see me improve just give me a week or two
see when you read the news my bitches all sleepin nude
my rhyme talent is why my album is fly
your favorite record you gon put it aside
this that old school shit soundin good in the ride
and fuck ten im only countin to nine
said this that old school shit soundin good in the ride
so lets head out to the party ill drive

chorus
theres a party on fifth ave party on fifth ave
hit me if you tryna go hit me if you tryna go
i can be there in like twenty ima honk it and come runnin
cause we gotta hit the road we gotta hit the road
make you sure you got a clean shirt clean pants new shoes new shoes
or just hitch a ride there you choose you choose
theres a party on fifth ave tonight
and thats what im tryin to do

bridge
whats goin on theres a party
hope the neighbors dont mind us gettin loud
homies to the left all the ladies to the right
we came to get down we gon do that now
my light up shoes on my light up shoes on my light up shoes on
they love the way my kicks flash
this aint a time to just sit back
cause theres a party on fifth ave
chorus
theres a party on fifth ave party on fifth ave
hit me if you tryna go hit me if you tryna go
i can be there in like twenty ima honk it and come runnin
cause we gotta hit the road we gotta hit the road
make you sure you got a clean shirt clean pants new shoes new shoes
or just hitch a ride there you choose you choose
theres a party on fifth ave tonight
and thats what im tryin to do7embed"
