id,song_name,artist_names,album_name,lyrics
3f3uxQEvj2dE6WmgvAr91V,U Don't Want Dat (feat. Lil Jon),"Petey Pablo, Lil Jon",2R7G5Z0RWWZU1V731JZG68,"14 contributorsjune 2019 singles release calendar lyrics61
jai paul  do you love her now
jai paul  he
molly brazy  lil booties matter
62
ion lil gut  arriba
ion lil gut  dopeboy
kesha  rich white straight men
63
bon iver  hey ma
bon iver  u man like
booka600  ok ok ok ft king von lil durk
city and colour  astronaut
joey trap  uberr
kap g  carlos slim
key glock  spazzing out
the black eyed peas  be nice ft snoop dogg
wale  daylight
64
aj tracey  ladbroke grove remix ft da general  novelist
bastille  those nights
camelphat  be someone ft jake bugg
casey veggies  stop playin ft dom kennedy
gnar  death note ft craig xen  lil skies
ozuna  amor genuino
65
bas  fried rice ft jid
chantel jeffries  chase the summer ft jeremih
chris stapleton  the ballad of the lonesome cowboy
gashi  roses
kembe x  raised a fool ft zacari absoul  jay rock
kim petras  clarity
madeintyo  look at the kid
róisín murphy  incapable
tyga  haute ft j balvin  chris brown

66
b young uk  gucci demon
cute girls doing cute things  friends
french montana  slide remix ft wiz khalifa blueface  lil tjay
goldlink  u say ft tyler the creator  jay prince
gta  fk it
jumex  alive in my coffin
lost frequencies  truth never lies ft aloe blacc
ocean alley  infinity
oliver tree  miracle man
ozuna  te soñé de nuevo
russ  paranoid
sob x rbe  rich
67
afrojack  it goes like
andy grammer  my own hero
big krit  krit here
bts  charli xcx  dream glow
call me karizma  rebels
christian rich  shibuya ghost ii ft jaden vic mensa  belly
christina grimmie  hold your head up
city morgue  66slavs
devvon terrell  replay
djds  dijon  magic loop
dominic fike  açaí bowl
dominic fike  rollerblades
ed sheeran  justin bieber  i don’t care jonas blue remix
fetty wap  birthday ft monty
gia woods  feel it
guapdad 4000  flossin
jean deaux  anytime ft romderful  kehlani
jon bellion  blu acoustic
jon bellion  conversations with my wife acoustic
jon bellion  stupid deep acoustic
justin jesso  nina nesbitt  let it be me
kflay  sister
kash doll  kitten ft lil wayne
kiiara  open my mouth
labrinth  miracle
left boy  corner store ft ferdinand
lil baby  out the mud
lil mosey chris brown  g walk
lost kings  too far gone ft anna clendening
liam gallagher  shockwave
luke christopher  champagne rain
mabel  mad love
machine gun kelly yungblud  travis barker  i think i’m okay
madonna  dark ballet
muna  number one fan
peg parnevik  27 sorries
pharrell williams  letter to my godfather from the black godfather
prince royce  manuel turizo  cúrame
rockit gaming  glitchtrap
roddy ricch  out tha mud
sabrina carpenter  in my bed
shy martin  same old
the underachievers  wasteman
tydi  matt fax  its always now
twin tides  risk it all
wifisfuneral  no trust
wildheart  seein it through
68
chris brown  no guidance ft drake
joey trap  trex freestyle
lil yachty  go krazy go stupid freestyle
69
yung nugget shotgun willy  yung craka  she took the kids
610
chasethemoney  on tha way
files j  burn the frames
kelsea ballerini  better luck next time
wale  gemini 2 sides
611
baby keem  invented it
banks  look what youre doing to me ft francis and the lights
finneas  angel
joey trap  “gotta go”
lil jon  ain’t no tellin’ ft mac dre
marc e bassy  save me
612
craig xen  xxxtentacion  run it back
don toliver  situation
dreamville  down bad ft earthgang j cole bas jid young nudy
dreamville  got me ft ari lennox ty dolla ign omen dreezy
files j  blood moon shines
flume  let you know ft london grammar
free nationals kali uchis  mac miller  time
jay critch  adlibs pt 2
montaigne  ready
shura  religion u can lay your hands on me
tobi lou  waterboy
unlike pluto   night light
613
alec benjamin  must have been the wind
anthony russo  pink slip  more than you know
big heath  pablo
bob  ol’ dirty bastard
dermot kennedy  outnumbered
dope lemon  salt  pepper
files j  over the palmtree
joey trap  nets
kim petras  personal hell
krept  konan  ban drill
lili trifilio  cycles
mo  aj tracey  choose sides
maleek berry  flashy
nafe smallz  good love ft tory lanez
simple creature  special
sscarlxrd  gxing the distance
yo trane  moonlight
614
alesso  sad song ft tini
alex aiono  unloving you
arc north  limbo ft veronica bravo
benny the butcher  18 wheeler ft pusha t
bazzi  focus ft 21 savage
blueface  daddy ft rich the kid
burna boy  anybody
cade  home to you ft desiigner
common  her love ft daniel caesar
danny jones  bad habits
dj snake  j balvin  loco contigo ft tyga
drax project  all this time
francis and the lights  do u need love
freddie gibbs  madlib  giannis ft anderson paak
galantis  yellow claw  we can get high
gucci mane  backwards ft meek mill
icy narco  hypocrites
joji  sanctuary
kamaiyah  windows ft tyga  quavo
kaskade  meghan trainor  with you
key  fall hard
lil keyu  buhsit
lil pete  toast
little big  im ok
little mix  bounce back
lykke li  sex money feelings die remix ft lil baby  snowsa
marshmello  rescue me ft a day to remember
matoma  bruised not broken ft kiana ledé  mnek
nle choppa  free youngboy
ozuna  anuel aa  cambio
soleima  stfu
stephen puth  look away
taylor swift  you need to calm down
the hails  nothing
tokyos revenge  goodmorningtokyo
trouble  she a winner ft city girls
vic mensa  93punx  camp america
wax  rare specimen
yung pinch  perfect
zack fox  jesus is the one i got depression
615
fredo bang  why
joey trap  mcm
joey trap  on time
joey trap  timex
617
mark ronson  pieces of us ft king princess
wale  09 folarin
ybn cordae  bad idea ft chance the rapper

618
a r i z o n a  nostalgic
big gigantic  you’re the one ft nevve
e40  chase the money ft quavo roddy ricch aap ferg schoolboy q
iann dior  what is real
jonas brothers  greenlight from ”songland”
michael kiwanuka  money ft tom misch
miraa may  angles ft jme
sabrina claudio  wale  all my love
sleeping with sirens  leave it all behind
sum 41  never there
yungeen ace  society
619
atliens  eddie  closer
austin mahone  dancing with nobody
chloe x halle  thinkin’ bout me
chloe x halle  who knew
cuco  feelings
dj luian  mambo kingz  tú no amas ft anuel aa arcángel  karol g
gucci mane  proud of you
kim petras  another one
major lazer  anitta  make it hot
poppy  choke
stefflon don  lil baby  phone down
unlike pluto  everything about nothing
trina  baps ft nicki minaj

620
88keys  that’s life ft sia  mac miller
digga d  mr sheeen ft russ msplash
imagine dragons  birds remix ft elisa
lil nas x  panini
lupe fiasco  run game
maj  tesla
migos  stripper bowl
nle choppa  shotta flow remix ft blueface
yellow days  just when
621
alex sensation anitta  luis fonsi  pa lante
alma  lonely night
astrid s  the first one acoustic
bea miller  feel something
​blackbear  tiny meat gang​​  short kings anthem
blink182  generational divide
bts  juice wrld  all night
cassie  moments
chris brown  heat ft gunna
city and colour  strangers
clara mae  loved you once demo
cole swindell  drinkin’ hours
daya  left me yet
florian picasso  but us
duwap kaine  my voice
foster the people  imagination
georgia ku  what do i do
goo goo dolls  miracle pill
grace carter  wicked game
hanne mjøen  strangers
hoodie allen  christian french  come around
ilkay sencan  dynoro  rockstar
j alvarez  me da lo mismo ft el alfa
jordyn jones  cut em off
kat dahlia  i’m doin good
khao  unified ft nipsey hussle snoop dogg the game e40 icet mozzy problem  g perico
labrinth  mount everest
lauren cimorelli  pressure
lil baby  out the mud ft future
marshmello  kane brown  one thing right
murda beatz  shopping spree ft sheck wes  lil pump
must die  epiphany rush
nicki minaj  megatron
parson james  minute
pia mia  crybaby ft theron theron
quinn xcii  stacy
rebecca black  do you
redfield  don’t worry axwell cut
rence  expensive ft noah cyrus
rick ross  act a fool ft wale
rob gz  lhna ft anuel aa
rudimental  the martinez brothers  sitigawana ft faith mussa
the game  west side
the kooks  so good looking
the knocks  awa ni ft kahlo
thouxanbanfauni  reunion ft lil yachty
tm88  slayerr ft lil uzi vert
​twenty one pilots  chlorine 194326° n 991332° w
sebastián yatra daddy yankee  natti natasha  runaway ft jonas brothers
shawn mendes  camilla cabello  señorita
stormzy  crown
thouxanbanfauni  reunion ft lil yachty
troyboi  warlordz ft skrillex
walk the moon  eat your heart out
wax  push on
wifisfuneral  eggs
yk osiris  freaky dancer ft dababy
zara larsson  all the time
622
dagames  we want out feat jt music dan bull bslick  inutrash
supreme patty  telenovela
624
aap ferg  wigs ft antha  city girls
big krit  addiction ft saweetie  lil wayne
danity kane  neøn lights
natasha bedingfield  unwritten 2019 remix
625
aidan alexander  guts
chris brown  don’t check on me ft ink  justin bieber
her  racks ft ybn cordae
jessie reyez  6lack  imported spanglish version
joell ortiz  learn you ft big krit
maliibu miitch  celine
meghan trainor  hurt me
rich brian  yellow ft bēkon
twista  summer 96 intro
ye ali  my way
zenaware  cutie ft emanixo

626
adam lambert  comin in hot
alexander cardinale  simple things ft christina perri
bhad bhabie  get like me ft nle choppa
conan gray  checkmate
ed sheeran  justin bieber  i don’t care chronixx  koffee remix
ellie goulding  juice wrld  hate me
njomza  no one is spared
​serpentwithfeet  receipts ft ty dolla ign
the drums  try
unlike pluto  a million voices
wifisfuneral  wya pt 2
627
a r i z o n a  nostalgic filous remix
clairo  closer to you
fat joe dre  lil wayne  pullin
jaebanzz  u mad
liam gallagher  the river
marshmello  flux pavilion  room to fall ft elohim
neck deep  she’s a god
nf  when i grow up
skizzy mars  calabasas
the plug  not today ft tory lanez  dappy
unknown t  leave dat trap ft aj tracey

628
alexandra stan  i think i love it
andy grammer – some girl
benny benassi  lonely nights ft lil yachty
​bonnie mckee  august 08  lovely
boy pablo  never cared ft jimi somewhere
carly rae jepsen – no drug like me mansionair remix
carnage geazy  wiz khalifa  wait for me
céline dion  flying on my own
charli xcx  blame it on your love seeb  kid joki remix ft lizzo
conor maynard  hate how much i love you
daddy yankee  wisin  yandel  si supieras
digital farm animals  aj mitchell  without you now
dj snake  sheck wes  enzo malaa remix ft offset 21 savage  gucci mane
ed sheeran  beautiful people ft khalid
felix jaehn  love on myself ft calum scott
fitz and the tantrums  all the feels
george maple  magic woman
grace vanderwaal  ur so beautiful
hodgy  no brainer
iggy azalea  just wanna
jaira burns  goddess
johntá austin  love angel
joyner lucas  broke and stupid
juicy j  three point stance ft megan thee stallion  city girls
jxn  going off ft aap twelvyy
kflay  not in california
kevin gates  push it
kygo  whitney houston  higher love
lais  spaceships ft a4
martin garrix  summer days botnek remix ft macklemore  patrick stump of fall out boy
pnk  can we pretend sigala remix ft cash cash
parson james wrabel  vincint  oh love
pouya  city morgue  bulletproof shower cap
rich forever music  party bus ft famous dex jay critch  rich the kid
ruth lorenzo  underworld
sasha sloan  dancing with your ghost
steve void  ain’t got you ft louisa
tatarka  au
tom francis  what they on
tori kelly  sorry would go a long way
unperfect  i’m a dreamer
​valerie broussard  actually
violet days  all i know
wax  good feeling
wax  i got it ft jarv
why don’t we  come to brazil
young ma  big
yuna  little simz  pink youth
yves v  we got that cool ft afrojack  icona pop

629
lilmar  juicy coochie
630
labrinth  all for usembed"
