id,song_name,artist_names,album_name,lyrics
4n4BflhWjCHIxrI4v7Xt9s,How Bout Now,Drake,7dqpveMVcWgbzqYrOdkFTD,"197 contributorshow bout now lyricsintro
thats the shit im talking bout though like you changed up you dont even fuckin link nobody no more you just dash me away like a cyattie yo you cheesed me dog

verse 1
always felt like my vision been bigger than the bigger picture
crazy how you gotta wait until its dark out to see who really with you
crazy how even when it miss you
shitll come back around and get you
crazy like all my niggas crazy like all my niggas
remember i deleted all my other girls numbers out the phone for you
remember when you had to take the bar exam
i drove in the snow for you yeah
you probably dont remember half the shit a nigga did for you yeah

chorus
yeah you aint really fuck with me way back then
but how bout now now
cause im up right now im up right now
and you stuck right now stuck right now
oh you thought you had it all figured out back then
but how bout now now
cause im up right now im up right now
and you stuck right now yeah stuck right now
you thought the little effort that you put in was enough girl
how bout now yeah
girl how bout now how bout now girl
what about now girl how bout now
see drake liveget tickets as low as 90you might also likeinterlude
my heart belongs to you

verse 2
yeah always been daddys little angel
i bought your dad a bunch of shit for christmas
he aint even say thank you
i had no money left from actin i was focused on the music
i used to always try and burn you cds of my new shit
you be like whos this i be like me girl
you be like oh word true shit
then ask if we could listen to ludacris
them car rides made me feel like i was losin it
yeah made me feel i aint have it like that
or i was average like that
started drinkin way more than i used to
people form habits like that girl
yeah man enough to tell you i was hurt that year
im not even christian i still went to church that year
guess i just had to pretend that year
i aint even see my friends that year
places that i shouldve been

chorus
yeah you aint really fuck with me way back then
but how bout now now
cause im up right now im up right now
and you stuck right now stuck right now
oh you thought you had it all figured out back then
girl how bout now now
cause im up right now im up right now
and you stuck right now yeah stuck right now
you thought the little effort that you put in was enough girl
how bout now yeah
girl how bout now how bout now girl
what about now girl how bout now
outro
my heart belongs to you
whatever you need theres nothin i wont do
whatever you need theres nothin i wont do
whatever you need theres nothin i wont do
whatever you need theres nothin i wont do14kembed"
