id,song_name,artist_names,album_name,lyrics
64PbFJPdRoMi87VJJk2NFI,Intro,Chris Brown,49gaz5rhWWgqCw61M9700v,"4 contributorsintro lyricsintro
yeah whod thought that this little dude right here
chris brown prissy boy from tappahannock virginia haha ha
i aint think this voice would get me this far
god pulled a fast one haha
va this ones for yall baby
all my dudes in etown stay up
and for my team mark pitts tina davis
ah ah ahah ahahah
mom dad ima make yall proud
aight we hereyou might also like13embed"
