id,song_name,artist_names,album_name,lyrics
6tyNlDonoU3GnU6fqnjCWD,Sucedio en el Aguaje,"Los Cadetes De Linares, Lupe Tijerina y Rosendo Cantu",1y9lJbemJO1OdyIQvcL1q4,"1 contributorsucedio en el aguaje lyricsque bonito que hermoso caballo
te lo compro delfino mendoza
nececita en su lomo un gallo
con agallas entre muchas cosas
te lo cambio cenovio montero
por lo que amas bonito en la vida
las cabrias tambien el lucero
de coleada el tesoro de villa
dejaremos que hablen nuestras armas
y tu escoge el terreno y la hora
si hace tiempo nos tenemos ganas
poes que suene la vieja tamboraa
me parece cenovio montero
que el aguaje a la 6 de la tarde
si te mato me caso de nuevo
con tu vuida que habra de adorarme
ella nuunca en la vida te quiso
me escogio porque yo soi mas hombre
sabes bien que la miel no se hizo
pa los burros por ser orejones
a las 6 de la tarde cayeron
al aguaje dos cuerpos sangrandes
por rencillas mui viejas murieron
y el aguaje se ha ido secandoyou might also likeembed"
