id,song_name,artist_names,album_name,lyrics
2ACOWPLUe4A4KuQ5ioD2od,That's My Girl,Fifth Harmony,0pF0oyuPNdOObniB1Ng0kW,"82 contributorstranslationsespañolthat’s my girl lyricsintro camila
thats my girl

verse 1 ally ally  camila
yeah whos been working so damn hard
you got that head on overload
got yourself this flawless body
achin now from head to toe

refrain normani ally dinah  all
aint nothin aint nothin ooh ah
all my ladies round the world
aint nothin aint nothin ooh ah
good girls better get bad

prechorus lauren  camila
youve been down before
youve been hurt before
you got up before
youll be good to go good to go

chorus normani  lauren
destiny said it you got to get up and get it
get mad independent and dont you ever forget it
got some dirt on your shoulder then let me brush it off for ya
if youre feeling me put your five high
thats my girl
you might also likepostchorus all ally camila  lauren
thats my girl
thats my girl
thats my girl get up
what you waitin for
thats my girl
thats my girl thats my girl
thats my girl my girl

interlude camila
thats my girl
yeah

verse 2 dinah dinah  camila
nod if you been played by every boo
just tryna show you off yeah
thought he was the best you ever had
until he cut you off

refrain normani ally dinah  all
aint nothin aint nothin ooh ah
bet you bet you know your worth
aint nothin aint nothin ooh ah
good girls better get bad

prechorus lauren  camila dinah
youve been down before oh
youve been hurt before oh
you got up before
youll be good to go good to go
chorus normani camila  lauren
destiny said it you got to get up and get it get up and get it
get mad independent and dont you ever forget it dont you ever forget it
got some dirt on your shoulder then let me brush it off for ya
if youre feeling me put your five high if youre feeling me put your five high
thats my girl thats my girl

postchorus all  camila
thats my girl
thats my girl
thats my girl
what you wa— what you wa— what you waitin for for for
thats my girl for for woah
thats my girl for for thats my girl
thats my girl girl

prechorus lauren  camila
youve been down before
youve been hurt before
you got up before
youll be good to go good to go
baby get up no no oh

chorus dinah  lauren camila dinah  ally dinah
destiny said it you got to get up and get it
get mad independent and dont you ever forget it dont you ever forget it
got some dirt on your shoulder then let me brush it off for ya
if youre feeling me put your five high
thats my girl woah woah
postchorus all camila lauren  dinah
thats my girl
thats my girl thats my girl
thats my girl
what you wa— what you wa— what you waitin for for for
thats my girl for for
thats my girl for for
thats my girl
thats my girl thats my girl thats my girl

bridge normani lauren  camila
aint nothin aint nothin
aint nothin put your heart and your soul in it
aint nothin aint nothin aint nothin
aint nothin put your heart and your soul in it yeah yeah

postbridge all  camila
for for
thats my girl for for
thats my girl for for
thats my girl thats my girl

outro camila dinah  normani
thats my girl
thats my girl
thats my girl thats my girl
thats my girl20embed"
