id,song_name,artist_names,album_name,lyrics
3OqX0Aw2U2ptIbOF4uCLEG,Up To You,Chris Brown,6df0qvkMXoyHGt9J8cujZb,"13 contributorsup to you lyricsintro
yeah
ohwoahoh woahoh
ohwoahwoah

verse 1
what the hell babe
damn i aint never felt this way
somebody somebody tell me
i dont have a clue what to do when it comes to you

prechorus
baby youre so beautiful youre beautiful
every time i see you girl it throw me off throw me off
its so unusual unusual for me to be waiting
but i dont wanna blow it girl
but you should know this girl oh

chorus
im not gonna be the one to mess this up
cause i done effed up in love before
ima be the one to take a backseat girl
we can take our time and you can run this
stay in go out
anything you want girl we can do
girl are we going down i dont know
but from here now baby im gon leave that up to you
im gonna leave it up to you oh
you might also likeverse 2
what the hell babe
make me wanna jump out an airplane
the way it feels i just cant explain
i dont wanna lose this so im just gon stay out my own way

prechorus
baby youre so incredible youre beautiful
every time i see you girl it throw me off throw me off
its some kind of special unusual so im gon keep waiting
but i dont wanna blow it girl
but you should know this girl woahwoahwoah

chorus
im not gonna be the one to mess this up
cause i done effed up in love before
ima be the one to take a backseat girl
we can take our time oh and you can run this
stay in yeahyeah go out yeahyeah
anything you want girl we can do we can do
girl are we going down i dont know
but from here now baby im gon leave that up to you

bridge
im not tryna be a heart breaker like i was before that was the old me
ive made so many tears i dont wanna make no make no more
so give me your list lets start checking things off
ready to go to work baby you can be boss
and im okay with it aint gon play with it
so baby girl its your call
chorus
im not gonna be the one to mess this up oh not gonna mess it up
cause i done effed up in love before been in love before
ima be the one to take a backseat girl oh girl
we can take our time and you can run this ooh woah
stay in go out in or out girl
anything you want girl we can do we can do
girl are we going down oh i dont know oh
but from here now here now

outro
baby im gon leave that up to you woahoh
im gon leave that you to you
leave that up to you woah
im gon leave that you to you
leave it up to you woahoh
im gon leave it up to you
leave it up to you you you
im gon leave it up to you
im gon leave it up to you
im gon leave it up to you7embed"
