id,song_name,artist_names,album_name,lyrics
3OUApyz3jDB3syGUNGqB1d,How You Gonna Act Like That,Tyrese,3skbBjGnAOqfy6ndwwOT4G,"11 contributorshow you gonna act like that lyricsverse 1
it seems like just the other day that we hooked up
i was drivin you was walkin and i swooped you up
from that moment on i knew you were the one yeah
i was single you was lonely and we fell in love
we would sit and talk for hours about anything
baby you hang up no you hang up on three hang up
i bought your whip i paid your rent i gave you everything
said youd always be my baby then you bounced
how you gonna

chorus
how you gonna up and leave me now
how you gonna act like that
how you gonna change it up we just finished makin up
how you gonna act like that
how you gonna act like we dont be makin love
you know we be tearin it up breakin stuff that ghetto love
how you gonna trip how could you forget
how you gonna act like that

verse 2
girl i never thought that lovin you would hurt
i did everything a good man would to make it work
girl you should have told me you had second thoughts
like before i put the down on the house we bought
now im thinkin you and me was a mistake
but then it hits me and im missin all the love we made
girl i know that weve been goin through some things yeah
but the sun is somewhere shinin even when it rains oh
you might also likebreak
ill be the one you kick it to
ill be the one that misses you
ill be the one to ease your pain
ill be the one you wont forget
and youll be the one i cant forget
youll be the one thats heaven sent
youll be the one i cant deny
youll be the one that makes me cry baby

chorus
how you gonna up and leave me now why you do
how you gonna act like that why you gotta act like this
how you gonna change it up whoa ho baby we just
finished makin up
how you gonna act like that but i need you
how you gonna act like we oh dont be makin love
whoa baby baby
you know we be tearin it up breakin stuff that ghetto love
how you gonna trip how could you forget
how you gonna act like that

bridge
you know im willin to do anything
just to keep you in my heart keep you in my heart
i messed around and gave up everything
i thought wed never part yes i did baby
i was a player and made the choice to give my heart to you
and i gotta keep it that way ooh baby
chorus
how you gonna up and leave me now ooh baby
how you gonna act like that why you gotta treat me this way
how you gonna change it up why you treat me wrong
we just finished makin up
how you gonna act like that can me somebody tell me why
how you gonna act why why like we dont be makin love hey
you know we be tearin it up breakin stuff oh oh baby that ghetto love
how you gonna trip all my friends became your friends
how can you forget all my ends became your ends
how you gonna act like that

bridge
keepin love ghetto all i want is you
keepin love ghetto all i need is you
keepin love ghetto all i need is you
keepin love ghetto all i need is you all i need is you babe

chorus
how you gonna up and leave me now oh babe how you gonna act like that
how you gonna act like that hey hey
how you gonna change it up oh we just finished
makin up why you actin so changed oh oh baby
how you gonna act like that anything you want in me i got ya hey
how you gonna act like we dont be makin love
you know we be tearin it up breakin stuff why you actin so changed that ghetto love
how you gonna trip oh oh baby
how can you forget
how you gonna act like that15embed"
