id,song_name,artist_names,album_name,lyrics
5H60a1evkC6f1VJ3TCkoIQ,El Aferrado,Julión Álvarez y su Norteño Banda,50JOxUvIxX7M3glXWM2Ubi,"1 contributorel aferrado lyricsque no le sorprenda
a ese con el que andas
que un día de estos
le intercambie unas palabras

si esta fuerte o grande no me importa
si se me pone rejego
a ver de a como nos toca

que no te das cuenta
que me has enamorado
y en el amor tengo fama de aferrado

y ese canijo me lo impide
nomas con que yo lo mire
y le quitaré lo bravo

prepárate porque a tu ventana
te llevare serenata
ganare tu corazón sin autorización
y si aquel la hace de enredo
dile que aquí lo espero
afuera de tu casa estoy

muero por tocarte
aunque sea un poco tu pelo
pues todo el día te traigo
en el pensamiento
you might also likesi quieres lo grito a cuatro vientos
para que vayas sabiendo
que me muero por tus besos

tu duerme tranquila
y no tengas pendiente
yo me encargare muy bien de tu pretendiente
mas vale que se haga para un lado
porque si no en estos días
rezaran su novenario

prepárate porque a tu ventana
te llevare serenata
ganare tu corazón sin autorización
y si aquel la hace de enredo
dile que aquí lo espero
afuera de tu casa estoy

julion alvarez y su norteño banda oiga

que se vaya acostumbrando
porque yo seré tu dueño
y que no me provoque
que puedo ser muy violento
puede que no me aguante las ganas
que tengo desde hace tiempo
de robarte algunos besos
no me creas tan bravo
ni un gallo de pelea
pero en cosas del amor
me la rifo con cualquiera
cuando quiero algo yo lo obtengo
y si alguien se me atraviesa
se lo despacho a san pedro

prepárate porque a tu ventana
te llevare serenata
ganare tu corazón sin autorización
y si aquel la hace de enredo
dile que aquí lo espero
afuera de tu casa estoy

prepárate porque a tu ventana
te llevare serenata
ganare tu corazón sin autorización
y si aquel la hace de enredo
dile que aquí lo espero
afuera de tu casa estoyembed"
