id,song_name,artist_names,album_name,lyrics
07NPnAXwGmtWFNy45EFVbM,Can't Believe It (feat. Lil' Wayne),"T-Pain, Lil Wayne",184XWylq7ZF0Hn7da4Tr6W,"53 contributorscan’t believe it lyricsintro tpain
she make me feel so good
better than i would by myself
or if was with somebody else
you dont understand she make the people say yeah yeah

verse 1 tpain
i can put you in the log cabin
somewhere in aspen
girl aint nothing to the pain
aint tricking if you got it what you asking for
put you in the mansion
somewhere in wisconsin
like i said aint nothing to the pain
we can change that last name whats happening
cause you look so good
tell me why you wanna work here
i put you on the front page of a king magazine
but you gon get yourself hurt here

prechorus tpain
baby i brought you in the back just to have a conversation
really think you need some ventilation
lets talk about you and me

chorus tpain
oh i cant believe it
ooo ooo she all on me on me
man man i think she want me want me
nah i cant leave her lonely now
oh i cant believe it
ooo ooo she all on me on me
man man i think she want me want me
nah i cant leave her lonely now
and you dont understand she make the people say yeah yeah yeah
she hit the main stage she make the people say yeah yeah yeah
see tpain liveget tickets as low as 49you might also likeverse 2 tpain
i could put you in the condo
all the way up in toronto
baby put you in the fur coat
riding the murciélago
i put you in the beach house
right on the edge of costa rica
put one of em lil flowers in your hair
have you looking like a fly mamacita fuego
cause you look so good
you make me wanna spend it all on you
get up out this club
slide with your boy
we can do what you wanna yeah

prechorus tpain
baby i brought you in the back cause you need a little persuasion
plus you need a little ventilation
lets talk about you and me

chorus tpain
oh i cant believe it
ooo ooo she all on me on me
man man i think she want me want me
nah i cant leave her lonely now
oh i cant believe it
ooo ooo she all on me on me
man man i think she want me want me
nah i cant leave her lonely now
and you dont understand she make the people say yeah yeah yeah
she hit the main stage she make the people say yeah yeah yeah
verse 3 lil wayne
now i can put your ass out
keep running your mouth
and if your brothers come tripping
imma show em what these teardrops bout
shawty i was just playing
oh but i can take you to the cayman islands
have you screaming and hollering
we gonna be making
love on the beach
the people see what we doing
aww they pointing and ooing
oh but we gone keep on doing it
like its just me and you and no one else around
it went down on the balcony
and i aint talking no penthouse suite
shawty like a model out the penthouse sheets
thats why i got her on my penthouse sheets

chorus tpain
oh i cant believe it
ooo ooo she all on me on me
man man i think she want me want me
nah i cant leave her lonely naw
oh i cant believe it
ooo ooo she all on me on me
man man i think she want me want me
nah i cant leave her lonely naw
and you dont understand she make the people say yeah yeah yeah
she hit the main stage she make the people say yeah yeah yeah22embed"
