id,song_name,artist_names,album_name,lyrics
6erUaewLXaLfppXcOviDjI,Remedy,Jagged Edge,2LFRjzwf61Y7CIl54Kiq8j,"3 contributorsremedy lyricsintro
remedy haha
je yall
yall know what it is
its that jagged little thrill right here
check this out
ohoh
oh oh woah mmm
oh oh woah
oh oh oh woah oh yeah yeah yeah oh oh
oh oh
do you think about it baby

verse 1
do you think about it while youre working while youre working late
feelin like is it something is it something more than this
girl if you need somebody ima bring the dom
so we can get our bubbles on chilled bottle of perignon if you feel if you feel
if you feel like youre hungry hey baby i can cook you a meal
pick you in a lac deville cant believe that im so real
girl its you i want and and its you i need and
girl i got the remedy

chorus
if you feel it girl i got the key remedy to your body yeah woah woah
you know like when youre weak in your knees girl when your knees get weak
its me that makes you rush right home after work
cause you feel it i got it said its me baby
the remedy the remedy and its me
if you feel it girl i got the key remedy to your body woah woah woah woah
you know like when youre weak in your knees girl oh oh
its me that makes you rush right home after work
cause you feel it i got it
the remedy the remedy and girl i got the remedy
you might also likeverse 2
in the morning when we wake up at sunrise yeah
relaxation over your body you cant deny uh
wanna leave ima kiss you bye i
i know last night did you right i i
im just tryna be the man you like girl i i
baby got a feelin youll be feelin me when youre at work today uh
cause you know i did my thing
and whenever you need a cure
just call me ill be yours
anytime you need a remedy baby

chorus
if you feel it girl i got the key remedy to your body oh oh
you know like when youre weak in your knees girl baby baby i know
its me that makes you rush right home after work
cause you feel it i got it whenever you need me girl just call me
the remedy the remedy ill be your remedy baby
if you feel it girl i got the key remedy to your body yeah yeah yeah
you know like when youre weak in your knees girl girl ill be
its me that makes you rush right home after work make you rush right home
cause you feel it i got it make you rush right home after work
the remedy the remedy ooh

bridge
day in day out out day in day out
all i think about about all i think about
is the time i spend just lovin you my girl my friend yes i do oh
anything you need need got the remedy need
yes i do oh oh oh oh oh oh
girl if its love that you want from me
then its love im gonna provide yeah
said my arms are here and theyre open wide
ill be your your remedy
interlude
if you feel it feel it feel it in your body
you know like when youre weak girl you know like when youre weak weak off in your knees oh oh
cause feel it i got it baby call me baby call me yeah
the remedy the remedy
if you feel it feel it and girl i wanna love you down
in your body
you know like when youre weak baby yeah yeah
makes you rush right home after work you aint never had a love
cause you feel it i got it a love like me
the remedy the remedy

chorus
yeah you know that want that key remedy
if you feel it girl i got the key remedy to your body
yeah you know that i got that key remedy
you know like when youre weak in your knees girl
yeah you know that want that key remedy
its me that makes you rush right home after work
to your body to your body baby
cause you feel it i got it
the remedy the remedy
you know that i want that key remedy
if you feel it girl i got the key remedy to your body
yeah i know that you got that key remedy
you know like when youre weak in your knees girl
you know that i want that key remedy
its me that makes you rush right home after work
to your body to your body baby
cause you feel it i got it
the remedy the remedy
outro
your body your body baby
your body your body baby
your body your body baby
your body in your bodyembed"
