id,song_name,artist_names,album_name,lyrics
2QTL50KC6sdHZqxwZvQBdg,No More,YNW Melly,09b9NC1oQbYaHcacgXn66k,"19 contributorsno more lyricschorus ynw melly  r lee ermey
i aint tryna get in my feelings but damn but damn
whats goin on bro i thought you was fam was fam
because i am hard you will not like me
and you mad at me about a bitch instagram like damn
got me like what the fuck wrong with him

verse 1
tryna beef over some pussy thats funny thats funny
cant believe this ho made you her crash dummy
the way you act that ho pussy better be squirtin out money
platinum diamond vvs payin taxes or somethin
but its okay i understand you just couldnt keep it a hunnid
while you locked up somebody else shovin that dick in her stomach
i cant be beefin bout these bitches bruh this shit gettin old
knowin that pussy stainless steel but yet you treat it like gold
they been showin me that these niggas aint real aint real fuck nigga
get caught up with that time they gon squeal gon squeal
these bitches aint shit these niggas aint real aint real
keep playin your ass fuck round and get killed
whats goin on bro i heard you been trippin was trippin
i thought you kept it real from beginnin
until i heard that track you made and i came to some suspicions
i cant believe to my surprise one of my woadies sneak dissin

bridge
yeah you turned cold i cant fuck with you
its like that molly done turned you into a fuck nigga
hold up wait bro pose for the picture
you officially have been framed as a fuck nigga
and thats truth this aint fuckin with you at all
and lil baby snapped but this fuck nigga aint my dawg
that aint my dawg no more
that aint my dawg no
that aint my dawg no more nah
you might also likechorus
i aint tryna get in my feelings but damn but damn
whats goin on bro i thought you was fam was fam
and you mad at me about a bitch instagram like damn
got me like what the fuck wrong with—

verse 2
i cant be fuckin with none of these niggas
cause all of these niggas be actin like bitches
you know that im straight out of indian river
i dont give no fuck about none of these niggas
we just tryna run up this mothafuckin skrilla
all of my niggas they really some killers
see you a pussy i used to fuck with you
but then you turned cold on me nigga whats up
i cannot go oh oh like that i cant go like that
cant believe you switched up like a ho like that
like bruh i know you aint got many hoes like that
i would have let you have the bitch
i would have let you smash the bitch
i dont give a fuck nigga what
cause youre still a fuck nigga what
and that time you let me hold your pistol
you should have bucked nigga
wait i shouldve bucked you nigga
but now im feelin like fuck you nigga fuck you
and if this chopper ever catch you its hungry
it eat your bitch ass up for supper nigga yum yum yum yum
sometimes i wake up and i be in my feelings all night
sometimes tell that i was reminiscin
all of these bitches they wasnt even missin me
now they all on me and they tryna kiss me
i thought that we were 5150 but you could never be with us
these niggas claim they fuck with us but really be the enemy
chorus
i aint tryna get in my feelings but damn but damn
whats goin on bro i thought you was fam was fam
and you mad at me about a bitch instagram like damn
got me like what the fuck wrong with him

outro
tryna beef over some pussy thats funny thats funny
cant believe this ho made you her crash dummy
the way you act that ho pussy better be squirtin out money
platinum diamond vvs payin taxes or somethin
but its okay i understand you just couldnt keep it a hunnid
and you just couldnt keep it a hunnid2embed"
