id,song_name,artist_names,album_name,lyrics
66Hsz65MRwDlXSPHGA7POY,Nobody,Ken Carson,191PJkW2uvXGUJPyl9KcdF,"32 contributorsnobody lyricsintro
nah he aint—hes not even teen x fuck him

chorus
i dont need no lean to tweak huh huh huh huh huh
i dont need no perc to geek up up up
fuck that shit i dont need no molly uh uh uh
fuck that shit i dont need nobody uh uh uh
i dont need these hoes i dont need these beans uh uh uh
i dont need these lows i dont need these fiends uh
i just need my dough its just me and me yeah uh
i just need my dough its just me and me yeah

verse
fuck it i dont want no smoke i dont need no weed
you just get high off drugs i get high off other things
i get high when i make a half a mill in a week
if money was a high these brokeass niggas would be sober
i get so much money i woke up with a money hangover
im sippin blue hundreds and i popped a pink fifty
alex moss post my jewelry the whole world like damn he shittin
i done copped so much the jeweler like damn how much money he gettin
these niggas pocket watchin my pistol hold a lil fifty
i got a drum on this bitch it look just like a titty
i make a fuck nigga dance just like p diddy
i made that motherfucker sing like pretty ricky
that stick turned a nigga into a bitch like he got ass and titties
got glocks and sticks yeah they came with dicks yeah they came with ass and titties
and you know i rock fashion with it my shoes came from balenci
my fit match my glizzy i cock it back and blick it yeah
you might also likechorus
i dont need no lean to tweak huh huh huh huh huh
i dont need no perc to geek up up up
fuck that shit i dont need no molly uh uh uh
fuck that shit i dont need nobody uh uh uh
i dont need these hoes i dont need these beans uh uh uh
i dont need these lows i dont need these fiends uh
i just need my dough its just me and me yeah uh
i just need my dough its just me and me yeah

outro
its just me and me yeah its just me uh
its just me and me yeah its just me uh
its just me and me yeah its just me uh
its just me and me yeah its just me uh1embed"
