id,song_name,artist_names,album_name,lyrics
1a3RarhRdrNSTEEERYEFJn,Boiler,Limp Bizkit,5mi7FKaWE5CtcOjdyxScA7,"41 contributorsboiler lyricsverse 1
looks like ima do everything myself
maybe i could use some help
but hell you want somethin done right
you gotta do it yourself
maybe life is up and down
but my lifes been what til now
i crawled up your butt from hell
and thats when things got turned around
it used to be a lie i used to feel pathetic and now i get it
whats done is done you just leave it alone and dont regret it
sometimes some things turn into dumb things
and thats when you put your foot down

chorus
why did i have to go and meet somebody like you like you
why did you have to go and hurt somebody like me like me
how could you do somebody like that like that
hope you know that im never comin back never comin back

verse 2
looks like ima do everything myself everything myself
maybe i could use some help
but hell if you want somethin done right
you just do it yourself got it
maybe life is up and down
but my lifes been what til now got it
i crawled up your butt from hell got it
and thats when shit got turned around got it
it used to be a lie – so pathetic well now i get it
whats done is done i know youll just leave it alone and dont regret it
but sometimes some things turn into dumb things
and thats when you put your foot down
see limp bizkit liveget tickets as low as 14you might also likechorus
why did i have to go and meet somebody like you like you
why did you have to go and hurt somebody like me like me
how could you do somebody like that
hope you know that im never comin back never comin back
why did i have to go and meet somebody like you like you
why did you have to go and hurt somebody like me like me
how could you do somebody like that
hope you know that im never comin back never comin back

bridge
depending on you is done
giving to you is done
no more eating no sleeping no living
its all just more giving to you and im done
depending on you is done
and giving to you is done
no more eating no sleeping no living
its all just what giving to you and im done
the hiding from you is done
the lying from you is done
no more eating no sleeping no living
its all just more giving to you and im done

chorus
why did i have to go and meet somebody like you like you
why did you have to go and hurt somebody like me like me
how could you do somebody like that
hope you know that im never comin back never comin back
outro
oh why why
why why
why why
why why
 album version only 
ladies and gentlemen what you are experiencin
is in fact an inner lie man i would like you to kick back
and think about everything youve just heard8embed"
