id,song_name,artist_names,album_name,lyrics
0MUAB4NiqM91Ndm7Tz3kEQ,Go For It,Djo,4JDXBZdRPId4devseaAOKH,"7 contributorsgo for it lyricsinstrumental intro

verse 1
somehow were here
a love to last a thousand years
it sinks it might change change
took this long to feel this way

chorus
communication breaks then trust starts to fray
unmet needs forty ways
i hear go for it
its a harder thing to do than to say

verse 2
one week and four years
you know my ways i know your fears
but then theres a misunderstanding
but what will it take to hear me out to hear me out

chorus
communication breaks then trust starts to fray
unmet needs forty ways
why not go for it
its a harder thing to do than to say
you might also likeinstrumental bridge

chorus
communication breaks then trust starts to fray
unmet needs forty ways
now i go for it
its a harder thing to do than to say
so dont say a thingembed"
