id,song_name,artist_names,album_name,lyrics
6M31fPFCYB8Job3MCjjrDV,They Don't Know About Us,One Direction,2sWX3HYnZjPZ9MrH6MFsBt,"82 contributorsthey don’t know about us lyricsverse 1 liam all harry
people say we shouldnt be together
were too young to know about forever
but i say they dont know
what they talk talk talkin about talk talk talkin about
cause this love is only getting stronger
so i dont wanna wait any longer
i just wanna tell the world that youre mine girl oh

chorus zayn all liam
they dont know about the things we do
they dont know about the i love yous
but i bet you if they only knew they dont know
they would just be jealous of us
they dont know about the up all nights
they dont know ive waited all my life
just to find a love that feels this right they dont know
baby they dont know about they dont know about us

verse 2 niall harry
just one touch and i was a believer
every kiss it gets a little sweeter
its getting better
keeps getting better all the time girl

chorus zayn all liam
they dont know about the things we do
they dont know about the i love yous
but i bet you if they only knew they dont know
they would just be jealous of us
they dont know about the up all nights
they dont know ive waited all my life
just to find a love that feels this right
baby they dont know about they dont know about us
you might also likebridge louis
they dont know how special you are
they dont know what youve done to my heart
they can say anything they want
cause they don’t know us

builtup niall zayn
they dont know what we do best
thats between me and you our little secret
but i wanna tell em
i wanna tell the world that youre mine girl

chorus all zayn
they dont know about the things we do they dont know about the
they dont know about the i love yous i love yous
but i bet you if they only knew if they only knew
they would just be jealous of us they would just be jealous of us
they dont know about the up all nights
they dont know ive waited all my life  they dont know ive waited all my life
just to find a love that feels this right it feels so right
baby they dont know about they dont know about us
they dont know about the things we do they dont know about us
they dont know about the i love yous they dont know about us
but i bet you if they only knew
they would just be jealous of us they would just be jealous of us
they dont know about the up all nights up all nights
they dont know ive waited all my life all my life
just to find a love that feels this right right
baby they dont know about they dont know about us
outro zayn
they dont know about us38embed"
