id,song_name,artist_names,album_name,lyrics
7LGWmZaoS7jZJ5tEi9EcDi,HAD ENOUGH (feat. Quavo & Offset),"Don Toliver, Quavo, Offset",1Sf8GsXG32t0jNrX11xqWx,"3 contributorstranslationsenglishenglishportuguêsрусскийespañolitalianodon toliver  had enough ft quavo  offset türkçe çeviri lyricsintro don toliver
biliyorum biliyorum biliyorum
yeterli olduğunu biliyorum
bana yeterli olduğunu biliyorum 8
ama bir süre daha kal
yeterli olduğunu biliyorum oh oh bana yeah yeah yeah bana

verse 1 don toliver
aşağı in bin yeteri kadar kötü yeteri kadar kötü
sen ve arkadaşların bentley komyonetinden atladınız bentley evet
i̇şini yapıyorsun bebeğim hızlı yaşıyorsun gününü gün ediyorsun
kapıyı gösterip siklemiyorsun
bu bir rodeo git ve ayak parmaklarına dokun parmak uçlarına
sana arkadan vuracağım ve bu kadarıyla gidecek
domino taşları gibi onları yere serdim
o parasını amcığıyla ve direğe tırmanarak kazanır
i̇ki seçeneğin var cennetde ya da cehennemde olmak iki şansın var
bu arada uyuşturucuyu teraziye koyun tuğla veya balya koyun yeah
bu arada sürtük 12 yıldır izliyorum uhhuh
hapse girmemek için tanrıma dua ediyorum

chorus don toliver  offset
biliyorum biliyorum biliyorum
yeterli olduğunu biliyorum
bana yeterli olduğunu biliyorum 8
ama bir süre daha kal
yeterli olduğunu biliyorum oh oh bana yeah yeah yeah bana
you might also likeverse 2 offset  quavo
yeterli olduğunu biliyor muydun ne
noluyor amına koyayım diye bakıyorsun kim
güvenebilirsin arzuyla sana aşık olduğumu düşünüyorsun
kötülüklerin esiri olmuş gibi görünüyor git ve göğüsünden çıkar
yazışmalarımı okumayı istedi yazışmaları
onun gözlerine bakıyor çok stresli stresli
bücür elmas gibi ıslanıyor elmas
geceliğini ve elbiseni çıkar çıkar
ccup dcup göğüsleri var dcup
o kuş ve bir yuvada yaşıyor brr
direksiyonu kırıp çıkıştan gideceğim
parmağındaki kaya disleksik aptal
parayı al onu korumam gerek onu korumam
elimden tuttu ama asla bu boktan pişman değilim
tüm bu uzanan sürtükler benimle seks yapmak istiyor uzanan oh
ye bitir beni yakalamaya çalış ye bitir
giyinmeyi istiyorlar ve tarifi tarif
susam gibi çörekler istiyorum susam yeah

verse 3 quavo
ve ben gerçekten beni sevdiğini söyleyebilirim yup
chanele yüklen ve onu ağlat yeah yeah yeah yeah ağlat
bi kenarında yeterli oldu
yeterince yedek sevgiliye sahip olduğunu biliyorum
yeterli olduğunu biliyorum vikingler gibi içiyoruz yeah yeah yeah yeah mor
spike lee doğru olanı yap doğru
ama sex ona yeterli gelmiyor sex
outro don toliver
yeterli olduğunu biliyorum
bana ooh ooh bir süre daha kal ooh ooh ooh
yeterli olduğunu biliyorum uh yeah yeah yeah banaembed"
