id,song_name,artist_names,album_name,lyrics
0ZnimFEb14Ciz5dvQJAQ3k,Take Me Back - 2010 Remix,"Taio Cruz, Tinchy Stryder",0eGvq1J5Ke7VlLLOYIlY4k,"1 contributortake me back 2010 remix lyricsflee shes telling me shes over me
babe dont run no jokes on me
in my mind im taken back
and now it feels like make believe

yeah

i play the game
off the leash i strayed away
i found my way back home
let me in im at the gates strydes

i didnt mean to let you go
i didnt mean to let you down
im sorry that i led you on
but i really need you around

tell me can i have you here
cause i really need you right now
and im hoping youll take me
hoping hoping youll take me back

oh ii

im sorry i misleaded you pretty lady
im sorry i mistreated you pretty lady
im sorry that i hurt you pretty lady
all i need to know is
you might also likecan you take me back can you take me back
can you take me back can you take me back
can you take me back can you take me back
can you take me back can you take me back

cause i cant live without ya oh oh oh
girl i cant live without ya oh oh oh oh oh oh oh oh

i really wanna start again
i really wanna start it right
i just wanna do what i can
cause i really think you and i

should give it just one more chance
should give it just one more try
im hoping you take me
hoping hoping you take me back

yo im hoping you take me back
thats weight of my shoulders and aching back
turn a different unverified life
i would show you that

till im stuck in your mind
like a favourite track
ill find your spot
thats kinda soft
my cheeky smile im wiping off
if you say no
i will deal with that
im hoping youll take me back

flee flee

im sorry i misleaded you pretty lady
im sorry i mistreated you pretty lady
im sorry that i hurt you pretty lady
all i need to know is

can you take me back can you take me back
can you take me back can you take me back
can you take me back can you take me back
can you take me back can you take me back

cause i cant live without ya oh oh oh
girl i cant live without ya oh oh oh oh oh oh oh oh

girl i need you back woah
cause i cant live without ya
cause i actually thought i could cope on my on woah
cause i cant live without ya

girl i need you back woah
cause i cant live without ya
cause i actually thought i could cope on my on woah
cause i cant live without ya
ive played away ive grown oh oh oh
now i need you back in my zone oh oh oh
im hoping youll take me
hoping im hoping youll take me back

oh ii flee
flee

im sorry i misleaded you pretty lady
im sorry i mistreated you pretty lady
im sorry that i hurt you pretty lady
all i need to know is

can you take me back can you take me back
can you take me back can you take me back
can you take me back can you take me back
can you take me back can you take me back

cause i cant live without ya oh oh oh
girl i cant live without ya oh oh oh oh oh oh oh ohembed"
