id,song_name,artist_names,album_name,lyrics
20N5T2Zun2FZQqrMMRzEQ5,Si Te Dejo de Querer,Banda MS de Sergio Lizárraga,5VL90afs1EsezktD44XMIN,"1 contributorsi te dejo de querer lyricssi te vas
ya no me quitaras el sueño
ya estoy arto
de tus escenas de celos
la paciencia no existe
en mi diccionario
te pasaste
y no me digas lo contrario

olvidarte
va a salirme más barato
que amargarme
aguantando tus maltratos
yo te quiero
pero eso no es suficiente
no me des motivos
para aborrecerte

si te dejo de querer
va a ser por tu inmadurez
te comportas como niña
y tienes más de 23
ya goce de tus caricias
al derecho y al revés
pero si no te compones
te prometo que me iré
see banda ms de sergio lizárraga liveget tickets as low as 73si te dejo de buscar
la culpable tú serás
me saliste batallosa
y muy difícil de domar
si corriges tus modales
la historia puede cambiar
el reloj sigue su curso
y ya no se ni que pensar
tu modito y tus chantajes
ya no pienso tolerar

y vale más que te acomodes mija

olvidarte
va a salirme más barato
que amargarme
aguantando tus maltratos
yo te quiero
pero eso no es suficiente
no me des motivos
para aborrecerte

si te dejo de querer
va a ser por tu inmadurez
te comportas como niña
y tienes más de 23
ya goce de tus caricias
al derecho y al revés
pero si no te compones
te prometo que me iré
si te dejo de buscar
la culpable tú serás
me saliste batallosa
y muy difícil de domar
si corriges tus modales
la historia puede cambiar
el reloj sigue su curso
y ya no se ni que pensar
tu modito y tus chantajes
ya no pienso tolerarembed"
