id,song_name,artist_names,album_name,lyrics
1vxu8vMNshg5J8z3oA7QJZ,Parabola,TOOL,5l5m1hnH4punS1GQXgEi3T,"56 contributorstranslationstürkçeparabola lyricsverse
we barely remember
who or what came before this precious moment
we are choosing to be here right now
hold on stay inside

prechorus
this holy reality
this holy experience
choosing to be here in

chorus
this body this body holding me
be my reminder here that i am not alone in
this body this body holding me
feeling eternal all this pain is an illusion

postchorus
alive

prechorus
in this holy reality
in this holy experience
choosing to be here in

chorus
this body this body holding me
be my reminder here that i am not alone in
this body this body holding me
feeling eternal all this pain is an illusion
see tool liveget tickets as low as 64you might also likebridge
twirling round with this familiar parable
spinning weaving round each new experience
recognize this as a holy gift and
celebrate this chance to be alive and breathing
a chance to be alive and breathing

outro
this body holding me reminds me of my own mortality
embrace this moment remember
we are eternal all this pain is an illusion41embed"
