id,song_name,artist_names,album_name,lyrics
2p9JWJJ7FEfXS02g1WHZXH,Bun Bun Bunny Bun,Parry Gripp,0xbbsauKysPCTQDd38P2CW,"4 contributorsbun bun bunny bun lyricsbunny bun bun bunny bun
bun bun bun bun
bun bun bunny bun bunny
bun bun bun bun
bun bun bunny bun
bun bun bun bun
bun bunny bun bun
freakin bunny
a yai a yai a yai bbbunny
freakin bunny
a yai a yai a yai bbbunny
from new york to melan
that rabbits in demand
eating the finest hay
on the beach at centro pay
the party never stooooops
that bunny loves to hoooooop
freakin bunny

bbbunny

bbunny
the events are always big
the status doesnt get any pig
the rabbits got appeal
yes that fur is real
the party never stoooops
that bunny loves to hooooop
freakin bunny bun bunny bun
you might also likefreakin bunny
a yai a yai a yaibbbunny
fasion bunny
a yai a yai a yai bbbunny
freakin bunny
a yai a yai a yai bbbunny
fasion bunny
a yai a yai a yai bbbunny
freakin bunny bun bun bunny bun
endembed"
