id,song_name,artist_names,album_name,lyrics
4bkhs6spQvVnVJAlXuKR6a,"Touchin, Lovin (feat. Nicki Minaj)","Trey Songz, Nicki Minaj",3pKTKC0AAe3yTcXQLzvpSW,"70 contributorstouchin lovin lyricsintro nicki minaj  trey songz
ooh woo yeah
ayy
young money
uhhuh
trigga trey
oh oh
oh oh
uh lets get it rrrrrrrr

verse 1 trey songz
no i aint tryna flex tryna flex
no ceilings you can see whos in it oh
if were talkin about sex girl you gon think
haha girl you know that i invented that invented that
and im onto the next next
thats unless you bring a friend who with it
oh im sorry
oh you mad that i came to the party

prechorus trey songz
like no no no uhhuh
you took your girl to the club and now she gone uhhuh
now she asking me when im takin her home uhhuh
i tell her lets go leggo
long as you know cause i know when we get alone that
see trey songz liveget tickets as low as 87you might also likechorus trey songz
im touchin you tonight
nah im lovin you tonight
wait no im fuckin you girl
you must be used to spendin puttin in that time uhhuh
touchin lovin fuckin cant make up my mind my mind oh oh
im lovin you oh oh
wait no im fuckin you tonight

verse 2 trey songz
girl you fuckin with the best best
take a picture while im deep up in it oh
and if they livin right next next next
then i bet they know my name in a minute trigga
let me feel your body sweat sweat
i promise ill keep your body dripping
oh im sorry
niggas mad cause i came to the party

prechorus trey songz
like no no no uhhuh
you took your girl to the club
and now she gone uhhuh
now she asking me
when im takin her home home home uhhuh
i tell her lets go leggo
long as you know cause i know when we get alone that
chorus trey songz
im touchin you tonight
nah im lovin you tonight
wait no im fuckin you girl
you must be used to spendin putting in that time uhhuh
touchin lovin fuckin cant make up my mind my mind oh oh
im lovin you oh oh
wait no im fuckin you tonight

verse 3 nicki minaj
yo sometimes i tell em i love em because i just wanna fuck em
i never love em or cuff em and when we done ima duck em
he ferragamo the buckle he louis v on the duffel
the pussy wetter than puddles i ride his dick like a shuttle
i said real niggas let real bitches cum first cum first
and real bitches been bad bitches from birth from birth
ugh kiss him when he cumming oh
made more money last year than mister drummond kyuhh
oh he like it when i ride it slow

chorus trey songz  nicki minaj
im touchin you tonight ugh yeah
nah im lovin you tonight uhhuh
wait no im fuckin you girl
you must be used to spendin putting in that time uhhuh
touchin lovin fuckin cant make up my mind my mind oh oh
nicki you know that i love it
im lovin you oh oh
and i really wanna touch you hahaha
wait no im fuckin you tonight
outro nicki minaj
what you mean wait no like what
you better act like you know nigga its nicki minaj
uhhuh144embed"
