id,song_name,artist_names,album_name,lyrics
5y7IfSDhBHFVnlGj1UrlA1,Detroit,Red Hot Chili Peppers,43otFXrY0bgaq5fB3GrZj6,"17 contributorsdetroit lyricsverse 1
find me in the suburbs and the shadow of decay
rolling rings of rubber and the band begins to play
am i on the right side of the left side of your brain
can you see the rising of old yesterdays remains
funkadelic said it best i think you know the rest
time dont stand a chance against this motor madness

chorus
dont you worry baby im like
detroit im crazy
dont you worry baby im like
detroit im crazy im like
detroit im crazy
dont you worry baby im like

verse 2
the stooges and j dilla yeah they tore this town apart
put me back together well i guess thats quite an art
henry won the war you see but not with pen or sword
he did it with the little thing i think its called a ford
funkadelic said it best i think you know the rest
time dont stand a chance against this motor madness

chorus
dont you worry baby im like
detroit im crazy
dont you worry baby im like
detroit im crazy im like
detroit im crazy
dont you worry baby im like
detroit im crazy im like
detroit im crazy
see red hot chili peppers liveget tickets as low as 75you might also likeoutro
everythings so hazy im like
detroit im crazy im like
detroit im crazy
everythings so hazyembed"
