id,song_name,artist_names,album_name,lyrics
1whAGgcXk2B1W3XluT2m0B,Trippin' on a Hole in a Paper Heart,Stone Temple Pilots,1fyLNx6wxgDA59wFInnyup,"20 contributorstrippin’ on a hole in a paper heart lyricsverse 1
dont cut out my paper heart
i aint dyin anyway
take a look at eiffel towers
never trust them dirty liars
sippin lemon yellow booze
old lead belly sings the blues
all dressed up on wedding day
keep on trippin anyway

chorus
i am i am i said im not myself
im not dead and im not for sale
so keep your bankroll lottery
eat your salad day deathbed motorcade

verse 2
fake the heat and scratch the itch
skinnedup knees and salty lips
ill breathe your life vicks vapor life
and when you binge i purge alike
let go its harder holdin on
one more trip and ill be gone
so keep your head up keep it on
just a whisper ill be gone
take a breath and make it big
its the last youll ever get
break your neck with diamond noose
its the last youll ever choose
you might also likechorus
i am i am i said im not myself
im not dead and im not for sale
hold me closer closer let me go
let me be just let me be
i am i am i said im not myself
im not dead and im not for sale
so keep your bankroll lottery
eat your salad day deathbed motorcade

guitar solo

chorus
i am i am i said im not myself
im not dead and im not for sale
hold me closer closer let me go
let me be just let me be
i am i am i said im not myself
im not dead and im not for sale
so keep your bankroll lottery
eat your salad day deathbed motorcade8embed"
