id,song_name,artist_names,album_name,lyrics
3sNVsP50132BTNlImLx70i,Bound 2,Kanye West,7D2NdGvBHIavgLhmcwhluK,"384 contributorstranslationsespañolрусскийportuguêsitalianofrançaisहिन्दीbound 2 lyricsintro ponderosa twins plus one  brenda lee
bbbbbound to fall in love
bound to fall in love
uhhuh honey
chorus kanye west ponderosa twins plus one  brenda lee
all them other niggas lame and you know it now
when a real nigga hold you down you sposed to drown
bound to fall in love
bound
bbbbbound to fall in love
bound
uhhuh honey

verse 1 kanye west
what you doin in the club on a thursday
she say she only here for her girl birthday
they ordered champagne but still look thirsty
rock forever 21 but just turned thirty
i know i got a bad reputation
walkaroundalwaysmad reputation
leaveaprettygirlsad reputation
start a fight club brad reputation
i turnt the nightclub out of the basement
ill turn the plane around your ass keep complainin
how you gon be mad on vacation
dutty wining round all these jamaicans
uh this that prom shit
this that whatwedodonttellyourmom shit
this that redcupallonthelawn shit
got a fresh cut straight out the salon bitch
see kanye west liveget tickets as low as 122you might also likeprechorus charlie wilson  brenda lee
i know youre tired of lovin of lovin oh
with nobody to love nobody no—
uhhuh honey
chorus kanye west ponderosa twins plus one  brenda lee
close your eyes and let the word paint a thousand pictures
one good girl is worth a thousand bitches
bound to fall in love
bound
bound to fall in love
bound
uhhuh honey

verse 2 kanye west
i wanna fuck you hard on the sink
after that give you somethin to drink
step back cant get spunk on the mink
i mean damn what would jeromey romey romey rome think
hey you remember where we first met
okay i dont remember where we first met
but hey admittin is the first step
and hey you know aint nobody perfect
and i know with the hoes i got the worst rep
but hey their backstroke im tryna perfect
and hey ayo we made it thanksgivin
so hey maybe we can make it to christmas
she asked me what i wished for on my wishlist
have you ever asked your bitch for other bitches
maybe we could still make it to the church steps
but first you gon remember how to forget
after all these longass verses
im tired you tired jesus wept
prechorus charlie wilson  brenda lee
i know youre tired tired of lovin of lovin
with nobody to love nobody nobody
so just grab somebody no leavin this party
with nobody to love nobody nobody
uhhuh honey

chorus kanye west ponderosa twins plus one  brenda lee
jeromes in the house watch your mouth
jeromes in the house watch your mouth
bound to fall in love
bound
bound to fall in love
bound
uhhuh honey
produced by kanye west and che pope with additional production from eric danchild noah goldstein no id and mike dean
video directed by nick knight427embed"
