id,song_name,artist_names,album_name,lyrics
6CRRlfXDdhsL6vih3J5xco,En Definitiva,Alfredo Olivas,1YDVn5KeQ7ZzX7TPmSLTKd,"2 contributorsen definitiva lyricsletra de en definitiva

verso
en definitiva esto es definitivo
y es que nuestro adiós ya tiene nombre y apellido
fue lindo mientras fue pero ya no se debe
porque de poder seguro que se puede
en definitiva y definitivamente
voy a extrañar tus besos y tu forma diferente
de hacerme el amor de tu figura exacta
porque lo que me hacías tú
a ella aún le falta

coro
si todo tiene un por qué
¿por qué nosotros no encuentro respuesta
y asimilar que llegamos tarde
¡caray cómo me cuesta

y si todo tiene un final
¿por qué este tiene que ser tan duro
¿quién inventó las reglas caray
si nos conociera las cambiaría te lo aseguro

postcoro
y el ruido del adiós
lo prefiero en silencio
y si todavía tengo opción
aún no lo des por hecho
you might also likeinterludio instrumental

coro
si todo tiene un por qué
¿por qué nosotros no encuentro respuesta
y asimilar que llegamos tarde
¡caray cómo me cuesta

y si todo tiene un final
¿por qué este tiene que ser tan duro
¿quién inventó las reglas
si nos conociera las cambiaría te lo aseguro

postcoro
el ruido del adiós
el alma me taladra
tú tienes algo que yo no
la última palabraembed"
