id,song_name,artist_names,album_name,lyrics
0c4PawLMDbnK1mXcf7vLVS,The R O C,"JAY-Z, Memphis Bleek, Beanie Sigel",3VfeeJElCEDeXlDiNZbn3E,"119 contributorscrazy in love lyricsintro jayz  beyoncé
yes woo ow
so crazy right now
most incredibly
its your girl b yes woo
its your boy young
you ready

refrain beyoncé  jayz
uhoh uhoh uhoh oh no no ow
uhoh uhoh uhoh oh no no
uhoh uhoh uhoh oh no no
uhoh uhoh uhoh oh no no

interlude jayz
chyeah
history in the making
part two
its so crazy right now

verse 1 beyoncé
i look and stare so deep in your eyes
i touch on you more and more every time
when you leave im beggin you not to go
call your name two three times in a row
such a funny thing for me to try to explain
how im feelin and my pride is the one to blame yeah yeah
cause i know i dont understand
just how your love can do what no one else can
you might also likechorus beyoncé
got me looking so crazy right now
your loves got me looking so crazy right now your love
got me looking so crazy right now
your touch got me looking so crazy right now your touch
got me hoping youll page me right now
your kiss got me hoping youll save me right now
looking so crazy your loves got me looking
got me looking so crazy in love

refrain beyoncé
uhoh uhoh uhoh oh no no
uhoh uhoh uhoh oh no no
uhoh uhoh uhoh oh no no
uhoh uhoh uhoh oh no no

verse 2 beyoncé
when i talk to my friends so quietly
who he think he is look at what you did to me
tennis shoes dont even need to buy a new dress
if you aint there aint nobody else to impress
its the way that you know what i thought i knew
its the beat that my heart skips when im with you
but i still dont understand
just how your love can do what no one else can
chorus beyoncé  jayz
got me looking so crazy right now
your loves got me looking so crazy right now so crazy your love
got me looking so crazy right now your love
your touch got me looking so crazy right now oh your touch
got me hoping youll page me right now yeah
your kiss got me hoping youll save me right now hey
looking so crazy your loves got me looking chyeah
got me looking so crazy in love chyeah
im looking so crazy your loves got me looking woo
got me looking so crazy in love im warmed up now lets go

verse 3 jayz  beyoncé
young hov yall know when the flow is loco no no
young b and the roc uhoh oh no
og big homie the one and only no no
stick bony but the pockets is fat like tony soprano no no no
the roc handle like van exel
i shake phonies man you cant get next to
the genuine article i do not sing though
i sling though if anything i bling yo
a star like ringo war like a green beret oh
you crazy bring your whole set oh
jayz in the range crazy and deranged
they cant figure him out they like hey is he insane
yes sir im cut from a different cloth
my texture is the best fur chinchilla
ive been iller than chain smokers
uhoh uhoh uhoh oh no no
how you think i got the name hova
uhoh uhoh uhoh oh no no
i been realer the games over
fall back young
uhoh uhoh uhoh oh no no
ever since i made the change over to platinum
uhoh uhoh uhoh oh no no
the games been a wrap one
bridge beyoncé
got me looking so crazy my baby
im not myself lately im foolish i dont do this
ive been playing myself baby i dont care
cause your loves got the best of me
and baby youre making a fool of me
you got me sprung and i dont care who sees
cause baby you got me you got me
you got me so crazy baby hey

chorus beyoncé
got me looking so crazy right now your love
your loves got me looking so crazy right now looking crazy
got me looking so crazy right now
your touch got me looking so crazy right now baby your touch
got me hoping youll page me right now yeah babe
your kiss got me hoping youll save me right now oh
looking so crazy your loves got me looking yeah
got me looking so crazy in love woah
got me looking so crazy right now
your loves got me looking so crazy right now your love
got me looking so crazy right now
your touch got me looking so crazy right now your touch
got me hoping youll page me right now
your kiss got me hoping youll save me right now
looking so crazy your loves got me looking
got me looking so crazy in love86embed"
