id,song_name,artist_names,album_name,lyrics
5XgSU5v3SgAXnCKFaEcrha,Hot,Missy Elliott,6DeU398qrJ1bLuryetSmup,"6 contributorshot lyricsintro
uh uh uh yeah huh
uh this is uh an old school uh missy exclusive huh
look

verse 1
i aint on no rara shit uh
you dont wanna test how far miss get ooh
me and timothy cars got kits
but we dont drive around tryna prove you shit uh
everyone tryna be that bitch
but there can only be one bitch make hits oh
i know i must make yall sick
cause after i spit you beg to quit ooh
i used to drive a six
and then i bought a murciélago to sit ooh
on the plush leather seats forget
am i on my own clit yes i must admit yeah
mis is it
misdemeanor have you seen her  im the best it get come on
and those who try to test this chick uh
where they at right now in peace resting in uh

chorus
if you broke just say you broke
cause all you blowin up your ass is some smoke uhhuh
cause rich folks we buy boats
and yous a bum broke nigga thats for sure uhhuh
i know you broke just say you broke ooh
cause all you blowin up your ass is some smoke uh
cause rich folks we buy boats
and yous a bum broke liar thats for sure for sure
you might also likeverse 2
yeah boo you know you a joke
wear a fake rolex call it a ro ooh
act like youre down with so and so
youre whack on wax bows i came to throw uh
i might just let you mop my floor
for my autograph take this flick to go cheese
miss dont say no more
cause you know what i do and you know what i know oh
and i dont think so
you dont wanna lose a arm or elbow ooh
if youre broke then just say so
cause the bentley that youre rentin yo its got to go ah
back to the black man store
along with your weave cop a new afro uh
why you wanna make miss stoop so low
but if you try to test me i just check you slow come on

chorus
if you broke just say you broke
cause all you blowin up your ass is some smoke uhhuh
cause rich folks we buy boats
and yous a bum broke nigga thats for sure uhhuh
i know you broke just say you broke ooh
cause all you blowin up your ass is some smoke uh
cause rich folks we buy boats
and yous a bum broke liar thats for sure for sure
verse 3
in old school we used to call out names ooh
but i aint tryna give you no fame uh
my credit card gon bring ya pain yeah
to know your account just hold change ooh
no need to wreck your brains oh
tryna see who missy gon slain uh
i roll solo not with a gang uh
i dont carry guns kick ass with a chain yeah
dont let me say it again
i dont carry guns kick ass with a chain whats up
like a chinese man reverse it ti esrever
know what im saying ooh

chorus
if you broke just say you broke
cause all you blowin up your ass is some smoke uhhuh
cause rich folks we buy boats
and yous a bum broke nigga thats for sure uhhuh
i know you broke just say you broke ooh
cause all you blowin up your ass is some smoke uh
cause rich folks we buy boats
and yous a bum broke liar thats for sure for sure

outro
dear lord almighty i know when its our time to go its our time to go
but when you come to carry us home do we not be entertainers anymore
do we just rest in peace or do we go back to see our familys pain
do we not remember hell on earthll come back as a new person again
i ask these questions will aaliyah lisa tupac big pun be our newest generation
because if so like a michael jackson release the whole world is anticipatin
to see these fallen soldiers come back and get the crown they deserve
for givin us great music and great music that will always be heard
we love youembed"
