id,song_name,artist_names,album_name,lyrics
3S2R0EVwBSAVMd5UMgKTL0,Thriller,Michael Jackson,1C2h7mLntPSeVYciMRTF4a,"184 contributorstranslationsportuguêsdeutschthriller lyricsverse 1
its close to midnight
and something evils lurking in the dark
under the moonlight
you see a sight that almost stops your heart
you try to scream
but terror takes the sound before you make it
you start to freeze
as horror looks you right between the eyes
youre paralyzed

chorus
cause this is thriller thriller night
and no ones gonna save you
from the beast about to strike
you know its thriller thriller night
youre fighting for your life inside a killer
thriller tonight yeah
ooh

verse 2
you hear the door slam
and realize theres nowhere left to run
you feel the cold hand
and wonder if youll ever see the sun
you close your eyes
and hope that this is just imagination girl
but all the while
you hear a creature creepin’ up behind
youre out of time
you might also likechorus
cause this is thriller thriller night
there aint no second chance
against the thing with forty eyes girl
thriller ooh thriller night
youre fighting for your life
inside a killer thriller tonight

bridge
night creatures call
and the dead start to walk in their masquerade
theres no escaping the jaws of the alien this time
theyre open wide
this is the end of your life ooh

verse 3
theyre out to get you
theres demons closing in on every side ooh
they will possess you
unless you change that number on your dial
now is the time
for you and i to cuddle close together yeah
all through the night
ill save you from the terror on the screen
ill make you see
chorus
that this is thriller thriller night
cause i can thrill you more
than any ghoul would ever dare try
thriller ooh thriller night
so let me hold you tight
and share a killer thriller chiller
thriller here tonight
cause this is thriller thriller night
girl i can thrill you more
than any ghoul would ever dare try
thriller ooh thriller night
so let me hold you tight
and share a killer thriller ow

outro vincent price  michael jackson
im gonna thrill you tonight
darkness falls across the land
the midnight hour is close at hand
creatures crawl in search of blood
to terrorize yalls neighborhood im gonna thrill you tonight
and whosoever shall be found
without the soul for getting down
must stand and face the hounds of hell
and rot inside a corpses shell
im gonna thrill you tonight
thriller ooh babe thriller
im gonna thrill you tonight thriller night
thriller oh darling oh baby
im gonna thrill you tonight thriller
ooh babe thriller night
im gonna thrill you tonight thriller
oh darling oh baby
thriller night babe thriller night babe
ooh
the foulest stench is in the air
the funk of forty thousand years thriller night thriller
and grisly ghouls from every tomb
are closing in to seal your doom
and though you fight to stay alive
your body starts to shiver im gonna thrill you tonight
for no mere mortal can resist
the evil of the thriller89embed"
