id,song_name,artist_names,album_name,lyrics
78eouBKVRyhbSzJwChr6QM,Don't Hurt Yourself (feat. Jack White),"Beyoncé, Jack White",7dK54iZuOxXFarGhXwEXfF,"162 contributorstranslationsespañolenglishdon’t hurt yourself lyricsintro beyoncé
oh na na na
oh na na na
oh na na na
dont hurt yourself
dont hurt yourself

verse 1 beyoncé
who the fuck do you think i is
you aint married to no average bitch boy
you can watch my fat ass twist boy
as i bounce to the next dick boy
and keep your money i got my own
keep a bigger smile on my face being alone
bad motherfucker god complex
motivate your ass call me malcolm x
yo operator or innovator
fuck you hater you cant recreate her no nuhuh
youll never recreate her no hell no

prechorus 1 beyoncé
we just got to let it be
let it be let it be let it be baby
you just got to let it be
let it be let it be let it be babe
you might also likechorus jack white
when you hurt me you hurt yourself
dont hurt yourself
when you diss me you diss yourself
dont hurt yourself
when you hurt me you hurt yourself
dont hurt yourself dont hurt yourself
dont hurt yourself
when you love me you love yourself
love god herself

verse 2 beyoncé
i am the dragon breathing fire
beautiful mane im the lion
beautiful man i know youre lying
i am not broken im not crying im not crying
you aint trying hard enough
you aint loving hard enough
you dont love me deep enough
we not reaching peaks enough
blindly in love i fucks with you
til i realize im just too much for you
im just too much for you

prechorus 2 beyoncé
you just got to let it be
let it be let it be let it be baby
hey baby who the fuck do you think i is
i smell that fragrance on your louis knit boy
just give my fat ass a big kiss boy
tonight im fucking up all your shit boy
chorus beyoncé  jack white
when you hurt me you hurt yourself
try not to hurt yourself
when you play me you play yourself
dont play yourself
when you lie to me you lie to yourself
you only lying to yourself dont hurt yourself
when you love me you love yourself
love god herself

outro beyoncé
we just got to let it be
let it be let it be let it be let it be babe
uh this is your final warning dont hurt yourself
you know i give you life dont hurt yourself
if you try this shit again dont hurt yourself
you gon lose your wife61embed"
