id,song_name,artist_names,album_name,lyrics
32lm3769IRfcnrQV11LO4E,Bailando - Spanish Version,"Enrique Iglesias, Descemer Bueno, Gente De Zona",2kZkiVn1m00XcgaWlLb2LD,"38 contributorstranslationsελληνικάbailando english version lyricsintro sean paul  gente de zona
bless them an there aint no stressin
and this one is straight for di girl them
enrique iglesias longside gente de zona descemer
get di girl dem inna di zone
gi dem di big bone
seandapaul a mi deh yah weh wi tell em pon di throne
lockin it just like that
di girl dem deh move pon track
seandapaul a mi deh yah
enrique sing fi dem dweet

verse 1 enrique iglesias  sean paul
you look at me and girl you take me to another place because me need it baby girl
got me feelin like im flyin like im out of space heart beat
something bout your body says come and take me because me need it baby girl
got me begging got me hoping that the night don’t stop rock dat body cah wi dont stop party

chorus alexander delgado randy malcom  sean paul
bailando bailando
bailando bailando
tú cuerpo y el mío
llenando el vacío subiendo y bajando subiendo y bajando bidi bangbangbang
bailando bailando
bailando bailando
ese fuego por dentro
me tá enloqueciendo
me va saturando bidi bangbangbang
see enrique iglesias liveget tickets as low as 57you might also likepostchorus enrique iglesias alexander delgado  sean paul
girl i like the way you move come and show me what to do
you can tell me that you want me girl you got nothing to lose
i cant wait no more ya no puedo más
i cant wait no more ya no puedo más zeen

bridge sean paul
she ah go love how mi ah set it
cah yuh know seh mi nah pet it
mi ah tell har nuh fi fret it
any time when mi get it
its gonna be alright
we taking it full flight
we doing this all night
baby girl bidi bang

refrain enrique iglesias descemer bueno  sean paul
i wanna be contigo
and live contigo and dance contigo
gotta have contigo
una noche loca una noche loca
ay besar tu boca y besar tu boca
i wanna be contigo zeen
and live contigo and dance contigo
gotta have contigo
una noche loca with you girl
con tremenda nota
bridge sean paul
ohohohoh bababy girl
ohohohoh stay with me girl
ohohohoh play with me girl
ohohohoh bababy girl

verse 2 enrique iglesias randy malcom  sean paul
i look at you and it feels like paradise estoy en otra dimensión
you got me spinning got me crazy got me hypnotized tus latidos aceleran a mi corazón heart beat
i need your love i need you closer because me need it baby girl
keep me begging keep me hoping that the night dont stop rock that body cah wi dont stop party girl

chorus alexander delgado randy malcom  sean paul
bailando bailando
bailando bailando
tú cuerpo y el mío
llenando el vacío subiendo y bajando subiendo y bajando bidi bangbangbang
bailando bailando
bailando bailando
ese fuego por dentro
me tá enloqueciendo
me va saturando

postchorus enrique iglesias alexander delgado  sean paul
girl i like the way you move come and show me what to do
you can tell me that you want me girl you got nothing to lose
i cant wait no more ya no puedo más
i cant wait no more ya no puedo más bidi bangbangbang
bridge 2 sean paul
she ah go love how mi ah set it
cah yuh know seh mi nah pet it
mi ah tell har nuh fi fret it
any time when mi get it
its gonna be alright
we taking it full flight
we doing this all night
baby girl bidi bang

refrain enrique iglesias descemer bueno  sean paul
i wanna be contigo
and live contigo and dance contigo
gotta have contigo
una noche loca una noche loca
ay besar tu boca y besar tu boca
i wanna be contigo
and live contigo and dance contigo zeen
gotta have contigo
una noche loca
con tremenda nota

outro sean paul
ohohoh ohohoh ohohoh ohohoh ohohoh
baby girl yuh a di bomb bomb di drop drop killin it wid di one drop
the way yuh move girl mek mi heart beat gwaan stop
tickatickatock never gonna stop girl
let mi heart burn when yuh twist it and turn turn
energy yuh give mi girl a you run di world
sexy body shape and yuh full of body curves
mek mi body tense to a rise up in there
long time yuh lookin you fi listen my word
ohohoh ohohoh ohohoh ohohoh ohohoh
ohohohoh come baby girl
ohohohoh bababy girl
ohohohoh stay with me girl
ohohohoh play with me girl
ohohohoh bababy girl26embed"
