id,song_name,artist_names,album_name,lyrics
5m9pNa8DUCxXL40hT5ryyY,Fresh Pair of Panties On,Snoop Dogg,797fkvAtk0iZvP1HHPCWbp,"7 contributorsfresh pair of panties on lyricsits time to slow it down steadily grindin
and this is the big doggy dogg

and i aint talkin about no air force ones
i just gotta know before you let me get some

hook
do you have a fresh pair of panties on
i got to know or you could show me
silk cotton seethrough lace your sexy thong
i got to know or you could show me

verse 1 snoop dogg
freakaleek peak peak
let a nigga sneak a few peekaboo
lets see what we can do
im bout freakin you and sneakin you
into a quiet place
so i can look at it face to face
let me guess you prefer to wear cotton
i can tell cause you like squattin
your last dude he was so rotten
and now your love is to be gotten
yeah baby girl i can read your mind
but what im really tryin to do is read between your pantylines
i know it seems oh so personal
but im just tryin to make you feel real comfortable
i know so what will it be
and the type of underwear you wear i mean its troublin me
can i get a glimpse one for the pimps
i got one question answer me this then
see snoop dogg liveget tickets as low as 59you might also likehook

verse 2 snoop dogg
you came by the church with a whole lot of body
got invited to our annual pajama party
workin that lace i think it was the french cut
yeah bitch you got a big ol butt
hidin it should be dividin it
its real tight now but i got a way to widen it
and slide in it real smooth like
with a little bit of miles davis to get you in the mood like
zoom boom hit the poompoom right
just to get your groove right
i can make it happen but it cant happen if you aint good at it
when you gon let a nigga have a look at it
callin all cars yeah baby girl you a star
but its on you if you wanna go real far
now let me get a glimpse one for the pimps
i have one question answer me this

hookembed"
