id,song_name,artist_names,album_name,lyrics
75IQVo8hqI1iwVZyvkN2VT,Show Me How,Men I Trust,7mUYDBqNiddmKxuKrnBEKQ,"47 contributorsshow me how lyricsverse 1
show me how you care
tell me how you were loved before
show me how you smile
tell me why your hands are cold

prechorus
show me how

chorus
i’m turning around i’m having visions of you
but then i understand
the friend i’m dreaming of is far away
but i’m here i’m here

verse 2
show me how you’re proud
tell me how you reach the moon
my thoughts err away tonight
my heart fell to love again

prechorus
show me how

chorus
i’m turning around i’m having visions of you
but then i understand
the friend i’m dreaming of is far away
and doesn’t feel my love
but i do i dosee men i trust liveget tickets as low as 100you might also like31embed"
