id,song_name,artist_names,album_name,lyrics
2H8jWuNmluerTEsuh8Gu6y,Jail pt 2,Kanye West,5CnpZV3q5BcESefcB3WJmz,"127 contributorstranslationskanye west  jail pt 2 ft dababy  marilyn manson türkçe çevirienglishрусскийportuguêskanye west  jail pt 2 ft dababy  marilyn manson traduzione italianadeutschfrançaisjail pt 2 lyricsintro kanye west
take what you want
take everything
take what you want
take what you want

verse 1 kanye west
better that i change my number so you cant explain
violence in the night violence in the night
priors priors do you have any product
well that one time ill be honest
ill be honest we all liars let it go

prechorus kanye west with marilyn manson
ill be honest we all liars
ill be honest we all liars
im pulled over and i got priors
guess we goin down guess whos goin to jail

chorus kanye west with marilyn manson
guess whos goin to jail tonight
guess whos goin to jail tonight
guess whos goin to jail tonight
god gon post my bail tonight

verse 2 kanye west  dem jointz
dont you curse at mе on text why you try to hit the flex
i hold up likе what i scroll i scroll up like next
guess whos getting xed like next
guess whos getting xed
you made a choice thats your bad
single life aint so bad
but we aint finna go there
somethings off ill tell you why
guess whos goin to jail tonight
what a grand plan to sell you out
i could scream and shout let it out
see kanye west liveget tickets as low as 112you might also likeprechorus kanye west with marilyn manson
ill be honest we all liars
ill be honest we all liars
im pulled over and i got priors
guess we goin down guess whos goin to jail

chorus kanye west with marilyn manson
guess whos goin to jail tonight
guess whos goin to jail tonight
guess whos goin to jail tonight
god gon post my bail tonight

verse 3 dababy
man tell them haters open up the jail open up the jail
and you can tell my baby mamas get the bail money bail me
i said one thing they aint like threw me out like they aint care for me
threw me out like im garbage huh
and that food that yall took off my table
you know that feed my daughters huh mmm
but i aint really mad cause when i look at it
im getting them snakes up out my grass and  thats a good habit
im ready for war lets get at em
and teaming up aint gon help em
cause beating the odds too deep
just me and god   im good at it
matter of fact im great at it my cell phone back at it
i know these people gon try to tell me how to talk
dont know what i seen or what i was taught
my mama worked two or three jobs to take care of three of her kids my uncles watched
yeah we was raised by the crack addicts
mmm raised by the drug dealers killers and the junkies junkies
mama couldnt save us cause she had to get the—
mama couldnt save us cause she had to get the money
feel like your world falling getting too hard to catch it aint it
you and your girl arguin you dont like how she actin lately
giving it everything that you can give and you dont get half the patience
you was busy hustlin the things come with your hustle
they got in her head corrupted her
yeah thats probably what happened aint it
large amount of capital invested in myself
underground i aint even have a basement i read the affidavit
lets see what it is with you
only thing i did to you
was always keep it real and true
guilty guess they gon have to take me
chorus kanye west with marilyn manson
guess whos goin to jail tonight
guess whos goin to jail tonight
guess whos goin to jail tonight
god gon post my bail tonight34embed"
