id,song_name,artist_names,album_name,lyrics
2lcJWXNJUjjL3ycoZrpU2g,Big Tipper (feat. Lil Keed),"Young Thug, Lil Keed",1bnHPO4dKK7IjvgrtVBcQh,"54 contributorsbig tipper lyricsintro young thug
southside on the track yeah
808 mafia
hey

refrain young thug
i can tiptoe in her pussy like a loub chanel ayy
harriet tubman twenties weigh em up on the scale ayy
hair down to her ass caught her like odell hey
all my hoes get rollie pollies mines up on the shelf lets go

verse 1 young thug
kicked out the hotel we smoking gas who else nigga
flooded belt buckle like a wrestler yes nigga
better not try to tell me what you seen a nigga doin
she not fuckin with me then her life is probably ruined
we can leave america and we can make a movie
every single diamond on me dancing like a movie
make lil mama nut inside her pants just like a movie
abracadabra tight pussy need a toothpick
throw away the fives and some of the dimes and then i got twenties and up
i come with the vibes and some of the guys and i got a flooded patek
i peep how you slide i peep how you ride and now they goin off with your head
they know the rewards a hundred racks so they gon do all that they can
dont tell me you ridin if you not gon ride we dont got no time for that playin
we dont come disguised we gangsters for life my nigga we showin our hands
i had turned the vibe my lil wife shell never be single again
they hate and throw rice we richer for life i used to serve ice yikes hey
you might also likechorus young thug
big tipper big big dipper
king spiller bitch king dripper
king killer king godzilla
fuck her every week still aint seen me marshmello
king kuba king tut kuba
black truck pull up on you just like uber
okay i fuck her every night and she still aint seen my eyes ayy
i dont know the vibes so i introduce the ice

verse 2 young thug
my lil shawty hit a lick out a bando yeah
shawty came through bout tall as a man woah aw yeah
she wont come to you ask yes you can go hey
i got hitters on 175th chicago lets play
man the feds done got my ms up im gon on
she got hit by the whole gang her pussy jumped on woo
baby tell me what you prayin for uh uh
that shit cap cause im the real mccoy yeah
white diamonds on me bitch im pale
i got a baddie flyin out of israel
i kept like twenty pints of actavis double sealed
i keep some dubai shit on deck when im on chill hey

refrain lil keed  young thug
i can tiptoe in that pussy like a loub chanel ayy
harriet tubman twenties weigh em up on the scale ayy
hair down to her ass caught her like odell hey
all my hoes get rollie pollies mines up on the shelf lets go keed talk to em
verse 3 lil keed
yeah i throw them racks on the blade
my baby she mad want me stay out of there yeah
i drip this shit with lil gotit
we matching the shoes the belt yeah
niggas they know im the topic
they takin they shot like ref yeah
soon as you think you gon try me
they leaving you dead in your step
ridin round like the army we triplecross like kyrie
my ho want a percocet she pop more than you and me
man that pussy too wet i dont care if she dont wanna top me
and state your number i dont care if you dont call me
i want big racks im up early morning
these niggas big cat pussy yeah they tellin on you
yeah the hellcat roll up keed be ridin on em
wanna beef i pay the cash i aint got time for you no cap no cap

chorus young thug
big tipper big big dipper
king spiller bitch king dripper
king killer king godzilla
fuck her every week still aint seen me marshmello
king kuba king tut kuba
black truck pull up on you just like uber
okay i fuck her every night and she still aint seen my eyes ayy
i dont know the vibes so i introduce the ice11embed"
