id,song_name,artist_names,album_name,lyrics
6oaZvhLj3UqDjwbs67ozVO,Drive-Thru,Tenacious D,1AckkxSo39144vOBrJ1GkS,"10 contributorsdrivethru lyricsjb kage
kg yeah
jb lets go to the drivethru
kg oh good im starvin

vroom noise

employee may i help you
jb yeah um uh
emp can i have your order
jb yeah hold on a second im looking at the menu
emp okay
jb ah
emp would you like to buy some curly fries
jb please dont dont offer me anything ill ill tell you want i want
emp okay
jb um okay you know how you got the sixpiece nuggets
emp yes sixpiece chicken nuggets
jb just uh can you just give me four nuggets im trying to
emp it comes in six or twelve piece would you like to try them
jb shut up and listen to my order take the six nuggets and throw two of them away im just wanting a four nugget thing im trying to watch my calorie intake
emp it comes in six or twelve piece
jb put two of them up your ass and give me four chicken mcnuggets
emp alright four sixpiece nuggets
jb and then um can i have a junior western bacon chee a junior western bacon chee im tryin to watch my figure
emp western bacon cheeseburger
jb a junior western bacon chee
emp would you like that with onions
jb no onions um
emp okay junior bacon cheeseburger twelvepiece chicken nuggets
jb and um im gonna go with a filet of fish sandwich since that has less calories cause its fish
emp filet o fish
jb now if you could take a cocacola and just go half cocacola half diet coke cause im trying to watch my figure tryin to lose some of the weight
emp you want half half cocacola half diet coke
jb um and a small a small chocolate shake because im trying to watch my figure not a large a small
emp it comes in mediumsmall or mediumlarge small chocolate shake
jb um also a small seasoned curlies small seasoned curlies
emp okay i got small seasoned curlies western bacon cheeseburger
jb okay um fuck my ass what else give me uh alright cherries jubilee and thats it
emp 1001
jb wait kage what do you want
kg uhh geez let me have uhh i think i want the regular uh western bacon cheeseburger large shake um seasoned curlies
jb oh god come on with the order take forever
kg thats all i want thats all i want
jb good how much is that sir
emp that will be 1475 at the window please please drive up
jb to kg do you have any money
kg oh shoot umm oh god yeah su yeah i got like
jb give it to me
kg alright here
jb mmkay we only have uh alright im gonna need to cancel the last two things on the order
emp okay thank you
jb okay thank you lets go
see tenacious d liveget tickets as low as 76vroom noiseembed"
