id,song_name,artist_names,album_name,lyrics
4X13MIZR2P4mon0udxgKhW,Knockin' Heads Off,"Lil Jon & The East Side Boyz, Jadakiss, Styles P",4htcOW08TqINNLbcSf9esI,"10 contributorsknockin’ heads off lyricsintro lil jon  jadakiss
yeah yeah ok ok motherfucker motherfucker
yall know who it is who is it
lil jon them motherfuckin east side booooyz yeah yeah
i got my nigga jadakiss with me too dblock live son
we gon do this for all the real motherfuckin niggas
uh uh uh uh yo
holla at them niggas j come on

verse 1 jadakiss
yeah kiss name known matter fact kiss name blown
and bitches always wanna hit me like i just came home
but i still put the tools in ya mouth
niggas know that im a monster on the east but im huge in the south
this is evil in the trenches and everybody starvin
so to get the money right we put the deisel on the benches
down bottom feel like the ol days
fuckin with the corn liquor ridin around listen to ojays
when we loadin the clip every slug gotta catch
when you goin to war every thug got his match
ss babyblue impala with the mack in it
big gold cup with rhinestones with my pack in it
its like the jungle but the broads is fine
and if they aint puffin crippie then this georgia fine
listen im the wrong nigga to style with
my motherfuckin problem to reconcile with
nigga what
you might also likechorus lil jon
we knockin heads off yeah
we knockin heads off yeah
we knockin heads off motherfuckin heads off yeah
we knockin heads off yeah
we knockin heads off yeah
we knockin heads off motherfuckin heads off yeah
you wanna go nigga
lets go ho
you wanna go nigga
lets go ho
you wanna go nigga
lets go ho
you wanna go nigga
lets go ho
whatwhatwhatwhatwhat

verse 2 lil jon
we lettin it go nigga
lets go ho
we lettin it go nigga
lets go ho
we lettin it go nigga
lets go ho
whatwhatwhatwhatwhat
pussyniggaslay itdown
me and myniggasfixinclown
pussyniggaslay itdown
me and myniggasfixinclown
we throw ourfuckinclick up
we give a fuck if you dontlike us
we throw ourfuckinclick up
we give a fuck if you dontlike us
dontlikethemniggas
cantstandthatbitch
dontlikethemniggas
cantstandthatbitch
wellshut theclub down
if yallniggaswanna clown
wellshut theclub down
bitchsaysomething now
chorus lil jon
we knockin heads off yeah
we knockin heads off yeah
we knockin heads off motherfuckin heads off yeah
we knockin heads off yeah
we knockin heads off yeah
we knockin heads off motherfuckin heads off yeah
you wanna go nigga
lets go ho
you wanna go nigga
lets go ho
you wanna go nigga
lets go ho
you wanna go nigga
lets go ho
whatwhatwhatwhatwhat

interlude lil jon
whaaaatwhaaaaat
yall know when the beat breakdown and shit
whats up whats up
its time to get motherfuckin buck wild in this biiiitch
now this what i want yall niggas to do whats up
all the real niggas and ladies out there ok
yall need to repeat after me right now
verse 3 lil jon
i aint scared of no nigga i aint scared of no bitch
i aint scared of nobody in ya motherfuckin click
i aint scared of no nigga i aint scared of no bitch
i aint scared of nobody in ya motherfuckin click
man fuck that shit nigga fuck that shit man
man fuck that shit nigga fuck that shit man
man fuck that shit nigga fuck that shit man
man fuck that shit nigga fuck that shit

chorus lil jon
we knockin heads off yeah
we knockin heads off yeah
we knockin heads off motherfuckin heads off yeah
we knockin heads off yeah
we knockin heads off yeah
we knockin heads off motherfuckin heads off yeah
you wanna go nigga
lets go ho
you wanna go nigga
lets go ho
you wanna go nigga
lets go ho
you wanna go nigga
lets go ho
whatwhatwhatwhatwhat

bridge lil jon
yeah bme ho we up out this bitch
ruff ryders ho whats up
but before we leave
i gotta let my nigga tell you his name

verse 4 styles p
im holiday styles where the fuck you thuggin at
i knock off ya head with a louisville slugger bat
pll go to war and aint never have to bring a nigga
my gun is armed and my bullets like a finger nigga
call up lil jon and them east side boyz
all i need is a lil bomb and them east side toys
you can catch me in the dirty south i got a dirty mouth
sittin on the roof with the fuckin 3030s out
i told you im a menace yall
i got enough guns to fill up the lennox mall
in the front parking lot coke still movin good
guns still sparke a lot
hustlin with family partyin with murderers
dblock and everything shit you probably heard of us
yeah im a ryder nigga you aint got a gun
or a motherfuckin knife you aint even gon try us
ill leave you with a hole daddy
and for the fact that im in the dirty south
ill be bouncin in the old caddy
what  motherfucker1embed"
