id,song_name,artist_names,album_name,lyrics
34UfbFy1jckcIwmbymvqwx,Panty Droppa - Intro,Trey Songz,44jrX3SThj7pFjOzUTLm85,"10 contributorspanty droppa intro lyricsintro
this right heres a panty dropper
whoa oh whoa oh oh oh oh oh
this right heres a panty dropper
whoa oh oh oh yeah whoa oh
this right heres a baby maker
can i sing my song

verse 1
if you up in the club tryna get a rub
then you need to tell the dj to put this song
putputputput this song put this song on
let me tell you what it is put away the kids
time to get it up get a cup fill it up
feeling on her booty touching on her butt
time to get her back to the crib beat it up

prechorus
we been spending time wanna make you mine oh oh
when youre not around youre still on my mind oh oh
and i hope this aint surprising that i been fantasizing
this aint no joke let me clear my throat ahem

chorus
i wanna make love to you
this right heres a panty dropper
this is my panty dropping love song
nothing but your heels on loving you
this right heres a baby maker
and well be making babies tonight
i wanna make love to you
this right heres a panty dropper
this is my panty dropping love song
nothing but your heels on loving you
this right heres a baby maker
and well be making babies tonight
see trey songz liveget tickets as low as 87you might also likeoutro
im ready2embed"
