id,song_name,artist_names,album_name,lyrics
7kwnOwh31BLpdSzgXgNS2D,Bruce Wayne - Outro,Takeoff,5XRCcUfwtLNQflDd9cfz4U,"38 contributorsbruce wayne outro lyricsintro
its bigger than what you thought it was
can you picture me rollin
haha
that boy cass

verse 1
i bet they know the name and the game game
whats a 28 we roll out the whole thing thing
order up a hundred ice trays for the gang gang
bruce wayne batmobile oneofone from spain oneof
order up a hundred ice chains for the gang icy
courtside we sit front row at ball games bron james
that wraith a widebody so i hog up all lanes skrrt
niggas they want clout thats a shame they want fame sad
before the bad and boujee been on flame
they say they love those songs dont know the group name how
i was thinkin of goin and buyin my bitch a birkin what happened
got me second guessin now but it might be worth it i dont know
this shit aint worth it she do this shit on purpose i dont know
i was nervous remember when she curved me curved
remember that first time i stepped on the stage i was nervous nerve
had butterflies in my stomach blrrt
i wanted to vomit blah
i was nervous
you might also likeinterlude
nah for real keep it a hundred
thats how i feel

verse 2
i ball james worthy ball ball ball
told her she can have it all gotta make sure that she worthy worthy
bitches and chickens all in my livin room brrt
two twins kissin do what i tell em do two twins
hollywood bitch in the kitchen cookin chicken soup whip it
they aint asian but eat rice more than asia do molly
i aint gon tell em how much to take gon do what they gon do
tryna talk my head off but bae this aint no interview
when i pour up i dont wanna speak or conversate with you
i know i told you lies before but right now ima tell the truth

bridge
the lion in the jungle but i still remain humble
get the sack might tumble it but i aint gon fumble
you gotta know me to understand me

verse 3
i just took a trip to kansas kansas
pour a four pop a xanny xanny
she a thottie but a baddy baddy
they will never understand me stand me
niggas we high demandin know that
nigga we high demandin know that
the gang we high demandin price
they will never understand it no
outro
i remember the backend wasnt big enough
now we seein more blue than bonnie

there is theres a world out there start the cameras wow thats very very reassuring what were seeing here couldnt have done it better myself so more than 24 miles up successful after all this training all this work all this time there is the capsule the data and the picture there their stratos capsules altitude is at families celebrating 104 thousand feet and our guardian angel will take care of it3embed"
