id,song_name,artist_names,album_name,lyrics
3SktMqZmo3M9zbB7oKMIF7,Gravity,John Mayer,1Xsprdt1q9rOzTic7b9zYM,"48 contributorsgravity lyricschorus
gravity is working against me
and gravity wants to bring me down

verse 1
oh ill never know
what makes this man with all the love that his heart can stand
dream of ways to throw it all away

chorus
woah woah
gravity is working against me
and gravity wants to bring me down

verse 2
oh twice as much aint twice as good
and cant sustain like one half could
its wanting more thats gonna send me to my knees

guitar solo

repeat verse 2
oh twice as much aint twice as good
and cant sustain like one half could
its wanting more thats gonna send me to my knees
see john mayer liveget tickets as low as 99you might also likechorus
woah woah
gravity stay the hell away from me
woah woah
gravity has taken better men than me
now how can that be

outro
just keep me where the light is
just keep me where the light is
just keep me where the light is
come on keep me where the light is
come on keep me where the light is
come on keep me where now keep me where the light is58embed"
