id,song_name,artist_names,album_name,lyrics
0d8ONGx43ZprlHlmLZODpD,"Analog 2 (feat. Tyler, The Creator, Frank Ocean & Sydney Bennett)","Odd Future, Tyler, The Creator, Frank Ocean, Syd",7ibEo7IK9E9mi2sU5rJNDC,"82 contributorsanalog 2 lyricspart i  analog 2

intro tyler the creator
yeah yeah yeah yeah yeah

verse 1 tyler the creator
bitches think im crazy but im normal
i just come off as a psycho maniac when im performin
thats an act so i wont bore you to death cause i adore you
and its the summer so yeah

chorus tyler the creator
can you meet me by the lake
at the park or in your room yeah
can you meet me by the lake
at the park or in your room yeah

verse 2 tyler the creator
you can bring your bitches ima bring my niggars
you can practice liking i ima practice that guitar baby
its summer camp golf wang where the talking trees are shit
you and your girls can roll if you yeah

chorus frank ocean
can you meet me by the lake
at the park or in your room
can you meet me by the lake
at the park or in your room yeah
you might also likebridge frank ocean  tyler the creator
if you meet me by the pier bring the beer we can menage
ooh your girlfriend nicki gots the back i like to massage yeah
ill be in the city with them actresses
the nissan is down there in the bottom of the lake yeah
ill make sure we have a good time a good time around 10
ill make sure it’s a good time a good time for you i said around 10

chorus tyler the creator  frank ocean
can you meet me by the lake
at the park or in your room
can you meet me by the lake
at the park or in your room

verse 3 tyler the creator  frank ocean
lovesick where’s the clinic aid
we’re young fun is what we’re having
fuck it pour a glass of lemonade
it’s snowcone and pop tarts i got and i got you snowcones pop tarts
let me take a dip and you can take a break
that’s only if you meet me by the lake yeah

outro frank ocean  tyler the creator
could you meet me by the lake around ten around 10 yeah
could you meet me by the lake around ten around 10 yeah
part ii  wheels 2

chorus tyler the creator  syd
meet me at the lake round ten ten come through
just meet me at the lake round ten ten its cool to kick it
meet me by the lake at ten
if im not there just call call
and if you need a way there
ill ride you on my handle bars
meet me at the lake round ten ten come through
meet me at the lake round ten ten its cool to kick it
meet me by the lake at ten
if im not there just call
and if you need a way there
ill ride you on my handle bars

bridge syd  tyler the creator
kissing under moonlight
i can bring you to our treehouse
well be fucking on the rooftop
if youre not down we can just make out

interlude tyler the creator
uh bitch uh
uh uh
said baby im a bitch
uh uh okay
chorus tyler the creator  syd
meet me at the lake round ten ten come through just call 
just call me play with your feathers
meet me by the lake at ten
if im not there just call
and if you need a way there
ill ride you on my handle bars

outro tyler the creator
so come along
just me and you and like nature
bring a life jacket
cause youre gonna need it
so go ahead take a dip
the waters pretty deep39embed"
