id,song_name,artist_names,album_name,lyrics
3pQYf90V5idOGrXzosm9rt,Se Amerita,Junior H,0HANqWtJABVpAWVrQzE2XM,"6 contributorsse amerita lyricsletra de se amerita

verso 1
y el cielo tocar una cessna para pilotear
y en un rzrsón pa las rutas un polvaderón
y un buen caballón pa pasear a una dama que traigo yo
la banda llegó y mi compadrito ya se enfiestó

estribillo
claro que se amerita en mi rostro una sonrisa
la mala racha pasó
claro que se amerita festejar por esta vida
saludos para el señor

posestribillo
vallarta y culichi y tijuana pa dar el rol

interludio
y se amerita compita steve
porque es lo que me falta
puro junior h
fierro ahístamos

verso 2
junto a mi carnal no es de sangre pero demostró lealtad
y eso vale más que hablar y cuando toca echarse pa atrás
y en un rubicon mejor duro para cualquier situación
por ahí andan dos que me cuidan y me brindan protección
see junior h liveget tickets as low as 123you might also likeestribillo
claro que se amerita en mi rostro una sonrisa
la mala racha pasó
claro que se amerita festejar por esta vida
saludos para el señor

posestribillo
vallarta y culichi y sonora pa dar el rolembed"
