id,song_name,artist_names,album_name,lyrics
4VDqjSacuRvunZwbsu1WLP,Fantasy,The xx,6tzQKMilI02kn1lzLklDI8,"10 contributorsfantasy lyricsverse oliver
for the desired effect
would you come back august or june june
and i hate that tomorrows too soon
but this collision came midbloom
better built to resume
ill see you august see you june
im building higher than i can see
i want fantasy
dont rest with the less
im burning to impress
its deep in the middle of me
i can be fantasy
instrumental outroyou might also like3embed"
