id,song_name,artist_names,album_name,lyrics
4lH6nENd1y81jp7Yt9lTBX,Solo,Future,7K6OykPbezfgKgBufihn6X,"86 contributorstranslationsportuguêssolo lyricsintro
talk to me

refrain
i dont wanna let you down i dont wanna let you down
i dont wanna let you down i dont wanna let you down

interlude
you see how we living yeah
im tryna keep it as simple as possible
you know what i do
haha

verse 1
get you gucci on sight yeah rollies on ice yeah
get first class flights yeah ride it like a bike yeah
get a brand new wag ayy be quiet dont brag hey
never pump gas hey nigga keep it on task yeah
peelin off flex hey keep it on track hey
fussin and fightin yeah fuckin all night ayy
gotta make it count yeah love it when it bounce yeah
girl thats tight yeah you do whatever you like yeah
gucci on sight yeah rollie on ice yeah
take my advice ayy live a better life

chorus
you got maids right now you got it made right now
i wont let you down i wont let you down
like 4 right now its like 4 right now
like 4 right now its like 4 am right now
we cant be too discrete niggas gon know right now
got my name too big everybody know right now
i enjoyed our time we been on the low for a while
i been solo now ive been going solo now
you might also likeverse 2
twenty ounce steaks hey cant fit it on the plate
jumbo shrimp hey straight out of the lake hey
sleeping on the boat ayy wake up take dope ayy
you dont want no smoke nigga dont want no starch ayy
we gon put it on the hood ayy before we put it on god hey ayy

chorus
you got maids right now you got it made right now
i wont let you down i wont let you down
like 4 right now its like 4 right now
like 4 right now its like 4 am right now
we cant be too discrete niggas gon know right now
got my name too big everybody know right now
i enjoyed our time we been on the low for a while
i been solo now ive been going solo now

postchorus
solo now
eeverybody know right now
ive been going solo now

bridge
bands on your tags woo aint got bags woo
i wont let you down bet i wont let you down
bands on your tags woo aint got bags woo
i wont let you down bet i wont let you down
refrain
i dont wanna let you down i dont wanna let you down
i dont wanna let you down i dont wanna let you down
i dont wanna let you down i dont wanna let you down
i dont wanna let you down i dont wanna let you down no way
i dont wanna let you down i dont wanna let you down
i dont wanna let you down i dont wanna let you down

outro
niggas gon know right now
everybody know right now
we been on the low for a while
i been going solo now
thank you for your time18embed"
