id,song_name,artist_names,album_name,lyrics
36MtCkr8m1HnLYu20Lfyuj,Somethin' That Makes You Smile,Dustin Lynch,2u0DD4sNHOcgbuJrJyMUu3,"3 contributorssomethin’ that makes you smile lyricsverse 1
maybe its drinkin a glassbottle coke
from petitts on 5th and main
or turnin a wrench on a softtop jeep
on a shade tree sunny day
youre only here for a little while
do somethin that makes you smile

verse 2
if its roundin up beerdrinkin buddies
to tell stories you always tell
or a threedollar ticket under friday night lights
to see a home team give em hell
youre only here for a little while
do somethin that makes you smile

chorus
whatever it is you better get to it
when you got the time you gotta use it
the road runs out so take it slow
when them good times roll man let em roll
youre only here for a little while
so do somethin that makes you smile

verse 3
for me its callin in sick to work
and takin grandpas tackle box
down to that same old fishin hole
where he taught me how to tie a knot
i aint done that in a little while
and thats somethin that makes me smile
see dustin lynch liveget tickets as low as 30you might also likechorus
whatever it is you better get to it
when you got the time you gotta use it
the road runs out so take it slow
when them good times roll man let em roll
youre only here for a little while
so do somethin that makes you smile

bridge
those little things
aint little things
those little things
those are everything

chorus
whatever it is you better get to it
when you got the time you gotta use it
the road runs out so take it slow
when them good times roll man let em roll
youre only here for a little while
yeah youre only here for a little while
so do somethin that makes you smile

outro
yeah yeah
ohembed"
