id,song_name,artist_names,album_name,lyrics
6eP67LCz5MXe5gFJM0bUHr,Aquí Me Quedaré,Banda Los Recoditos,6BmzjJPjWBVfTwbKMFdTUs,"1 contributoraquí me quedaré lyricsenfadado de curar siempre la herida
aunque tenga la razón es culpa mía
permitir que tu me muevas a tu antojo
que mi orgullo este muriendo poco a poco

harto de seguir siempre a tu espalda
de seguir a tus desprecios que me matan
hasta aquí llego tu juego y no hay remedio
si tu no vienes no regreso lo prometo

y aquí me quedare
bebiéndome el recuerdo de las noches que te ame
tirado en este orgullo que me tiene aferrado
si no vienes yo no voy
que me tiene estacionado en la tristeza y el dolor
y así yo seguiré no importa que me duela
aunque me aguante este querer
yo se que en esta pena me castigo
y me emborracho por la ausencia de tus besos
pero yo no me rajo yo no sigo mas tu juego

y aquí me quedare
bebiéndome el recuerdo de las noches que te ame
tirado en este orgullo que me tiene aferrado
si no vienes yo no voy
que me tiene estacionado en la tristeza y el dolor
y así yo seguiré no importa que me duela
aunque me aguante este querer
yo se que en esta pena me castigo
y me emborracho por la ausencia de tus besos
pero yo no me rajo yo no sigo mas tu juego
you might also likey así yo seguiré extrañándote
y aquí me quedaré esperándoteembed"
