id,song_name,artist_names,album_name,lyrics
5w3faWGjZFbTXkPXLAATkC,Already Taken,Trey Songz,3sDoSYf2AKB2IegZmkISGD,"13 contributorsalready taken lyricsintro
songbook songz for you
yeah come on

refrain
every night up in the club getting money with the thugs
thought id never fall in love and then there was you
and i dont wanna be a player no more
every night in the club tricking with a different girl
thought id never fall in love then i met you
girl you changed my mind

verse 1
one look and just one touch
and i knew she was the girl for me like no other i had seen
they say that im tripping but i know what i want
this girl here is different she got something that they dont yeah

hook
she might be my lover
she makes me want no other
she dont care if i go to the strip club she wanna go too
and i never met a girl like you that makes me want to settle down
they throwing me that booty im already taken
theres a lot of girls up in this club but baby im taken
throwing that good ol groupie love im already taken
and its hard as a man but i know i can baby im taken
see trey songz liveget tickets as low as 87you might also likeverse 2
shes the apple of my eye keep that body on time
i know im a player but she might be mrs right
plus that girl told me if i ever do wrong
i can have all the money all the keys from that day on shes through with me

hook
she might be my lover
she makes me want no other
she dont care if i go to the strip club she wanna go too
and i never met a girl like you that makes me want to settle down
they throwing me that booty im already taken
theres a lot of girls up in this club but baby im taken
throwing that good ol groupie love im already taken
and its hard as a man but i know i can baby im taken

refrain
every night up in the club getting money with the thugs
thought id never fall in love then there was you
and i dont want to be a player no more
every night in the club tricking with a different girl
thought id never fall in love then i met you
girl you changed my mind

chorus
so when they throwing me that booty im already taken
so hard to look the other way but baby im taken
i dont want to be a player im already taken
no more no more baby im taken
bridge
none of these chicks cant fuck with my baby
none of these chicks cant fuck with my baby
aint none of these chicks cant fuck with my baby
no fuck with my baby no
fuck with my baby no
none of these chicks cant fuck with my baby
none of these chicks cant fuck with my baby nuh uh
none of these chicks cant fuck with my baby
fuck with my baby fuck with my baby

chorus
im already taken
i dont want to be a player baby im taken
i just want to love my baby im already taken
no more im already taken girl yeah
im already taken girl yeah
im already taken girl yeah
im already taken girl yeah7embed"
