id,song_name,artist_names,album_name,lyrics
6AahQ5P0KbDLt702Fm1VHR,Billy Ocean (feat. Fat Joe & Raekwon),"DJ Khaled, Fat Joe, Raekwon",3HhZbSJdhOqMSaRbEt3gtw,"48 contributorsbilly ocean lyricsintro dj khaled
dj khaled

chorus fat joe
from the mud to the marble floors minks galore
hustlin on the corners now we own the stores
fuck a million dollars boy i need a billi for sure
chchchcheer tuckin billy ocean billy ocean
more billys more problems
we got too many ways to solve em
my life is like a movie that made the oscars
turned a key into a billion dollars billy ocean billy ocean

verse 1 fat joe
i got my car back im john wick
the sky blue tint come equipped with the convicts
the dons slick some billys we gon get
broke a leg in my debut no bogut crack get em uh
talkin sports trades with pecas
while sides cheat on their husbands those be the best vibes
satin grain on the hood of the car
switch lanes yeah i used to flood the hood with them jars
you can get a taste for a flat out key
cause nowadays im klay see my spot up 3
draped in hermes scarves crusing the riviera
more solid than gold bars the billy era
you might also likechorus fat joe
from the mud to the marble floors minks galore
hustlin on the corners now we own the stores
fuck a million dollars boy i need a billi for sure
chchchcheer tuckin billy ocean billy ocean
more billys more problems
we got too many ways to solve em
my life is like a movie that made the oscars
turned a key into a billion dollars billy ocean billy ocean

verse 2 raekwon
hermes sweatsuits and scoupes
fly around nba money in jets too
back of the bags all crunched out we vexed too
shouldve been billys in 92 line who the shines new
yeah its sorta like a mafia movie
sit back rocky and groovie with the 92
silk pieces in velezs sneakers
a duffle bag with handcuffs on it we creatures
ayo runnin every strip club lit love
yeah we sit around and just drip bub the homies get piff love
to all the realest ones and rich thugs
one my hundred niggas billy we gun on niggas

chorus fat joe
from the mud to the marble floors minks galore
hustlin on the corners now we own the stores
fuck a million dollars boy i need a billi for sure
chchchcheer tuckin billy ocean billy ocean
more billys more problems
we got too many ways to solve em
my life is like a movie that made the oscars
turned a key into a billion dollars billy ocean billy ocean
instrumental outro4embed"
