id,song_name,artist_names,album_name,lyrics
1eR7O53nKjPk58DYEinO0Y,Where My Money (I Need That),Rick Ross,42T8qfRs7jdpInsSk6nDJk,"15 contributorswhere my money i need that lyricshook
where my money i need i need i need cash
nigga where my money i need i need i need cash
where where where where my money i need i need i need cash
nigga where where my money i need i need i need cash
where where where where my money
you dont wanna be the one i blast ross
where where where my money
you dont wanna be the one i blast ross
where where where my money
you dont wanna be the one i blast ross
where my money you dont wanna be the one i blast ross

verse 1
never try me like a thug
if you do you better duck
imma hit him in his body somebody patchin him up
imma bust a nigga head somebody wrappin him up
when i ask you for my shit nigga am i askin too much
ridin dirty in my seven deuce
its dirty you can tell the truth
im dirtier than a reverend fightin internal revenue
imma get mine you can call me uncle sam
use you for your services than i dont give a damn
slap bush with my cash all these taxes and his gas
got these bitches sellin ass homicide for the cash
homicide for the cash ride around gunnin mass
summer time son of sam triple cs gon gun you down
twenty birds imma serve posted up on this curb
got a lot of pistol game so we at ya everyday
if you owe me a dime boy you better give me mine
cause im pullin my nine with one thing thats on my mind
see rick ross liveget tickets as low as 117you might also likehook
where my money i need i need i need cash
nigga where my money i need i need i need cash
where where where where my money i need i need i need cash
nigga where where my money i need i need i need cash
where where where where my money
you dont wanna be the one i blast ross
where where where my money
you dont wanna be the one i blast ross
where where where my money
you dont wanna be the one i blast ross
where my money you dont wanna be the one i blast ross

verse 2
still waitin on the call homie post to be my dawg
it done been more than a week he caught himself runnin off
yeah he bought two but i fronted another three
but imma get him marked off for no less than a quarter key
yeah i broke him off now i gotta break him off
he think he usin his head i gotta take it off
that boy losin his head then im takin off
mashin in the grand national wont break it off
let me break it down
i see fifty off a chicken every time i break it down down
bad little bitches shakin it when they break it down down
let me break it down i broke it down to the smallest slab
cause im so fat got the fiends callin cabs
im out here for my stacks
im out here for my stacks
from the side of the bridge
you gotta cross the tracks
dade county dboys at your front door ross
three in the mornin and you know why they knockin for ross
hook
where my money i need i need i need cash
nigga where my money i need i need i need cash
where where where where my money i need i need i need cash
nigga where where my money i need i need i need cash
where where where where my money
you dont wanna be the one i blast ross
where where where my money
you dont wanna be the one i blast ross
where where where my money
you dont wanna be the one i blast ross
where my money you dont wanna be the one i blast ross

verse 3
im like a professor i weigh and i measure
triple beam on the dresser couldnt be fresher
cookin is my pleasure cookies is my treasure
hustle couldnt be better muscle you couldnt measure
niggas feelin the pressure pressure they bust pipes
im cool wit your bitch your bitch fuck nice see i need that
fly hoes on my team see i need that my hoes will gimmie anythin
grindin back in savannah climbin back through atlanta
shoot through macon see what’s shakin my shit white as miss vanna
its rick ross rollsroyce when i floss
imma big boss and i never took a loss see i need that
i might of took a loss but it wasnt like that ross
so im back on my grizzle got the streets on sizzle
its ricky rizzle the rich nizzle the rich nizzle now bitch
hook
where my money i need i need i need cash
nigga where my money i need i need i need cash
where where where where my money i need i need i need cash
nigga where where my money i need i need i need cash
where where where where my money
you dont wanna be the one i blast ross
where where where my money
you dont wanna be the one i blast ross
where where where my money
you dont wanna be the one i blast ross
where my money you dont wanna be the one i blast ross1embed"
