id,song_name,artist_names,album_name,lyrics
5Dj3Rmo9bmyXw48wTE2EGr,I Got Swag,50 Cent,4kaCrosmqvvrPUEAwcnC3s,"16 contributorsi got swag lyricsproduced by dual output

hook
i dont really think she want me back then she want me now
she can play games all she wants she cannot pretend she like my style
i got swag now i got paper im rolling in the dough im caked up
i got swag now i got paper im swimming in the dough im caked up

verse 1
i was a real bum now im really rich kid
i come through the hood in some really really sick shit
the rolls the roof gone your flows theyre lukewarm
its why youre not me nahnahnahnahnah
she like the kid my lifestyle what she wanting
bottle after bottle by the bar i be stunting
its gucci this gucci that gucci hat
big doofy gat hit you in your kufi hat
you know me i told your ass in 03 get rich or die
g5 i fly write my name in the sky
pick an island on the map i been to it
shorty wanna try anal her friends do it
wrists rocked up shining flawless diamonds
you could hardly see the face on my audemar time and
on that jt shit me im bringing sexy back
louis belt wrapped around right where the tec be at
see 50 cent liveget tickets as low as 87you might also likehook
i dont really think she want me back then
she want me now
she can play games all she wants
she cannot pretend she like my style
i got swag now i got paper
im rolling in the dough im caked up
i got swag now i got paper
im swimming in the dough im caked up

verse 2
getting papers my objective yup now your chain gone
one false move and clap now your brains gone
you like me you aight with me me im into me
i destroy my enemies even if theyre kin to me
do em like the kennedys chingching thats mo bread
say something slick out your mouth ill come for your head
she likes me more than you can imagine
bad bitch look like she fell up out a pageant
closest imma get to heaven in this lifetime
is right below her waist in between her thighs
call her pussycat thats my nickname for her
and i aint got to buy shit or run game on her
see when i stunt she stunt we stunt together
oh you dont like how that sound aw nigga whatever
we both rock bugarri both push ferraris
i go so hard in the paint im sorry
hook
i dont really think she want me back then she want me now
she can play games all she wants she cannot pretend she like my style
i got swag now i got paper im rolling in the dough im caked up
i got swag now i got paper im swimming in the dough im caked up

bridge
you want me i want you  plug one plug two
im infinitely special girl
the lords gonna bless you if you do what i tell you to do
you want me i want you  you want a benz ill buy two
you should want me like you want success
girl with us together well be better than the best
why settle for less

hook
i dont really think she want me back then she want me now
she can play games all she wants she cannot pretend she like my style
i got swag now i got paper im rolling in the dough im caked up
i got swag now i got paper im swimming in the dough im caked up1embed"
