id,song_name,artist_names,album_name,lyrics
1F9Iuq2Y91v61lP8Yy7zIo,Love Hangover,Jason Derulo,0aVJmVAeEx78nAA1rAKYf7,"7 contributorslove hangover lyricsverse 1
uh i met her at a bar bar bar bar
the look she gave me said i wouldnt get far hey
but that aint never stop me me me me
see i like a challenge so i proceeded to speak hey

prechorus
one drink turned into two drinks two drinks
three drinks turned into dancing dancing
and pretty soon her body was all up on me on me
when i woke up i saw her laying next to me

chorus
it was just a fling
but i really dont regret a thing
cause it was crazy babe
and by the looks of it you feel the same
and all i remember is me saying oh oh
give it to me then you gave it oh oh
now im smiling and im barely sober oh
im caught in a love hangover hey
love hangover hey
love hangover

verse 2
dont you worry its fine fine fine fine
see this will be our little dirty secret for life hey
cause your man will lose his mind mind mind mind
if he ever found out last night that
see jason derulo liveget tickets as low as 26you might also likeprechorus
one drink turned into two drinks two drinks
three drinks turned into dancing dancing
and pretty soon her body was all up on me on me
when i woke up i saw her laying next to me

chorus
it was just a fling
but i really dont regret a thing
cause it was crazy babe
and by the looks of it you feel the same hey
and all i remember is me saying oh oh
give it to me then you gave it oh oh
now im smiling and im barely sober oh
im caught in a love hangover

bridge
now i didnt know i didnt know
how far itll go oh
but i said i would have her i said i would have her
now its the morning after

chorus
it was just a fling
but i really dont regret a thing
cause it was crazy babe crazy babe
and by the looks of it you feel the same you feel the same
and all i remember is me saying i remember me saying
give it to me then you gave it yeah yeah
now im smiling and im barely sober girl im smiling sober
im caught in a love hangover
im caught in a love hangover yeah
im caught in a love hangover
im caught in a love hangover
love hangover1embed"
