id,song_name,artist_names,album_name,lyrics
5SGGXFZF36L8JfZfJTqWf7,Don't Turn Around,Bonnie Tyler,0VJI3wpebzRyVHq0eZQidb,"4 contributorsdon’t turn around lyricsif you wanna leave
i wont beg you to stay
and if you gotta go darling
maybe its better that way
im gonna be strong
im gonna do fine
dont worry about this heart of mine
just walk out that door
yeah see if i care
go on and go now but

dont turn around
cause youre gonna see my heart breaking
dont turn around
i dont want you seeing me cry
just walk away
its tearing me apart that youre leaving
im letting you go
but i wont let you know

i wont miss your arms around me
holding me tight
if you ever think about me
just know that ill be alright
im gonna be strong
im gonna do fine
dont worry about this heart of mine
i know ill survive
sure ill make it through
and ill even learn to live without you
see bonnie tyler liveget tickets as low as 43you might also likedont turn around
cause youre gonna see my heart breaking
dont turn around
i dont want you seeing me cry
just walk away
its tearing me apart that youre leaving
im letting you go
but i wont let you know

i wish i could scream out loud
that i love you
wish i could say to you
dont go dont go dont go but

dont turn around
cause youre gonna see my heart breaking
dont turn around
i dont want you seeing me cry
just walk away
its tearing me apart that youre leaving
im letting you go
but i wont let you knowembed"
