id,song_name,artist_names,album_name,lyrics
1fCeXjoRExPP2qwSBh2aST,Black & White,Juice WRLD,6tkjU4Umpo79wwkgPMV3nZ,"105 contributorstranslationsespañolрусскийitalianofrançaisnederlandsdeutschblack  white lyricschorus
im in my black benz uh
doing cocaine with my black friends uh
well be high as hell before the night ends yeah
oh well be high before the night ends
before the night ends
switch up to the white benz okay
doing codeine with my white friends uh friends
well be high as hell before the night ends yeah uh
before the night ends woah
before the night begins woah

verse 1
lord have mercy uh hey
i know that these perkys finna hurt me ayy hey
sometimes i feel like they doing surgery ayy ayy hey
tell me are they working are they working
are they working are they working
tell me are they working uh ayy working
i party too damn much uh too much
ayy and you niggas cant keep up huh
im getting too fucked up yeah
too fucked up yeah im too fucked up yeah
wont look up til the sun come up okay
pills with the hennessy i might throw up said i might throw up
i might throw up said i might throw up
ill be okay
you might also likechorus
in my black benz uh
doing cocaine with my black friends uh
well be high as hell before the night ends yeah
oh well be high before the night ends
before the night ends ends
switch up to the white benz uh okay
doing codeine with my white friends uh friends
well be high as hell before the night ends yeah uh
before the night ends woah
before the night begins woah

verse 2
everydays a party dont let no one tell you different different
no lames allowed you should really keep your distance yeah
smoking on loud and that codeine i sip yeah
pouring up this purple shit until its in my piss yeah yeah yeah yeah
rip to prince we got purple rain on deck lean
she love bobby brown so we keep the caine on deck lean
there be haters round keep an ak on deck lean
man down man down on ooh ooh yeah
party animals im a lion in the zoo yeah
party animals im a lion at the zoo yeah yeah
party animals im a party animal party it off

chorus
in my black benz uh
doing cocaine with my black friends uh
well be high as hell before the night ends yeah
oh well be high before the night ends ends
before the night ends before the night ends yeah
switch up to the white benz uh okay
doing codeine with my white friends uh friends
well be high as hell before the night ends yeah uh
before the night ends woah
before the night begins woah
outro
before the night begins
before the night begins49embed"
