id,song_name,artist_names,album_name,lyrics
2jnZUvhw2LTvDI6YidRVcO,Llamado de Emergencia,Daddy Yankee,7JeWY0pvC27pCgn5eiSeV6,"17 contributorstranslationsenglishdeutschllamado de emergencia lyricsletra de llamado de emergencia

intro
atención a todas las unidades
llamado de emergencia del sistema 911
hombre moribundo con aparente ataque cardíaco
necesitamos asistencia de inmediato en el área

coro
ven y sana mi dolor
tienes la cura de este amor de este amor
hago este llamado para que tú vuelvas
¿tú no ve que estoy sufriendo es muy dura esta prueba

postcoro
hay un hombre moribundo aquí
dime quién lo puede revivir
hay un hombre moribundo aquí
dime quién lo puede revivir

puente
tú tienes la receta la fórmula secreta
para poner en ritmo mi corazón
no existe medicina doctore ni aspirina
para el dolor que siente mi corazón
you might also likeverso 1
casi no siento mis pálpitos
al rescate que venga la paramédico
necesito que me de un electroshock
eheh de tu calor
tu suero de cariño es lo que me toca
quiero que me de respiración boca a boca
y que la camilla sea nuestra camita
hay un hombre caído que a ti te necesita ay ombe

precoro
ven aquí rápido ven aquí rápido
e un llamado de emergencia baby
ven aquí rápido ven aquí rápido

coro
ven y sana mi dolor
tienes la cura de este amor de este amor
hago este llamado para que tú vuelvas
¿tú no ve que estoy sufriendo es muy dura esta prueba

puente
y abrázame y dime que me amas
abrázame y dime que me amas
quédate
ey y dale alivio a mi alma inyéctale calma
quédate
eh ¿qué tú no ve que por tu amor yo me muero ma
verso 2
sin ti mi camino se desaparece
sin ti las espina son las que florecen
sin ti yo no vivo
sin ti no se escribe la historia del amor
sin ti mi poema se queda sin verso
sin ti no ilumina la estrella en mi universo
mis signos vitale van disminuyendo
ven por favor

precoro
ven aquí rápido ven aquí rápido
e un llamado de emergencia baby
ven aquí rápido ven aquí rápido

coro
ven y sana mi dolor
tienes la cura de este amor de este amor
hago este llamado para que tú vuelvas
¿tú no ves que estoy sufriendo es muy dura esta prueba

interludio
ven aquí rápido ven aquí rápido
ven aquí rápido ven aquí rápido
ven aquí rápido ven aquí rápido
ven aquí rápido ven aquí rápido
outro
control necesitamos asistencia en el área
lo estamos perdiendo lo estamos perdiendo
control se nos va se nos va se nos va se nos va4embed"
