id,song_name,artist_names,album_name,lyrics
0zqy3ss4CwD6u4QPksS0nI,8 Out Of 10,Drake,1ATL5GLyefJaxhQzSPVrLX,"213 contributors8 out of 10 lyricsintro drake
too rich for who yall just got rich again
who grips the mic and likes to kill they friends
ive never been the type to make amends
if shit was at a eight we like to we like to we like to—
yeah if shit was at a eight we like to make it ten
1da sent this in im goin up all the way
i dont like to talk when theres nothin else left to say true

chorus drake
drizzy bout to drop the game is in disarray
id tell you hear me out but we both know end of the day
your sister is pressin play your trainer is pressin play
your wifey your wifey your wifey your wifey— true

verse 1 drake
i gotta breathe real deep when i catch an attitude
i got a whole nother level that i can tap into
max said they only blessed when they attached to you
the only deadbeats is whatever beats i been rappin to true
and the product is still the best though
its only good in my city because i said so
just to fit the estate man i had to copperfield like presto
voilà tada true

bridge drake
never a matter of could i or should i
kiss my son on the forehead then kiss your ass goodbye
as luck would have it ive settled into my role as the good guy
i guess luck is on your side
i guess luck is on your side
all sevens no sixes rest easy get some shut eye
hold on hold up but i—
see drake liveget tickets as low as 90you might also likeverse 2 drake
miss makin em pay
helipad from will smith crib straight to the stage
three forum shows but i played staples today
the neighborhood is smokey yall stay safe in this place true

chorus drake
drizzy bout to drop the game is in disarray
id tell you hear me out but we both know end of the day
your niggas is pressin play your nanny is pressin play
your wifey your wifey your wifey your wifey— true

verse 3 drake
had to go and hit reset now we here
i been on top for three sets of three years
i cant be around the niggas you minglin with
i cant fly if i could sit on the wing of that shit true
i try to pay it less mind
they been keepin tabs on me like im payin next time
i think i sense a little fear from the other side
white vans parked across the street real subtle guys true

bridge drake
yeah never a matter of could i or should i
kiss my mom on the forehead then kiss your ass goodbye
as luck would have it ive settled into my role as the good guy
i guess luck is on your side
i guess luck is on your side
all sevens no sixes rest easy get some shut eye
hold on hold up but i—
outro plies
hahaha i cant argue with you no you mad
look at you you mad you big mad haheheh
im happy leave me alone
i just want some money a lot of money
i dont get paid to argue with you
no who is you you aint nobody
you mad29embed"
