id,song_name,artist_names,album_name,lyrics
3JaQQnAGa5pIqhqSiA7r2f,Outro,Big Sean,1j2x7FJXTgUT0X5hZ8TDXE,"11 contributorsbest songs of 2015 lyricsthis is an ongoing list of the best rap songs of 2015 the lists will be updated as the year goes on remember that rap is subjective and everyone likes different things you can make your own list at the bottom but please dont mess with other peoples listsswinelord
6pm in new york by drake
miracle by donnie trumpet  the social experiment
polaroids  by jay prince
u by kendrick lamar
wesleys theory by kendrick lamar
m by aap rocky feat lil wayne
you  the 6 by drake
paper trail by joey bada
the blacker the berry by kendrick lamar
panic room by sahtyre
norf norf by vince staples
get paid by vince staples
buzz aldrin by sahtyre
mural by lupe fiasco
prisoner 1  2 by lupe fiasco
money trees deuce by jay rock
like it is  jump off the roof by vince staples
blur my hands by lupe fiasco feat guy sebastian
señorita by vince staples feat future
war by king los
od by young thug
bad santa by joell ortiz  llmind
ps  qsalchemy by mick jenkins
im good by jay prince
body of work  theyresurrectovernew by lupe fiasco
madonnachopperadoration of the magidots  lines by lupe fiasco
okey dog by murs
no more control by murs
window by nappy roots
easy bake by jay rock
with that by young thug
holy ghost by aap rocky
canal st by aap rocky
pyramid by lupe fiasco
schemes by lupe fiasco
the hills by the weeknd
often by the weeknd
in the night by the weeknd
pornography by travi scott
3500 by travi scott
brokeland by kirk knight
diamonds dancing by drake  future
jumpman by drake  futurepsyqonaut
tuxedo  get u home
kendrick lamar  wesleys theory
yelawolf  devil in my veins
tame impala  cause im a man
freddie gibbs  pronto
sufjan stevens  fourth of july
snoop dogg  peaches n cream
aap rocky  ld
everything everything  distant past
vince staples  senorita
the weeknd  the hills
the weeknd  cant feel my facemattw116
mural lupe fiasco
prisoner 12 lupe fiasco
body of work lupe fiasco
wesleys theory kendrick lamar
how much a dollar cost kendrick lamar
the blacker the berry kendrick lamar
will to believe clarence clarity
1800worship clarence clarity
starry eyed balcony walkers lorange  jeremiah jae
ld aap rocky
shaolin monk motherfunk hiatus kaiyote
breathing underwater hiatus kaiyote
the wander years voli
loud places jamie xx
i know theres gonna be good times jamie xx
the downtown cliché jazz cartier
dead or alive jazz cartier
heaven only knows towkio
girl the internet
ride twenty one pilots
my x rae sremmurd
paper trail joey bada
let it happen tame impala
same person old mistakes tame impala
lay up future
trap niggas future
devils whisper raury
the hills the weeknd
miracle donnie trumpet  the social experiment
temporary saba
alchemy mick jenkins
ps and qs mick jenkinsoldskewl
something to believe in  fashawn ft nas  aloe blacc
higher  fashawn
paper trail  joey bada
the blacker the berry  kendrick lamar
ice obsidian  lorange  jeremiah jae
all i need  lorange  jeremiah jae
cobb  blu
the gcode  blu ft action bronson  domo genesis
money makes us happy  skyzoo ft black thought  bilal
god bless america  dizzy wright ft big krit  tech n9ne
no time is better  dizzy wright  irv da phenom
freddie gibbs  pronto
how you feel  mick jenkins  statik selektah
in the wind  joey bada ft big krit ft chauncy sherod  statik
tear it down  slum village ft jon connor  j dilla
nightcrawler  czarface  method man
scarface ft john legend  god
mos def  ski beatz  sensei on the block
elzhi  february
warren g  keep on hustlin ft feat nate dogg bun b  young jeezy
mick jenkins  your love
method man  the purple tape feat raekwon inspectah deck
mickey factz ft elzhi  cyhi the prince  hayworth
jack rock ft isaiah rashad  wanna ride
jay rock  gumbo
jay rock   telegram going krazy
blu med  madlib ft mf doom  knock knock
med blu  madlib  finer things feat phonte likewise
freddie gibbs  fuckin up the count
med blu  madlib ft aloe blacc  drive in
freddie gibbs  narcos
freddie gibbs  freddie gordiesteelo47
every song on tetsuo  youth
ps  qs — mick jenkins
alchemy — mick jenkins
paper trail — joey bada
on and on — joey bada ft maverick sabre  dyemond lewis
hazeus view — joey bada
curry chicken — joey bada
like me — joey bada ft bj the chicago kid
i — kendrick lamar
the blacker the berry — kendrick lamar
alright — kendrick lamar
you ain’t gotta lie momma said — kendrick lamar
complexion a zulu love — kendrick lamar ft rhapsody
how much a dollar cost — kendrick lamar
decades — quest
top ten — logic ft big krit
war — king los ft marsha ambrosius
glory to the lord — king los
ghetto boy — king los
all day — kanye west
money trees deuce — jay rock
blessings – big sean ft drake  kanye west
u mad — vic mensa ft kanyemcryn x patrickrossey collab
alright  kendrick lamar
coffee  miguel
mural  lupe fiasco
christ conscious  joey bada
collard greens  schoolboy q kendrick lamar
deal  miguel
diablo  mac miller
0 to 100the catch up  drake
energy  drake
everyday  aap rocky
trap queen  fetty wap
fire squad  j cole
hell of a night  schoolboy q
this could be us  rae sremmurd
the hills  the weeknd
sunday candy  donnie trumpet  the social experiment
have a nice life  murs
outro  big sean
research  big sean
all your fault  big sean
baby blue  action bronson
legend  drake
hood politics  kendrick lamar
idfwu  big sean
king kunta  kendrick lamar
lpfj2  aap rocky
man of the year  schoolboy q
my way  fetty wap drake
no role modelz  j cole
paradise extended  big sean
the soundtrack  the game meek mill
studio  schoolboy q bj the chicago kid
a tale of 2 citiez  j cole
these walls  kendrick lamar bilal anna wise thundercat
u  kendrick lamar
used to  drake lil wayne
6 god  drake
6 man  drake
10 bands  drake
100 grandkids  mac miller
big rings  drake future
break the law  mac miller juicy j
all of y3  mickey factz
norf norf  vince staples  rest of summertime 06
easy bake  jay rock kendrick lamar
vice city  black hippyjaniojala


quarter 1
10 kendrick lamar  complexion a zulu love
9 malik b  mr green  dark streets
8 kendrick lamar  the blacker the berry
7 joey bada  paper trail
6 lupe fiasco  atomic misphilosophy
5 elzhi  february
4 kendrick lamar  mortal man
3 common  glory
2 kendrick lamar  how much a dollar cost
1 lupe fiasco  mural

quarter 2
10 apathy  the pendulum swings
9 skyzoo  money makes us happy
8 dizzy wright  god bless america
7 large professor  industry remix 2
6 jedi mind tricks  fraudulent cloth
5 czarface  escape from czarkham asylum
4 red pill  rum  coke
3 locksmith  the love
2 blueprint  persevere
1 oddisee  belong to the world
quarter 3
10 lorange  kool keith  the traveler
9 ghostface killah  deaths invitation
8 jay rock  fly on the wall
7 talib kweli  money good
6 joell ortiz  llmind  bad santa
5 statik selektah  in the wind
4 dr dre  its all on me
3 scarface  mental exorcism
2 the underachievers  illusions
1 scarface  godthekiddrob

vice city  black hippy
joey bada  on  on feat dyemond lewis  maverick sabre
logic  innermission feat lucy rose
vince staples  birds  bees feat daley
statik selektah  silver lining feat aap twelvyy kirk knight  chauncy sherod
kirk knight  heaven is for real
joey bada  save the children
kendrick lamar  these walls feat anna wise thundercat  bilal
statik selektah  all you need feat absoul elle varner  action bronson
aap rocky  canal street
travi scott  antidote
vince staples  summertime
freddie gibbs  curreny  fetti
absoul  aloe blacc  trouble
action bronson  terry
lupe fiasco  prisoner 1  2 feat ayesha jaco
futuristic  man on a mission
joey bada  run up on ya feat action bronson  elle varner
joey bada  ocb
mac miller  two matches feat absoul
mac miller  break the law
big sean  one man can change the world feat kanye west  john legend
kendrick lamar  how much a dollar cost feat james fauntleroy  ronald isley
king los  god money war
aap rocky  jukebox joints feat kanye west x joe fox
lupe fiasco  mural
lupe fiasco  theyresurrectovernew feat absoul  troi
joey bada  aim high
statik selektah  carry on feat joey bada  freddie gibbs
statik selektah  alarm clock feat absoul jon connor  logic
absoul  closure
bishop nehru  elder blossoms
statik selektah  in the wind feat joey bada big krit  chauncey sherod
capital steez  free the robots
pro era  last cypher feat capital steez joey bada rokamouth kirk knight nyck caution a la ole cj fly dyemond lewis  dessy hinds
pro era  school high feat dyemond lewis joey bada nyck caution  kirk knight
pro era  resurrection of real feat a la ole  nyck caution
pro era  interlude 47 feat cj fly joey bada capital steez  kirk knight
pro era  run or fly feat dirty sanchez joey bada capital steez  cj fly
kirk knight  dyemond lewis  extortion
joey bada  sol luna feat dyemond lewis  a la ole
dirty sanchez  trespassing feat yl  jab
a tribe called quest  jazz weve got
statik selektah  my time feat black dave cj fly nyck caution  josh xantus
dessy hinds  homecoming
run the jewels  all due respect feat travis barker
schoolboy q  break the bank
smoke dza  fhvt bvsturd feat joey bada
absoul  stigmata feat action bronson  asaad
statik selektah  silver lining feat aap twelvyy kirk knight  chauncey sherod
statik selektah  long time feat action bronson
action bronson  the alchemist  demolition men feat schoolboy q
schoolboy q  californication feat aap rocky
danny brown  action bronson  bad news
chance the rapper  acid rain
chance the rapper  nana feat action bronson
cj fly  ernee feat dirty sanchez
cj fly  day zzzs
earl  grief
hudson mohawke  100hm
jahkoy  downtown
j cole  love yourz
isaiah rashad  west savannah feat sza
joey bada  curry chicken
joey bada  dont front feat cj fly
joey bada  fromdatomb feat chuck strangers
joey bada  sorry bonita feat dyemond lewis chuck strangers a la ole cj fly dessy hinds kirk knight  dirty sanchez
logic  soul food im gone never enough under pressure metropolis nikki growing pains ii young sinatra young sinatra iii nasty common logic  midnight marauder dead presidents iii 30000
kendrick lamar  j cole  black friday
logic  i am the greatest fade away intro under pressure gang related till the end
bishop nehru  misruled order feat que hampton
joey bada  born day
logic  top ten feat big krit
bj the chicago kid  joey bada  nothin but loveyou might also like10embed"
