id,song_name,artist_names,album_name,lyrics
7LpOv13UlQtTVbknzGGzQm,Mi Vecindario,Fuerza Regida,7idxAlo8GuUKWV7RhOlptp,"1 contributormi vecindario lyricsletra de mi vecindario

verso 1
la patrulla pasa por mi vecindario
es hora de locos se escuchan balazos
se oyen los rumores que me andan buscando
me pusieron la cachucha y ahora yo me encuentro al mando
tengo los motivos para ser el diablo
de una vida perra y momentos amargos
nadie está en mi gracia y miren no es pa tanto
por mi cuero le refiero si me tocan van pa abajo
pasamos de sierra a un doble rr del año
las cadenas gruesas se le ven colgando
anduve entre lumbrе y ya hasta me robaron
ningún santo dio su llanto por el bolsillo de tantos

coro
fui soy y sеguiré
me dicen el rey
y hasta capitán del barco
fui desmadre al crecer
mi empresa formé
buena yerba voy quemando
ahuevo viejo

interludio
y de donde yo vengo
no muchos salen vivos
mucho menos millonarios
ajá otro pedo
see fuerza regida liveget tickets as low as 98you might also likeverso 2
me critican ponen peros piden paros
ni fronteras ni 2 lacras me pararon
le chingamos y llegamos y aquí estamos
que viva mi raza somos 100 mexicanos
las calles son perras permiten estragos
desde el wey que troza por unos centavos
siéntense y escuchen que no es nada raro
rasgos de malditos caminando solo por mi barrio

coro
fui soy y seguiré
me dicen el rey
y hasta capitán del barco
fui desmadre al crecer
mi empresa formé
buena yerba voy quemando
ahuevo viejo

outro
bienvenidos
ahí nomás pa que hablenembed"
