id,song_name,artist_names,album_name,lyrics
3QJ8u89keBXA7bWnNgMGxS,DTB 4 Life,A Boogie Wit da Hoodie,4v0IxMbMN975IfxFHzgK9d,"46 contributorsdtb 4 life lyricsintro
its joefromyo
sephgotthewaves

prechorus
yeah thinkin bout you i catch chills my nigga
shit aint been the same since they killed my nigga
broski doin time it get real my nigga
i just hope you hold it down just dont squeal my yeah

chorus
im dtb for life no i cant trust my bitches
i cant even trust my girl cause im a fucked up nigga yeah
and if you say you trust me girl you lied
cause i cant even trust myself i dont know why you waste time in your feelings yeah

verse 1
im dtb forever on god i dont trust bitches
i dont even trust my girl i still try to fuck her friends and shit
that niggas movin while gettin live
i dont even wanna talk to nobody i got a feelin the feds listenin
she told me im not myself no more
and i swear i know exactly who i am
girl just love me for the differences
she told me she dont want me around
how could you feel that way baby
especially after all this time with you
see a boogie wit da hoodie liveget tickets as low as 35you might also likechorus
now its dtb for life no i cant trust my bitches
dont you trust me neither im a fucked up nigga yeah
but if you gettin money thats whats up my nigga
bitch you know im smacked im smokin blunts like cigarettes

bridge
lets be honest lets be real my nigga
if a nigga play with me i will get rid of him
montana had the grills in his hilfigers yeah
my niggas quado and beasty i be missin em

prechorus
but thinkin about it i catch chills my nigga
shit aint been the same since they killed my nigga
broski doin time it get real my nigga
i just hope you hold it down just dont squeal my yeah

chorus
im dtb for life no i cant trust my bitches
i cant even trust my girl cause im a fucked up nigga yeah
and if you say you trust me girl you lied
cause i cant even trust myself i dont know why you waste time in your feelings yeah

verse 2
im dtb and its cause what she what she done to me
so i was hopin my babys eyes would smile just like mine
thatdve been crazy yeah
will i regret you will i regret you yeah yeah
will i still put you on my schedule will i still put you on my
yeah put you on my itinerary put you on my itinerary
said i aint gon lie it can get scary i aint gon lie yeah yeah
i know you just want me to sweat you
you say i changed you wish i was the same as when i met you
well these hoes who was lyin oh they wanna kick it but it get messy
yeah and you aint never die if youre a legend yeah
prechorus
you dont even know how i feel my nigga
shit aint been the same since they killed my nigga
i be tryna tell my bros just chill out
my little bro he be on go he be on drill time nigga

chorus
im dtb for life no i cant trust my bitches
dont even trust my girl after i tried fuckin her friend
and if you say you love me girl you lied
cause you dont even love yourself i dont know why you waste time in your feelings yeah

outro
no no23embed"
