id,song_name,artist_names,album_name,lyrics
1MQ8ydvrTnn2QJgXFATJvD,Ex Calling,6LACK,7iwGw8ob3YLqZrbKzGFnHi,"79 contributorsex calling lyricsintro
scrolling through these mother fucking texts
they aint say nothing but the same shit
put that shit on do not disturb
bitch im in the studio
three in the morning im on do not disturb
my last little fling i put that shit in the dirt yeah
pop out the car screamin

chorus
i can hear my ex calling ex calling
dont know why my ex calling calling calling
why the fuck my ex calling calling calling
dont know why my ex calling wait wait wait
i can see my ex calling calling calling
hold up why my ex calling calling calling
dont know why my ex calling
why the fuck my ex calling calling

bridge
i can see my ex calling ex calling
oh no now my next calling my next calling
i dont know why i stress all em stress all em
i just want the best out em best out em

verse 1
we been through some things yeah
thought i could restrain ya
i dont wanna tame ya tame ya
impossible to change ya change ya
every time i try to put the fire out it boosts the flames up flames up
you text me like i called ya called ya
well i dont mean to stall ya
but i cannot afford ya afford ya
so i gotta ignore ya
cause i just want to ball yeah and you just want to fall yeah
i pick up my phone what the heck
coming at my neck
tripping via text disrespect
i dont fuck with that
cant put me in check
you the ex calling for the sex
want me cause im next
im the future where the percocets
you might also likebridge
i can see my ex calling my ex calling
oh no now my next calling my next calling
i dont know why i stress all em stress all em
i just want the best out em best out em

verse 2
theres something wrong with my hand with my hand
cant pick up the phone goddamn
hope you understand understand
i cant have you fuck up the plans the plans
and if you gotta choose then you better choose the other man
see i weighed out that good side and that bad side so im done
i broke it down it was crunch time got focused and we won
your favorite rapper gon want to join it the dream team and we come
dont do this shit just for fun hey
do this shit just to run hey
run it back like a punt hey
run that shit like chris breez hey
all these hoes is on me hey
all this ice on me
all these lights on me
not really i like to stay lowkey
but still all that vice is on me hey
never been bout that bird talk
to me thats that absurd talk
always been bout the splurge talk
back when we used to bird walk
and knocked off of my course man that one time and i swear
i never wanna go there
thats unless she got nice brown skin good credit man and long hair
bridge
i can see my ex calling my ex calling
oh no now my next calling my next calling
i dont know why i stress all em stress all em
i just want the best out em best out em

chorus
i can hear my ex calling my ex calling
dont know why my ex calling my ex calling
why the fuck my ex calling ex calling
dont know why my ex calling ex calling
i can see my ex calling my ex calling
hold up why my ex calling my ex calling
dont know why my ex calling my ex calling
why the fuck my ex calling38embed"
