id,song_name,artist_names,album_name,lyrics
2JS2pRsEyYMPl58VI4ymYC,Through the Eyes of a Child,AURORA,6f20spSQ9DLynFAXEKmqHf,"43 contributorstranslationsfrançaisthrough the eyes of a child lyricsverse 1
world is covered by our trails
scars we cover up with paint
watch them preaching sour lies
i would rather see this world through the eyes of a child
through the eyes of a child

verse 2
darker times will come and go
times you need to see her smile
and mothers hands are warm and mild
i would rather feel this world through the skin of a child
through the skin of a child

instrumental

verse 3
when a human strokes your skin
that is when you let them in
let them in before they go
i would rather feel alive with a childlike soul
with a childlike soul

outro
hey oh oh hey
oh hey
ahah hey
oh hey
hey oh oh hey
oh hey
ahah hey
oh hey
please dont leave me hereyou might also like10embed"
