id,song_name,artist_names,album_name,lyrics
2ovLRfotBro4W3pRaEha8I,Rain,bôa,7sGYAV0xv7ZfAMzIpMl8m1,"9 contributorsrain lyricsverse 1
friend of mine sex is child inside
adored by that sex soaked in wine
the dark world we hide paint the child to entice

chorus
rain suicide is rain in pain suicide is rain in pain
falling into gutters they splash their remains

verse 2
what is night without the stars
what is dark about the heart
whats in the park  were not there anyway

chorus
rain suicide is rain in pain suicide is rain in pain
suicide is rain in pain suicide is rain

bridge
i cant be bothered
i cant be bothered
i cant be bothered

verse 1
friend of mine sex is child inside
adored by that sex soaked in wine
the dark world we hide paint the child to entice
you might also likechorus
rain suicide is rain in pain suicide is rain in pain
suicide is rain in pain suicide is rain in pain
suicide is rain in pain suicide is rain in pain
suicide is rain in pain falling into gutters they splash
their remainsembed"
