id,song_name,artist_names,album_name,lyrics
7qaoXmlsSrndaQeDRPpOeW,FEIGNING,Gunna,0gA0nZrZ55PLUp7ARfrICu,"43 contributorsfeigning lyricsintro gunna  lil juice
tay keith fuck these niggas up
yeah yeah
yeah yeah yeah yeah yeah yeah yeah yeah
oh woah woah woah woah
woah

chorus
make em bleed for the season
i got pretty tings overseas yeah seas yeah yeah
shopping sprees for a week yeah yeah yeah yeah
like fbg i got free bands yeah free bands
above the trees hard to breathe in hard to breathe in
we spending gs for no reason yeah yeah
better go sleep she not leavin yeah leavin
crib in the hills like im fiendin yeah

verse 1
huh huh huh
bout a dollar huh huh woah
whip that panamera yeah
piss in my ring diamonds canary yellow ooh
im sippin codeine im movin slower than donatello donatello
i doubt that she dont let me fuck but i swear i wont sweat her nah
im runnin the millions up on god my fam doin better on god
bein broke didnt break us apart got rich we still together still together we still together
we storm the weather you get jammed ill write you letters write you letters
we flock of feathers yeah the parasailers yeah
gave her a groove like stella my vocals makin her pussy wetter wetter
bought a new louis flannel flowers all over my white margielas white margiela
you might also likechorus
make em bleed for the season
i got pretty tings overseas yeah seas yeah yeah
shopping sprees for a week yeah yeah
like fbg i got free bands yeah free bands
above the trees hard to breathe in
we spending gs for no reason yeah yeah
better go sleep she not leavin yeah leavin
crib in the hills like im fiendin yeah

verse 2
huh huh
feel the miley cyrus yeah
we gettin geeked up at the private party yeah yeah
leak it aint no secret know i drip the hardest drip the hardest
the valet cant hold my key i let my people park it people park it
got that escalade bp cause i might be a target bulletproof
my fans screamin at me say im they favorite artist favorite artist
pay what i want no back and forth dont do no bargain do no bargain
we cross the margin cross the margin
fuck niggas barkin main reason i keep a carbon yeah
we burn like arsons burn
snakes in the garden yeah
we rich i beg you pardon
my lil niece is startin niece is startin
the vehicles foreign foreign
feel like im soarin yeah
chorus
make em bleed for the season
i got pretty tings overseas yeah seas yeah yeah
shopping sprees for a week yeah yeah yeah yeah
like fbg i got free bands yeah free bands
above the trees hard to breathe in hard to breathe in
we spending gs for no reason yeah yeah
better go sleep she not leavin yeah leavin
crib in the hills like im fiendin yeah

outro
yeah yeah yeah9embed"
