id,song_name,artist_names,album_name,lyrics
0NAT5pDG4XcYe9sUD3fR7k,Mi Ultima Carta,Prince Royce,5zEFCJy9kAyD8rMbBESdYh,"11 contributorsmi ultima carta lyricsletra de mi ultima carta

intro
royce

verso 1
y ya son las dos de la mañana y todavía sigo aquí
escribiendo una carta para ti
solo pensando en todo lo que sucedió
y en los errores cometidos en este amor
como es posible que mi esposa me boto
mi hogar mi alma todo lo destruyo
me quedo solo frio en esta habitación
soy un difunto

precoro
y no sé porque esta novela termino así
en papel escribo mi historia y te la entrego así

coro
y querida amada
esta es la última carta que te escribo
mi últimas letras y te dejo en el olvido
¿cómo es posible que no sepas perdonar
y querida amada
este fracaso se lo dejo al destino
prometo que yo nunca quise lastimarte
y aunque te vas
por siempre te amaré te amaré
you might also likeverso 2
y al fin y al cabo e tratado de arreglar la situación
pero me hechas como un perro sin valor
cada minuto me enveneno con rencor
al ver tu cara solo crece mi odio
se que al final solo te vas arrepentir
te darás cuenta de todo lo que sufrí
cuando regreses ya yo no estaré aquí
y solo pregunto

precoro
y no sé porque esta novela termino así
en papel escribo mi historia y te la entrego así

coro
y querida amada
esta es la última carta que te escribo
mi últimas letras y te dejo en el olvido
¿cómo es posible que no sepas perdonar
y querida amada
este fracaso se lo dejo al destino
prometo que yo nunca quise lastimarte
y aunque te vas
por siempre te amare te amaré

interludio
te amaré ooh ooh
precoro
y no sé porque esta novela termino así
en papel escribo mi historia y te la entrego así

coro
y querida amada
esta es la última carta que te escribo
mi últimas letras y te dejo en el olvido
¿cómo es posible que no sepas perdonar
y querida amada no no no no

outro
querida amada ah ay ay
querida amada
ya no te quiero a ti
querida amada y ya no regreso aquí
querida amada aah
querida amada
querida amada y aunque me duela
querida amada ya se acabóembed"
