id,song_name,artist_names,album_name,lyrics
4OfESCGOUVZMuGvppCU51j,I. Pink Toes,"Childish Gambino, Jhené Aiko",62yjWIhnATHxPqGbgC9Lqr,"94 contributorsi pink toes lyricsintro childish gambino
rainbows sunshine everywhere we go
rainbows sunshine go

chorus childish gambino
rainbows sunshine
rainbows sunshine
rainbows sunshine yeah
rainbows sunshine

refrain childish gambino
i thought i told you bout it
act like you know act like you know act like you know
you dont leave home without it
move that kilo move that kilo move that kilo
she on my back about it
c3po c3po c3po
and all the time ohoh yeah
act like you know act like you know act like you know

verse 1 childish gambino
how could you ever question they know better to mention
the budget truck aint just enough to make her pay attention
the who what why and where they sport the flyest pairs
she got the nicest hair and she know life is better with this nigga
its crazy how the world look different
its crazy how the girls look different
the colors and the sounds so vivid
you never catch your boy popimpin
me sittin on the sidewalk now that dont sound right
but as long as i look fly by prom night—go
you might also likechorus childish gambino
rainbows ho sunshine
rainbows ho sunshine
rainbows sunshine yeah
rainbows sunshine

interlude jhené aiko
harmonizing
verse 2 jhené aiko
he slangs his yay through the corridors
every day 20k yep at the very least for sure
and they say theres no way i should stay with someone like you
but i tell them no
theres no way i could stray gotta stay with someone like you
cause i know one day you could take me away far away
i know you could pay all the money you made
therell be plenty of sunshine

refrain childish gambino
i never worry bout it
act like you know act like you know act like you know
i have my nigga count it no no
back up them os back up them os back up them os
shes dressed up in gold
dressed up in gold c3po c3po
im out of time oh no no no
act like you know act like you know act like you know
outro childish gambino
im out of time oh no no no no
im out of time ooh
im out of time out of time
lalala lalala go
produced by childish gambino stefan ponce  ludwig göransson102embed"
