id,song_name,artist_names,album_name,lyrics
13G2wryMsFflncAwdDPrLn,Intro/Medley,Ashanti,4vjeaWsf9UH2ecdKXAZaq2,"6 contributorsintromedley lyricsannouncer
chapter ii
ashanti

ashanti from foolish
see my days are cold without you
but im hurting while im with you
and though my heart cant take no more
i keep on running back to you

ashanti from happy
found you boy
all my life
ive been feeling for you
everyday
im so happy baby

ashanti  ja rule from down 4 u
i wanna be your chick
and only for the rule baby
ill ride for you die for you
do anything yout want me to
ill be you down ass chick
im gonna be here when you need

ashanti from baby
i love it when i hear your name got me saying
baby baby baby baby baby baby i love you
baby baby baby baby baby
see ashanti liveget tickets as low as 70you might also likeashanti  ja rule from mesmerize
love it when you look at me baby
your lips your smile i
love it when you kiss me baby
your hips those thighs i
love it when you call me baby
and i cantembed"
