id,song_name,artist_names,album_name,lyrics
4fA40676Ja1N59rCa9QECx,Mr. Clean,"Viktor Vaughn, MF DOOM",7HPjcPD2cr8E5oHvVAmBp7,"47 contributorstranslationsрусскийmr clean lyricsverse
study your history—
whoever dont i pity the fool like mr t
knowledge this degree it ain’t no mystery
what you gon do or what you know is what is to see
and thats more than meets the eyeball
now who wants to buy a brand new tsetse fly call
alright yall zooom the speed was breakneck
faster than the hispeed dual cassette tape deck
how far the distance was lightspeed
he went to see a buddy who said he had some white weed
in case it might need it didnt mean much
for in his lean clutch was the elusive green dutch
who that kinga vaughns younger brother
a real live swinger who rock louis vuitton pleather
and he walk around like he think he king
even made the hoodrats stop to kiss his pinky ring
like a soup sandwich on a hand dish
some say his language is way too outlandish
he did his thing spoke in a jigslang
and translate einsteins theory of the big bang
he told his boo boo i put a spell on you
stay with me whether we broke or we welltodo
if it dont work the hell with cha
may the doorknob hit cha where the poor slob bit cha
what you thought ya darn skeezer
the g of a mack and the steez of a geezer
true man of leisure she mustve caught amnesia
paid off the 8th grade fade or a caesar
he was known for his thick skin
part zimbabwean and part trini mixed in
big shot sold a guy a pound of pig snot
said it was proven to remove stains and ink spots
kinky flow dripped down her leg to her pinky toe
jinky ho who dont know as much as she think she know
one wink she stepped to him like a slinky yo
wig like a mink skin soft like twinkie dough
then he kissed the queen and told her she need listerine
twist the green its laced with antihistamine
enough to make you make your face up like mr bean
v hit the scene like fuck it give me a mr clean
you might also likeoutro
shit tired of all this
its too hot out here to be having all this shit man
shit take that shit take it all off
take it all off boss
no matter what the cost2embed"
