id,song_name,artist_names,album_name,lyrics
4TCL0qqKyqsMZml0G3M9IM,Telephone,"Lady Gaga, Beyoncé",6rePArBMb5nLWEaY9aQqL4,"96 contributorstranslationstürkçeespañolportuguêstelephone lyricsintro lady gaga
hello hello baby you called i cant hear a thing
i have got no service in the club you say say say
whawhawhat did you say huh youre breakin up on me
sorry i cannot hear you im kinda busy im kinda busy
kkinda busy im kinda busy kkinda busy im kinda busy
sorry i cannot hear you im kinda busy

verse 1 lady gaga
just a second its my favorite song theyre gonna play play
and i cannot text you with a drink in my hand eh
you shouldve made some plans with me you knew that i was free
and now you wont stop callin me im kinda busy

chorus lady gaga
stop callin stop callin i dont wanna think anymore
i left my head and my heart on the dance floor
stop callin stop callin i dont wanna talk anymore
i left my head and my heart on the dance floor

postchorus lady gaga
eh eh eh eh eh eh eh eh eh eh eh
stop telephonin me
eh eh eh eh eh eh eh eh eh eh stop telephonin me
im busy
eh eh eh eh eh eh eh eh eh eh im busy
stop telephonin me
eh eh eh eh eh eh eh eh eh eh eh stop telephonin me
you might also likerefrain lady gaga
can call all you want but theres no one home
and youre not gonna reach my telephone no
out in the club and im sippin that bub
and youre not gonna reach my telephone no
can call all you want but theres no one home
and youre not gonna reach my telephone
out in the club and im sippin that bub
and youre not gonna reach my telephone
verse 2 beyoncé
boy the way you blowin up my phone wont
wont make me leave no faster puput
put my coat on faster leleave
leave my girls no faster
i shouldve left my phone at home
cause this is a disaster
callin like a collector
sorry i cannot answer

bridge lady gaga beyoncé  both
its not that i dont like you im just at a party
and i am sick and tired of my phone rringin
sometimes i feel like i live in grandcentral sstation station
tonight im not takin no calls cause ill be dancin
cause tonight im dancin dancin
cause ill be dancin cause tonight im dancin dancin
cause ill be dancin cause tonight im dancin
tonight im not takin no calls cause ill be dancin
chorus lady gaga  beyoncé lady gaga
stop callin stop callin i dont wanna think anymore
i left my head and my heart on the dance floor
stop callin stop callin i dont wanna talk anymore
i left my head and my heart on the dance floor
stop callin stop callin i dont wanna think anymore
i left my head and my heart on the dance floor
stop callin stop callin i dont wanna talk anymore
i left my head and my heart on the dance floor

postchorus lady gaga  beyoncé
eh eh eh eh eh eh eh eh eh eh eh stop telephonin me
stop telephonin me
eh eh eh eh eh eh eh eh eh eh im busy
im busy
eh eh eh eh eh eh eh eh eh eh stop telephonin me
stop telephonin me eh eh eh eh eh
eh eh eh eh eh eh eh eh eh eh eh im busy

refrain lady gaga
can call all you want but theres no one home
and youre not gonna reach my telephone
cause im out in the club and im sippin that bub
and youre not gonna reach my telephone
can call all you want but theres no one home
and youre not gonna reach my telephone
cause im out in the club and im sippin that bub
and youre not gonna reach my telephone
dddddddddarkchild
my telephone mmmy telephone
cause im out in the club and im sippin that bub
and youre not gonna reach my telephone
my telephone mmmy telephone
cause im out in the club and im sippin that bub
and youre not gonna reach my telephone
outro
were sorry were sorry
the number you have reached is not in service at this time
please check the number or try your call again36embed"
