id,song_name,artist_names,album_name,lyrics
61uyGDPJ06MkxJtHgPmuyO,Company,Justin Bieber,6Fr2rQkZ383FcMqFyT7yPr,"57 contributorscompany lyricschorus
can we we keep
keep each other company
maybe we can be
be each others company
oh company

verse 1
lets end each others lonely nights
be each others paradise
need a picture for my frame
someone to share my reign
tell me what you wanna drink
ill tell you what i got in mind
oh i dont know your name
but i feel like thats gonna change

prechorus
you aint gotta be my lover
for you to call me baby
never been about no pressure
aint that serious

chorus
can we we keep
keep each other company oh
maybe we can be
be each others company
oh company
you might also likepostchorus
oooooooooh
oooooooooh
oooooooooh
oooooooooh

verse 2
it aint about the complications
im all about the elevation
we can keep it goin up
oh dont miss out on us
just wanna have a conversation
forget about the obligations
maybe we can stay in touch
oh that aint doin too much

prechorus
you aint gotta be my lover
for me to call you baby
never been about no pressure
aint that serious no

chorus
can we we keep
keep each other company
maybe we can be
be each others company
oh company
postchorus
yeah yeah
oooooooooooh
oooooooooooh
oooooooooooh
oooooooooooh

chorus
can we be can we be
be each others company
be each others company oh
just be each others company
be each others company oh ohohoh
can we we keep
keep each other company oh
maybe we can be
be each others company
oh company30embed"
