id,song_name,artist_names,album_name,lyrics
1D2L6MefbXon28PzIk9I3r,92 Explorer,Post Malone,6trNtQUgC8cgbWcqoMYkOR,"89 contributorstranslationsnederlands92 explorer lyricsintro
oohooh wow
ahh yeahyeah wow
yeahyeah yeahyeah yeahyeah
we got london on the track

verse 1
hunnid and twenty come catch me
forties inside of my belly
shouldnt be drivin im faded skrt yeah
rock that nirvana my favorite
damn i forgot what her name is
she in the front seat headbangin yeah yeah
yeah money counter sound somethin like a chopper chopper chopper chopper
speaker system bumpin fuck your fuckin block up fuck your block up
used to mock him now its custom bentley mockups mockups
killer drop a call from lockup
if you buy that echo why you lyin you broke
got a nine in my tote get you smoked like a stoge
keep on ridin my coat your new shit is a joke
why you bitin my flows what you tryna be post
yeah

chorus
ooh baby ooh baby guap keep expandin
ooh yuck me up i dont want no romancin
ooh baby i see these muhfuckas glancin
when my whip stop then my wheels keep spinnin skrt
ooh baby ooh baby guap keep expandin
ooh yuck me up i dont want no romancin
ooh baby i see these muhfuckas glancin
when my whip stop then my wheels keep spinnin
see post malone liveget tickets as low as 186you might also likeverse 2
ooh
she used to shoppin at the mall ooh
ill teach lil baby how to ball
i hit rodeo spent like 40 gs wow
four hunnid pairs of gucci socks socks
i lost all my friends made a lot of foes
made a lot of ms made a lot of os
open up the safe ooh im just with the bros
cop the 458 cost me 250 yeah
man look at all my ice ice
i hit your main thing twice your main thing twice
take a word of advice a word of advice
break up with that ho ho

chorus
ooh baby ooh baby guap keep expandin
ooh yuck me up i dont want no romancin ohh
ooh baby i see these muhfuckas glancin ahh
when my whip stop then my wheels keep spinnin skrt
ooh baby ooh baby guap keep expandin skrt
ooh yuck me up i dont want no romancin skrt
ooh baby i see these muhfuckas glancin
when my whip stop then my wheels keep spinnin

bridge
cold wrist frozen
got sacks goldman
bought the bar roseanne
no joke deadpan
chorus
ooh baby ooh baby guap keep expandin
ooh yuck me up i dont want no romancin
ooh baby i see these muhfuckas glancin
when my whip stop then my wheels keep spinnin skrt skrt
ooh baby ooh baby guap keep expandin skrt
ooh yuck me up i dont want no romancin skrt
ooh baby i see these muhfuckas glancin skrt
when my whip stop then my wheels keep spinnin

outro
ooh oooooo
yeah haha oooooo
ooh oooooo
oooooo
we got london on da track46embed"
