id,song_name,artist_names,album_name,lyrics
4XvcHTUfIlWfyJTRG0aqlo,2055,Sleepy Hallow,38nZLvJx8A9p4YYpTG5iFP,"54 contributors2055 lyricsintro
wanna slide
like its 2055 huh
i just wanna ride great john on the beat by the way
like its 2055 huh
huh huh huh

chorus
i just wanna slide huh
parties in the sky like its 2055 huh
she said boy you nice boy you nice huh
heart cold like some water and some ice huh

verse 1
why would you sacrifice huh
knowing you could die aint nobody by your side huh
i know niggas cap cap and bitches lie
came from dirt cant go back you could see it in my eyes huh
real niggas cry blood blood hope my kid never try drugs huh
all i wanted was some love would that trade for a gun huh
big pack on me now member back then i was fucked up huh
i dont really want friends everybody fake i dont got trust but

chorus
i just wanna slide huh
parties in the sky like its 2055 huh
she said boy you nice boy you nice huh
heart cold like some water and some ice water and some ice water and some ice
i just wanna slide huh
parties in the sky like its 2055 huh
she said boy you nice nice boy you nice nice huh
heart cold like some water and some ice
see sleepy hallow liveget tickets as low as 55you might also likeverse 2
shawty get energized huh livin life
spilled some liquor on her inner thigh but she aint tired
she just turn it up huh i could get you brushed huh
zaza got me stuck sorry i cant open up
fuck it we try huh gotta compromise huh
he want beef with gang but he dont know it come with fries huh
thats aks and nines huh please dont play with mines huh
my body different i know they love that line but

chorus
i just wanna slide huh
parties in the sky like its 2055 huh
she said boy you nice nice boy you nice nice huh
heart cold like some water and some ice water and some ice water and some ice19embed"
