id,song_name,artist_names,album_name,lyrics
2IG6Te7JyvrtqhFeOF7le4,Zoom,Future,17FBoXK1NU2rvJBbzdzw0r,"100 contributorszoom lyricsintro
pluto yeah yeah brr brr
bought a droptop porsche about to cut the top off
trappin is a sport young nigga get you knocked off
hol up

chorus
turbo switchin lanes brr hublot switch your watch brr
trappin switch the spots brr brr brr when youre runnin hot
feet on the gas gone trappin them bags pluto
run up a sack gone and never look back brr brr
shorty got miles on her pew pew im about to spaz in it boom boom
i ran it up fast zoom zoom i ran it up fast money machine
i ran it up fast money machine i ran it up fast money machine
i ran it up fast money machine i ran it up fast brr

verse 1
i secure the bag first brr brr im ready to boast ready to go yeah
i secure the bag first im full of that dope full of that dope yeah
courtside with a mink yah pee wee kirkland in the sink shiing
five karats one link err both hands full of ink brr
money drying in your hand brr wrap the bale in saran brr
my yellow bitch want a tan i just landed from japan pew
tokyo and korea pew panamera to the lear pew
yellow mellow with the gold gold fishscale with these hoes let go
mossberg im drinkin mud pluto put a hit out on a dub yah
bought my lil nigga 12 slugs yah just to shine bright when he mug yah yah
i just bailed out ol buice woo 20 pills goin hyphy yah
oh you lookin real icy what boy you know you nothin like me
you might also likechorus
turbo switchin lanes brr hublot switch your watch brr
trappin switch the spots brr brr brr when youre runnin hot
feet on the gas gone trappin them bags pluto
run up a sack gone and never look back brr brr
shorty got miles on her pew pew im about to spaz in it boom boom
i ran it up fast zoom zoom i ran it up fast money machine
i ran it up fast money machine i ran it up fast money machine
i ran it up fast money machine i ran it up fast brr

verse 2
i gave her the raw lean
they sound like my offsprings yeah
nitro gasoline pew
bought some more money machines brr
bring out a brand new machine brr
i bought a whole lot of bling hol up
treat me like weezy and baby pluto
treat me like mannie and turky turky
i was the juve with work on me juve
i had to cop it and purchase hol up
i put more ice in the date today huh
rockin these prezzies and cartier huh
i got it in flooded and plain jane huh
i made my young niggas insane huh
crunchin them xans up and then drink crunchin them
get you a draco and then crank it brr
saudi arabian ben franklin brr
leave it to me they wouldve been stained em brr brr
saditty in back we done got acquainted yo
you see the dash they gotta see me yo
i ran it up fast they cant see me huh
i wasnt surfin with you i wasnt surfin with you
i buy them birkins for you i buy them birkins for you
i go to surgery with you i go to surgery with you
chorus
turbo switchin lanes lanes brr hublot switch your watch brr
trappin switch the spots brr brr brr when youre runnin hot
feet on the gas gone trappin them bags pluto
run up a sack gone and never look back brr brr
shorty got miles on her pew pew im about to spaz in it boom boom
i ran it up fast zoom zoom i ran it up fast money machine
i ran it up fast money machine i ran it up fast money machine
i ran it up fast money machine i ran it up fast brr yah

podcast skit got it allgot it all
hahahahaha ahhh shit
got it all back baby
god damn welcome to cap city records internet podcast baby
where we make dreams come true
the first five callers that call in right now man
we gone have you the rapper starter kit
oh my god it comes with the cap city contract
which is a twelve album nine year deal
we gone take some calls the counting in boards are lighting up right now
the boards are lightin up
look take a call we up caller
yeah that deal we need that
yeah we need that yeah yeah
yeah we need that shit dat way nigga yeah gunshot and assault rifle sounds
yeah nigga
this way nigga yeah
we need that deal nigga
what what you say young man
i keep it on me
hold on fella hold on fella gunshot and assault rifle sounds
listen li
boom nigga
im sayin i cant hear you shoot
is is there a shoot out
whats goin on young fella
lil draco in this bitch
lil extendo in this bitch lil extendo yeah yeah
nigga yeah gunshots
whats goin on nigga
you just won a cap city records contract man
listen here baby
lil draco lil extendo congratulations baby yall won
yeah nigga yeah hahaha
cap city man whats up
six months man we got that shit
twelve albums man we got that shit
yeah nigga yeah
im finna shoot everything up
bow bow bow bow bow
nigga yeah yeah whats up nigga yeah yeah i need that
we need that mimicking gunshot noises10embed"
