id,song_name,artist_names,album_name,lyrics
6AOt2y4PzYgiUapxCIrbfV,Que Seas Feliz,Luis Miguel,41VfVz6sKvbm1yCbqAlwfM,"2 contributorsque seas feliz lyricsletra de que seas feliz

verso 1
que seas feliz feliz feliz
es todo lo que pido en nuestra despedida
no pudo ser después de haberte amado tanto
por todas esas cosas tan absurdas de la vida

coro
siempre podrás contar conmigo
no importa dónde estés
al fin que ya lo ves quedamos como amigos
y en vez de despedirnos con reproches y con llanto
yo que te quiese tanto
quiero que seas feliz feliz feliz

coro
siempre podrás contar conmigo
no importa dónde estes
al fin que ya lo ves quedamos como amigos
en vez de despedirnos con reproches y con llanto
yo que te quise tanto
quiero que seas feliz feliz feliz

outro
y en vez de despedirnos con reproches y con llanto
yo que te quise tanto
quiero que seas feliz feliz
felizsee luis miguel liveget tickets as low as 28you might also likeembed"
