id,song_name,artist_names,album_name,lyrics
4dmz7UKE8sXL93M4p1Ecy0,Cuando No Estás Te Invento,El Trono de Mexico,58phrarDe6ZFupwWSkNSqe,"1 contributorcuando no estás te invento lyricsesta loca idea de vivir tu vida
y olvidar la mía
es una aventura donde el equipaje
son mis fantasías
de pronto te vas
e pronto te quienes
y eso me sostiene

soy un laberinto donde cordura
a perdido el juicio
dungeta fugas ni quien
te reclama mi alma te extraña

y cuando no estas te llamo con
el pensamiento puedo
respirar tu aliento desnudar tu cuerpo por que
así te invento y cuando
no estas con tu recuerdo me alimento
y vuelvo a despertar en soledad
y solo vivo cuando así te invento
haciendote el amor

y esta loca idea de vivir
tu vida y yo lamia es
por que te amo
ora¡
you might also likeesta loca idea de seguir tu vida
y no vivir la mía es una
aventura donde el equipaje
son mis fantasías de
pronto te vas de pronto te
tienes y eso me sostiene

soy un laberinto donde la cordura
a perdido el juicio
dungeta fugaz ni quien te
reclama mi alma te extraña

y cuando no estas te llamo con
el pensamiento y puedo
respirar tu aliento desnudar tu cuerpo
por que así te invento

y cuando no estas con tu
recuerdo me alimento y vuelvo a despertar
en soledad y solo vivo cuando así te invento
haciéndote el amorembed"
