id,song_name,artist_names,album_name,lyrics
4oqD7zXh23uvf583rDkunI,Blowin' Smoke,Kacey Musgraves,6IGpQUt0KNi5rBUXZZOFI6,"19 contributorsblowin’ smoke lyricsverse 1
between the lunch and dinner rush
kelly caught that outbound bus for vegas
and were all out here talking trash making bets
lips wrapped round our cigarettes
she always thought she was too good to be a waitress

prechorus 1
well we all say that well quit someday
when our ship comes in well just sail away

chorus
but were just blowin smoke
hey yeah
were just blowin smoke
hey yeah
out here goin broke
hey yeah
yeah were just blowin smoke

verse 2
well janie got divorced again
her exhusbands in the pen
for two to five or five to ten longer ha
and brendas traded smokes for cake
still hadnt lost that baby weight
and that babys bout to graduate from college
you might also likeprechorus 2
i just flick an ash into the tray
and tell them both itll be okay

chorus
but im just blowin smoke
hey yeah
im just blowin smoke
hey yeah hey yeah
im out here goin broke
hey yeah
yeah were just blowin smoke

bridge
we all say that well quit someday
when our nerves aint shot
and our hands dont shake yeah
we all say that well quit someday
when our nerves aint shot
and our hands dont shake

verse 3
wipe down the bar take out the trash
light one up and count my cash
swear im never coming back again
chorus
im just blowin smoke
hey yeah
im just blowin smoke
hey yeah
out here goin broke
hey yeah
yeah were just blowin smoke3embed"
