id,song_name,artist_names,album_name,lyrics
5v2ePUTZiv1mPDCD1nSbfF,Lost,"Chance the Rapper, Noname",2VBcztE58pBKjIDS5oEgFh,"156 contributorslost lyricschorus chance the rapper
my druggy love me when im ugly hug me
when im bummy scummy im your hubby
lets get lost
lets get lost

verse 1 chance the rapper
damn im in so deep girl probably cause youre empty
you cant even speak igh damn your mouth so minty
ooh your mama hate me daddy wouldnt let you
if he ever met me if he ever met you
put that shit behind us and put this in your sinus
mine is all up in my gums minus all that shit its lined with
i say ohohohoh you been scratchin you been fiendin
ima fix you ima fuck you ima get rid of them demons
its my

chorus chance the rapper
my druggy when im ugly hug me
when im bummy scummy im your hubby
lets get lost lets get lost

verse 2 chance the rapper
damn i need a minute aight leggo
she fell in love it fell apart aight let go
she met her match i let her match
she lit her match she let me smoke
yeah me mad petty yeah me bogus
yeah yeah yeah yeah yeah me know
yeah she knew too igh it made her love it
her pussy like me her heart like fuck it
so dance for daddy like gator
aint no partners on this trip
and lose yourself in my room
and find yourself in my grip
im sayin
you might also likechorus chance the rapper
my druggy when im ugly hug me
when im bummy scummy im your hubby
lets get lost lets get lost

verse 3 noname
i blessed myself inside your arms one day
swear to god there i was when the dress
and the silver buttons fade away
miss mary mattress geriatrics
fuck me into open caskets i wanna die with this
i wanna stop seeing my psychiatrist
she said pill pop baby girl cause i promise you you tweaked
the empty bottled loneliness this happiness you seek
the masochism that you preach
practice backflips tragic actress
on a movie with no screen
when the only time he loves me is naked in my dreams

chorus chance the rapper
my druggy when im ugly hug me
when im bummy scummy im your hubby
lets get lost lets get lost
igh201embed"
