id,song_name,artist_names,album_name,lyrics
0gM2LPvmYnW1Gr6A3hS8Fg,Kill You,Eminem,5qENHeCSlwWpEzb25peRmQ,"303 contributorstranslationsportuguêsenglishрусскийtürkçesvenskakill you lyricsintro
when i was just a little baby boy my momma used to
tell me these crazy things
she used to tell me my daddy was an evil man
she used to tell me he hated me
but then i got a little bit older and i realized
she was the crazy one
but there was nothin i could do or say to try to change it
cause thats just the way she was

verse 1
they said i cant rap about bein broke no more
they aint say i cant rap about coke no more ahh
slut you think i wont choke no whore
til the vocal cords wont work in her throat no more ahh
these motherfuckers are thinkin im playin
thinkin im sayin this shit cause im thinkin it just to be sayin it ahh
put your hands down bitch—i aint gon shoot you
ima pull you to this bullet and put it through you ahh
shut up slut youre causin too much chaos
just bend over and take it like a slut—okay ma
oh now hes rapin his own mother
abusin a whore snortin coke and we gave him the rolling stone cover
you goddamn right bitch and now its too late
im triple platinum and tragedies happened in two states
i invented violence you vile venomous volatile vicious
vain vicodin vrin vrin vrin
texas chainsaw left his brains all
danglin from his neck while his head barely hangs on
blood guts guns cuts
knives lives wives nuns sluts
you might also likeprechorus
bitch ima kill you you dont wanna fuck with me
girls neither you aint nothin but a slut to me
bitch ima kill you you aint got the balls to beef
we aint gon never stop beefin i dont squash the beef
you better kill me ima be another rapper dead
for poppin off at the mouth with shit i shouldnt have said
but when they kill me im bringin the world with me
bitches too you aint nuttin but a girl to me i said

chorus
you dont wanna fuck with
shady cause why
cause shady will fuckin
kill you ah haha
i said you dont wanna fuck with
shady why
cause shady will fuckin
kill you bitch ima kill you

verse 2
like a murder weapon ima conceal you
in a closet with mildew sheets pillows and film you
fuck with me i been through hell shut the hell up
im tryna develop these pictures of the devil to sell em
i aint acid rap but i rap on acid
got a new blowup doll and just had a strapon added
whoops is that a subliminal hint no
just criminal intent to sodomize women again
eminem offend no eminemll insult
and if you ever give in to him you give him an impulse
to do it again then if he does it again
youll probably end up jumpin out of somethin up on the tenth ahh
bitch ima kill you i aint done this aint the chorus
i aint even drug you in the woods yet to paint the forest
a bloodstain is orange after you wash it
three or four times in a tub but thats normal aint it norman
serial killer hidin murder material
in a cereal box on top of your stereo
here we go again were out of our medicine
out of our minds and we want in yours let us in
prechorus
or ima kill you you dont wanna fuck with me
girls neither you aint nothin but a slut to me
bitch ima kill you you aint got the balls to beef
we aint gon never stop beefin i dont squash the beef
you better kill me ima be another rapper dead
for poppin off at the mouth with shit i shouldnt have said
but when they kill me im bringin the world with me
bitches too you aint nothin but a girl to me i said

chorus
you dont wanna fuck with
shady cause why
cause shady will fuckin
kill you ah haha
i said you dont wanna fuck with
shady why
cause shady will fuckin
kill you haha

verse 3
know why i say these things
cause ladies screams keep creepin in shadys dreams
and the way things seem i shouldnt have to pay these shrinks
these 80 gs a week to say the same things tweece
twice whatever i hate these things
fuck shots i hope the weedll outweigh these drinks
motherfuckers want me to come on their radio shows
just to argue with em cause their ratings stink
fuck that ill choke radio announcer to bouncer
from fat bitch to all seventy thousand pounds of her
from principal to the student body and counselor
from inschool to beforeschool or outta school
i dont even believe in breathin im leavin
air in your lungs just to hear you keep screamin for me to seep it
okay im ready to go play i got the machete from o j​
im ready to make everyones throats ache
you faggots keep eggin me on
til i have you at knifepoint then you beg me to stop
shut up give me your hands and feet i said shut up
when im talkin to you you hear me answer me
prechorus
or ima kill you you dont wanna fuck with me
girls neither you aint nothin but a slut to me
bitch ima kill you you dont got the balls to beef
we aint gon never stop beefin i dont squash the beef
you better kill me ima be another rapper dead
for poppin off at the mouth with shit i shouldnt have said
but when they kill me im bringin the world with me
bitches too you aint nuttin but a girl to me bitch ima kill you

chorus
you dont wanna fuck with
shady cause why
cause shady will fuckin
kill you haha
i said you dont wanna fuck with
shady why not
cause shady will fuckin
kill you

outro
hahaha
im just playin ladies
you know i love you
produced by dr dre  melman158embed"
