id,song_name,artist_names,album_name,lyrics
0q2vG0UVuy6ajjcpkQHdZM,Unaccommodating (feat. Young M.A),"Eminem, Young M.A",4otkd9As6YaxxEkIjXPiZ6,"7 contributorstranslationsenglishitalianotürkçeenglishfrançaiseminem ft young ma  unaccommodating ترجمه‌ی فارسی lyricsintro young ma  eminem
oh this what we doin alright
ma
خب این کارو قراره انجام بدیم؟ باشه

verse 1 young ma
i like a bitch that like to wobble wobble
من از جنده ای خوشم میاد که بخواد بلرزونه، بلرزونه
shake it shake it break it break it uh
تکونش بده، تکونش بده،  بشکونش، بشکونش
nigga we made it made it they hate it hate it
پسر، ما موفق شدیم موفق شدیم اونا بدشون میاد بدشون میاد
pro professional pure persistent im paper chasing
فوق حرفه ای هستم کاملاً مُصِر، دنبال پولم
i hate complaining i hated waiting ill pay for patience
از غر زدن و شکایت کردن بدم میاد از صبرکردن بدم میومدواسه صبر حاضرم پول بدم
but i hate to pay a bill hate that
اما بدم میاد قبضی رو پرداخت کنم، بدم میاد
and i made a mil without a major deal i made that
و بدون قرارداد بزرگی تونستم یک میلیون بدست بیارم  تونستم
yeah her ass fake but she came for real she came uh
آره، کونش فیکهاما یکاری کردم که واقعا آبش اومداومد
money aint a thing that aint a thing for real
پول که چیزی نیست واقعا که چیزی نیست
its the broke lingo huh
زبانِ دلال های بانکیه
and no aint nothing saweetie this is no quavo migo
و نه، مثل سویتی فیک نیست کوایوو نیست  میگو
man i just get high let my hoes lay low ooh
پسر، من نشئه میکنم بذارین جک و جنده هام سرشون تو کار خودشون باشه
i just want some face but this is no facial ooh
من فقط پول یا ساک میخوام ولی قرار نیست روی صورت بریزه
do right and kill erbody drake mode hello
کار درست رو انجام میدم و همه رو میکُشممثل دریک
bitch im tryna eat out take your plate mode hello
عوضی ، سعی دارم غذام رو بخورم سرت تو بشقابت باشه
disrespect that life and im in gang mode grrr
اگه به این سبک زندگیم توهین کنی، توی مُد گنگستری میرم
you can leave this earth bitch im in rake mode huh
میتونی از این زمین بری، جنده من زن‌بازم
im in cake mode huh im in brave mode uh
من دنبال ک و کونم  توی مُد شجاعتم
what up marshall im a martian im in wayne mode facts
چه خبر، مارشال؟ من مریخی ام مثل لیل وین
neck wet big drip im in rain mode drip drip drip
گردنم خیسهسکسی و باکلاسم مثل بارون
eight niggas eight hittas take eight souls brrr
هشت تا کاکاسیاه، هشت تا آدمکشجون هشت نفر رو میگیرن
collect pesos huh and im paid so paid
پسو جمع میکنم پول میگیرم خب که چی؟
selfmade goals hey
اهداف خودساخته دارم
when the pain leaves huh
where does the pain go where
وقتی درد بره، به کجا میره؟
tip of the backwood is where the flame goes there
سر سیگار بک وود جاییه که روشن میشه
to the sky is where my brain goes wow
ذهنم به آسمون ها میره
same pack same fiend sellin the same clothes wow
همون بسته، همون شیطان یا معتاد ، همون لباس هارو میفروشه
pinocchio and my pistol they got the same nose
پینوکیو و اسلحه ام جفتشون دماغ بزرگی دارن
me and my niggas gotta eat we share the same stove what
من و رفیقام باید یک لقمه نون بخوریماز یک اجاق استفاده میکنیم
case closed bodies in my lane bitch lane closed
پرونده مختومه شدجسدهایی سر راهم هستنجنده، راه رو میبندم
you might also likeverse 2 eminem
game over thanos on you hos
بازی تموم شده، شما جک و جنده هارو مثل تینوس نابود میکنم
on my petty shit but i dont paint toes yeah
کارهای کوچیکم رو دارم انجام میدم اما ناخن هام رو لاک نمیزنم
get the plunger plunger cause marshall and ma go plum crazy
لوله بازکن رو بیار لوله بازکن چونکه مارشال و امای قراره  دیوونه‌بازی در بیارن
call us liquid plumber cause even dre know dre know
به ما بگو مایع لوله‌باز کن  چونکه حتی دره هم میدونن
beat knocks like a beefed up detox
بیت میترکونه مثل دیتاکس قوی
youre gonna need three swats or police officers at least to come
pull me off of it and i dont stop
به حداقل سه تا نیروی ضربت یا افسر پلیس نیاز دارین تا بیان منو جدا کنن و منم دست برنمیدارم
please dawg i need yall to keep talking shit cause i feed off of it
بیخیال پسر، من نیاز دارم شماها کسشر بگین چونکه از کسشرهاتون واسه رپ انرژی میگیرم
i am the complete opposite of these retards who spit these weak
bars ima leave carnage
من کاملاً متضاد این عقب‌افتاده هایی هستم که ضعیف رپ میکنن  من خونریزی به پا میکنم
each thoughtll be so toxic itll block the wind through your esophagus
تک تک افکارم اونقدر سمی و مهلکن که مسیر هوای مِری ـت رو بند میاره
stop it cutting off your oxygen
بس کن، اکسیژنت رو قطع میکنم
and i hit them pads like a boxing gym
و مُشت میزنم مثل توی باشگاه بوکس
better watch for slim better get to popping and when im at the top again
بهتره مراقب اسلیم باشین ، بهتره به شلیک کردنم برسم و وقتی دوباره تو اوج باشم، سقوط نمیکنم
i wont topple im giving it to anyone who wanna come and get it and im not gonna stop
هرکی که بخواد بخاره پدرشو در میارم و میدم دستش و دست هم برنمیدارم
but when they ask me is the war finished with mgk of course it is
اما وقتی ازم میپرسن که جنگت با ام جی کی تموم شده؟ جواب میدم  معلومه که شده
i cleansed him of his mortal sins im god and the lord forgives even the devil worshippers
من اون رو از گناهان دنیویش پاک کردم من خدا هستم و پروردگار حتی شیطان پرست هارو هم میبخشه
im moving on but you know your scruples are gone when youre born with lucifers horns
من که دیگه ازش گذشتم ولی وقتی میدونی دیوونه ای که با شاخ های لوسیفر شیطان به دنیا اومده باشی
and youre from the school of notorious puba cube and the poor righteous teachers
و شاگرد مکتب نوتوریس ، پابا ، کیوب و پور رایچز تیچرز هستی
tutored my students showed them all the blueprint and formula
به شاگردهام درس یاد دادم، بهشون همه فرمول و طرح های اولیه رو نشون دادم
but it seems like the more they studied my music the more they remind me of eyeballs
اما به نظر هرچی بیشتر موزیک من رو مطالعه میکنن، بیشتر منو یاد تخم چشمام میندازن
im watching my pupils get cornier uh
هی شاگردهام خزتر میشن
but im contemplating yelling bombs away on the game
من دارم به این فکر میکنم که برم داد بزنم و روی این بازی رپ بمب بندازم
like im outside of an ariana grande concert waiting
انگار که بیرون کنسرت آریانا گرانده منتظر نشستم
chorus eminem
they call me saddam hussein ayatollah khomeini
اونا به من میگن صدام حسین و آیت الله خمینی
wheres osama been i been laden lately
اسامه کجاست؟ اخیراً دست کم گرفته شدم
look at how im behaving they want me gone away
ببینین چطور رفتار میکنم اونا میخوان که من برم
they wanna jonbenet me fuck you im unaccommodating
میخوان منو مثل جان بنت سربه‌نیست کنن  من ناسازگارم

verse 3 eminem
man i dont see why they hate me huh
پسر، من واقعا نمیفهمم چرا از من بدشون میاد ها؟
im a clown like john wayne gacy what
من مثل جان وین گیسی یک دلقکم
they call me kanye crazy yah
میگن مثل کانیه دیوونه ام
apeshit beyonce jayz woo
دیوونه و عصبانیم  بیانسهجی زی
and im back with andre baby yeah
و الان پیش آندره برگشتم، عزیزم
and the doctors operating what
و دکتر داره عمل میکنه چی؟
but he never put no scrubs on from snoop k dot to shady
اما هیچوقت آدم بیخودی روسر کار نیاورده از اسنوپ بگیر تا کندریک لامار و شیدی
shady like a shadow or your silhouette intellect i better check to see why you feel upset
شیدی مثل سایه یا تصویر سیاه‌نمات میمونه خردمندمبهتره ببینم چرا احساس ناراحتی میکنی
cause i met your bitch on the internet now im getting head like a pillow pet
چونکه با زیدت توی اینترنت آشنا شدم و حالا برام داره ساک میزنه
that bimbo can put her lips all the way around this bone and then blow
اون جنده بلده چطور خوب لب هاش رو دور کیرم بذاره و برام ساک بزنه
like a dusty cartridge from an old nintendo
مثل فوت کردن کارتریج خاکی یک نینتندوی قدیمی
those were the days but i bet you im never gonna be broke again no
اون قضیه مال گذشته ها بود اما شرط میبندم باهاتون که دیگه بی پول نمیشم نه
i dont smoke but i got paper to be blunt im rolling indo
من سیگار نمیکشم اما پول پیپر دارم  راستش رو بگم توی پول دارم غرق میشم
and i keep it one comma zero zero zero zero
و یکویرگولصفرصفرصفرصفر 1،0000 نگهش میدارم
real real real murder murder murder kill kill kill
جدیم، جدیم، جدیم، قتل ، قتل ، قتل ، بکش، بکش، بکش
nickelplated twenty two two two
با روکش نیکلی ، بیست و دو ، دو ، دو
bitch shut the fuck up fore i shoot you too
عوضی، دهنتو ببند قبل از اینکه به تو هم شلیک کنم
aint shit i wont do just to get a few youtube views
مثل بعضیا نیستم که هرکاری حاضرن انجام بدن تا چهارتا بازدید توی یوتیوب بگیرن
run up in a church like pew pew pew
میرم توی کلیسا و شلیک میکنم، پیو، پیو،پیو
cause thats what i do do do
چونکه اینکارو میکنم اینکارو میکنممیکنم
but even to the untrained human eye
we aint the same you and i
اما حتی در مقابل چشم غیرمسلح انسان هم ما مثل هم نیستیممن و تو
somebody should have explained to you why
for you to go against me its simply insane you will die yeah
یکی باید بهت توضیح میداد که چرا اقدام کردن علیه من کار احمقانه ایه تو میمیری آره
thats why they call me kamikaze its plain suicide yeah
برای همین به من میگن کامیکازی ، خودکشی توی روز روشنه  آره
but i know magic and here go my last trick
اما من شعبده بازی بلدم و اینم از حقه آخرم
im bout to say abracadabra and pull a b rabbit up out of my hat
میخوام بگم اجی مجی لا ترجی و یک بی ربیت از کلاهم دارم
im about to relapse and i betcha that you wont know how to react
میخوام دوباره به دوران اعتیادم برگردم و شرط میبندم که اصلا نمیدونین چطور واکنش نشون بدین
but a look of disgust i dont doubt itd be that
به جز اینکه ابراز انزجار کنین بی شک همینجوری میشه
as i begin to fuckin devour the track
من شروع میکنم به بلعیدن و قورت دادن این تِرک
and you backpedal that is a cowardly act
ولی شما به عقب پا میزنین  و میرین  این یک حرکت بزدلانه هست
like a saudi attack when the towers collapsed
مثل حمله سعودی ها وقتی که برج ها فرو ریختن
chorus eminem
they call me saddam hussein ayatollah khomeini
اونا به من میگن صدام حسین و آیت الله خمینی
wheres osama been i been laden lately
اسامه کجاست؟ اخیراً دست کم گرفته شدم
look at how im behaving they want me gone away
ببینین چطور رفتار میکنم اونا میخوان که من برم
they wanna jonbenet me fuck you im unaccommodating
میخوان منو مثل جان بنت سربه‌نیست کنن  من ناسازگارمembed"
