id,song_name,artist_names,album_name,lyrics
1qgNiHh7QoSgzoFZEPwPNm,Be With You,Beyoncé,6oxVabMIqCMJRYN1GqR3Vf,"21 contributorstranslationsportuguêsbe with you lyricsintro
ooh baby
mm
ooh baby
oh yeah

verse 1
i love the way you make me feel it slows down time
come in my bedroom and turn off the lights
you whisper softly in my ear makes me unwind
the way you touch me lets me know youre mine

chorus
id rather be with you cause i love the way you scream my name
and theres no other man that gives me what i want and makes me feel this way
id rather be with you cause you hustle hard to take care of me
id rather be with you boy id rather be with you
you know id rather with you boy id rather be with you

verse 2
i love the way you look at me stare into my eyes
what do they say to you boy dont be shy
tonights the night your fantasies will all come true
i am your woman i belong to you woah
there is nothing i wont do for you
i know my soul connected me to you
i feel so safe when im alone with you oh
im holdin back nothing savin it all for you
baby i love making love to you
its like a high i cant come down from you
you might also likechorus
id rather be with you cause i love the way you scream my name ooh scream my name
and theres no other man that gives me what i want and makes me feel this way only you ooh who makes me feel this way
id rather be with you cause you hustle hard to take care of me id rather be with you babe you hold it down for me baby
id rather be with you boy id rather be with you
you know id rather with you id rather be id rather be with you boy id rather be with you

bridge
ah ah ah ah ah ah hey
id rather be with you well yeah
boy id rather be with you
id rather be with you well yeah yeah yeah
boy id rather be with you id rather rather be with rather be with you

chorus
id rather be with you cause i love the way you scream my name scream it louder baby
and theres no other man that gives me what i want and makes me feel this way woo make me feel good baby
id rather be with you cause you hustle hard to take care of me so good so good so good
id rather be with you boy id rather be with you
you know id rather with you dont want nobody else but you
id rather be with you cause i love the way you scream my name i aint goin nowhere
and theres no other man that gives me what i want and makes me feel this way im happy with you you got me baby i aint think bout nobody else baby
id rather be with you cause you hustle hard to take care of me you you you you ooh woah
id rather be with you boy id rather be with you
you know id rather with you boy id rather be with you6embed"
