id,song_name,artist_names,album_name,lyrics
37HyO9EKIh9jgQcPNq1RfL,Heal the World,Michael Jackson,77dNyQA0z8dV33M4so4eRY,"77 contributorsheal the world lyricsintro child
think about um the generations and uh say we wanna make it a better place for our children and our childrens children so that they they they s—they know its a better world for them and think if they can make it a better place

verse 1 michael jackson
theres a place in your heart
and i know that it is love
and this place could much brighter than tomorrow
and if you really try
youll find theres no need to cry
in this place youll feel theres no hurt or sorrow

prechorus michael jackson
there are ways to get there
if you care enough for the living
make a little space
make a better place

chorus michael jackson
heal the world
make it a better place
for you and for me and the entire human race
there are people dying
if you care enough for the living
make a better place for you and for me

verse 2 michael jackson
if you want to know why
theres a love that cannot lie
love is strong it only cares for joyful giving
if we try we shall see
in this bliss we cannot feel
fear or dread we stop existing and start living
you might also likeprechorus michael jackson
then it feels that always
loves enough for us growing
make a better world
so make a better world

chorus michael jackson
heal the world
make it a better place
for you and for me and the entire human race
there are people dying
if you care enough for the living
make a better place for you and for me

bridge michael jackson
and the dream we were conceived in will reveal a joyful face
and the world we once believed in will shine again in grace
then why do we keep strangling life
wound this earth crucify its soul
though its plain to see this world is heavenly
be gods glow

verse 3 michael jackson
we could fly so high
let our spirits never die
in my heart i feel you are all my brothers
create a world with no fear
together well cry happy tears
see the nations turn their swords into plowshares
prechorus michael jackson
we could really get there
if you cared enough for the living
make a little space
to make a better place

chorus michael jackson  the john bahler singers
heal the world
make it a better place
for you and for me and the entire human race
there are people dying
if you care enough for the living
make a better place for you and for me
heal the world
make it a better place better place
for you and for me and the entire human race
there are people dying
if you care enough for the living
make a better place for you and for me
heal the world heal the world
make it a better place better place
for you and for me and the entire human race oh no
there are people dying oh
if you care enough for the living
make a better place for you and for me
postchorus michael jackson  the john bahler singers
yeah there are people dying oh
if you care enough for the living
then make a better place for you and for me
everyone there are there are people dying oh
if you care enough for the living
make a better place for you and for me

outro mj mj  the john bahler singers christa collins mj  christa collins
you and for me make a better place
you and for me make a better place
you and for me make a better place
you and for me heal the world we live in
you and for me save it for our children
you and for me heal the world we live in
you and for me save it for our children
you and for me heal the world we live in
you and for me save it for our children
you and for me heal the world we live in
you and for me save it for our children25embed"
