id,song_name,artist_names,album_name,lyrics
2VdT56BGpdqNHUgOe1j5vc,Rich & Sad,Post Malone,6trNtQUgC8cgbWcqoMYkOR,"73 contributorstranslationstürkçenederlandsrich  sad lyricsverse 1
hunnid thousand for the chain and now my drop drop drop
when i pull out the garage i chop my top top top
just like a fiend when i start i cannot stop whoa
i got i got hella guap look at me now at me now
ooh covered in carats ooh mahogany cabinets
ooh i ball like the mavericks ooh stable and stallions
ooh massive medallions ooh i finally had it
ooh but then you just vanished damn i thought i was savage

prechorus
all this stuntin couldnt satisfy my soul –oul
got a hundred big places but im still alone –one

chorus
ayy i would throw it all away
i just keep on wishin that the money made you stay
you aint never cared about that bullshit anyway
i just keep on wishin that the money made you stay ayy
you know i would throw it all away
i just keep on wishin that the money made you stay
price went up my price went up we went our separate ways
i just keep on wishin that the money made you stay ayy ayy

verse 2
buy me love tried to buy me love
now im alone ice box omarion ooh
plenty sluts grabbin on my nuts whoa
might have fucked it was only lust trust
i was livin life how could i have known could have known
couldnt listen to advice cause im never wrong oh
in the spotlight but im on my own oh
now that youre gone now that youre gone
see post malone liveget tickets as low as 186you might also likeprechorus
all this stuntin couldnt satisfy my soul –oul
got a hundred big places but im still alone –one

chorus
ayy i would throw it all away
i just keep on wishin that the money made you stay
you aint never cared about that bullshit anyway
i just keep on wishin that the money made you stay ayy
you know i would throw it all away
i just keep on wishin that the money made you stay
price went up my price went up we went our separate ways
i just keep on wishin that the money made you stay ayy ayy

bridge
i dont even wanna go home
in a big house all alone alone
i dont even wanna go home no no no
but ima try to call you on the phone
brrt

chorus
i would throw it all away
i just keep on wishin that the money made you stay
you aint never cared about that bullshit anyway
i just keep on wishin that the money made you stay made you stay ayy
you know i would throw it all away  all away
i just keep on wishin that the money made you stay made you stay
price went up my price went up we went our separate ways separate ways
i just keep on wishin that the money made you stay made you stay ayy ayy55embed"
