id,song_name,artist_names,album_name,lyrics
3O6d469HVaF8M3FOGcUf4r,Corridos Tumbados,Natanael Cano,6HvpgqHcpyXzAdNIioqIoq,"5 contributorscorridos tumbados lyricsletra de corridos tumbados

verso 1
muchos piensan que es sencillo y no saben de que se trata
y aquellos que no han llegado ahora quieren meter la pata
y en la mente una misión todos la misma visión
siete corridos tumbados siempre sonaran mejor

coro
no me da miedo y represento el movimiento
un doble vaso retacado y polvo en mi nariz
una línea que despierta lo que yo siento
y aunque no siento nada de esto no quiero salir
mi vida es gris a veces ni pa que les cuento
un hoyo negro la gente solo te quiere hundir
pero salí cabrón de nada me arrepiento
no me detiene ningún puto que se cruce aquí eah

verso 2
hoy me miran elegante con mí rolex en la mano
¿que no soy el mismo de antes para eso le batallamos
siempre tengo claro el mapa la envidia no nos opaca
todo lo que tiro es brillo y un suspiro y a volar
no me da miedo y represento el movimiento

coro
un doble vaso retacado y polvo en mi nariz
una línea que despierta lo que yo siento
y aunque no siento nada de esto no quiero salir
mi vida es gris a veces ni pa que les cuento
un hoyo negro la gente solo te quiere hundir
pero salí cabrón de nada me arrepiento
no me detiene ningún puto que se cruce aquísee natanael cano liveget tickets as low as 101you might also like1embed"
