id,song_name,artist_names,album_name,lyrics
1n73Qe6oEprLsUNHXET2pb,Love Me or Leave Me,Little Mix,2FnfZiFMv7bmXAIATOJDHs,"52 contributorstranslationsespañollove me or leave me lyricsintro jesy
mmmhmm

verse 1 jesy
you used to tell me that you loved me once
what happened what happened
where is all of this coming from
what happened what happened
you say im crazy and theres nothing wrong
youre lyin and you know i know
baby what have we become
what happened

prechorus jesy
we used to never go to bed angry
but its all we ever do lately
and youre turning away like you hate me
do you hate me do you hate me oh

chorus perrie
you can take this heart
heal it or break it all apart
no this isnt fair
love me or leave me here

postchorus perrie
ahahah ohohoh
love me or leave me here
ahahah ohohoh
love me or leave me here oh
you might also likeverse 2 jade
do you remember when you loved me once
what happened what happened
and youd hold me here just because
what happened no

prechorus jade
we used to never go to bed angry
but its all we ever do lately
youre turning away like you hate me
do you hate me do you hate me oh

chorus perrie
you can take this heart
heal it or break it all apart
no this isnt fair
love me or leave me here

postchorus all perrie
ahahah ohohoh
love me or leave me here
ahahah ohohoh
love me or leave me here
bridge jade
and love me baby please
cause i could still be the only one you need
the only one close enough to feel you breathe
yeah i could still be that place where you run
instead of the one that youre running from oh
chorus leighanne
you can take this heart
heal it or break it all apart
no this isnt fair
love me or leave me here

postchorus all leighanne
ahahah ohohoh
love me or leave me here
ahahah ohohoh ohoh
love me or leave me here45embed"
