id,song_name,artist_names,album_name,lyrics
50pJXx2ImZomgdmFUtIczx,Where Do We Go (feat. Jamie Foxx),"Pitbull, Jamie Foxx",4rG0MhkU6UojACJxkMHIXB,"13 contributorswhere do we go lyricsintro pitbull
lets mr worldwide take over
mk
jim jonsin globe lets take over the globe

prechorus jamie foxx
where do we go from here
world tell me please
where do we go from here
i want the world to tell me please

chorus jamie foxx  pitbull
where do we go where do we go where do we go
where do we go where do we go where do we go
where do we go where do we go where do we go
where do we go where do we go from here

verse 1 pitbull
how you gon tell me the skys the limit
when theres footprints on the moon
i dont need a tv show to dance with the stars
not me im good
half of the world dont like me
half of the world wanna be me
but believe it or not
that pretty little thing they call earth needs me
im here to show the world
what it is to make something from nothing
yeah fo sho
im here to show the world what it is to do good business
how to blow what i blow
im here to show the world that money dont buy happiness
believe me i know
but just one thing once ive showed the world
i just wanna know
you might also likeprechorus jamie foxx
where do we go from here
world tell me please
where do we go from here
i want the world to tell me please

chorus jamie foxx  pitbull
where do we go where do we go where do we go
where do we go where do we go where do we go
where do we go where do we go where do we go
where do we go where do we go from here

verse 2 pitbull
as the suns rotates and pit gets bigger
the more countries in the world i hit em all
armando bond double 0305 aka mr worldwide
dont be silly ive had it on lock and thats fo sho
ive already changed my city
now im on my way to change the globe
im tryna inspire the world to show em what it is
when you hustle and you work hard
show em what it is to put your life on the line
for the love of the grind
life is a rhyme with no reason
and thats the reason that i rhyme
but once i show the globe
i just wanna know
prechorus jamie foxx  pitbull
where do we go from here where do we go from here
world tell me please world tell me please
where do we go from here where do we go from here
i want the world to tell me please world tell me please
where do we go from here where do we go from here
world tell me please world tell me please
where do we go from here where do we go from here
i want the world to tell me please

chorus jamie foxx  pitbull
where do we go where do we go where do we go
where do we go where do we go where do we go
where do we go where do we go where do we go
where do we go where do we go from here

outro pitbull
you must be blind if ya cant see the world is mine
you must be blind if ya cant see the world is mineembed"
