id,song_name,artist_names,album_name,lyrics
1kQqiC1rS1FiuVpeBKN0QN,Rakata,Wisin & Yandel,0mfiGkVJST0ysEVznu2aZP,"9 contributorsrakata lyricsletra de rakata

precoro yandel wisin
salte w con—
si no estás bailando con ella salte y yandel
si no estás perreando con ella salte
luny medio millón de copias obligao
si no estás bailando con ella salte
el dúo de la historia en mas flow 2 ¡sumba

coro yandel  wisin
para hacerle rakata rakata
si se me pega voy a darle rakata rakata
esta noche quiero hacerle rakata rakata
si se me pega voy a darle rakata rakata
eheh me toca a mí

verso 1 wisin
campicu llegó el frontú
no trates de apagarme porque te apagas tú
w apágale la luz
mami acelera duro ese cucú
tiene veinte enemiga dos amiga
pantalla en la barriga tatuaje en la vejiga
en el culipandeo ella mata la liga
siga sisisisiga
you might also likecoro yandel  wisin
para hacerle rakata rakata
si se me pega voy a darle rakata rakata
esta noche quiero hacerle rakata rakata
si se me pega voy a darle rakata rakata
eheh nely nos vamos

verso 2 wisin  jenny la sexy voz
le gusta que wisin la hale por el pelo
¡grítalo papi dame lo que quiero
siente la presión del callejero
¡grítalo papi dame lo que quiero
bizcochito dame un beso con sabor a caramelo
¡grítalo papi dame lo que quiero
cielo a ese trago le hace falta hielo
grítalo papi dame lo que quiero
pues tenga lo suyo sin orgullo
yo tengo el agua pa ese capullo sss
mami deja el murmullo
coge lo que es tuyo tutututuyo

coro yandel  wisin
para hacerle rakata rakata
si se me pega voy a darle rakata rakata
esta noche quiero hacerle rakata rakata
si se me pega voy a darle rakata rakata
eheh
outro wisin
luny ahora hay que trabajar de medio millón pa arriba
tú sabe el dúo de la historia
w el sobreviviente con yandel
ellos lo saben
mas flow 2 el que para ventas
este disco no hay quien lo supere
matando la liga el arma secreta sin miedo
nelly
mas flow 2
w el sobreviviente con yandel
el dúo dinámico1embed"
