id,song_name,artist_names,album_name,lyrics
0reLKqd7eytYsiFzhKfUEX,R.I.P. (feat. Offset),"YoungBoy Never Broke Again, Offset",1xFoRn9DxZXwPjEdGnw800,"3 contributorsnew music friday 062918 lyricsdrake  don’t matter to me
drake  talk up
drake  8 out of 10
drake  in my feelings
onerepublic  connection
florence  the machine  patricia
charli xcx  focus
teyana taylor  rose in harlem
max  still new york
88rising  warpaint
bad bunny  estamos bien
honne  i got you ◑
jonas blue  i see love
nicky jam  x remix
axwell  ingrosso  dancing alone
mason ramsey  the way i see it
yung bans  ridin feat landon cube  ybn nahmir
bullet for my valentine  the very last time
¿téo  américano
the blaze  she
filmore  love that about you
the brummies  drive away
aap ferg  verified
jozzy  push thru
88rising  let it go
king henry  bad for me
sean paul  bad love
rudy mancuso  mama
breathe carolina  feel it
mike perry  dont hide
mondo cozmo  tonight tonight
years  years  all for you
dean lewis  be alright
benny benassi  everybody needs a kiss
gorillaz  tranz
ella vos  you dont know about me the aclu remix
labrinth  same team
aj mitchell  girls
lovelytheband  alone time
novaa  club paradise
wiz khalifa  gin  drugs feat problem
hillsong young  free  every little thing
sheryl crow  wouldnt want to be like you featuring annie clark
hot since 82  buggin edit
big pineapple  another chance don diablo edit
sachi  hollywood angel
james vincent mcmorrow  me and my friends
eden  about time
st paul  the broken bones  apollo
mansionair  technicolour
youngboy never broke again  rip feat offset
mitski  nobody
lets eat grandma  i will be waiting
kenny chesney  pirate song
for king  country  pioneers
midland  burn out recorded at sound stage studios nashville
the knocks  shades
shallou  lie le youth remix
ozuna  vaina loca
all time low  birthday
love and theft  you didnt want me
xylø  dont panic
olivia obrien  rip remixfeat geazy  drew love
pale waves  noises
michl  tell her
daisy gray  saviour acoustic
cleopatrick  youth
devault  stay feat njomza  bipolar sunshine
passenger  runaway
chocolate puma  tear this mother down feat mx2
tieks  break the rules
moti  i see light in you feat faye medeson
bearson  i only need one feat mndr
eny  until next time
boy pablo  sick feeling
martin solveig  my love
the aston shuffle  everything i got
blanco white  olalla
louie vega  last night a dj saved my life feat anané  tony touch
phil wickham  song in my soul
ruston kelly  jericho
the interrupters  gave you everything
the score  glory
casanova  down bitch
lökii  lovers
ayokay  half past you feat future jr
dijon  wild
allen stone  warriors
the wild feathers  quittin time
randy houser  what whiskey does
smalltalk  youngembed"
