id,song_name,artist_names,album_name,lyrics
7qQwSPK13YDvjxMmzdNyxq,No Me Digas Que No,Intocable,1kV7jDTxmrdblp3QD0ypND,"2 contributorsno me digas que no lyricsmirame y escucha bien lo que te voy a decir
no hay nadie mas que te quiera como yo
en este mundo no hay nadie
que te entregue tanto amor oh no

escuchame y piensa bien lo que me vas a decir
porque me puedes partir el alma en dos
en este mundo no hay nadie
que te entregue tanto amor oh no

piensalo bien si me vas a querer
si me dices que no me vas a hacer llorar
dame tu corazon no me digas que no
y dame una oportunidad

no me digas que no piensalo bien
recuerda que como yo no hay quien te quiera
no me digas que no si me entregas tu amor
te voy a dar todo lo que tu quieras
no me hagas llorar dame una oportunidad

escuchame
piensalo
no me digas que no

no me digas que no piensalo bien
recuerda que como yo no hay quien te quiera
no me digas que no si me dices que si
te voy a dar toda mi vida entera
no me hagas llorar dame una oportunidadsee intocable liveget tickets as low as 58you might also likeembed"
