id,song_name,artist_names,album_name,lyrics
57AvqW4n5SfgtCSra5RE6t,Start Turnin' Me On,New Edition,5Bp5PZqYJ9tiz0Hf6lOD5Q,"3 contributorsstart turnin’ me on lyricschorus
when you
start turning me on
i just react when you
start turning me on
i cant hold back when you
start turning me on
i give it to you and

verse 1 ralph
it started scratchin sweatin mournin
my body is growing hotter in georgia
i want cha beside me all over my body
dont worry my neighbors to old to hear us baby
when you

chorus
start turning me on
i just react when you
start turning me on
i cant hold back when you
start turning me on
i give it to you and
start turning me on
dont stop what you doing
see new edition liveget tickets as low as 1086you might also likeverse 2 ralph
what do you want me to taste first
baby it dont matter at all
as long as i feel your thirst
baby got me climbin the wall
all i request is 3000 seconds
of your time your soul
baby i lose control when you

chorus
start turning me on
i just react when you
start turning me on
i cant hold back when you
start turning me on
i give it to you and
start turning me on
dont stop what you doing

bridge
when we start touchin kissin and grindin
got me open temperatures risin
i start shakin movin and grindin
dont want you to hold back the climax
let it go and show me your love girl
hold me when its all set and done girl
we can do this thing every time
that you start turnin me on
verse 3 mike
you turnin me on and on and on and
first thing in the mornin the middle we yawnin
your word is born you all i think about
when the snow fall the minks be out
diamonds and links be out
we in the club where all the drinks be out
where the thugs and all the freaks be out
wont you peep me out
approach me and try to sneak me out
whoever thought you take the kinky route ouch

verse 4 ronnie
pain is pleasure
mommy ronnie had game forever
mommy my hobbies aint chains and leather
mommy my hobbies be planes and cheddar
and the strangest weather
and the mohabe didnt rain forever
but in the club its a different perpective
dance floor electric ronnie a star mommy its hectic
since 83 the ladies be in my mercedes 3
yo whatever the ladies be so please believe

chorus
start turning me on
i just react when you
start turning me on
i cant hold back when you
start turning me on
i give it to you and
start turning me on
dont stop what you doing
outro
oh turnin me babe
you turn me on you turn me on babe
girl im about to lose my mind
please dont stop what you doing oh oh babe
and i think i like it babeembed"
