id,song_name,artist_names,album_name,lyrics
6tjsbysvZh8Pq8DZA5ldrn,The Knowing,The Weeknd,7zCODUHkfuRxsUjtuzNqbd,"107 contributorstranslationsespañolрусскийtürkçeмакедонскиportuguêsthe knowing lyricsintro
oh oh oh
oh yeah yeah ayy

verse 1
i know what you did
i know
so ima let you taste her
i aint washing my sins
i aint washing my sins

prechorus
now were lying about the nights
hiding all it behind the smiles
take a look at what you did ayy
you probably thought that youd break my heart ohohohooh
you probably thought that youd make me cry
but baby its okay
i swear its okay

chorus
cause i know everything yeah
i know everything yeah yeah
i know everything everything ayy ayy
i know everything yeah yeah
you might also likeverse 2
now these tongues dont twist like they did before
tryin to keep me up
and you are dry
but baby it dont hurt
oh like you thought it would
the more of you the merrier ohohohooh

prechorus
now were lying about the nights
hiding all it behind the smiles ooh
take a look at what you did ooh hey
you probably thought that youd break my heart ooh ooh
you probably thought that youd make me cry woo
but baby its okay
its okay ayy

chorus
i know everything
i know everything yeah
everything yeah
i know everything everything137embed"
