id,song_name,artist_names,album_name,lyrics
5MUxrNd7Gr2HksLcAlB0IO,Yah Mean,Playboi Carti,4rJgzzfFHAVFhCSt2P4I3j,"79 contributorstranslationsfrançaisyah mean lyricsintro
you know what im sayin
young prettyass nigga you know
young handsome ass nigga you know
pretty nigga you dig

chorus
shawty wanna ball with the team team what what
money sittin tall yao ming what beep
shawty wanna kick it with the team what what
i got all this guap on me guap guap guap guap
shawty wanna ball with the team team guap guap
money sittin tall yao ming what

bridge
guap guap what
guap guap what
guap guap what
guap guap what what what
guap guap what
guap guap what
guap guap what
guap guap what what what what what

verse 1
uh shawty wanna ball with the team team what
money sittin tall yao ming what what
im countin all this guap on me what what
countin all this guap you know what i mean you know what i mean nigga check it what
sippin on that motherfuckin lean what what
promethazine motherfuckin lean purple motherfuckin tech actavis
niggas watered down like some fuckin chlorine what what
bitch its lord of the rings beep ice ice
diamonds lookin like summertime look at the ice look at the ice ice
tryna bite my flow and my rhymes look at the ice ice you got that shit you got that shit
i thought i told that ho the world is mines look at the ice ice what what
i just took his bitch like a crime look at the ice what what what what
see playboi carti liveget tickets as low as 70you might also likechorus
shawty wanna ball with the team team ball with the team ball with the
money sittin tall yao ming what money sittin tall yao ming
shawty wanna kick it with the team what team what
i got all this guap on me guap guap
shawty wanna ball with the team team guap guap guap guap
money sittin tall yao ming what guap guap guap guap guap guap beep

verse 2
fuckin on that swoop fuckin on that ho
ooh fuckin on that swoop fuckin on that ho what
fucked her in the coupe yeah then she popped the blue yeahyeah
woah ooh yeah south atlanta goon yeah
rip troup what what what what beep
at the citgo what you know how it go gas
count them big bankrolls what and she on the pole
and she came a long way from the stripper pole that my ho yeah
and i came a long way from kickin doors thats on bro what look at the ice

chorus
shawty wanna ball with the team ball with the team ball with the
money sittin tall yao ming money sittin tall yao ming
shawty wanna kick it with the team what team
i got all this guap on me guap guap
shawty wanna ball with the team team
money sittin tall yao ming what what what what
outro
fuckin on that swoop fuckin on that ho
fuckin on that swoop fuckin on that ho
fuckin on that swoop fuckin on that ho
fuckin on that swoop fuckin on that ho
fuckin on that swoop fuckin on that ho25embed"
