id,song_name,artist_names,album_name,lyrics
3iujdhEEObcf6u8NHz1nBo,Weezy Baby,"Lil Wayne, Nikki",7slHgsEMuJfnuft5LAPyw6,"40 contributorsweezy baby lyricsintro lil wayne
yeah
my girl get in at 115 am yeah
the guitars cryin right now
just a couple things thats goin on in my life you know
yeah

verse 1 lil wayne
brim leanin yeah cup tilted yeah
blunt flickin yeah get money fuck bitches hah
young weezy woah young pimpin ow she love it yeah
i keep goin she keep cummin what you know bout it nothin
so bout it yeah like master p who
but no coward uhuh
no i am no howard the duck duck baow
lead showers yeah black flowers yeah
black dresses yeah two hours yeah
closed casket uh aw
my dough tactics is so crafty yes
no laughter uh
i do that after i get the dough bastards stupid
i get the dough faster yes what if i flowed faster damn
like oh nancy the fours plastic automatic im ow
more drastic youre nonames compared to me yeah
who are you where are ya
i cant see you youre air to me nothin
youre not there to me nothin
i aint fuckin with you bitch niggas hah
im fucking your sis nigga its weezy yeah
see lil wayne liveget tickets as low as 84you might also likechorus nikki  lil wayne
if you gon call him weezy yeah yeah yyeah thats thats me
then you must say the baby bitch please say the baby
if you dont say the baby and if you dont say the baby
then just dont say it at all shut the fuck up shut the fuck up bitch yeah

verse 2 lil wayne
yeah im slick as an old mack im yeah
sick as a prozac yeah and tha carter i was the hah
dick for you hoes trap and ah this is tha carter ii and yeah
this is the bozack ah ow diggin you hoes back bitch
quick if i blow back i yeah got it gone rabbit oh
fast my daddy rabbits at home what up pa what up
what up pac what up what up pun what up
what up big what up what up soulja what up
as the streets get colder i get chillier yeah
what up left eye what up what up aaliyah what up
yeah tec9 close by touch em up yeah
i shoot niggas in the mouth boy pucker up mwah
sweet succotash yeah gee golly what the fuck ow
where the hell all these new pussy rappers come from huh
i chew em up like bubble gum yum yum
young weezy so troublesome whatwhat ow

chorus nikki  lil wayne
if you gon call him weezy thats baby thats me
then you must say the baby i said do me a favor please say the baby
if you dont say the baby but if you dont say the baby
then just dont say it at all shut the fuck up shut the fuck up bitch
verse 3 lil wayne
i aint talkin fast you just listenin too slow yeah
im gettin them benjamins can serve like the wimbledon yeah
if im in any predicament nervous never that
got a gat to knock whoever back back very flat
chest caved in mess on the pavement
splat cherry wax rrah bury that hah
rats scary cat hah rrat carry that hah
hollygrove triggerman guns in a knapsack yeah
area code fivezerofour yeah
i am nino fuckin brown and this is tha carter ho woah
this is a quarter stick this in ya garter ho
leave out the back and go straight to the corner store hah
return with the cake come with all my dough yeah
if not they find you in a lake in the morning ho oh
weezy baby please say the baby hey hey
if not dont you motherfuckin say it at all oh bitch

chorus nikki  lil wayne
if you gon call him weezy baby thats me
then you must say the baby say the baby
if you dont say the baby if you dont say the baby
then just dont say it at all shut the shut the fuck up shut the fuck up bitch

outro lil wayne
its real pimpin uh
its real pimpin goin on like bitch
yeah yeah yeah yeah
you could be my bitch
uh uhuhuh
its real pimpin real nigga ow12embed"
