id,song_name,artist_names,album_name,lyrics
3mgN4TJIX6hXrytf0qKhYt,Star (feat. Lucky Daye),"Megan Thee Stallion, Lucky Daye",4YP0h2KGDb20eJuStnBvim,"19 contributorsstar lyricsintro megan thee stallion
j white i need a beat i can go off on ooh
they dont need eyes to see when youre next to me
im a superstar a star a star
and you should wanna take me out and make me smile
lemme jump in yo car yo car yo car

prechorus megan thee stallion and lucky daye
you gotta be a star to jump over the moon so when you touch on me
youre a shootin star oh yeah a star a star
you know you got somethin for the world to see and there i go
still wonderin who you are a star a star
yeah yeah ooh

chorus megan thee stallion
im a superstar im a motherfuckin superstar
must be crazy oohoohooh
im a superstar im a motherfuckin superstar
man you must be crazy oohoohooh
im a superstar im a motherfuckin superstar
must be crazy
im a star im a star

verse 1 megan thee stallion
ayy how you get me is how you keep me yeah
the pussy get stringy every time you get cheesy ah
i used to get flowers yeah
and get fucked in the shower
my pussy ate for hours yeah
now we gotta argue whats yours and whats ours
these other niggas lined up lined up
before your times up times up
you better hope nobody help me make my mind up yeah
treat me like you wanna keep me and like you only see me ayy
and any bitch after megan probably wanna be me woah woah
see megan thee stallion liveget tickets as low as 244you might also likeprechorus lucky daye and megan thee stallion
gotta be a star to jump over the moon come fly with me
youre a superstar oh yeah a star a star
i know you got somethin for the world to see and there she goes
theyre all wonderin who you are a star a star
oh ooh

chorus megan thee stallion lucky daye and both
im a superstar im a motherfuckin superstar
you might go crazy ooh
im a superstar im a motherfuckin superstar
wanna be my baby ooh
im a superstar im a motherfuckin superstar
you must be crazy
im a star im a star oh

verse 2 lucky daye
ayy yeah cash out pass out big benz bentley coupe
shoppin sprees swipe cards i aint got no roof
flights just to see art out in rome
cause we got time dinner in an arena were sprung
he pay attention i pay that and more
who you think im stackin these racks for

prechorus megan thee stallion lucky daye and both
you gotta be a star to jump over the moon so when you touch on me
youre a shootin star oh yeah a star a star
i know you got somethin for the world to see and there i go
still wonderin who you are a star a star
yeah yeah ooh
chorus megan thee stallion lucky daye and both
im a superstar im a motherfuckin superstar
must be crazy ooh
im a superstar im a motherfuckin superstar
tryna be my baby ooh
im a superstar im a motherfuckin superstar
must be crazy
im a star im a star
ohembed"
