id,song_name,artist_names,album_name,lyrics
391SNxpaaNuUx1eCEkTxcE,Tan Sola,Paulina Rubio,64M45unRUhuzlOYth6w5HB,"5 contributorstan sola lyricsletra de tan sola

verso 1
mira que no sé nada
que a veces me pregunto si cambiar o esperar o seguir este ritmo
constante delirante desafiante rutinario y continuo
mira que ha sido poco
el despertar latidos y tratar de correr de evadir mis sentidos
que imponen y someten a este cuerpo a volar en tu auxilio

coro
aquí me tienes hecha nada
haciéndote parches en el alma
con tu recuerdo que me mata
y aquí me tienes hecha trizas
entre mis penas y desdichas
y no te miento que estoy sola
siempre sola siempre sola

verso 2
mira si me haces falta
que por tu ausencia y esta soledad que me abate todo queda en sequía
y llega a concluir con tu adiós solo fui yo quién perdía
mira sí lo comprendo
que se me ha hecho tarde y para hacerte volver se me agotan mis días
y ahora lo sé bien que para amar hay que jugarse la vida
see paulina rubio liveget tickets as low as 126you might also likecoro
aquí me tienes hecha nada
haciéndote parches en el alma
con tu recuerdo que me mata
y aquí me tienes hecha trizas
entre mis penas y desdichas
y no te miento que estoy sola
siempre sola siempre sola

fin
y aquí me tienes hecha trizas
entre mis penas y desdichas
y no te miento que estoy sola
siempre sola siempre solaembed"
