id,song_name,artist_names,album_name,lyrics
5lzKgiXPaDXTMUXfSFQM97,Te Voy A Enamorar,Los Angeles De Charly,2vnk3clo4g2pmzD2P5QaDp,"1 contributorte voy a enamorar lyricsyo soy
el que te manda flores
cada tarde
el que escribe canciones
por nombrarte
el más enamorado
de los que te han tocado
yo soy
el último romántico querida
quien va a llenar de amor
toda tu vida
con un amor amante
tan loco y delirante
te juro corazón
te voy a enamorar
y en nombre de este amor
vas a ser mía
te juro corazón
te voy a enamorar
y vas a ser feliz
toda la vida
yo soy
quien te regalara
la luna llena
y hasta un millón de besos
que ni sueñas
seré punto y aparte
el último en amarte
yo soy
el que te cantara
suave al oído
y aunque tu amor me diga
que es prohíbido
no van a convencerme
que deje de quererte
te juro corazón
te voy a enamorar
y en nombre de este amor
vas a ser mía
te juro corazón
te voy a enamorar
y vas a ser feliz
toda la vida
te juro corazón
te voy a enamorar
y en nombre de este amor
vas a ser mía
te juro corazónyou might also likeembed"
