id,song_name,artist_names,album_name,lyrics
2ACs0dJwkSsvNZvEbvFurK,Better Than Me,The Brobecks,1KLBdhphdiK82hYpAiw8DR,"50 contributorsbetter than me lyricsverse 1
every girl from here to soho
loves to tell me things i dont know
beautiful and smart and not good for me
at all
all your boyfriends go to film school
nathan was in plays in high school how bout that
me im going to play the imbecile who
who keeps choosing you
even though youre bipolar and youre selfish and i hate you ahhh

chorus
everyone is better than me i think
everyone is better than better than me
everyone is better than better than me
hey hey oh hey

piano solo

bridge
look what youve done now im a mess
today i even thought id wear a dress
its beautiful so smart and no good for me
at all

outro
yeah
everyone is better than me i think
throw your hands up if you agree with me
now everyone is better than me i think
everyone is better than better than me
better than oh hey come on now
oh oh
whoa whoa
whoa
you might also likeso wont you go12embed"
