id,song_name,artist_names,album_name,lyrics
2ZrHbO88rM6Ijeg0aJmSzl,Patient,Charlie Puth,0mZIUXje90JtHxPNzWsJNR,"31 contributorstranslationstürkçepatient lyricsintro
sorry

verse 1
these mistakes ive made my fair share
when you needed me i wasn’t there
i was young i was dumb i was so immature
and the things that i did made you so insecure
but baby im still your man i swear

chorus
please be patient with me
please be patient with me
i know i’m not what you need
but baby i’m gonna be
so please be patient with me

verse 2
is it too much is it too much that im askin for
can we start over can we start over yeah can we end this war
i’ve been takin your love ive been wastin your time
but is there still a chance of me changin your mind
before you yeah go walkin out the door

prechorus
oh you know im not perfect
if you leave i deserve it
but baby all im askin you is please please oh
you might also likechorus
please be patient with me patient with me
please be patient with me patient with me
i know im not what you need i know im not what you need
but baby im gonna be baby im gonna be
so please be patient with me yeah patient with me

bridge
oh you dont wanna wait another minute
you dont wanna wait another night
just trust me just trust me just trust me baby
you dont wanna wait another minute no
you dont wanna wait another night
just trust me just trust me just trust me baby

chorus
please be patient with me
please be patient with me
i know im not what you need
but baby im gonna be
so please be patient with me
please be patient with me patient with me
please be patient with me yeah
i know im not what you need i know im not what you need
but baby im gonna be
so please be patient with me29embed"
