id,song_name,artist_names,album_name,lyrics
38yQMFhgXnTFYOnxrbOv9v,Huerfano De Amor,Don Omar,6mGDfbDErYIJsmSewvccWm,"5 contributorshuérfano de amor lyricsayer te vi
y senti que en tu vida ya no existe
un poco de amor de ese que me diste
nuestro amor se enfermo de repente
si aqui estuviera seria feliz

si una llamada tuya recibiera
te juro que todo seria diferente
el tiempo me ha vuelto un tempano
sin ti me siento huerfano
sin ti me siento huerfano huerfano
me siento solo por el mundo
sigo siendo el mismo huerfano que te enamoro que te enamoro
que te enamoro que te enamoro
vivo solo por el mundo
sigo siendo el mismo huerfano que te enamoro

yo quisiera explicarte y decirte tantas cosas
que se convirtieron en murcielagos mis mariposas
que la rosa que me diste tu se llenaron de espinas
y que tu recuerdo ya es una serpiente venonaso que me sigue
que me dice syko que pa tra no mire
que en el mundo hay mucho gente espera que tu amor se expire
que el amor que sentia se fue a una zona de combate
lo hirieron y hoy entre la muerte se devate
que el amor es de papel y brilla como el aluminio
uno como una casa otros es un condominio
ese es nuestro caso gigante como un edificio
por el medio a las alturas se fue por el presipicio
hay amor que si es sincero
hay amor que es embustero
hay amor que dice te amo
otro que dice te quiero
hay amores para siempre
hay amores por un rato
hay amores como el nuestro que se le vencio el contrato
see don omar liveget tickets as low as 77ayer te vi
y senti que en tu vida ya no existe
un poco de amor de ese que me diste
nuestro amor se enfermo de repente
si aqui estuviera seria feliz

si una llamada tuya recibiera
te juro que todo seria diferente
el tiempo me ha vuelto un tempano
sin ti me siento huerfano
sin ti me siento huerfano huerfano
me siento solo por el mundo
sigo siendo el mismo huerfano que te enamoro que te enamoro
que te enamoro que te enamoro
vivo solo por el mundo
sigo siendo el mismo huerfano que te enamoro

me enseñaron que la vida es como un rompecabeza
que lo nuestro esta completo solo faltaba una pieza
que el amor que te tenia se contagio de costumbre
soy un huerfano en la noche ya no hay sol que me alumbre
soy un barco que navega en el mar sin direccion
soy un soldado desarmado sin ninguna mision
que ha fallado en la azaña de encontrar el amor perdido
sin sentido hoy siento que cupido es mi enemigo
que me odia aveces creo que me abandona
me siento en la nada perdido en el amazonas
amor tan complicado creo que me has abandonado
y como ser juzgado en juicio sin servicio de abogado
ayer te vi
y senti que en tu vida ya no existe
un poco de amor de ese que me diste
nuestro amor se enfermo de repente
si aqui estuviera seria feliz

si una llamada tuya recibiera
te juro que todo seria diferente
el tiempo me ha vuelto un tempano
sin ti me siento huerfano
sin ti me siento huerfano huerfano
me siento solo por el mundo
sigo siendo el mismo huerfano que te enamoro que te enamoro
que te enamoro que te enamoro
vivo solo por el mundo
sigo siendo el mismo huerfano que te enamoroembed"
