id,song_name,artist_names,album_name,lyrics
1BCHhb7Zd9mK4X602uhZi3,I Can't Take It Back,YoungBoy Never Broke Again,4ssppGN0Qy4OeJTUDr1Etd,"35 contributorsi can’t take it back lyricsintro
pipe that shit up tnt
i take everything offensive haze get mad over anything
now im trippin i think i drunk too much lean
before its time for night for the calling i will not recall it i wont remember anything

chorus
shit i said before i cant take that back
i dont want no cutlass no real gangsters drive that cadillac
shyne i need some clear diamonds boy i see some clouds in that
these slimes they tryna kill bout me tryna chill so i aint call em back
give you my lean better drink all of that yeah
soon as i flash you just break down and get another pass
young nigga went under with ten ms i need another bag
tryna be pierced top young nigga go find some gems
hold on tryna pop his shit bout top gon pop soon as i see him

verse 1
ooh tell me if you got me
i aint been maybach riding its in la i dont drive it
we dont go to the lauberge while we on highland
you wanna go in make sure you call before the night end
it came in like a powerball powerball oh
i admit it caught me slippin
i admit i wasnt prepared for how your love came hit me
now you got me but around feel i should still tote my glizzy
salt lake city covered up in snow with my apparel on
old ways and just might settle with a stand off
lets see who draw the fastest i aint going down
quick man drawin on madden its a fast ball
you might also likechorus
shit i said before i cant take that back
i dont want no cutlass no real gangsters drive that cadillac
shyne i need some clear diamonds boy i see some clouds in that
these slimes they tryna kill bout me tryna chill so i aint call em back
give you my lean better drink all of that yeah
soon as i flash you just break down and get another pass
young nigga went under with ten ms i need another bag
tryna be pierced top young nigga go find some gems
hold on tryna pop his shit bout top gon pop soon as i see him

verse 2
i aint changing shit on my car ima ride on factory rims
go a to z on one tour bus i aint flying on lears
real 38 baby on certain occasions young nigga earned him seven kills
i say fuck em if they hate me but speakin on cases get you drilled
d dawg coming home next year
i wake up and take one pill
aint turn down since i signed my deal
aint shown love since dump got killed
ride that rolls and lift the front i got killers on my rear
i got loss sittin on my brain feel like ive been here for years
tryna do better for my girl feel like my heart made of steel
three million for my children a piece thats my goal for this year
told myself one million dollars but i did that last year
young nigga still riding round with them choppers bout some shit from last year
chorus
shit i said before i cant take that back
i dont want no cutlass no real gangsters drive that cadillac
shyne i need some clear diamonds boy i see some clouds in that
these slimes they tryna kill bout me tryna chill so i aint call em back
give you my lean better drink all of that yeah
soon as i flash you just break down and get another pass
young nigga went under with ten ms i need another bag
tryna be pierced top young nigga go find some gems
hold on tryna pop his shit bout top gon pop soon as i see him1embed"
