id,song_name,artist_names,album_name,lyrics
1zigoX1Bxo39a9lIHPxFyR,Mr. Carter,"Lil Wayne, JAY-Z",4fRZNOawjx1uzGLN3VhAZ4,"157 contributorsmr carter lyricsproduced by infamous and drew correa

intro lil wayne
yo yo drew and inf
thisthis this right here is crazy
yo i i feel big you know what i mean
like not not big in the sense of weight
you know what i mean like gainin weight or nothin like that
like colossal
like you know what i mean like sighs
i heard you were lookin for me
chorus sharon prescott  lil wayne
hey mr carter hello
tell me where have you been haha you know hehe
cause theyve been asking theyve been searching
theyve been wondering why i know haha
hey mr carter hey hello
tell me where have you been shit you know
cause theyve been asking theyve been searching
theyve been wondering why hahahah

verse 1 lil wayne
yeah to you forever from me to you
i heard somebody say church ima need a suit
ima need a coupe i wont need a roof
flyer than beetlejuice beetlejuice beetlejuice
i got the flow im tryin to see the roof
didnt wear a bulletproof so i got shot and you can see the proof
blind eyes could look at me and see the truth
wonder if stevie do
but ima leave it to god not beaver neither you
cause ima murder y kill o and even u
man i got summer hatin on me cause im hotter than the sun
got spring hatin on me cause i aint never sprung
winter hatin on me cause im colder than yall
and i will never i will never i will never fall
im being hated by the seasons
so fuck yall who hatin for no reason
see lil wayne liveget tickets as low as 84you might also likechorus sharon prescott  lil wayne
hey mr carter i am him
tell me where have you been
around the world and im back again
cause theyve been asking theyve been searching
whos been askin about me
theyve been wondering why in case you wonderin hah
hey mr carter i am him
tell me where have you been
around the world now im back again
cause theyve been asking theyve been searching
whos been askin about me
theyve been wondering why in case you wonderin hah

verse 2 lil wayne
yeah i been in and out the bank bitch
while yall asshole niggas been on the same shit
i flush and watch em go down the drain quick
two words you never hear wayne quit
cause wayne win and they lose
i call em april babies cause they fools
and when they snooze we up
feet up like a paraplegia
or paraplegic i parallel park
in that redandyellow thing old school atlanta hawk
like im from college park but im from hollygrove
now all my bloods scream soowoo and dadadoe
i know my role and i play it well
and i weigh it well on my libra scale
i suck a pussy fuck a pussy leave it there
long hair dont even care
chorus sharon prescott  jayz
hey mr carter young i am him
tell me where have you been
around the world now im back again
cause theyve been asking theyve been searching
whos been askin about me
theyve been wondering why in case you wonderin
hey mr carter i am him
tell me where have you been
around the world now im back again
cause theyve been asking theyve been searching
whos been askin about me
theyve been wondering why in case you wonderin chyeah

verse 3 jayz
im right here in my chair with my crown and my dear
queen b as i share mic time with my heir
young carter go farther go further go harder
is that not why we came and if not then why bother
show no mercy in murcielagos
im far from bein the bastard that marcy had fathered
now my names been mentioned with the martyrs
the biggies and the pacs and the marleys and the marcuses
garvey got me a molotovcocktail flow
even if you box well cant stop the blows
kaboom the roc boy in the room
the dope boy i just came off the spoon
also im so fly im on auto
pilot while guys just stare at my wardrobe
i see euros thats right plural
i took so much change from this rap game its your go
hey mr carter young
verse 4 lil wayne
its my go yeah… and ima go so opposite of soft
off the richter hector camacho man randy savage
far from average above status–quo flow so pro
i know i ride slow and when i pass
they say what up killa man stop bringin up my past
and next time you mention pac biggie or jayz
dont forget weezy baby

chorus sharon prescott lil wayne  choir
hey mr carter amen
tell me where have you been yeah
cause theyve been asking theyve been searching
theyve been wondering why haha
hey mr carter amen
tell me where have you been hova
cause theyve been asking theyve been searching weezy
theyve been wondering why baby
hey mr carter hahaha
tell me where have you been i been hustlin
cause theyve been asking theyve been searching hustlin hard
theyve been wondering why chyeah
hey mr carter
tell me where have you been
cause theyve been asking theyve been searching
theyve been wondering why
outro lil wayne
and i swear to everything when i leave this earth
its gonna be on both feet never knees in the dirt
and you can try me fucker but when i squeeze it hurt
fine well lose two lives yours and mine
give me any amount of time dont let ms carter grieve
at the funeral parlor drippin tears down my sleeve
give me any amount of time dont let ms carter grieve69embed"
