id,song_name,artist_names,album_name,lyrics
77IhMuHt8dFcwdqeSuh6N9,Filthy Rich,South Park Mexican,09Xf2KxWvXS88dd5OdTcu9,"13 contributorsfilthy rich lyricsverse 1
its the same ol shit in the same ass place
my studio smells like ten ash trays
my nigga still gettin too fucked up
and im still smokin too much blunts
haters always gon run they mouth
and keep tryin to take me out
mama always gonna worry herself
and me i cant forget the pain i felt
even though i drive a new 6 double 0
they be thinkin like what is los frontin for
i bought a club and they filled up with envy
now every body pissed cuz they cant get in free
new enemies still poppin up
throw away gats still chop em up
i walk in and the whole club stands still
more money more problems thats real

hook
this is what an ol g told me
filthy rich and dyin lonely
fuck a benz and fuck a rolly life is what you make it homie
this is what an ol g told me
filthy rich and dyin lonely
fuck a benz and fuck a rolly life is what you make it homie
you might also likeverse 2
my little babygirl just turned 6
i gave her the biggest room in my crib
she gets what she wants so does her mama
i dont think they know the value of a dollar
fineass bitches all in my limosine
i just wish i was jumpin on my trampoline
with my babies i miss my children
to me thats worth more than trillions and trillions
she calls me fatboy says im loco
and she doesnt understand when i gotta go
hope she doesnt think i dont wanna be wit her
hope she knows that it hurts not to be wit her
hope she knows that wit her im the happiest
i cant make it to her piano practices
when i was young my ol man left us
and i pray that she wont be like i was

hook

verse 3
playa hataz wanna play me close
do you really wanna meet carlos
do you really wanna feel my wrath
mad cuz your bitch want my autograph
nigga i dont wanna fuck yo ho
but ill let her suck my dick and lick my asshole hahah
started out with a silly game of footsie
now i got her eatin out her best friends pussy
rollin hydro sippin on cris
when i was broke i would dream about this
get my back rubbed in a big bath tub
i dont know her name but shes showin mad love
i got 7 gs sittin in my pants
and my jewlry is underneath those lamps
im gettin sleepy all you hoes gotta bail
once again im in the bed by myself
all alone in another city
i get my bill the cris was 950
2 gs for them bottles of don p
it was just me and the hoes was free
hook

outro
yeah fuck a benz fuck a rolly family comes first and im alone
yeeeeah
this is what an ol g told me he died lonely13embed"
