id,song_name,artist_names,album_name,lyrics
1RAeuvRyRzCweAK3jUT0ZW,bet u wanna,Sabrina Carpenter,5kDmlA2g9Y1YCbNo2Ufxlz,"38 contributorstranslationsespañolhrvatskiportuguêsfrançaisitaliano​bet u wanna lyricsverse 1
told me told me im your only
its all unfoldin babe
slowly slowly lies you sold me
all saw the light of day

prechorus
you been wastin time on the other side
if youre satisfied touché
now you say you hate all the empty space
and if you could go back youd stay

chorus
didnt think about it when you let me down
hurts to see me outta your reach
bet you wanna touch me now
its cold out there let me know what you found
let me know what you found
bet you wanna love me now
bet you wanna love me now

verse 2
chase me chase me thats right baby
yeah feel the way it feels
when you dont havе control of who im holdin
is it feedin all your fears
you might also likeprechorus
you been wastin time on the othеr side
if youre satisfied touché
but the lights are off your socalled friends are gone
oh i know what youre bout to say

chorus
didnt think about it when you let me down
hurts to see me outta your reach
bet you wanna touch me now
its cold out there let me know what you found
let me know what you found
bet you wanna love me now
bet you wanna love me now
didnt think about it when you let me down
hurts to see me outta your reach
bet you wanna touch me now
its cold out there let me know what you found
let me know what you found
bet you wanna love me now
bet you wanna love me now

postchorus
i bet you wanna
i bet you wanna ah
bridge
bet you miss me bet youre reminiscin
i bet you hate the way that you said goodbye
and you still cant even tell me why
i hate the way that you left me dry
but ill keep that between you and i

chorus
i bet you didnt think about it when you let me down
hurts to see me outta your reach
bet you wanna touch me now oh touch me now
its cold out there let me know what you found
bet you wanna love me now uhhuh
bet you wanna love me now7embed"
