id,song_name,artist_names,album_name,lyrics
5MiRdR9TLtpUyXDDTO2Lgd,The Sky's the Limit,Jason Derulo,0aVJmVAeEx78nAA1rAKYf7,"7 contributorsthe sky’s the limit lyricsintro
yeah oh mu
jason derulo
jjjjjr

verse 1
like a shock to my heart
when i saw you tonight
like a dream come alive
for the very first time
when we touch in the dark
baby youre blowing my mind
wish i could freeze you and me
in this moment in time hey

prechorus
you got it what i want
give it up shorty
step it up for me
and ill give you everything
all my life all my love
ill give you my fortune and fame
id even give you my name

chorus
girl you take me higher
than ive ever been before my feet dont touch the floor
well fly the sky is the limit
the sky is the limit
girl you take me up up up up up up up up
girl you take me up
you take me higher the sky is the limit
the sky is the limit
see jason derulo liveget tickets as low as 26you might also likeverse 2
when we dance when we kiss
doesnt get any better than this
how you shine trapped in the spotlight
finally mine yeah
baby lets go go lets get out of here
baby let go go got nothing to fear
and now that were here lets disappear
into the night hey

prechorus
you got it what i want what i want
give it up shorty shorty
step it up for me
and ill give you everything
all my life all my love
ill give you my fortune and fame
id even give you my name

chorus
girl you take me higher
than ive ever been before my feet dont touch the floor
well fly the sky is the limit
the sky is the limit
girl you take me up up up up up up up up
girl you take me up
you take me higher the sky is the limit
the sky is the limit
bridge
my feet are on the ceiling haha the ceiling
and they dont wanna touch the ground anymore
oh what i feel what i feel i can feel it i can feel it
can you feel it feel it feel it yeah yeah

chorus
girl you take me higher oh yeah
than ive ever been before before my feet dont touch the floor
well fly the sky is the limit
the sky is the limit
girl you take me up up up up up up up up you take me up baby
girl you take me up oh whoa oh
you take me higher the sky is the limit higher
the sky is the limit oh whoa2embed"
