id,song_name,artist_names,album_name,lyrics
0kfbQsz5j5ifJmtIn9LCeH,Ronnie,Frankie Valli & The Four Seasons,0NUEQILaBzavnzcMEs4buZ,"6 contributorsronnie lyricschorus
ill go on living and keep on forgiving
because you were my first love

verse 1
so very warm and tender the way you loved me
hey girl cant remember and want more of me
ronnie ronnie ronnie why did you go
ronnie oh ronnie ronnie i am regretting but cant stop forgetting
because you were my first love

verse 2
you said now you dont need me because i cheated
why didnt you believe me when i repeated
ronnie ronnie ronnie youll never know
ronnie oh ronnie ronnie ill go on living and keep on forgiving
because you were my first love

outro
i walk alone
i cry at home
night after night night after night
day after day

verse 3
ohh i never cheated
ohh i still repeat it
ronnie ronnie ronnie youll never know
ronnie oh ronnie ronnie ill go on living and keep on forgiving
because you were my first love
see the four seasons liveget tickets as low as 50you might also likechorus x3embed"
