id,song_name,artist_names,album_name,lyrics
7EJoyKBdCiqU40UKWb0EH3,La Escalera,Jenni Rivera,6JpMhu4IR3A7gwjksos2Sa,"3 contributorsla escalera lyricsletra de la escalera

verso 1
te encontré abandonado en el suelo
olvidado del reino de dios
yo viajaba en mi trono de reina
bajé la escalera y te levanté

te llené de tesoros y besos
pero tú me pagaste muy mal
ya lo dijo muy bien josé alfredo
los hombres al cielo no saben mirar

coro
pero mira mírame mírame mírame y óyeme bien
arrodíllate frente a la reina
tu lugar siempre ha sido la tierra
fue un error elevarte ante mi

pero mira mírame mírame mírame y ponte de pie
este amor no se va con cualquiera
te me vas a bajar la escalera
y no intentes volverla a subir

verso 2
sé muy bien que la culpa fue mía
por hacerte en mi trono un lugar
pero no cabe duda que es cierto
que el suelo y el cielo no se han de juntar
you might also likecoro
pero mira mírame mírame mírame y óyeme bien
arrodíllate frente a la reina
tu lugar siempre ha sido la tierra
fue un error elevarte ante mi

pero mira mírame mírame mírame y ponte de pie
este amor no se va con cualquiera
te me vas a bajar la escalera
y no intentes volverla a subirembed"
