id,song_name,artist_names,album_name,lyrics
1XyRT1VeLaJs5rEJA3rMO9,Dia Especial (feat. Gustavo Cerati),"Shakira, Gustavo Cerati",3zHPYwiMJqa3hTBgk695Ae,"19 contributorstranslationsenglishdía especial lyricsletra de día especial ft gustavo cerati

verso 1
ya no sé si es muy tarde para ti
quiero desafiar la comodidad
no nos sirve más fingir
yo no sé cuán efímero es tu error
ya te perdoné
adelanté las agujas del reloj

precoro
mi lágrima secó
se aleja el temporal
latiendo como el sol
mi corazón no tiene edad
para esperarte

coro
este es un día especial
quiero creer en otra oportunidad
dimos un salto mortal
y hoy vuelvo a ver
un faro en la oscuridad

verso 2
ya no estoy tan confusa como ayer
solo la ilusión trae desilusión
y es tan fácil de caer
you might also likeprecoro
el mundo en que creí
lo eterno y lo fugaz
prefiero darle fin
aunque me ocultes la verdad más vulnerable

coro
este es un día especial
quiero creer en otra oportunidad
dimos un salto mortal
y hoy vuelvo a ver
un faro en la oscuridad

puente
latiendo como el sol
mi corazón no tiene edad
ah uuh

coro
este es un día especial
quiero creer en otra oportunidad
dimos un salto mortal
y hoy vuelvo a ver
un faro en la oscuridad

outro
ah especial
ah ah ooh2embed"
