id,song_name,artist_names,album_name,lyrics
3ppVO2tyWRRznNmONvt7Se,Summers Over Interlude,"Drake, Majid Jordan",40GMAhriYJRO1rsY4YdrZb,"99 contributorstranslationstürkçeenglishsummers over interlude lyricsintro majid al maskati
ooh baby yeah

verse majid al maskati
days in the sun and nights in the rain
summer is over simple and plain
found me some fun thats good for the pain
already told you i dont feel the same
i dont feel the same

outro majid al maskati
anywhere i go
i cant help but show
i dont feel the same
anywhere i go
i cant help but know
i dont feel the same
anywhere i go
i cant help but knowsee drake liveget tickets as low as 90you might also like33embed"
