id,song_name,artist_names,album_name,lyrics
052z2UsE2wPrHsBJ9tly0g,Playground Love,"Air, Gordon Tracks",2E1q8eohZZ1BUQ7Bq5WUIY,"24 contributorsplayground love lyricsverse 1
im a high school lover
and youre my favorite flavour
love is all all my soul
youre my playground love

verse 2
yet my hands are shaking
i feel my body remains
times no matter im on fire
on the playground love

verse 3
youre the piece of gold
that flashes on my soul
extra time on the ground
youre my playground love

verse 4
anytime anywhere
youre my playground lovesee air liveget tickets as low as 75you might also like4embed"
