id,song_name,artist_names,album_name,lyrics
5vsyddyBVx9kNIiCzvg935,Let's Go Study,"Snoop Dogg, Wiz Khalifa",12pnVAswzLE6hArSl0bF0h,"10 contributorslet’s go study lyricsintro snoop dogg
yeah whats up baby girl
im just looking over this homework
i really need some help
you wanna study with me
thatd be nice yeah

hook snoop dogg
i wanna go study baby would you be my buddy
and help me with my project cause you are who i roll with
honestly i know it take me boo you the one i wanna go with
5 days out the week my stays out the street
it pays to be discreet your fragrance is sweet

verse 1 snoop dogg
honeydew money do
but this aint about no money this about me and you making ooh
take it from me first day of school im looking cool i got my clothes pressed
im a senior but im seeming like an old vet
time will pass me by if i dont graduate this time so i expand my mind
find ways to elevate it motivate it calculate it reinstate it
look at you girl you got me dedicated

hook snoop dogg
i wanna go study baby would you be my buddy
and help me with my project cause you are who i roll with
honestly i know it take me boo you the one i wanna go with
5 days out the week my stays out the street
it pays to be discreet your fragrance is sweet
you might also likeverse 2 wiz khalifa
uh put me on the game
though i keep my head in these books im not a lame
usually kinda square im trying new shit for a change
telling bitches things like if wanna get with me you gone need a lot of brains
and just cause i dont play who say i cant ball
my nigga mac dude me and him is in the same hall
so dont get mad if i relax and get my bake on
just promise that youll try to catch me if my grades fall

hook snoop dogg
i wanna go study baby would you be my buddy
and help me with my project cause you are who i roll with
honestly i know it take me boo you the one i wanna go with
5 days out the week my stays out the street
it pays to be discreet your fragrance is sweet

verse 3 snoop dogg
devin there you are look at my repertoire
spitting game you know for reppin hard
change that perspective thats my objective
cool and oh so collective connected
check this i need you more that you could know
see you the seed in my weed baby help me grow
let it go let me know where to meet at
student of the week baby i will be that you know i need that
hook snoop dogg
i wanna go study baby would you be my buddy
and help me with my project cause you are who i roll with
honestly i know it take me boo you the one i wanna go with
5 days out the week my stays out the street
it pays to be discreet your fragrance is sweet

bridge wiz khalifa
call you on your phone and never come see you darling i will never do that
im roaming through the halls and asking people who be with you just to try to know where you at
call you on your phone and never come see you darling i will never do that
im roaming through the halls and asking people who be with you just to try to know where you at

hook snoop dogg
i wanna go study baby would you be my buddy
and help me with my project cause you are who i roll with
honestly i know it take me boo you the one i wanna go with
5 days out the week my stays out the street
it pays to be discreet your fragrance is sweet8embed"
