id,song_name,artist_names,album_name,lyrics
58sdfzX722CMoU7m0s5dUi,Poetic Tragedy,The Used,57d5dFo7oN2yUyGfSKPrRv,"13 contributorspoetic tragedy lyricsverse 1
the cup is not half empty as pessimists say
as far as he sees nothings left in the cup
a whole cup full of nothing for him to indulge
since the voice of ambition has long since been shut up

chorus 1
a singer a writer hes not dreaming now of going nowhere
he gave heed to nothing and all that he was is just a tragedy

verse 2
so he voyages in circles and succeeds getting nowhere
and submits to the substance that first got him there
there there there

chorus 2
in violent frustration he cries out to god or just no one
is there a point to this madness and all that he was is just a tragedy

bridge
he feels alone
his heart in his hand hes alone
he feels alone
i feel…

verse 3
then on that last day he break
and he stood tall and he yelled and he yelled
why world why world hate you hate you bye world
you might also likechorus 2
in violent frustration he cries out to god or just no one
is there a point to this madness and all that he was is just a tragedy

outro  spoken
yeah that goes on
very good beautiful
oh oh my god
please come on
could be holding one yeah yeah
lovely then good work2embed"
