id,song_name,artist_names,album_name,lyrics
4tCtwWceOPWzenK2HAIJSb,Work from Home (feat. Ty Dolla $ign),"Fifth Harmony, Ty Dolla $ign",0pF0oyuPNdOObniB1Ng0kW,"3 contributorstop tracks of 2016  global lyricsdrake  one dance feat kyla  wizkid
mike posner  i took a pill in ibiza seeb remix
the chainsmokers  dont let me down feat daya
rihanna  work feat drake
sia  cheap thrills
justin bieber  love yourself
fifth harmony  work from home feat ty dolla ign
calvin harris  this is what you came for feat rihanna
lukas graham  7 years
alan walker  faded feat iselin solheim
twenty one pilots  stressed out
justin bieber  sorry
major lazer  light it up feat nyla  fuse odg remix
the chainsmokers  closer feat halsey
geazy  me myself  i feat bebe rexha
desiigner  panda
major lazer  cold water feat justin bieber  mø
jonas blue  fast car
zayn  pillowtak
justin timberlake  cant stop the feeling
dnce  cake by the ocean
drake  too good feat rihanna
the chainsmokers  roses feat rozes
zara larsson  lush life
dj snake  middle feat bipolar sunshine
​gnash  i hate u i love u feat olivia obrien
rihanna  needed me
shawn mendes  treat you better
twenty one pilots  heathens
twenty one pilots ride
dj snake  let me love you feat justin bieber
shawn mendes  stitches
galantis  no money
cheat codes  sex feat kris kross amsterdam
justin bieber  what do you mean
charlie puth  we dont talk anymore feat selena gomez
flo rida  my house
kygo  stay feat maty noyes
adele  hello
mnek  zara larsson  never forget you
arian grande  into you
kiiara  gold
kungs  cookin on 3 burners  this girl
mike perry  the ocean
major lazer  lean on feat mø  dj snake
drake  hotline bling
robin schulz  sugar feat francesco yates
coldplay  hymn for the weekend feat beyonce
selena gomez  hands to myself
david guetta  bang my head feat sia  fetty wap
flume  never be like you feat kai
coldplay  adventure of a lifetime
drake  controlla
jonas blue  perfect strangers
david guetta  this ones for you feat zara larsson
adele  send my love to your new lover
the weeknd  cant feel my face
frenship  capsize
enrique iglesias  duele el corazón feat wisin
kent jones  dont mind
martin garrix  bebe rexha  in the name of love
drake  future  jumpman
coldplay  hymn for the weekend feat beyonce seeb remix
lil wayne wiz khalifa  imagine dragons  sucker for pain with logic ty dolla ign  x ambassadors
mø  final song
ed sheeran  photograph
joel adams  please dont go
nick jonas  close feat tove lo
timeflies  once in a while
charlie puth  one call away
troye sivan  youth
selena gomez  kill em with kindness
the weeknd  the hills
snakehips  all my friends feat tinashe  chance the rapper
alessia cara  wild things
calvin harris  disciples  how deep is your love
daya  hide away
meghan trainor  no
future  low life feat the weeknd
ariana grande  side to side feat nicki minaj
jack ü  where are ü now feat justin bieber
ed sheeran  thinking out loud
hailee steinfeld  grey  starving feat zedd
shawn mendes  camila cabello  i know what you did last summer
bryson tiller  dont
dram  broccoli feat lil yachty
cheat codes  dante klein  let me hold you turn you on
adele  when we were young
drake  pop style
the weeknd  starboy feat daft punk
onerepublic  wherever i go
fifth harmony  all in my head flex feat fetty wap
nicky jam  hasta el amanecer
rudimental  lay it all on me feat ed sheeran
kanye west  famous feat rihanna
sia  the greatest feat kendrick lamar
james bay  let it go
maroon 5  sugar
flume  say it feat tove loembed"
