id,song_name,artist_names,album_name,lyrics
4NTWZqvfQTlOMitlVn6tew,The Show Goes On,Lupe Fiasco,1j0apvEvaWbTmlZpKsfr2D,"97 contributorsthe show goes on lyricsintro lupe fiasco
laser
yeah yeah
kane is in the building nigga
yeah

chorus jr get money
alright already the show goes on
all night til the morning we dream so long
anybody ever wonder when they would see the sun up
just remember when you come up the show goes on
alright already the show goes on
all night til the morning we dream so long
anybody ever wonder when they would see the sun up
just remember when you come up the show goes on

verse 1 lupe fiasco
have you ever had the feelin that you was bein had
dont that shit there make you mad they treat you like a slave
put chains all on your soul and put whips up on your back
they be lyin through they teeth hope you slip up off your path
i dont switch up i just laugh ha ha put my kicks up on they desk
unaffected by they threats then get busy on they ass
see thats how that chitown made me
thats how my daddy raised me
that glitterin may not be gold dont let nobody play me
if you are my homeboy you never have to pay me
gon and put your hands up when times is hard you stand up
lup the man cause the brand that the fans trust
so even if they ban us theyll never slow my plans up
you might also likechorus jr get money
alright already the show goes on
all night til the morning we dream so long
anybody ever wonder when they would see the sun up
just remember when you come up the show goes on
alright already the show goes on
all night til the morning we dream so long
anybody ever wonder when they would see the sun up
just remember when you come up the show goes on

verse 2 lupe fiasco
one in the air for the people aint here
two in the air for the father thats there
three in the air for the kids in the ghetto
four for the kids that dont wanna be there
none for the niggas tryna hold them back
five in the air for the teachers not scared
to tell those kids thats livin in the ghetto
that the niggas holdin back that the world is theirs
yeah yeah the world is yours i was once that little boy
terrified of the world now im on a world tour
i would give up everything even start a world war
for these ghetto girls and boys im rappin round the world for
africa to new york haiti then i detour
oakland out to auckland gaza strip to detroit
say hiphop only destroy tell em look at me boy
i hope your son dont have a gun and never be a dboy
chorus jr get money
alright already the show goes on
all night til the morning we dream so long
anybody ever wonder when they would see the sun up
just remember when you come up the show goes on
alright already the show goes on
all night til the morning we dream so long
anybody ever wonder when they would see the sun up
just remember when you come up the show goes on

verse 3 lupe fiasco
so no matter what you been through no matter what you into
no matter what you see when you look outside your window
brown grass or green grass picket fence or barbed wire
never ever put them down you just lift your arms higher
raise em til your arms tired let em know you here
that you strugglin survivin that you gon persevere
yeah aint nobody leavin nobody goin home
even if they turn the lights out the show is goin on alright

chorus jr get money
alright already the show goes on
all night til the morning we dream so long
anybody ever wonder when they would see the sun up
just remember when you come up the show goes on
alright already the show goes on
all night til the morning we dream so long
anybody ever wonder when they would see the sun up
just remember when you come up the show goes on76embed"
