id,song_name,artist_names,album_name,lyrics
2n6red10oCd6YhlEUp6jXy,Used To Be,Jonas Brothers,1Uf67JAtkVWfdydzFFqNF2,"34 contributorsused to be lyricschorus nick jonas
spending all your time with your new friends
and you take em all the places now that we been
but you used to be the one i love
yeah you used to be the one i love
say you wanna talk howhaveyoubeens
im the only one you know thatll listen
and you used to be the one i love
yeah you used to be the one i love used to be the one i

verse 1 joe jonas
lately i dont even know ya
too many devils on your shoulder shoulder
oh my god
baby if its what you want
i just wanna see you happy
i can see it in your eyes
and you dont believe me
i dont lie
even though youre not mine

prechorus nick jonas  joe jonas
cold feet turned into cold weather
we had love now it dont matter
you just thought you could do better
so do better
see jonas brothers liveget tickets as low as 30you might also likechorus nick jonas
spending all your time with your new friends
and you take em all the places now that we been
but you used to be the one i love used to be the one i
yeah you used to be the one i love used to be the one i
say you wanna talk howhaveyoubeens
im the only one you know thatll listen
and you used to be the one i love used to be the one i
yeah you used to be the one i love used to be the one i

verse 2 joe jonas  nick jonas
woke up late and im dreamin yeah
so tired of chasing all your demons demons
oh my god
baby if its what you want if its what you
little late if you ask me
but you know ill come around if you ask me ask me
i dont lie
even though youre not mine oh yeah

prechorus nick jonas
cold feet turned into cold weather
we had love now it dont matter
you just thought you could do better
so do better
chorus nick jonas
spending all your time with your new friends
and you take em all the places now that we been
but you used to be the one i love used to be the one i
yeah you used to be the one i love used to be the one i
say you wanna talk howhaveyoubeens
im the only one you know thatll listen
and you used to be the one i love used to be the one i
yeah you used to be the one i love used to be the one i

outro joe jonas  nick jonas
you used to be the one
yeah you used to be the one
yeah you used to be the one
used to be the one
used to be the one i6embed"
