id,song_name,artist_names,album_name,lyrics
73wSiU9LHQsmL2YMuD6N4e,Me Tenia Que Alejar,Los Inquietos Del Norte,7M2EVYSttIuhJ63yOsIUrR,"1 contributorme tenía que alejar lyricsme tenia que alejar de tu vida
y partir en mil pedazos mi corazon
por haberme enamorado tanto tanto
es el precio que eh pagado por tu amor
es difícil es martirio el sufrimiento
alejarse cuando amas de verdad
y no hay nada que te alivie el sufrimiento
solo el tiempo es el que ayuda a olvidar

y lloras y tomas
y gritas y imploras a dios
que te ayude a olvidar ese amor
y no hayas respuestas
se cierran las puertas
y sientes que mueres
de puro dolor

los recuerdos que se anidan en mi mente
hace que sea mas grande mi sufrir
por mas que trato no te apartas de mi mente
y es difícil seguir y sobrevivir

y lloras y tomas
y gritas y imploras a dios
que te ayude a olvidar ese amor
pero en un momento
y dios a su tiempo
pa siempre te ayuda
a olvidar ese amoryou might also likeembed"
