id,song_name,artist_names,album_name,lyrics
0C4e5m5HogFCgAc5GaYSBD,RISK TAKER,YNW Melly,7naY6j4wcgUxfHB98G79CW,"21 contributorsrisk taker lyricsintro
yeah
yyung lan on the track
yeah yeah yeah yeah
yeah young nigga world
foreigngotem
and i think yung lan on the track but
hundred bands for a kilo nigga

verse
shawty say she love me really wanna fuck me
say she thinkin of me and she wanna hug me
i dont wanna fuck with her she say that im thuggin
nigga i aint thuggin look lil bitch you buggin
i think that she buggin i think that she buggin ayy
ayy lil bitch you buggin
she blow me up this ho be buggin
switch up the flow for goodness sakes
these niggas talkin nd they fallin i think i need rakes
and all these bitches they cutthroat they gon try to say rape
when she let me fuck every time and the pipe she couldnt take
stupid bitch i i im a millionaire
you just dont know it yet we shoot at them civilians yeah
my bitch so foreign she black but she got brazilian hair
you niggas talk like you want it them choppas comin yeah
them choppers bombin yeah crips in the cut with me
they know ima fuck tell that young nigga to fuck with me yeah
if you get money put your hands up
and bitch if you aint run them bands up
cause when i was a youngin i knew i was gon get money
niggas talkin like they on that shit but couldnt keep it a hundred k
all you niggas talkin like you wanna let me get it hey
all these bitches fuckin im like hold up wait a minute
you know the glock on the pistol that bitch extended ayy
your life a movie lil bitch the choppa gon end it hey
you fuck with us like banana your ass get peeled
i got my bitch shakin ass in banana heels
that mean yellow that mean mustard that mean betchup yeah
bitch im runnin on these niggas better catch up yeah
big dog big slime tell em fetch us yes
she gon suck a nigga dick like its licorice
on that bloody shit yeah he on that slimy shit
pull a home invasion and we dont really fuck with them
ooh ooh fuck with them
he slime you out because of him
nigga oh your big homie say he gon kill me
shawty say she really wanna kiss me
big ass glock and its a semi
and foolie he gon shoot it til its empty
i can see it in they eyes these niggas envy
sakchaser that my motherfuckin nigga yeah
dave cause he was thuggin with me when i aint have it
i swear to god at night we slept on the palette
yall niggas wasnt there when them roaches and them maggots
was crawlin on a niggas floor and a nigga didnt have it like this
when a nigga was just really actin savage and shit
when a niggas was eatin cornbread and cabbage and shit
and all these niggas rap the same they all average and shit
and all my niggas on the block aint no lackin lil bitch
but its brackin lil bitch hey whats crackin lil bitch
choppa pack you lil bitch
choppa gon pack a nigga up like some laundry in a suitcase
shawty wanna fuck slurp this dick like a shoelace
up foo late fuck late my bae
my neck and my wrist so motherfuckin wet
hold up shawty wanna fuck on my gang cause im wavy
rolex watch vvs on my ap
diamonds on my neck and im shinin like hailey
shawty said she really wanna fuck with my friends
mama im sorry i just wrecked your benz
what the fuck you mean i got all dead prez
we gon pay for it if that shit dont hit
the way i wanted it yeah you know we get it lil baby
ooh yeah
wanna fuck the gang cause a nigga lit yeah
first date every bitch say she like his hair
she gon like my hair we gon run a train
train my whole clique
cause all of my niggas really on they shit
your bitch hit my dm say she want my dick
but i will not give it to her
my niggas gon pull up that pussy stankin it smell like sewer
that shit smell like cow manure
that shit smell like bow manure
hoo i would never pursue that ho
pussy so stank i might just sue that ho
pussy is loose i might have to glue that ho
hah pussy sick achoo that ho
hah i swear to god i never chew that bitch
where the fuck these niggas at
turn em into a target facebook we aint into that
snapchat we aint into that instagram we aint into that
we just wanna shoot somethin we just wanna kill em dead
and i think that i changed
but i went into my old ways and i switched lanes
started smokin on that weed again with my main thing
that my motherfuckin dawg we gon let our nuts hang
we gon let the pistol sing we gon let the choppa ring
he say that he really whodie he was never with the gang
when a young nigga was strugglin road runnin and dufflin
road runnin and killin shit lil bitch you aint drillin shit
you might also likechorus
oh i later
that rolex watch dont tell no lies
risk taker risk taker
that neck and my wrist got you hypnotized
risk taker risk taker
that rolex watch dont tell no lies
we major we major
these labels callin and they know not to lie to me
know not to lie to me yeah

outro
its like
when i get in front of the mic
itit dont give a i dont give a fuck you know what im talkin bout
risk taker risk taker
that rolex watch dont tell no lies
we major they aint major
these labels got them hypnotized
hypnotized hypnotized
hypnotized
shawty wanna fuck cause she saw me in the paper ooh
shawty wanna fuck yeah and we gettin paper2embed"
