id,song_name,artist_names,album_name,lyrics
2x9K3ygr4S8hNNRRUpye1E,Ride Around,Mac Miller,1jzqEyjugAp9iLtRsj9LZg,"32 contributorsride around lyricsverse 1 mac miller
ridin with the window down rollin through the city
got the weed goin round and the most dope with me hey
simply gettin high like its 1969
ima be grindin til the kid ahundredsixty
new york atlanta too flyer than santas shoes
she bring her camera through im playin crash bandicoot
this be the bitch got some cock to serve her
ima rape the game no roethlisberger hey
above the clouds seein stars like la
have your girl always comin back like elway
ima be rich thats what they tell me
so let me start workin with this paper like an essay hey
athleticism workin game when im gettin women
the freshest linen like im spittin through your television
in a daydream livin while these minutes pass me by
lean back and hang these nikes out the ride just

chorus
roll the windows down turn the system up
we just tryna ride around cause we dont give a fuck
got a full tank of gas and some shit to smoke
hey lets just hit the road
roll the windows down turn the system up
we just tryna ride around cause we dont give a fuck
got a full tank of gas and some shit to smoke
hey lets just hit the road
you might also likeverse 2 mac miller
rockin khaki colored jeans and a plain white tee
nike watch pow chain spend a day like me hey
every day like a movie scene
smokin weed eyes glued to the computer screen
im super duper skeed ridin in the civic
just got some speakers now im tryin get it tinted
every dream vivid talk it how i live it
uh up in the air playin quidditch bitches
this is once in a lifetime
they gon put me in a flight no priceline
used to want to be in marvel fightin crimes
til i realized the boy had the nicest rhymes

chorus
roll the windows down turn the system up
we just tryna ride around cause we dont give a fuck
got a full tank of gas and some shit to smoke
hey lets just hit the road
roll the windows down turn the system up
we just tryna ride around cause we dont give a fuck
got a full tank of gas and some shit to smoke
hey lets just hit the road3embed"
