id,song_name,artist_names,album_name,lyrics
6IM45SqAURH6PrvziDs1RQ,Why Won't They Talk To Me?,Tame Impala,3C2MFZ2iHotUQOSBzdSvM7,"48 contributorswhy won’t they talk to me lyricsverse
out of the zone trying to see
im so alone nothing for me
i guess ill go home try to be sane
try to pretend none of it happened
oh this old tree lonely old me
whoopsadaisy i thought i was happy oh
out of this zone now that i see
i dont need them and they dont need me
i guess ill go home try to be sane
try to pretend none of it happened
destined to be lonely old me
whoopsadaisy i thought i was happy oh

chorus
ah why wont they talk to me i thought i was happy
ah why wont they talk to me i thought i was happy
ah why wont they talk to me i thought i was happy
ah why wont they talk to me
ah why wont they talk to me

bridge
but i dont even care about it anyway
i wouldnt listen to a word any of them say
they just talk about themselves all day
one day ill be a star and theyll be sorry
you might also likechorus
ah why wont they talk to me
ah why wont they talk to me
ah why wont they talk to me
ah why wont they talk to me
ah why wont they talk to me34embed"
