id,song_name,artist_names,album_name,lyrics
1QUNnTrw6HArKribJn2it0,Couldn't Say No,Mario,4qqrq2LYJYvKOV5Xrcajvp,"5 contributorscouldn’t say no lyricsintro
damnall i could do all i could say
is that im sorry
listen to me i know i really messed up this time
just hear me out

verse 1
ohhh you should of shown me a little more love
but still there aint no reason
for me to walk out on this thing called us
but you keep giving me the feeling
that i should throw the towel in
cause we cant keep each other no way
cussing me out in front of my friends not giving a damn on how i feel

prechorus
i dont even want
i dont want to be the guy that tricks around you
and you dont even know
how many times i asked your momma what i should do
and its my fault
and its my fault im in a situation i may not get through
i got bad news that i gotta break to you
i know you gonna act a fool but i gotta let her know

chorus
i had a girlfriend pinned up aye
in between that week we split up she need to know
it was looking so good i couldnt say no
i think its time you know
every time that i see you with her ooh
i was thinking how i was picking them legs up leg up
its a shame when a man just cant say no
ohh yeah
you might also likeverse 2
see what is done is done and i realize now aint no taking it back
i committed the worst crime i could ever do to my girl
damn she aint never gonna forgive me
every time that you through a fit
my twoway she hits saying im on the way
putting it down in out up and down anyway id say
but baby girl i really didnt wanna

prechours
i dont want to be the guy that tricks around you woah oh
you dont even know hey
how many times i asked your momma what i should do
she didnt even know
and its my fault im in a situation i may not get through
i got some real bad news to tell you
and i know you gon act a fool
she really needs to know

chorus
i had a girlfriend pinned up ooh yeah
in between that week we split up
it was looking so good i couldnt say no
its gonna be bad but i gotta let her know
every time that i see you with her
i think of how i was picking them legs up picking them legs up girl
its a shame when a man just cant say no when i couldnt say no couldnt say no
bridge
yeah its bad i done messed up
gave up all i had with you
just for a fast piece of pleasure
that can never replace you
one more chance he said never
girl you made mistakes too
uh baby oh girl

chorus
i had a girlfriend pinned up
in between that week we split up remember when we broke up
it was looking so good i couldnt say no i couldnt say no
and every time i see you with her
every time i see you with her
i think of how i was picking them legs up
its a shame when a man just cant say no its a shame oh its a shame oh
i had a girlfriend pinned up i had a girlfriend pinned up
in between that week we split up between that week we split up ooh
it was looking so good i couldnt say no no say no babe
every time that i see you with her
i was thinking how i was picking them legs up
its a shame when a man just cant say no
cant say no now cant say no1embed"
