id,song_name,artist_names,album_name,lyrics
7DFnq8FYhHMCylykf6ZCxA,Yo (Excuse Me Miss),Chris Brown,49gaz5rhWWgqCw61M9700v,"27 contributorsyo excuse me miss lyricsintro
woah woah
doodoodoodoodoo
yeah uhhuh yeah

verse 1
yo tell me fellas have you seen her seen her
it was about five minutes ago
when i seen the hottest chick that a youngin ever seen before
i say yo tell the girls i wanna meet her meet her
on second thought that aint the way to go
i gotta give her game proper
spit it so shell get it there she is i gotta stop her
oh should i talk about her smile its been said before
or what about her style too obvious
im out of time shes out the door
i gotta go for mine i think ill say

chorus
yo
i dont know your name but excuse me miss oh yeah
i saw you from across the room
and i gotta admit that you got my attention
youre making me wanna say yo
i know youre tryna leave but excuse me miss
i saved the last dance for you
i would love to keep you here with me oh baby
you might also likeverse 2
now shawty grab hold of my hand
and lets pretend the floor is ours
you say you dont really dance
dont worry bout it we just onetwo step onetwo step
now if the music is movin too fast too fast
grab my hand a little tighter tighter
dont be afraid to move a little closer
girl theres somethin about you that makes me wanna say aw yeah aw yeah

chorus
yo
i dont know your name but excuse me miss ooh
i saw you from across the room
and i gotta admit that you got my attention
youre making me wanna say yo
i know youre tryna leave but excuse me miss ooh
i saved the last dance for you
i would love to keep you here with me oh baby
i think ill say yo
i dont know your name but excuse me miss
i saw you from across the room
and i gotta admit that you got my attention
youre making me wanna say yo
i know youre tryna leave but excuse me miss
i saved the last dance for you
i would love to keep you here with me oh baby
bridge
i wanna be where you are
aint nothin wrong with dancin
baby youre so romantic
baby i can be in your heart
so many things i wanna tell you
i think that i should start by sayin

chorus
yo woah
i dont know your name but excuse me miss oh yeah
i saw you from across the room
i gotta give her game proper
spit it so shell get it there she is i gotta stop her oh yeah
i know youre tryna leave but excuse me miss oh
i saved the last dance for you
i would love to keep you here with me oh baby

outro
now everybody just clap your hands like this like this
just clap your hands like this woah like this huh
and if your shortys in the house tonight
just grab her by the hand homie make her understand
yall was made to dance like this like this
yall was made to bounce like this woah like this
just let her know she was made for you and
you wanna do everything she want to man
ha woo40embed"
