id,song_name,artist_names,album_name,lyrics
4KKuTZghPZvjDoMBIIR2g1,Te Recordaré,El Trono de Mexico,2UZuDn4sKTaAiQxjKlJYfE,"1 contributorte recordaré lyricsnecesito oír tu voz
para poder vivir
en este mundo vació
que estremece mi alma

porque has sido en mi vida
mi primer amor mi primera ilusión
el deseo de amar mi necesidad

cuantas veces
intente cambiar tu decisión
pero tu maldito orgullo
pudo mas que yo

te alejaste sin siquiera
darme una razón
solo un triste adiós
lo nuestro termino

y ahora que no estas
dime como enfrentarme
al mundo en esta soledad

se que no volverás
pues tu vanidad vale mas
que la palabra amar
you might also likenunca olvidare
las noches cuando me decías
siempre te amare

que te vaya bien
que por el resto de mi vida
te recordare

y nunca olvidare las noches
cuando me decías
siempre te amare

el trono de mexico

te alejaste sin siquiera
darme una razón
solo un triste adiós
lo nuestro termino

y ahora que no estas
dime como enfrentarme
al mundo en esta soledad

se que no volverás
pues tu vanidad vale mas
que la palabra amar
nunca olvidare
las noches cuando me decías
siempre te amare

que te vaya bien
que por el resto de mi vida
te recordareembed"
