id,song_name,artist_names,album_name,lyrics
3aJslQrqwbWI3EP2vN766e,Nobody's Lonely Tonight,Chris Stapleton,24fkX2Gdqw4a6pR9BUYbE5,"10 contributorsnobody’s lonely tonight lyricsverse 1
sittin here its closing time
youve got your troubles and i bet theyre just like mine
somebody told you goodbye

verse 2
i know a way cant go wrong
nobody leads nobody on
nobodys lonely tonight

chorus
whats love but just some illusion we believe
whats love but just some confusion we dont need

interlude

chorus
whats love but just some illusion we believe
whats love but just some confusion we dont need

outro
you be her and ill be him
for a while well pretend
nobodys lonely tonightsee chris stapleton liveget tickets as low as 36you might also likeembed"
