id,song_name,artist_names,album_name,lyrics
0AaBRYWKQNOmq0Y0qoedI9,Suck My Kiss,Red Hot Chili Peppers,53tvjWbVNZKd3CvpENkzOC,"48 contributorssuck my kiss lyricsintro
and im sailin yeah
yeah oh yeah
yeah oh yeah
hit me

verse 1
shoulda been coulda been woulda been dead
if i didnt get the message goin to my head
i am what i am
most motherfuckers dont give a damn
oh baby think you can
be my girl ill be your man
someone full of fun do me til im well done
little bo peep cummin from my stun gun
beware take care
most motherfuckers have a cold ass stare
oh baby please be there
suck my kiss cut me my share

chorus 1
hit me you cant hurt me suck my kiss
kiss me please pervert me stick with this
is she talking dirty
give to me sweet sacred bliss your mouth was made to suck my kiss
see red hot chili peppers liveget tickets as low as 75you might also likeverse 2
look at me cant you see all i really want to be
is free from a world that hurts me
i need relief
do you want me girl to be your thief
oh baby just for you
id steal anything that you want me to
kissing
chicka chicka dee do me like a banshee
low brow is how
swimming in the sound of bow wow wow
oh baby do me now
do me here i do allow

chorus 2
hit me you cant hurt me suck my kiss
kiss me please pervert me stick with this
is she gonna curtsy
give to me sweet sacred bliss that mouth was made to

guitar solo

verse 1
shoulda been coulda been woulda been dead
if i didnt get the message goin to my head
i am what i am
most motherfuckers dont give a damn
oh baby think you can
be my girl ill be your man
someone full of fun do me til im well done
little bo peep cummin from my stun gun
beware take care
most motherfuckers have a cold ass stare
oh baby please be there
suck my kiss cut me my share
chorus 1
hit me you cant hurt me suck my kiss
kiss me please pervert me stick with this
is she talking dirty
give to me sweet sacred bliss that mouth was made to suck my kiss9embed"
