id,song_name,artist_names,album_name,lyrics
4jn8tyUfu7YadZfC2QrAHI,Music for Crying Baby,Baby Lullaby Academy,3mhj07LztP90qqKz37X1YG,"12 contributorsjuly 2021 singles release calendar lyrics71
amorphous  finally cannot hide it ft kelly rowland  cece peniston
brent faiyaz  wasting time ft drake
dblock europe  kevin mccallister ft lil pino
enrique iglesias  me pasé ft farruko
good times ahead  la fiesta
hanson  only love
hauskey  hope tala  one minute
j balvin  skrillex  in da getto
jackboy  ten toes down
jay1  ksi  swerve
joan  come over hi
maisie peters  psycho
needtobreathe  chances
russ millions  big shark
steel banglez  blama ft tion wayne  morrisson
trap manny  big flex ft lil rekk
villagers  so simpatico
72
not  red
adam lambert  these are your rights
alexandra stan  nervo  come into my world
alvaro soler  mañana ft cali y el dandee
andra day  all rise
avelino  100k
azizi gibson  suspicious
beatking  sdab ft juicy j  2 chainz
bebe rexha  american citizen
big30  too official ft yo gotti
big boi  sleepy brown  lower case no cap ft killer mike
big red machine  renegade ft taylor swift
big scarr  quezz ruthless  bacc to bacc
booka600  phase
brandi carlile  speak your mind
casanova  popcaan  deserve you
cassius jay  fish scale ft tory lanez  trouble
chase matthew  county line
chief keef  tear da club up
chevy woods  txt me remix ft ty dolla ign
chris sebastian  wasted on me
cordae  taxes
d savage  dont u change
dan bull  bat bitch
david guetta mistajam  john newman  if you really love me how will i know
ddg  paidway to  no kizzy
desiigner  slutty
girli  dysmorphia
hanne mjøen  too tired dont feel a thing
idk  young thug  pradadabang
iggy azalea  iam the stripclub
illenium  matt maeson  heavenly side
imagine dragons  wrecked
isaac dunbar  celebrate
jahmiel  jah never leave
janelle monáe  stronger
jazmin bean  4 u looking for me now
jhonni blaze  nle choppa  toxic
jutes  riptide
kyle  link up
like saturn  forsaken truth
logic  vaccine
maia wright  do yourself a favor
mariah the scientist  aura
marino infantry  mega man x ft aap ant lulu p  soduh
mokita  slenderbodies  speeding up
mýa  worth it
nick wilson  love can be so lonely sometimes
noodah05  glock in the club
omb peezy  before i go not the usual
q da fool  risk it
rich dunk  demon ft dababy
rubi rose  twork
russ  on the way
sasha keable  dont get lost
scarlxrd  lil darkie  cant stxp
sam feldt  sam fischer  pick me up vavo remix
sigala  rita ora  you for me
sonia stein  zoom out
tay money  walk
tish melton  we can do hard things
​toosii  heart cold
troyboi  madting
unlike pluto  elephant ears
urban cone  never enough
ynw melly  pieces ft queen naija
73
id ky  stay for the night
74
jliu  we gon fight remix ft fetty wap
lil barnacle  creampie
lil barnacle  lyrical genius
lil cezer  bornbroke ft boosie badazz  j10
majinmaj  feel
sol jay  mile high club
75
jennifer lopez  rauw alejandro  cambia el paso
omb peezy  feeling like dat
soulja boy  ratio
76
amen dunes  sleaford mods  feel nothing
atomic kitten  southgate youre the one footballs coming home again
bad bunny  de museo
childish major  f yah job
damon albarn  polaris
jungle  romeo ft bas
oscar lang  thank you
ray blk  mia ft kaash paige
vince staples  are you with that
yameii online  floozie
77
allison ponthier  hell is a crowded room
anna sofia  6ft under
aubrey oday  body love high
aurora  cure for me
biffy clyro  holier than thou
bj the chicago kid  type of day ft eric bellinger
courtney barnett  rae street
honne  what a wonderful world
hotboy wes  my lil dance ft gucci mane
james vickery  finally
kirinji  爆ぜる心臓 ft awich
nathy peluso  mafiosa
orla gartland  you’re not special babe
oston  hurt like 
pip millett  hard life
sam fender  seventeen going under
self esteem  prioritise pleasure
ngeeyl  off white ft lil uzi vert
yn jay  plastic surgery ft lil pump
youngboy never broke again  nevada
78
adekunle gold  sinner ft lucky daye
angel olsen  gloria
ant clemons  section ft kehlani
arkells  one thing i know
charlotte day wilson  i can only whisper ft badbadnotgood
claptone  james vincent mcmorrow  wake up
fnf chop  walk down remix ft young nudy  sheff g
fredo  wandsworth to bullingdon ft headie one
honne  now im alone ft sofía valdés
jmsn  love 2 u
little simz  i love you i hate you
lp  goodbye
maluma  sobrio
maya  swing of things remix ft powfu
omah lay  understand
omar apollo  go away
priya ragu  kamali
sarkodie  vic mensa  vibration
shaybo  friendly ft haile
will young  crying on the bathroom floor
79
ak  broken road
annie  just like honey
azealia banks  fuck him all night
babyface ray​  what the business is
babysantana  prada remix ft lil tecca
bas  j cole  the jackie ft lil tjay
bia  whole lotta money remix ft nicki minaj
bighead  yung booke  emotions ft three days grace  young thug
billie eilish  nda
bts  permission to dance
carolesdaughter  please put me in a medically induced coma
cassadee pope  say it first
chelsea collins  open your mouth
chris young  one of them nights
clinton kane  i guess im in love
conor maynard  aint got no friends
cynthia erivo  day off
daddex  demons
dan bull  deep deep dreams
dan caplen  lie to myself
dave  stormzy  clash
dave east  harry fraud  diamonds
declan mckenna  my house
delilah montagu  lost keys
dust in mind  take me away
ella jane  thief
emily vaughn  lil xan  ryder
emily weisband  butterfly ft karen fairchild
drumma boy  wake up ft lil gotit  kollision
evan giia  in motion ft reo cragun  memba
frank walker sophie simmons  nevada  shadows
fredo bang  bless his soul ft polo g
glaive  ericdoa  fuck this town
grace mitchell  tryst
hey violet  party girl
icona pop  vize  off of my mind
jai waetford  cocaine kisses
jessica taylor  daisy baby ft blocco
jones  around ft nardeydey
joshua bassett  let you go
jucee froot  i need a bag
jutes  here we go again
kalie shorr  love child
kane brown  blackbear  memory
kid ink  party ft rmr
kidd g  leah marie mason  love isnt real
killy  euphoric
kyle dion  ja rule  placebo
lael  crazy
ledisi  feeling good
like saturn  abandoned
lil he77  blame
lilbubblegum  drift ft lames
logic  get up
loren gray  piece of work
lost kings  me myself  adderall ft goody grace
lou elliotte  teenage dirtbag
loud luxury  wasted ft wav3pop
matt ox  take advantage ft lancey foux
maye  versos de placer
melo makes music  916frosty  lol
mirours  all i got
montell fish  talk 2 me
nico  vinz  dont be afraid remix ft bow anderson
nina nesbitt  summer fling
nothing but thieves  miracle baby
ot genasis  what is your name
olivia dean  slowly
peggy gou  i go
post malone  motley crew
rachel chinouriri  november ft hak baker
rob tone too hort  uce lee  gossip
rosie  ​to get over you
russ  nothin i wont do
sakima  sleepy head
skaar  black hole
steve aoki chemical surf  zafrir  siliwa hay ft maxafricana
switchfoot  the bones of us
sylvie kreusch  let it all burn
the jungle giants  love signs
the kid laroi  justin bieber  stay
tinashe  bouncin
token  sip
troye sivan  ​could cry just thinkin about you full version
unlike pluto  talladega knights
walk off the earth  lukas graham  love you right
ysn flow  chrome hearts
ytb trench  3roken soul
yung bleu  way more close stuck in a box ft big sean
zac brown band  old love song
zac brown band  out in the middle
zara larsson  i need love remix ft trevor daniel

710
ken caron  patrick ewing ft lil tecca
lil mosey  how i been
711
david shawty  rip my honda
minzy  teamo
soulja boy  bop
soulja boy  rick n morty ft rich the kid

712
annemarie  beautiful
chvrches  good girls
jay critch  pc
matt ox  already did it
son lux  gone ft kimbra

713
baby queen  you shaped hole
benny the butcher  pyrex picasso ft conway the machine  rick hyde
chief keef  the talk
diane warren geazy  santana  shes fire
ksi  number 2 ft future  21 savage
lil chrome  spacepakk ft two4 trenchbaby  bmoneyy
pixey  sunshine state
quincey white  this little light of mine ft the game
ruby fields  song about a boy
rudimental  skream  so sorry
rüfüs du sol  alive
sada baby  whoop kamp
tainy yandel  saint jhn  si te vas
714
8ubbles  dangerous
alex porat  bubblegum
anderson east  hood of my car
beaux  its a landslide
bj the chicago kid  lucky daye  make you feel good
camilo  shawn mendes kesi remix
caroline polachek  bunny is a rider
chiiild  jensen mcrae  gone remix
conan gray  people watching
dan bull  mercybeat ft lollia
dc the don  megalodon
kučka  beautiful
neer tnw  bad ft majinmaj
neffex  revolution
pouya  burn ft kxllswxtch
torres  thirstier
turnstile  alien love call ft blood orange
walk the moon  can you handle my love
715
alessia cara  shapeshifter
alessia cara  sweet dream
amaal  honey
baker boy  my mind ft g flip
bastille  give me the future
bipolar sunshine  gone
central cee  little bit of this
chet faker  its not you
cody ko  ice out my newborn
dan  shay  good things
derivakat  fireborn
iron maiden  the writing on the wall
ji the prince of ny  morning
lany  up to me
lyrica anderson  act a fool remix ft tory lanez
mahalia  whenever youre ready
mostack  ride
needtobreathe  carry me ft jon foreman
not3s  boom bam ft young t  bugsey
rafael casal  quicksand
since99  kenny beats  mutombo
soccer mommy  rom com 2004
swedish house mafia  it gets better
the academic  not your summer
tory lanez  crocodile teeth freestyle
trae tha truth  the cru ft baby houston
unknown t  driller sht
zzile  the side
716
2kbaby  zack  cody ft ddg
alexander oscar  sunlight
amber van day  touch
anfa rose  onefour  hot minute
anfa rose  talk 2 me nicely
aqua  i am what i am
armin van buuren  dubvision  i should be loving you
azizi gibson  petty tings
baynk  esther ft tinashe
ben platt  happy to be sad
big30  mista
big zuu  mae muller  i did it
blueface  tiktok
bvdlvd  smoke up
cheat codes little big town  bryn christopher  never love you again
chelsea cutler  walking away
cj fly  privacy
clever  tattoo your name
dava  sticky
​deadmau5  lights  when the summer dies
dionne bromfield  silly love
elias boussnina  under the moon
eric bellinger  only fan
fat joe remy ma  cool  dre  back outside
funkmaster flex  king von  lurkin remix ft polo g
garzi  paranoia unplugged version
garzi  sick of me unplugged version
gorilla zoe  jacquees  top of the week
grouplove  you oughta know
haim  cherry flavored stomach ache
halocene  when demons come to life ft lauren babic
hillsong young  free  phenomena da da
oe ndrei  legumă
jennifer hudson  you make me feel like a natural woman
jessie murph  when im not around
johnny yukon  mystery
kbfr  dj chose  from the a
kevin abstract  slugger ft slowthai  not
kevin george  all in my head ft johan lenox
khea julia michaels  becky g  only one ft di genius
kolyon  clyde and dodo ft 9lokknine
kshmr  ready to love ft sam feldt
levi hummon  paying for it ft walker hayes
like saturn  unseen lights
lil gnar  no regular
lil mama  uhoh ft corbourine
lil mosey  problem solvin
logic  my way
lola lennox  love like that
love ghost  wolfsbane ft rico nasty
luh kel  slidin
mabel  take it home
manic street preachers  the secret he had missed ft julia cumming
marina  venus fly trap kito remix ft tove lo
masn  dont talk
mavi phoenix  tokyo drift
michael calfan  imagining ft gabrielle aplin
​mike fka mike stud  bar hoppin
molly brazy  tob
natalie imbruglia  maybe its great
nghtmre  yung pinch  scars
normani  wild side ft cardi b
obn jay  take the time
og bobby billions  food stamp baby ft trapboy freddy  uno loso
paul oakenfold  aloe blacc  im in love
phora  numb pt 2
​ppcocaine  full tac  bmpu
raissa  policía
richgains  tilt ft boldy james
rubi rose  poke
russ  cheers
ryan trey  its about a girl
scarypoolparty  the darkness
shakira  dont wait up
retch  v don  devil on my back ft dave east
shenseea  run run
sonny fodera  kolidescopes  nah ft sinéad harnett
ssgkobe  mia
still woozy  get down
uicideboy  materialism as a means to an end
syd  fast car
tay money  shake
tech n9ne  take your halo
teezo touchdown  mid
the stupendium  fragments ft freeced
tink  yung bleu  selfish
tone trump  can i deen ft jim jones
toosii  ​head over hills
trapboy freddy  freddy ft young thug
transviolet  fever
trippie redd  holy smokes ft lil uzi vert
tyla yaweh  back outside
tyler posey  past life
weathers  karma
yn jay  magic stick
ynw bortlen  dedication ft hotboii
ynw melly  yung nigga shit ft hotboii  ynw gunna
yorke  joan  window shopping remix
una sand  fever
unlike pluto  conspiracy
vanilla ninja  no regrets
717
hoodrich pablo juan  dope in my veins ft yung mal
soulja boy  trappin so hard ft desiigner

718
sada baby  remember
vita flare  swang
719
a boogie wit da hoodie  gyalis remix
anette olzon  sick of you
asian doll  nunnadet shit remix ft dreamdoll ivorian doll rubi rose  dreezy
dan bull  king of avalon
ddg  midwest flow
emlyn  plot line
homeboy sandman  lice team baby ft aesop rock
k camp  guts ft true story gee
kodak black  senseless
soulja boy  she make it clap remix ft french montana
swedish house mafia  lifetime ft ty dolla ign  070 shake
the war on drugs  living proof
720
500raxx  dump truck ft tyga
brittany howard  childish gambino  stay high remix
cold hart  wild wild west
david shawty  scary guys ft lil tracy
eli fross  laced
j balvin  wherever i may roam ft metallica
jesse mccartney  kiss the world goodbye
pollari  rager city 3
remi wolf  liquor store
sad frosty  dopamine freestyle
samia  as you are
sy mosquiat  in traffic ft lil keed
tokyo jetz  lemon pepper freestyle
vistas  brand new
721
alewya  spiritx
brandi carlile  right on time
citizen soldier  always december
dan bull  losing moira leechin
dj diddy barlito  soulja boy  pricey
ider  obsessed
idles  model village remix ft slowthai
khalid  new normal
lorde  stoned at the nail salon
luke hemmings  motion
marian hill  omg
midwxst  made it back
neffex  no turning back
porches  okay
tommy genesis  a woman is a god
tops  party again
valley  tempo
722
alina baraz  alone with you
avelino  control ft yungen  not3s
bazzi  i like that
bbno  edamame ft rich brian
belly the weeknd  young thug  better believe
big red machine  phoenix ft anaïs mitchell  fleet foxes
booka600  skrt off
boys noize  tommy cash  nude
cnco  toa la noche
eliza  the delusionals  save me
gretta ray  cherish
gretta ray  the brink
ignea  bosorkun
james blake  say what you will
jetta  he usually likes boys
jim jones  scram jones  filet mignon ft eric bellinger  fabolous
jordan hollywood  the ugly song ft timbaland
namasenda  demonic ft la zowi
role model  forevermore
samm henshaw  grow
will young  strong
723
alesha dixon  war
allison leah  what im missing
azure ryder  some kind of love
blac chyna  thick ft desiigner
black birdie  powerful
bloxx  magnet
boldy james  the alchemist  first 48 freestyle
brady watt  the narcissist ft westside gunn  dj premier
bts  permission to dance rb remix
bullet for my valentine  parasite
calvin harris  by your side acoustic ft tom grennan
camila cabello  dont go yet
changing cleo  addiction
coldplay  coloratura
colony houe  automatic feat fleurie
culture jam  waves ft gunna  polo g
dan bull  ashe like that
dave east  harry fraud  uncle ric ft benny the butcher
deathbyromy  day i die
delli boe  iwss remix ft ppcocaine kidd kenn  stunna girl
dixie  psycho ft rubi rose
dj snake  malaa  ring the alarm
doodie lo  bodies ft pooh shiesty
dorian electra  ​happy ft 645ar
enemy inside  black butterfly
fedd the god chevy woods  wiz khalifa  activated
gashi  sleeping on my left
grace davies  toothbrush
half•alive  summerland
hvme  24kgoldn  alright ft quavo
isaiah rashad  wat u sed ft iamdoechii  kal banx
jake bugg  downtown
james tw  hopeless romantics
jasiah  world tar
jason aldean  carrie underwood  if i didnt love you
jeremy zucker  honest
joshua speers  just kids
jp cooper  if the world should ever stop
julian lamadrid  saturday
kamille  sad party ft haile  ivorian doll
kayzo whales  shiah maisel  replay
kevin ross  looking for love
kiana ledé  kehlani  ur best friend
kilo kish  american gurl
knightlight  lool  barode
leisure  mesmerised
like saturn  unfinished
lil nas x  jack harlow  industry baby
lil tecca  money on me
lil xxel tyga  coi leray  what u want
lily rose  know my way around
logic  call me
lola young  pill or a lullaby 4am till sunrise
loud luxury  safe with me ft drew love
mabel  let them know acoustic
matt ox  state to state
melvoni  feel alive
ohgeesy  big bad wolf ft yg
oscar and the wolf  oliver
party pupils  marc e bassy  signs
r3hab  gabry ponte  the portrait ooh la la
raja kumari  firestarter
russ  lake como
sheff g  on go ft polo g
smiley  over the top ft drake
softcult  spit it out
sophie and the giants  if i dont break your heart ill break mine
soulja boy  blatt
stalking gia  blue
the score  head up
the warning  evolve
tinashe  i can see the future
vérité  hes not you
whokilledxix  thump
wylie hopkins  cut
young dolph paper route empire  key glock  blu boyz ft snupe bandz
zhu  monster ft john the blind

724
al geno  rich like roddy ft rylo rodriguez
jay critch  to the sky
725
headie one  pound signs remix ft j ramms

726
l devine  priorities
seven spires  lightbringer
727
dolly parton  sent from above
oscar lang  write me a letter
porridge radio  new slang
quin nfn  dawm
sebastian  dont tread on else matters ft metallica
sugababes  overload metronomy  tatyana remix
yebba  louie bag ft smino

728
8ubbles  honey
bleachers  secret life ft lana del rey
dababy  giving what its supposed to give
dermot kennedy  better days
destiny rogers  what i like
dj snake  you are my high
duckwrth  phabo  4k
eladio carrión j balvin  daddy yankee  tata remix ft bobby shmurda
gee get money  salsa ft ace hood
gmo skee  fuck it all up ft trizz  tech n9ne
isaiah rashad  runnin 4rm da law ft schoolboy q
jinjer  mediator
jungle  truth
miles wesley  jutes  medicine
neffex  thats what it takes
parcels  comingback
rozzi  mad man
since99  overnight celebrity remix
sleepy hallow  2055 remix ft coi leray
sleigh bells  locust laced
taylor janzen  push it down
the knocks  sound the alarm ft rivers cuomo  royal  the serpent
ye ali  dangerous
ys  hate me ft fenix flexin  babyface ray
zella day  golden
729
a1 x j1  deno  baby
angel olsen  safety dance
b young  justin bieber
banofee  idiot
chenzo y dezz  estela
dan  shay  lying
david archuleta  movin
david archuleta  movin  after hours
dax  child of god
deko  unimportant ft yameii online
dierks bentley  beers on me ft hardy  breland
fergus james  backseat
freddie dredd  doomset
fredo bang  jail blues
​glaive  bastard
isaiah rashad  from the garden ft lil uzi vert
jasmine thompson  happy for you
katelyn tarver  shit happens
koi  rushing
nao  and then life was beautiful
skepta  nirvana ft j balvin
steps  take me for a ride
stunna gambino  zaza
young t  bugsey  prada bae
730
9lokknine  freeze me
achal  dirty dancin
all time low  post modern anxiety ft pale waves
alok  john legend  in my mind
aluna  punctual  summer of love
aly  aj  i need my girl
ant clemons 2 chainz  ty dolla ign  appreciation
arizona zervas  still breathing
aura  screw feelings
benny the butcher  remember me
bktherula  not wock
calboy  round here
clean bandit  topic  drive ft wes nelson
cynthia erivo  alive
dallask  try again ft lauv
darren criss  for a night like this
david archuleta  movin
don diablo  galantis  tears for later
danielle bradbery  stop draggin your bots
ed sheeran  bad habits meduza remix
edge of paradise  the unknown
elderbrook  bob moses  inner light
fredo bang  street team
geazy  at will ft est gee
ghastly  burner
hot milk  i think i hate myself
jacquees  not jus anybody ft future
johnny yukon  soon
jordan joseph  rodeo ft riff raff
jutes  broke boy
kap g  birthday
kash doll  juicy j  like a pro
lauren alaina  it was me
like saturn  turns to ash
lilbubblegum  yiko  hyper rage
lil lotus  rooftop
lost frequencies  calum scott  where are you now
loud luxury  cat dealers  mistakes
mø  kindness
marc e bassy  tell me lies
matilda mann  february
maxo kream  local joker
mickey guyton  remember her name
morray  polo g  trenches remix
natasha bedingfield  adorable
ohana bam  coo coo remix ft ot genasis
poppy  flux
powfu  ​tinted green ft mila moon  jomie
prettymuch  trust
projexx  unda pressure
pvris  monster
raleigh ritchie  say what you mean
rexx life raj  red lobster biscuits
rich the kid  prada
russ  fate
ryan hurd  coast
sean kingston  love is wonderful ft travis barker
silk sonic  skate
sogone soflexy  nueces county
spencer sutherland  paranoia
surf  ricky
terror jr  smile like that
themxxnlight  naughty or nice ft wiz khalifa
tokimonsta  channel tres  naked
tom speight  feel the night
tyga  mrs bubblegum
unlike pluto  endless
upsahl  time of my life
whyg  goat farm ft burna bandz
​wrabel  duncan laurence  back to back
x ambassadors  okay
yungmanny  her peace ft loui  yk osiris
zak abel  why cant we get along
zebrahead  lay me to rest
zillakami  frosty1embed"
