id,song_name,artist_names,album_name,lyrics
4SFknyjLcyTLJFPKD2m96o,How You Like That,BLACKPINK,71O60S5gIJSIAhdnrDIh3N,"133 contributorstranslationsromanizationenglishfrançaisdeutschportuguêsрусскийespañolไทย  phasa thaitürkçetiếng việthow you like that lyrics블랙핑크 how you like that 가사

intro lisa
blackpink in your area

verse 1 jennie  jisoo
보란 듯이 무너졌어
바닥을 뚫고 저 지하까지
옷 끝자락 잡겠다고
저 높이 두 손을 뻗어봐도

prechorus rosé
다시 캄캄한 이곳에 light up the sky
네 두 눈을 보며 ill kiss you bye
실컷 비웃어라 꼴좋으니까
이제 너희 하나 둘 셋

chorus jennie lisa  jisoo
ha how you like that woo
you gon like that thatthatthat that thatthatthat that
how you like that bada bing bada boom boom boom
how you like that thatthatthat that thatthatthat that

postchorus lisa rosé jennie
now look at you now look at me uh
look at you now look at me uh
look at you now look at me
how you like that
now look at you now look at me uh
look at you now look at me uh
look at you now look at me
how you like that
you might also likeverse 2 lisa
your girl need it all and thats a hundred
백 개 중에 백 내 몫을 원해
karma come and get some
딱하지만 어쩔 수 없잖아
whats up im right back
방아쇠를 cock back
plain jane get hijacked dont like me
then tell me how you like that like that

prechorus jennie  jisoo
더 캄캄한 이곳에 shine like the stars
그 미소를 띠며 ill kiss you goodbye
실컷 비웃어라 꼴좋으니까
이제 너희 하나 둘 셋

chorus rosé jennie jisoo  lisa
ha how you like that woo
you gon like that thatthatthat that thatthatthat that
how you like that bada bing bada boom boom boom
how you like that thatthatthat that thatthatthat that

postchorus lisa rosé jennie
now look at you now look at me uh
look at you now look at me uh
look at you now look at me
how you like that
now look at you now look at me uh
look at you now look at me uh
look at you now look at me
how you like that
bridge rosé jisoo rosé  jisoo all
날개 잃은 채로 추락했던 날
어두운 나날 속에 갇혀 있던 날
그때쯤에 넌 날 끝내야 했어
look up in the sky
its a bird its a plane

break all jennie
yeaheaheaheah
bring out your boss bitch
yeaheaheaheah
blackpink

outro lisa rosé  jennie
ddu ddu ddu ddudduddu
ddu ddu ddu ddudduddu
how you like that
ddu ddu ddu ddudduddu
ddu ddu ddu dudududdu
you gon like that
ddu ddu ddu ddudduddu
ddu ddu ddu ddudduddu
how you like that
ddu ddu ddu ddudduddu
ddu ddu ddu dudududdu67embed"
