id,song_name,artist_names,album_name,lyrics
7IKDcwrvxaBs6dnrT36NbH,Long Way to Happy,P!nk,5rK6h49Qd6gSxxbQGMrWfq,"11 contributorslong way to happy lyricsverse 1
one night to you
lasted six weeks for me
just a bitter little pill now
just to try to go to sleep
no more waking up to innocence
say hello to hesitance
to everyone i meet
thanks to you years ago
i guess ill never know
what love means to me but oh

prechorus
ill keep on rolling down this road
but ive got a bad bad feeling

chorus
its gonna take a long time to love
its gonna take a lot to hold on
its gonna be a long way to happy yeah
left in the pieces that you broke me into
torn apart but now ive got to
keep on rolling like a stone
cause its gonna be a long long way to happy
to happy to happy to happy
see pnk liveget tickets as low as 53you might also likeverse 2
left my childhood behind
in a rollaway bed
everything was so damn simple
now im losing my head losing my head
trying to cover up the damage
and pad out all the bruises
too young to know i had it
so it didnt hurt to lose it didnt hurt to lose it
didnt hurt to lose it didnt hurt to lose it
no but oh

prechorus
ill keep on rolling down this road
but ive got a bad bad feeling

chorus
its gonna take a long time to love
its gonna take a lot to hold on
its gonna be a long way to happy yeah
left in the pieces that you broke me into
torn apart but now ive got to
keep on rolling like a stone
cause its gonna be a long long way to—

bridge
now im numb as hell and i cant feel a thing
but dont worry about regret or guilt
cause i never knew your name
i just wanna thank you thank you
from the bottom of my heart
for all the sleepless nights
and for tearing me apart
yeah yeah
chorus
its gonna take a long time to love
its gonna take a lot to hold on
its gonna be a long way to happy yeah
left in the pieces that you broke me into
torn apart but now ive got to
keep on rolling like a stone
cause its gonna be a long long way
its gonna take a long time to love
its gonna take a lot to hold on
its gonna be a long long long long way to happy yeah
left in the pieces that you broke me into
torn apart but now ive got to
keep on rolling like a stone
cause its gonna be a long long way to happy
to happy to happy to happy
cause its gonna be a long long way to happy
to happy to happy to happy3embed"
