id,song_name,artist_names,album_name,lyrics
1fPCGREltHJuV3axEPydLp,Loba,Shakira,5u0OuxRnf3FzvZR07xAxL2,"23 contributorsloba lyricsletra de loba

intro
sigilosa al pasar
sigilosa al pasar
esa loba es especial
mírala caminar caminar

verso 1
quién no ha querido a una diosa licántropa
en el ardor de una noche romántica
mis aullidos son el llamado
yo quiero un lobo domesticado

precoro 1
por fin he encontrado un remedio infalible que borre del todo la culpa
no pienso quedarme a tu lado mirando la tele y oyendo disculpas
la vida me ha dado un hambre voraz y tú apenas me das caramelos ah
me voy con mis piernas y mi juventud por ahí aunque te maten los celos

coro
una loba en el armario
tiene ganas de salir ahooh
deja que se coma el barrio
antes de irte a dormir
ah ah
you might also likeverso 2
tengo tacones de aguja magnética
para dejar la manada frenética
la luna llena como una fruta
no da consejos ni los escucha

precoro 2
llevo conmigo un radar especial para localizar solteros
si acaso me meto en aprietos también llevo el número de los bomberos
ni tipos muy lindos ni divos ni niños ricos yo sé lo que quiero ay
pasarla muy bien y portarme muy mal en los brazos de algún caballero

coro
una loba en el armario
tiene ganas de salir ahooh
deja que se coma el barrio
antes de irte a dormir
ah ah

puente 1
cuando son casi la una la loba en celo saluda a la luna
duda si andar por la calle o entrar en un bar a probar fortuna
ya está sentada en su mesa y pone la mira en su próxima presa
pobre del desprevenido que no se esperaba una de esas

puente 2
sigilosa al pasar
sigilosa al pasar
esa loba es especial
mírala caminar caminar
outro
deja que se coma el barrio
antes de irte a dormir
ah ah6embed"
