id,song_name,artist_names,album_name,lyrics
0RjJSBBEolCDJ6wDiuVCmh,ATTENTION!,XXXTENTACION,3hn46RDrEmoi4XhLjgdNjZ,"63 contributorstranslationsespañolрусскийenglishportuguêsattention lyricschorus
tention hey tention hey
when you see me please stand at attention hey
real life hey realize hey
try me ima send you back to real life uh
tention hey tention hey
when you see me please stand at attention ayy
real life hey real life yeah
try me ima send you back to real life

verse
oh my god ive been up ive been dead yeah yeah
put a show on take it off get it wet yeah
i might drop a bomb on your head funk flex yeah
blew up no saddam i put money on your head yeah
shawty im an asshole like charlamagne
please excuse this cash i am fresh out the bank
put one in the head if you charmin like a snake
bible on the dash like im fucking gunplay ayy

chorus
tention hey tention hey
when you see me please stand at attention hey
real life hey real life hey
try me ima send you back to real life uh
tention hey tention hey
when you see me please stand at attention hey
real life hey real life huh
try me ima send you back to real lifeyou might also like34embed"
