id,song_name,artist_names,album_name,lyrics
19a3JfW8BQwqHWUMbcqSx8,Famous,Kanye West,7gsWAHLeT0w7es6FofOXk1,"301 contributorstranslationsespañolportuguêsfrançaispolskisvenskatürkçefamous lyricsintro rihanna  kanye west
man i can understand how it might be
kinda hard to love a girl like me
i dont blame you much for wanting to be free
i just wanted you to know
woo woo
swizz told me let the beat rock oh
oh

verse 1 kanye west  swizz beatz
for all my southside niggas that know me best
i feel like me and taylor might still have sex
why i made that bitch famous goddamn
i made that bitch famous
for all the girls that got dick from kanye west
if you see em in the streets give em kanyes best
why they mad they aint famous goddamn
they mad they still nameless talk that talk man
her man in the store tryna try his best
but he just cant seem to get kanye fresh
but we still hood famous goddamn
yeah we still hood famous

chorus rihanna  swizz beatz
i just wanted you to know
ive loved you better than your own kin did
from the very start
i dont blame you much for wanting to be free
wake up mr west oh hes up
i just wanted you to know
see kanye west liveget tickets as low as 122you might also likeverse 2 kanye west  swizz beatz
i be puerto rican day parade floatin
that benz marina del rey coastin
she in school to be a real estate agent
last month i helped her with the car payment
young and we alive whoo
we never gonna die whoo
i just copped a jet to fly over personal debt
put one up in the sky
the sun is in my eyes whoo
woke up and felt the vibe whoo
no matter how hard they try whoo
we never gonna die
chorus rihanna  swizz beatz
i just wanted you to know
get em

bridge sister nancy  swizz beatz
bam ey ey ey
bam bam bam bam bam dilla
bam bam ey ey ey
what a bam bam bam bam dilla
how you feeling right now let me see your lighters in the air
bam bam ey ey ey ey ey
bam bam ey ey ey
what a bam
let me see your middle finger in the air
bam ey ey ey
bam bam bam bam bam dilla
let me see you act up in this motherfucker
bam bam ey ey ey
what a bam bam bam bam dilla
how you feelin how you feelin how you feelin in this mother fucker god damn
bam bam ey ey ey ey ey
bam bam ey ey ey
what a bam
one thing you cant do is stop us now
bam ey ey ey
bam bam bam bam bam dilla
ayy you cant stop the thing now
bam bam ey ey ey
what a bam bam bam bam dilla
man its way too late its way too late its way too late you cant fuck with us
bam bam ey ey ey ey ey
bam bam ey ey ey
what a bam
to the left to the right
bam ey ey ey
bam bam bam bam bam dilla
i wanna see everybody hands in the air like this
bam bam ey ey ey
what a bam bam bam bam dilla
bam bam ey ey ey ey ey
bam bam ey ey ey
what a bam bam
outro nina simone
i just wanted you to know
i loved you better than your own kin did
from the very start
i dont blame you much for wanting to be free
i just wanted you to know
produced by kanye west charlie heat havoc  noah goldstein169embed"
