id,song_name,artist_names,album_name,lyrics
2iu60eTIm2py6MaoVMcBAR,Crossfaded,Don Toliver,2WmJ5wp5wKBlIJE6FDAIBJ,"39 contributorstranslationsespañolportuguêscrossfaded lyricschorus
it aint that much to do out here i see you
i see you
i get a little bit crossfaded catch a vibe ooh
sometimes youre toxic toxic
im through with nonsense nonsense
and whatever you call this yeah

verse
but ive known you for a long time long time
put you on your own grind yeah yeah
need you on my own line
starin at the sunrise
it be hella hard to cut ties
me and baby start an enterprise
speedin in that sv woahoh
leg room on sight aint gotta touch the key yeah
when you know you need help aint gotta ask me
aint got your own bag and yes im happy
oh yes im happy oh
i wanna feel the juice at thе car lot
gimme head at the light whеn the car stop car stop
in the range in the jeep in the droptop droptop
hold me down gotta watch for the cooops
my block yeah my block
you know what youre doin on my block
tried to sit you down this a time out
guess that really shows you what im about what im about
see don toliver liveget tickets as low as 208you might also likechorus
it aint that much to do out here i see you
i see you
i get a little bit crossfaded catch a vibe ooh
sometimes youre toxic toxic
im through with nonsense nonsense
and whatever you call this yeah

outro
are we down for each other
are you down for another
are we down for each other
are you down are you down
cause im down for you
down for each other
down for each other
are you down for another
cause im down for you
down for each other7embed"
