id,song_name,artist_names,album_name,lyrics
35YyxFpE0ZTOoqFx5bADW8,Nude,Radiohead,5vkqYmiPBYLaalcmjujWxK,"86 contributorstranslationstürkçefrançaisnude lyricsverse 1
dont get any big ideas
theyre not gonna happen
you paint yourself white
and fill up with noise
but therell be something missing

chorus
now that youve found it its gone
now that you feel it you dont
youve gone off the rails

verse 2
so dont get any big ideas
theyre not gonna happen
youll go to hell
for what your dirty mind is thinkingyou might also like51embed"
