id,song_name,artist_names,album_name,lyrics
4V5Dv8IjHNTk2YJzU9vgsW,Eat It,Megan Thee Stallion,6B26OzQRObxAp1tbf8jeTq,"32 contributorseat it lyricsintro
bitch its young tina snow the nastiest freak you know
murda on the beat so its not nice

verse 1
bust through the walls break in and enter
how many licks til you get to the center
how many times have i heard that a nigga a dog but scared when he play with the kitten
how many times have i heard that somebody last long
these niggas aint lastin a minute
how many times have i heard that a nigga was big but dick as small as an eggshaker
legs shaking hit it til the bed breakin til the bed breakin
best friend it talk to it yeah
what you wanna tell megan what you wanna tell me
he say he finna keep me up huh
yeah nigga well see nigga well see
i dont want just one nut hmm
daddy ima need the whole tree ah

chorus
yeah yeah
eat it eat it eat it til i faint ah
kick you out heres a towel nigga wipe your face your face
eat it eat it til you break a sweat
lick it all give your all til you outta breath ah
eat it eat it eat it til i cum
gimme some gimme some til im goin dumb
gimme some gimme some til im goin uh
gimme some gimme some til im goin uh
ah
see megan thee stallion liveget tickets as low as 244you might also likeverse 2
they finna call me a bully but fuck it its up because i want my lick back
all of you bitches is kids and yall shoulda never got let out the nutsack
i got so much plaque built up ridoublea my dentist
and i feel like aw shit yall should eat my pussy how much yall mention me ah
megan so this and that whatever i do they aint missin that
she doin too much tell her ooh relax ooh relax
he done and you gotta be cool with that
i probably had somethin to do with that
yeah i got these niggas trippin got these niggas trippin
he hate my fuckin guts but he lovin my pimpin ah yeah yeah

chorus
yeah yeah
eat it eat it eat it til i faint ah
kick you out heres a towel nigga wipe your face wipe your face
eat it eat it til you break a sweat
lick it all give your all til you outta breath ah
eat it eat it eat it til i cum
gimme some gimme some til im goin dumb
gimme some gimme some til im goin uh
gimme some gimme some til im goin uh

outro
og parker
legs on the headboard pussy in his mouth
legs on the headboard pussy in his mouth
legs on the headboard pussy in his mouth
legs on the headboard pussy in his mouth
interlude vickeelo dino btw
alright sister im not gon hold you up no longer bitch i think im bout to get me somethin on the phone im bout to get into some action you know what i mean okay you callin a trick
yes bitch bills paid okay aha period
alright dino i aint gon hold you up go head girl alright vickee bitch
bye bye ho1embed"
